[
  {
    "human": "1975-09-28",
    "machine": "1975-09-28"
  },
  {
    "human": "08-26-70",
    "machine": "1970-08-26"
  },
  {
    "human": "july 12, 1988",
    "machine": "1988-07-12"
  },
  {
    "human": "wednesday, october 8, 1980",
    "machine": "1980-10-08"
  },
  {
    "human": "august 15, 1992",
    "machine": "1992-08-15"
  },
  {
    "human": "16, jun 2007",
    "machine": "2007-06-16"
  },
  {
    "human": "10-05-31",
    "machine": "2010-05-31"
  },
  {
    "human": "aug 14 2006",
    "machine": "2006-08-14"
  },
  {
    "human": "february 8, 1981",
    "machine": "1981-02-08"
  },
  {
    "human": "dec 28, 83",
    "machine": "1983-12-28"
  },
  {
    "human": "12-18-09",
    "machine": "2009-12-18"
  },
  {
    "human": "oct 7 2022",
    "machine": "2022-10-07"
  },
  {
    "human": "22 may 1997",
    "machine": "1997-05-22"
  },
  {
    "human": "2023/05/27",
    "machine": "2023-05-27"
  },
  {
    "human": "94.08.30",
    "machine": "1994-08-30"
  },
  {
    "human": "04.03.26",
    "machine": "2004-03-26"
  },
  {
    "human": "23-06-05",
    "machine": "2023-06-05"
  },
  {
    "human": "november 06, 2019",
    "machine": "2019-11-06"
  },
  {
    "human": "11-20-82",
    "machine": "1982-11-20"
  },
  {
    "human": "5 dec, 1980",
    "machine": "1980-12-05"
  },
  {
    "human": "2008-08-18",
    "machine": "2008-08-18"
  },
  {
    "human": "sep 10, 2001",
    "machine": "2001-09-10"
  },
  {
    "human": "16 feb, 1974",
    "machine": "1974-02-16"
  },
  {
    "human": "10-13-99",
    "machine": "1999-10-13"
  },
  {
    "human": "20 oct, 1979",
    "machine": "1979-10-20"
  },
  {
    "human": "8/20/77",
    "machine": "1977-08-20"
  },
  {
    "human": "09, nov 2014",
    "machine": "2014-11-09"
  },
  {
    "human": "6 february 2011",
    "machine": "2011-02-06"
  },
  {
    "human": "97.04.28",
    "machine": "1997-04-28"
  },
  {
    "human": "2/5/75",
    "machine": "1975-02-05"
  },
  {
    "human": "12/7/70",
    "machine": "1970-12-07"
  },
  {
    "human": "jun 4 2015",
    "machine": "2015-06-04"
  },
  {
    "human": "1975.03.23 ad",
    "machine": "1975-03-23"
  },
  {
    "human": "28 may 2023",
    "machine": "2023-05-28"
  },
  {
    "human": "3/13/22",
    "machine": "2022-03-13"
  },
  {
    "human": "sunday, march 28, 1976",
    "machine": "1976-03-28"
  },
  {
    "human": "may 6, 1977",
    "machine": "1977-05-06"
  },
  {
    "human": "25.02.1970",
    "machine": "1970-02-25"
  },
  {
    "human": "24.03.2013",
    "machine": "2013-03-24"
  },
  {
    "human": "tuesday, april 26, 2011",
    "machine": "2011-04-26"
  },
  {
    "human": "15 may, 1972",
    "machine": "1972-05-15"
  },
  {
    "human": "2006-09-12",
    "machine": "2006-09-12"
  },
  {
    "human": "02 july 2014",
    "machine": "2014-07-02"
  },
  {
    "human": "june 29, 1986",
    "machine": "1986-06-29"
  },
  {
    "human": "7/16/00",
    "machine": "2000-07-16"
  },
  {
    "human": "21 january 1977",
    "machine": "1977-01-21"
  },
  {
    "human": "5-may-1978",
    "machine": "1978-05-05"
  },
  {
    "human": "10/21/2013",
    "machine": "2013-10-21"
  },
  {
    "human": "17.01.1989",
    "machine": "1989-01-17"
  },
  {
    "human": "friday, february 11, 2000",
    "machine": "2000-02-11"
  },
  {
    "human": "1997-12-16",
    "machine": "1997-12-16"
  },
  {
    "human": "2007/01/31",
    "machine": "2007-01-31"
  },
  {
    "human": "00-01-02",
    "machine": "2000-01-02"
  },
  {
    "human": "july 14, 1995",
    "machine": "1995-07-14"
  },
  {
    "human": "monday, december 3, 1979",
    "machine": "1979-12-03"
  },
  {
    "human": "10-26-97",
    "machine": "1997-10-26"
  },
  {
    "human": "tue, jan 20, 98",
    "machine": "1998-01-20"
  },
  {
    "human": "17, nov 2004",
    "machine": "2004-11-17"
  },
  {
    "human": "1978.04.24 ad",
    "machine": "1978-04-24"
  },
  {
    "human": "22 dec, 1999",
    "machine": "1999-12-22"
  },
  {
    "human": "june 24, 1985",
    "machine": "1985-06-24"
  },
  {
    "human": "83.10.19",
    "machine": "1983-10-19"
  },
  {
    "human": "29.12.2006",
    "machine": "2006-12-29"
  },
  {
    "human": "24-may-2015",
    "machine": "2015-05-24"
  },
  {
    "human": "2013.04.07 ad",
    "machine": "2013-04-07"
  },
  {
    "human": "october 2, 1978",
    "machine": "1978-10-02"
  },
  {
    "human": "3/31/71",
    "machine": "1971-03-31"
  },
  {
    "human": "3 may 2021",
    "machine": "2021-05-03"
  },
  {
    "human": "21.11.2015",
    "machine": "2015-11-21"
  },
  {
    "human": "2012/03/06",
    "machine": "2012-03-06"
  },
  {
    "human": "1975-07-21",
    "machine": "1975-07-21"
  },
  {
    "human": "april 30, 2021",
    "machine": "2021-04-30"
  },
  {
    "human": "8/14/18",
    "machine": "2018-08-14"
  },
  {
    "human": "1979/07/12",
    "machine": "1979-07-12"
  },
  {
    "human": "sunday, may 2, 2004",
    "machine": "2004-05-02"
  },
  {
    "human": "30, jan 2024",
    "machine": "2024-01-30"
  },
  {
    "human": "03-28-81",
    "machine": "1981-03-28"
  },
  {
    "human": "1993-04-7",
    "machine": "1993-04-07"
  },
  {
    "human": "9/26/16",
    "machine": "2016-09-26"
  },
  {
    "human": "tuesday, august 2, 1977",
    "machine": "1977-08-02"
  },
  {
    "human": "26 february 2007",
    "machine": "2007-02-26"
  },
  {
    "human": "11/23/2002",
    "machine": "2002-11-23"
  },
  {
    "human": "1977-05-9",
    "machine": "1977-05-09"
  },
  {
    "human": "december 14, 1986",
    "machine": "1986-12-14"
  },
  {
    "human": "11 apr, 2008",
    "machine": "2008-04-11"
  },
  {
    "human": "fri, apr 18, 03",
    "machine": "2003-04-18"
  },
  {
    "human": "fri, mar 29, 74",
    "machine": "1974-03-29"
  },
  {
    "human": "01-26-97",
    "machine": "1997-01-26"
  },
  {
    "human": "2016/06/14",
    "machine": "2016-06-14"
  },
  {
    "human": "21-jan-1972",
    "machine": "1972-01-21"
  },
  {
    "human": "2023-03-29",
    "machine": "2023-03-29"
  },
  {
    "human": "30, aug 2025",
    "machine": "2025-08-30"
  },
  {
    "human": "30 mar, 2003",
    "machine": "2003-03-30"
  },
  {
    "human": "1998.06.05 ad",
    "machine": "1998-06-05"
  },
  {
    "human": "october 28, 2020",
    "machine": "2020-10-28"
  },
  {
    "human": "1/6/89",
    "machine": "1989-01-06"
  },
  {
    "human": "29/01/2020",
    "machine": "2020-01-29"
  },
  {
    "human": "jun 11, 25",
    "machine": "2025-06-11"
  },
  {
    "human": "may 29, 1991",
    "machine": "1991-05-29"
  },
  {
    "human": "5-aug-1972",
    "machine": "1972-08-05"
  },
  {
    "human": "october 7, 1983",
    "machine": "1983-10-07"
  },
  {
    "human": "22/06/2006",
    "machine": "2006-06-22"
  },
  {
    "human": "may 20, 1989",
    "machine": "1989-05-20"
  },
  {
    "human": "sun, aug 13, 89",
    "machine": "1989-08-13"
  },
  {
    "human": "jun 16, 1984",
    "machine": "1984-06-16"
  },
  {
    "human": "october 1, 1999",
    "machine": "1999-10-01"
  },
  {
    "human": "1980-04-22",
    "machine": "1980-04-22"
  },
  {
    "human": "mar 9, 1972",
    "machine": "1972-03-09"
  },
  {
    "human": "15 august 1998",
    "machine": "1998-08-15"
  },
  {
    "human": "sunday, april 25, 1982",
    "machine": "1982-04-25"
  },
  {
    "human": "26.08.2010",
    "machine": "2010-08-26"
  },
  {
    "human": "aug 19, 21",
    "machine": "2021-08-19"
  },
  {
    "human": "14-sep-1976",
    "machine": "1976-09-14"
  },
  {
    "human": "02/13/1981",
    "machine": "1981-02-13"
  },
  {
    "human": "22.06.27",
    "machine": "2022-06-27"
  },
  {
    "human": "may 14, 89",
    "machine": "1989-05-14"
  },
  {
    "human": "06/24/1989",
    "machine": "1989-06-24"
  },
  {
    "human": "23, dec 2013",
    "machine": "2013-12-23"
  },
  {
    "human": "00-04-02",
    "machine": "2000-04-02"
  },
  {
    "human": "fri, dec 30, 16",
    "machine": "2016-12-30"
  },
  {
    "human": "1987-11-4",
    "machine": "1987-11-04"
  },
  {
    "human": "2/26/77",
    "machine": "1977-02-26"
  },
  {
    "human": "18 apr 1988",
    "machine": "1988-04-18"
  },
  {
    "human": "fri, mar 21, 80",
    "machine": "1980-03-21"
  },
  {
    "human": "23, apr 1994",
    "machine": "1994-04-23"
  },
  {
    "human": "07/11/2006",
    "machine": "2006-07-11"
  },
  {
    "human": "23.11.1990",
    "machine": "1990-11-23"
  },
  {
    "human": "1976-12-19",
    "machine": "1976-12-19"
  },
  {
    "human": "8/29/15",
    "machine": "2015-08-29"
  },
  {
    "human": "11/19/16",
    "machine": "2016-11-19"
  },
  {
    "human": "sunday, january 24, 1988",
    "machine": "1988-01-24"
  },
  {
    "human": "89.08.1",
    "machine": "1989-08-01"
  },
  {
    "human": "90-02-05",
    "machine": "1990-02-05"
  },
  {
    "human": "tue, jun 12, 73",
    "machine": "1973-06-12"
  },
  {
    "human": "16.01.1994",
    "machine": "1994-01-16"
  },
  {
    "human": "11-07-02",
    "machine": "2011-07-02"
  },
  {
    "human": "15.6.87",
    "machine": "1987-06-15"
  },
  {
    "human": "may 19 2014",
    "machine": "2014-05-19"
  },
  {
    "human": "january 22, 1970",
    "machine": "1970-01-22"
  },
  {
    "human": "13 apr, 1973",
    "machine": "1973-04-13"
  },
  {
    "human": "9/19/02",
    "machine": "2002-09-19"
  },
  {
    "human": "september 28, 2022",
    "machine": "2022-09-28"
  },
  {
    "human": "thursday, october 10, 2002",
    "machine": "2002-10-10"
  },
  {
    "human": "21 march 2016",
    "machine": "2016-03-21"
  },
  {
    "human": "15.10.2002",
    "machine": "2002-10-15"
  },
  {
    "human": "wed, jun 23, 93",
    "machine": "1993-06-23"
  },
  {
    "human": "jun 26 1993",
    "machine": "1993-06-26"
  },
  {
    "human": "2010.09.06 ad",
    "machine": "2010-09-06"
  },
  {
    "human": "aug 13 1974",
    "machine": "1974-08-13"
  },
  {
    "human": "28.8.87",
    "machine": "1987-08-28"
  },
  {
    "human": "78.07.27",
    "machine": "1978-07-27"
  },
  {
    "human": "7/12/1995",
    "machine": "1995-12-07"
  },
  {
    "human": "feb 18 2017",
    "machine": "2017-02-18"
  },
  {
    "human": "1992/01/17",
    "machine": "1992-01-17"
  },
  {
    "human": "tuesday, september 5, 1972",
    "machine": "1972-09-05"
  },
  {
    "human": "feb 5, 2021",
    "machine": "2021-02-05"
  },
  {
    "human": "august 01, 2017",
    "machine": "2017-08-01"
  },
  {
    "human": "17-jan-2025",
    "machine": "2025-01-17"
  },
  {
    "human": "9/23/85",
    "machine": "1985-09-23"
  },
  {
    "human": "wed, jan 4, 12",
    "machine": "2012-01-04"
  },
  {
    "human": "april 18, 1987",
    "machine": "1987-04-18"
  },
  {
    "human": "nov 5 2010",
    "machine": "2010-11-05"
  },
  {
    "human": "august 24, 1994",
    "machine": "1994-08-24"
  },
  {
    "human": "1997.02.16 ad",
    "machine": "1997-02-16"
  },
  {
    "human": "8/3/11",
    "machine": "2011-08-03"
  },
  {
    "human": "12/1/80",
    "machine": "1980-12-01"
  },
  {
    "human": "29/05/1989",
    "machine": "1989-05-29"
  },
  {
    "human": "10/22/84",
    "machine": "1984-10-22"
  },
  {
    "human": "saturday, april 23, 1983",
    "machine": "1983-04-23"
  },
  {
    "human": "fri, oct 28, 77",
    "machine": "1977-10-28"
  },
  {
    "human": "2004-12-27",
    "machine": "2004-12-27"
  },
  {
    "human": "apr 6 2010",
    "machine": "2010-04-06"
  },
  {
    "human": "thursday, april 22, 1976",
    "machine": "1976-04-22"
  },
  {
    "human": "april 17, 2019",
    "machine": "2019-04-17"
  },
  {
    "human": "october 25, 1977",
    "machine": "1977-10-25"
  },
  {
    "human": "2018-02-07",
    "machine": "2018-02-07"
  },
  {
    "human": "november 5, 1997",
    "machine": "1997-11-05"
  },
  {
    "human": "4 december 1971",
    "machine": "1971-12-04"
  },
  {
    "human": "25, jun 2002",
    "machine": "2002-06-25"
  },
  {
    "human": "2016-12-13",
    "machine": "2016-12-13"
  },
  {
    "human": "29 march 1990",
    "machine": "1990-03-29"
  },
  {
    "human": "15, apr 1984",
    "machine": "1984-04-15"
  },
  {
    "human": "10-30-18",
    "machine": "2018-10-30"
  },
  {
    "human": "6-nov-1970",
    "machine": "1970-11-06"
  },
  {
    "human": "mar 14, 78",
    "machine": "1978-03-14"
  },
  {
    "human": "jul 16, 1994",
    "machine": "1994-07-16"
  },
  {
    "human": "jun 24 2016",
    "machine": "2016-06-24"
  },
  {
    "human": "21.11.1973",
    "machine": "1973-11-21"
  },
  {
    "human": "10 feb 2020",
    "machine": "2020-02-10"
  },
  {
    "human": "wednesday, june 10, 1992",
    "machine": "1992-06-10"
  },
  {
    "human": "aug 12, 2022",
    "machine": "2022-08-12"
  },
  {
    "human": "31/08/2015",
    "machine": "2015-08-31"
  },
  {
    "human": "4/3/95",
    "machine": "1995-04-03"
  },
  {
    "human": "2/24/13",
    "machine": "2013-02-24"
  },
  {
    "human": "04/16/1995",
    "machine": "1995-04-16"
  },
  {
    "human": "01.12.2024",
    "machine": "2024-12-01"
  },
  {
    "human": "september 19, 2003",
    "machine": "2003-09-19"
  },
  {
    "human": "2010/09/28",
    "machine": "2010-09-28"
  },
  {
    "human": "aug 11, 87",
    "machine": "1987-08-11"
  },
  {
    "human": "3 aug 1970",
    "machine": "1970-08-03"
  },
  {
    "human": "18-10-17",
    "machine": "2018-10-17"
  },
  {
    "human": "1996/06/29",
    "machine": "1996-06-29"
  },
  {
    "human": "sunday, january 31, 2010",
    "machine": "2010-01-31"
  },
  {
    "human": "4/25/87",
    "machine": "1987-04-25"
  },
  {
    "human": "14 november 1972",
    "machine": "1972-11-14"
  },
  {
    "human": "jul 9 2008",
    "machine": "2008-07-09"
  },
  {
    "human": "12-26-09",
    "machine": "2009-12-26"
  },
  {
    "human": "10.12.88",
    "machine": "1988-12-10"
  },
  {
    "human": "11/16/97",
    "machine": "1997-11-16"
  },
  {
    "human": "30.4.71",
    "machine": "1971-04-30"
  },
  {
    "human": "5/9/85",
    "machine": "1985-05-09"
  },
  {
    "human": "1987/08/06",
    "machine": "1987-08-06"
  },
  {
    "human": "20-02-10",
    "machine": "2020-02-10"
  },
  {
    "human": "10.06.2018",
    "machine": "2018-06-10"
  },
  {
    "human": "18, nov 1976",
    "machine": "1976-11-18"
  },
  {
    "human": "15 jul 1984",
    "machine": "1984-07-15"
  },
  {
    "human": "jul 14 2020",
    "machine": "2020-07-14"
  },
  {
    "human": "mon, jan 10, 22",
    "machine": "2022-01-10"
  },
  {
    "human": "18 april 2024",
    "machine": "2024-04-18"
  },
  {
    "human": "1986-06-09",
    "machine": "1986-06-09"
  },
  {
    "human": "tuesday, january 17, 2017",
    "machine": "2017-01-17"
  },
  {
    "human": "2016-07-10",
    "machine": "2016-07-10"
  },
  {
    "human": "aug 4, 91",
    "machine": "1991-08-04"
  },
  {
    "human": "8 december 1994",
    "machine": "1994-12-08"
  },
  {
    "human": "01, jan 2017",
    "machine": "2017-01-01"
  },
  {
    "human": "october 8, 1976",
    "machine": "1976-10-08"
  },
  {
    "human": "25-nov-2016",
    "machine": "2016-11-25"
  },
  {
    "human": "4.7.24",
    "machine": "2024-07-04"
  },
  {
    "human": "14 mar, 2011",
    "machine": "2011-03-14"
  },
  {
    "human": "01-06-13",
    "machine": "2013-01-06"
  },
  {
    "human": "august 20, 2002",
    "machine": "2002-08-20"
  },
  {
    "human": "jan 12, 98",
    "machine": "1998-01-12"
  },
  {
    "human": "1999-01-18",
    "machine": "1999-01-18"
  },
  {
    "human": "1991.01.02 ad",
    "machine": "1991-01-02"
  },
  {
    "human": "16 june 1986",
    "machine": "1986-06-16"
  },
  {
    "human": "november 19, 1973",
    "machine": "1973-11-19"
  },
  {
    "human": "2/02/2002",
    "machine": "2002-02-02"
  },
  {
    "human": "jun 8, 76",
    "machine": "1976-06-08"
  },
  {
    "human": "15.02.1975",
    "machine": "1975-02-15"
  },
  {
    "human": "3 oct 1987",
    "machine": "1987-10-03"
  },
  {
    "human": "june 13, 2004",
    "machine": "2004-06-13"
  },
  {
    "human": "february 12, 2011",
    "machine": "2011-02-12"
  },
  {
    "human": "1989/07/27",
    "machine": "1989-07-27"
  },
  {
    "human": "15.08.14",
    "machine": "2015-08-14"
  },
  {
    "human": "2013/02/12",
    "machine": "2013-02-12"
  },
  {
    "human": "1979-11-11",
    "machine": "1979-11-11"
  },
  {
    "human": "2022.08.14 ad",
    "machine": "2022-08-14"
  },
  {
    "human": "1974-07-14",
    "machine": "1974-07-14"
  },
  {
    "human": "2019.11.30 ad",
    "machine": "2019-11-30"
  },
  {
    "human": "jul 2, 2012",
    "machine": "2012-07-02"
  },
  {
    "human": "12 sep 2002",
    "machine": "2002-09-12"
  },
  {
    "human": "september 2, 2008",
    "machine": "2008-09-02"
  },
  {
    "human": "2024-01-26",
    "machine": "2024-01-26"
  },
  {
    "human": "23/02/2024",
    "machine": "2024-02-23"
  },
  {
    "human": "06-20-99",
    "machine": "1999-06-20"
  },
  {
    "human": "28, may 1996",
    "machine": "1996-05-28"
  },
  {
    "human": "feb 27 2002",
    "machine": "2002-02-27"
  },
  {
    "human": "1972.09.08 ad",
    "machine": "1972-09-08"
  },
  {
    "human": "2015-02-22",
    "machine": "2015-02-22"
  },
  {
    "human": "jun 16, 91",
    "machine": "1991-06-16"
  },
  {
    "human": "2005/10/17",
    "machine": "2005-10-17"
  },
  {
    "human": "apr 27, 22",
    "machine": "2022-04-27"
  },
  {
    "human": "feb 15 2001",
    "machine": "2001-02-15"
  },
  {
    "human": "nov 24, 23",
    "machine": "2023-11-24"
  },
  {
    "human": "feb 7 2025",
    "machine": "2025-02-07"
  },
  {
    "human": "feb 18, 10",
    "machine": "2010-02-18"
  },
  {
    "human": "14-04-15",
    "machine": "2014-04-15"
  },
  {
    "human": "3 mar 2014",
    "machine": "2014-03-03"
  },
  {
    "human": "27.1.10",
    "machine": "2010-01-27"
  },
  {
    "human": "89.11.6",
    "machine": "1989-11-06"
  },
  {
    "human": "october 24, 1973",
    "machine": "1973-10-24"
  },
  {
    "human": "06/29/2006",
    "machine": "2006-06-29"
  },
  {
    "human": "10/31/2012",
    "machine": "2012-10-31"
  },
  {
    "human": "01-27-77",
    "machine": "1977-01-27"
  },
  {
    "human": "13.1.82",
    "machine": "1982-01-13"
  },
  {
    "human": "july 21, 2023",
    "machine": "2023-07-21"
  },
  {
    "human": "thu, aug 12, 21",
    "machine": "2021-08-12"
  },
  {
    "human": "august 15, 2011",
    "machine": "2011-08-15"
  },
  {
    "human": "2000.12.23 ad",
    "machine": "2000-12-23"
  },
  {
    "human": "2010/11/18",
    "machine": "2010-11-18"
  },
  {
    "human": "23, mar 2001",
    "machine": "2001-03-23"
  },
  {
    "human": "07.11.1",
    "machine": "2007-11-01"
  },
  {
    "human": "apr 13 2024",
    "machine": "2024-04-13"
  },
  {
    "human": "01-05-29",
    "machine": "2001-05-29"
  },
  {
    "human": "mar 26, 99",
    "machine": "1999-03-26"
  },
  {
    "human": "february 7, 1996",
    "machine": "1996-02-07"
  },
  {
    "human": "5/2/89",
    "machine": "1989-05-02"
  },
  {
    "human": "29/12/2017",
    "machine": "2017-12-29"
  },
  {
    "human": "sun, jun 30, 74",
    "machine": "1974-06-30"
  },
  {
    "human": "september 10, 2021",
    "machine": "2021-09-10"
  },
  {
    "human": "27 jan, 1988",
    "machine": "1988-01-27"
  },
  {
    "human": "13 apr, 1991",
    "machine": "1991-04-13"
  },
  {
    "human": "06-20-02",
    "machine": "2002-06-20"
  },
  {
    "human": "11/11/96",
    "machine": "1996-11-11"
  },
  {
    "human": "19/04/1978",
    "machine": "1978-04-19"
  },
  {
    "human": "jun 10, 1990",
    "machine": "1990-06-10"
  },
  {
    "human": "2025-02-23",
    "machine": "2025-02-23"
  },
  {
    "human": "03-05-10",
    "machine": "2010-03-05"
  },
  {
    "human": "april 16, 2010",
    "machine": "2010-04-16"
  },
  {
    "human": "aug 19 1976",
    "machine": "1976-08-19"
  },
  {
    "human": "5 september 2016",
    "machine": "2016-09-05"
  },
  {
    "human": "march 16, 2012",
    "machine": "2012-03-16"
  },
  {
    "human": "01-25-04",
    "machine": "2004-01-25"
  },
  {
    "human": "12/04/2018",
    "machine": "2018-04-12"
  },
  {
    "human": "1986.04.15 ad",
    "machine": "1986-04-15"
  },
  {
    "human": "8/24/97",
    "machine": "1997-08-24"
  },
  {
    "human": "1996.11.27 ad",
    "machine": "1996-11-27"
  },
  {
    "human": "2/19/82",
    "machine": "1982-02-19"
  },
  {
    "human": "12/21/80",
    "machine": "1980-12-21"
  },
  {
    "human": "monday, february 28, 2011",
    "machine": "2011-02-28"
  },
  {
    "human": "saturday, august 14, 2004",
    "machine": "2004-08-14"
  },
  {
    "human": "august 26, 2006",
    "machine": "2006-08-26"
  },
  {
    "human": "1980.06.29 ad",
    "machine": "1980-06-29"
  },
  {
    "human": "6/05/2023",
    "machine": "2023-05-06"
  },
  {
    "human": "9 may 1997",
    "machine": "1997-05-09"
  },
  {
    "human": "3/10/18",
    "machine": "2018-03-10"
  },
  {
    "human": "03-25-93",
    "machine": "1993-03-25"
  },
  {
    "human": "sunday, may 29, 1994",
    "machine": "1994-05-29"
  },
  {
    "human": "26 nov 1989",
    "machine": "1989-11-26"
  },
  {
    "human": "20, jul 1990",
    "machine": "1990-07-20"
  },
  {
    "human": "march 10, 2024",
    "machine": "2024-03-10"
  },
  {
    "human": "02.12.29",
    "machine": "2002-12-29"
  },
  {
    "human": "thu, jul 3, 86",
    "machine": "1986-07-03"
  },
  {
    "human": "dec 22, 80",
    "machine": "1980-12-22"
  },
  {
    "human": "09-13-24",
    "machine": "2024-09-13"
  },
  {
    "human": "1987.12.20 ad",
    "machine": "1987-12-20"
  },
  {
    "human": "june 15, 2023",
    "machine": "2023-06-15"
  },
  {
    "human": "29, mar 2007",
    "machine": "2007-03-29"
  },
  {
    "human": "1997/04/16",
    "machine": "1997-04-16"
  },
  {
    "human": "mon, apr 24, 95",
    "machine": "1995-04-24"
  },
  {
    "human": "01.07.1",
    "machine": "2001-07-01"
  },
  {
    "human": "88-11-27",
    "machine": "1988-11-27"
  },
  {
    "human": "1971/12/16",
    "machine": "1971-12-16"
  },
  {
    "human": "saturday, october 3, 1981",
    "machine": "1981-10-03"
  },
  {
    "human": "1/08/2021",
    "machine": "2021-08-01"
  },
  {
    "human": "8/30/95",
    "machine": "1995-08-30"
  },
  {
    "human": "3 mar, 2020",
    "machine": "2020-03-03"
  },
  {
    "human": "12/31/20",
    "machine": "2020-12-31"
  },
  {
    "human": "6 mar, 2024",
    "machine": "2024-03-06"
  },
  {
    "human": "00-10-04",
    "machine": "2000-10-04"
  },
  {
    "human": "march 24, 1977",
    "machine": "1977-03-24"
  },
  {
    "human": "may 12, 1992",
    "machine": "1992-05-12"
  },
  {
    "human": "2025-10-14",
    "machine": "2025-10-14"
  },
  {
    "human": "fri, jun 6, 97",
    "machine": "1997-06-06"
  },
  {
    "human": "82.11.17",
    "machine": "1982-11-17"
  },
  {
    "human": "2008.01.23 ad",
    "machine": "2008-01-23"
  },
  {
    "human": "wed, oct 26, 05",
    "machine": "2005-10-26"
  },
  {
    "human": "1991-01-22",
    "machine": "1991-01-22"
  },
  {
    "human": "26.4.80",
    "machine": "1980-04-26"
  },
  {
    "human": "03-27-25",
    "machine": "2025-03-27"
  },
  {
    "human": "22-jan-1995",
    "machine": "1995-01-22"
  },
  {
    "human": "2 dec 2014",
    "machine": "2014-12-02"
  },
  {
    "human": "1994/01/11",
    "machine": "1994-01-11"
  },
  {
    "human": "73.12.25",
    "machine": "1973-12-25"
  },
  {
    "human": "4-oct-2014",
    "machine": "2014-10-04"
  },
  {
    "human": "jul 13, 22",
    "machine": "2022-07-13"
  },
  {
    "human": "3/12/95",
    "machine": "1995-03-12"
  },
  {
    "human": "11-dec-1971",
    "machine": "1971-12-11"
  },
  {
    "human": "august 4, 2005",
    "machine": "2005-08-04"
  },
  {
    "human": "04 june 2021",
    "machine": "2021-06-04"
  },
  {
    "human": "wed, dec 26, 12",
    "machine": "2012-12-26"
  },
  {
    "human": "04-08-94",
    "machine": "1994-04-08"
  },
  {
    "human": "1989.02.10 ad",
    "machine": "1989-02-10"
  },
  {
    "human": "27.02.1993",
    "machine": "1993-02-27"
  },
  {
    "human": "19 november 1999",
    "machine": "1999-11-19"
  },
  {
    "human": "thursday, february 27, 1992",
    "machine": "1992-02-27"
  },
  {
    "human": "september 30, 1994",
    "machine": "1994-09-30"
  },
  {
    "human": "27, jul 1980",
    "machine": "1980-07-27"
  },
  {
    "human": "01/17/1981",
    "machine": "1981-01-17"
  },
  {
    "human": "7/20/25",
    "machine": "2025-07-20"
  },
  {
    "human": "october 11, 1995",
    "machine": "1995-10-11"
  },
  {
    "human": "24-aug-2012",
    "machine": "2012-08-24"
  },
  {
    "human": "wed, dec 21, 05",
    "machine": "2005-12-21"
  },
  {
    "human": "05/07/2020",
    "machine": "2020-05-07"
  },
  {
    "human": "wednesday, april 1, 1998",
    "machine": "1998-04-01"
  },
  {
    "human": "2007-06-07",
    "machine": "2007-06-07"
  },
  {
    "human": "19.01.23",
    "machine": "2019-01-23"
  },
  {
    "human": "15-01-05",
    "machine": "2015-01-05"
  },
  {
    "human": "december 16, 2007",
    "machine": "2007-12-16"
  },
  {
    "human": "1973-10-29",
    "machine": "1973-10-29"
  },
  {
    "human": "feb 12, 1971",
    "machine": "1971-02-12"
  },
  {
    "human": "6/6/01",
    "machine": "2001-06-06"
  },
  {
    "human": "14 jul, 1995",
    "machine": "1995-07-14"
  },
  {
    "human": "august 26, 2007",
    "machine": "2007-08-26"
  },
  {
    "human": "4/28/02",
    "machine": "2002-04-28"
  },
  {
    "human": "10/06/1998",
    "machine": "1998-06-10"
  },
  {
    "human": "3 jan 1985",
    "machine": "1985-01-03"
  },
  {
    "human": "23 jan, 2016",
    "machine": "2016-01-23"
  },
  {
    "human": "aug 9, 73",
    "machine": "1973-08-09"
  },
  {
    "human": "saturday, august 23, 1997",
    "machine": "1997-08-23"
  },
  {
    "human": "2/26/16",
    "machine": "2016-02-26"
  },
  {
    "human": "2020-02-27",
    "machine": "2020-02-27"
  },
  {
    "human": "2007-10-18",
    "machine": "2007-10-18"
  },
  {
    "human": "tuesday, august 9, 1994",
    "machine": "1994-08-09"
  },
  {
    "human": "july 14, 1980",
    "machine": "1980-07-14"
  },
  {
    "human": "04/28/2017",
    "machine": "2017-04-28"
  },
  {
    "human": "01 january 1987",
    "machine": "1987-01-01"
  },
  {
    "human": "jan 9, 08",
    "machine": "2008-01-09"
  },
  {
    "human": "jun 1 2004",
    "machine": "2004-06-01"
  },
  {
    "human": "09-04-01",
    "machine": "2001-09-04"
  },
  {
    "human": "tuesday, october 30, 2007",
    "machine": "2007-10-30"
  },
  {
    "human": "23 sep, 2021",
    "machine": "2021-09-23"
  },
  {
    "human": "wed, apr 1, 20",
    "machine": "2020-04-01"
  },
  {
    "human": "10 dec, 1993",
    "machine": "1993-12-10"
  },
  {
    "human": "feb 2 1981",
    "machine": "1981-02-02"
  },
  {
    "human": "may 27, 1999",
    "machine": "1999-05-27"
  },
  {
    "human": "1984/03/14",
    "machine": "1984-03-14"
  },
  {
    "human": "2017-03-17",
    "machine": "2017-03-17"
  },
  {
    "human": "12/30/81",
    "machine": "1981-12-30"
  },
  {
    "human": "2006-04-9",
    "machine": "2006-04-09"
  },
  {
    "human": "2022/11/11",
    "machine": "2022-11-11"
  },
  {
    "human": "april 19, 1992",
    "machine": "1992-04-19"
  },
  {
    "human": "13.04.1996",
    "machine": "1996-04-13"
  },
  {
    "human": "wed, may 3, 23",
    "machine": "2023-05-03"
  },
  {
    "human": "nov 29, 02",
    "machine": "2002-11-29"
  },
  {
    "human": "23, jul 1991",
    "machine": "1991-07-23"
  },
  {
    "human": "11-oct-1972",
    "machine": "1972-10-11"
  },
  {
    "human": "24/08/1998",
    "machine": "1998-08-24"
  },
  {
    "human": "june 14, 2012",
    "machine": "2012-06-14"
  },
  {
    "human": "2000-10-13",
    "machine": "2000-10-13"
  },
  {
    "human": "7/03/2003",
    "machine": "2003-03-07"
  },
  {
    "human": "09 november 2023",
    "machine": "2023-11-09"
  },
  {
    "human": "2 jan, 2016",
    "machine": "2016-01-02"
  },
  {
    "human": "07-01-74",
    "machine": "1974-07-01"
  },
  {
    "human": "12/12/1978",
    "machine": "1978-12-12"
  },
  {
    "human": "1990/04/02",
    "machine": "1990-04-02"
  },
  {
    "human": "1 may 2010",
    "machine": "2010-05-01"
  },
  {
    "human": "july 21, 1977",
    "machine": "1977-07-21"
  },
  {
    "human": "1989-05-20",
    "machine": "1989-05-20"
  },
  {
    "human": "30 aug 1998",
    "machine": "1998-08-30"
  },
  {
    "human": "apr 22 2014",
    "machine": "2014-04-22"
  },
  {
    "human": "mon, nov 11, 85",
    "machine": "1985-11-11"
  },
  {
    "human": "16.08.2005",
    "machine": "2005-08-16"
  },
  {
    "human": "1-mar-2008",
    "machine": "2008-03-01"
  },
  {
    "human": "22.11.2002",
    "machine": "2002-11-22"
  },
  {
    "human": "04.01.8",
    "machine": "2004-01-08"
  },
  {
    "human": "june 17, 1998",
    "machine": "1998-06-17"
  },
  {
    "human": "saturday, april 20, 2002",
    "machine": "2002-04-20"
  },
  {
    "human": "31.03.1996",
    "machine": "1996-03-31"
  },
  {
    "human": "monday, october 18, 2021",
    "machine": "2021-10-18"
  },
  {
    "human": "wednesday, february 26, 2025",
    "machine": "2025-02-26"
  },
  {
    "human": "28 june 2014",
    "machine": "2014-06-28"
  },
  {
    "human": "sun, jul 7, 74",
    "machine": "1974-07-07"
  },
  {
    "human": "sat, feb 21, 70",
    "machine": "1970-02-21"
  },
  {
    "human": "1991.08.12 ad",
    "machine": "1991-08-12"
  },
  {
    "human": "6 sep 1991",
    "machine": "1991-09-06"
  },
  {
    "human": "2/17/80",
    "machine": "1980-02-17"
  },
  {
    "human": "11.07.5",
    "machine": "2011-07-05"
  },
  {
    "human": "9 mar 1983",
    "machine": "1983-03-09"
  },
  {
    "human": "jul 24 1992",
    "machine": "1992-07-24"
  },
  {
    "human": "mar 15, 1974",
    "machine": "1974-03-15"
  },
  {
    "human": "09, aug 2007",
    "machine": "2007-08-09"
  },
  {
    "human": "2001-02-22",
    "machine": "2001-02-22"
  },
  {
    "human": "29 mar, 2011",
    "machine": "2011-03-29"
  },
  {
    "human": "april 2, 1980",
    "machine": "1980-04-02"
  },
  {
    "human": "february 5, 1981",
    "machine": "1981-02-05"
  },
  {
    "human": "10, nov 2007",
    "machine": "2007-11-10"
  },
  {
    "human": "10/26/17",
    "machine": "2017-10-26"
  },
  {
    "human": "11/05/1973",
    "machine": "1973-11-05"
  },
  {
    "human": "may 11, 1974",
    "machine": "1974-05-11"
  },
  {
    "human": "april 15, 2024",
    "machine": "2024-04-15"
  },
  {
    "human": "29 august 1999",
    "machine": "1999-08-29"
  },
  {
    "human": "tuesday, july 10, 2007",
    "machine": "2007-07-10"
  },
  {
    "human": "feb 13, 91",
    "machine": "1991-02-13"
  },
  {
    "human": "2011-10-15",
    "machine": "2011-10-15"
  },
  {
    "human": "july 24, 2008",
    "machine": "2008-07-24"
  },
  {
    "human": "7 aug, 2007",
    "machine": "2007-08-07"
  },
  {
    "human": "28 apr, 1980",
    "machine": "1980-04-28"
  },
  {
    "human": "tuesday, september 4, 1990",
    "machine": "1990-09-04"
  },
  {
    "human": "05/11/2020",
    "machine": "2020-05-11"
  },
  {
    "human": "19 jun, 2021",
    "machine": "2021-06-19"
  },
  {
    "human": "9/11/11",
    "machine": "2011-09-11"
  },
  {
    "human": "sun, jan 9, 11",
    "machine": "2011-01-09"
  },
  {
    "human": "jun 19, 2009",
    "machine": "2009-06-19"
  },
  {
    "human": "may 18, 1991",
    "machine": "1991-05-18"
  },
  {
    "human": "06, aug 2008",
    "machine": "2008-08-06"
  },
  {
    "human": "saturday, july 10, 1999",
    "machine": "1999-07-10"
  },
  {
    "human": "2009-08-31",
    "machine": "2009-08-31"
  },
  {
    "human": "13 july 2015",
    "machine": "2015-07-13"
  },
  {
    "human": "12-01-06",
    "machine": "2006-12-01"
  },
  {
    "human": "november 25, 2013",
    "machine": "2013-11-25"
  },
  {
    "human": "03-11-01",
    "machine": "2003-11-01"
  },
  {
    "human": "05-15-86",
    "machine": "1986-05-15"
  },
  {
    "human": "tuesday, august 8, 1972",
    "machine": "1972-08-08"
  },
  {
    "human": "21 july 2011",
    "machine": "2011-07-21"
  },
  {
    "human": "sep 7, 1995",
    "machine": "1995-09-07"
  },
  {
    "human": "aug 15 1999",
    "machine": "1999-08-15"
  },
  {
    "human": "july 19, 2023",
    "machine": "2023-07-19"
  },
  {
    "human": "saturday, november 7, 2015",
    "machine": "2015-11-07"
  },
  {
    "human": "december 10, 1988",
    "machine": "1988-12-10"
  },
  {
    "human": "09.10.2014",
    "machine": "2014-10-09"
  },
  {
    "human": "march 18, 2007",
    "machine": "2007-03-18"
  },
  {
    "human": "2023-04-21",
    "machine": "2023-04-21"
  },
  {
    "human": "14.02.1979",
    "machine": "1979-02-14"
  },
  {
    "human": "19 october 2011",
    "machine": "2011-10-19"
  },
  {
    "human": "sun, mar 10, 91",
    "machine": "1991-03-10"
  },
  {
    "human": "1970-11-27",
    "machine": "1970-11-27"
  },
  {
    "human": "monday, november 20, 2000",
    "machine": "2000-11-20"
  },
  {
    "human": "1975/02/17",
    "machine": "1975-02-17"
  },
  {
    "human": "jul 27, 82",
    "machine": "1982-07-27"
  },
  {
    "human": "wed, dec 13, 72",
    "machine": "1972-12-13"
  },
  {
    "human": "26 may, 2001",
    "machine": "2001-05-26"
  },
  {
    "human": "09/13/1975",
    "machine": "1975-09-13"
  },
  {
    "human": "november 6, 2018",
    "machine": "2018-11-06"
  },
  {
    "human": "19 march 2002",
    "machine": "2002-03-19"
  },
  {
    "human": "02 january 2003",
    "machine": "2003-01-02"
  },
  {
    "human": "30/04/2005",
    "machine": "2005-04-30"
  },
  {
    "human": "5 oct, 1981",
    "machine": "1981-10-05"
  },
  {
    "human": "29.04.1987",
    "machine": "1987-04-29"
  },
  {
    "human": "march 1, 1998",
    "machine": "1998-03-01"
  },
  {
    "human": "may 25 2011",
    "machine": "2011-05-25"
  },
  {
    "human": "26 april 1985",
    "machine": "1985-04-26"
  },
  {
    "human": "2013-10-25",
    "machine": "2013-10-25"
  },
  {
    "human": "24/02/1970",
    "machine": "1970-02-24"
  },
  {
    "human": "wed, dec 2, 15",
    "machine": "2015-12-02"
  },
  {
    "human": "1988-01-9",
    "machine": "1988-01-09"
  },
  {
    "human": "03.10.20",
    "machine": "2003-10-20"
  },
  {
    "human": "11-jul-2011",
    "machine": "2011-07-11"
  },
  {
    "human": "jan 28 2008",
    "machine": "2008-01-28"
  },
  {
    "human": "12-18-22",
    "machine": "2022-12-18"
  },
  {
    "human": "2011.03.09 ad",
    "machine": "2011-03-09"
  },
  {
    "human": "15.04.1976",
    "machine": "1976-04-15"
  },
  {
    "human": "june 15, 2012",
    "machine": "2012-06-15"
  },
  {
    "human": "25 may, 2005",
    "machine": "2005-05-25"
  },
  {
    "human": "04 august 1997",
    "machine": "1997-08-04"
  },
  {
    "human": "02/04/1982",
    "machine": "1982-02-04"
  },
  {
    "human": "07/10/1991",
    "machine": "1991-07-10"
  },
  {
    "human": "sunday, october 29, 2023",
    "machine": "2023-10-29"
  },
  {
    "human": "07, dec 2005",
    "machine": "2005-12-07"
  },
  {
    "human": "jan 24 1973",
    "machine": "1973-01-24"
  },
  {
    "human": "30, oct 2011",
    "machine": "2011-10-30"
  },
  {
    "human": "wednesday, march 1, 1989",
    "machine": "1989-03-01"
  },
  {
    "human": "03-01-10",
    "machine": "2003-01-10"
  },
  {
    "human": "mar 8, 71",
    "machine": "1971-03-08"
  },
  {
    "human": "02, oct 2017",
    "machine": "2017-10-02"
  },
  {
    "human": "05-30-01",
    "machine": "2001-05-30"
  },
  {
    "human": "11 jun, 1982",
    "machine": "1982-06-11"
  },
  {
    "human": "2004/12/10",
    "machine": "2004-12-10"
  },
  {
    "human": "5/20/92",
    "machine": "1992-05-20"
  },
  {
    "human": "18.09.2014",
    "machine": "2014-09-18"
  },
  {
    "human": "wed, may 13, 92",
    "machine": "1992-05-13"
  },
  {
    "human": "1/31/06",
    "machine": "2006-01-31"
  },
  {
    "human": "83.05.21",
    "machine": "1983-05-21"
  },
  {
    "human": "1999-07-27",
    "machine": "1999-07-27"
  },
  {
    "human": "25.09.1974",
    "machine": "1974-09-25"
  },
  {
    "human": "1989.10.15 ad",
    "machine": "1989-10-15"
  },
  {
    "human": "dec 17, 1979",
    "machine": "1979-12-17"
  },
  {
    "human": "jan 10, 22",
    "machine": "2022-01-10"
  },
  {
    "human": "august 8, 1993",
    "machine": "1993-08-08"
  },
  {
    "human": "may 13, 2014",
    "machine": "2014-05-13"
  },
  {
    "human": "19 july 1978",
    "machine": "1978-07-19"
  },
  {
    "human": "3/28/76",
    "machine": "1976-03-28"
  },
  {
    "human": "1971.05.04 ad",
    "machine": "1971-05-04"
  },
  {
    "human": "02.08.1999",
    "machine": "1999-08-02"
  },
  {
    "human": "13 june 2023",
    "machine": "2023-06-13"
  },
  {
    "human": "thursday, july 16, 2020",
    "machine": "2020-07-16"
  },
  {
    "human": "march 14, 1984",
    "machine": "1984-03-14"
  },
  {
    "human": "thursday, september 10, 1992",
    "machine": "1992-09-10"
  },
  {
    "human": "1/03/1997",
    "machine": "1997-03-01"
  },
  {
    "human": "3 december 1972",
    "machine": "1972-12-03"
  },
  {
    "human": "2003-08-16",
    "machine": "2003-08-16"
  },
  {
    "human": "wed, may 9, 18",
    "machine": "2018-05-09"
  },
  {
    "human": "80.05.20",
    "machine": "1980-05-20"
  },
  {
    "human": "30, aug 1998",
    "machine": "1998-08-30"
  },
  {
    "human": "77.10.30",
    "machine": "1977-10-30"
  },
  {
    "human": "88-03-01",
    "machine": "1988-03-01"
  },
  {
    "human": "26.04.1972",
    "machine": "1972-04-26"
  },
  {
    "human": "10/27/2018",
    "machine": "2018-10-27"
  },
  {
    "human": "2009/02/22",
    "machine": "2009-02-22"
  },
  {
    "human": "20 october 2025",
    "machine": "2025-10-20"
  },
  {
    "human": "4/22/96",
    "machine": "1996-04-22"
  },
  {
    "human": "sep 18 1989",
    "machine": "1989-09-18"
  },
  {
    "human": "03.07.23",
    "machine": "2003-07-23"
  },
  {
    "human": "83.09.17",
    "machine": "1983-09-17"
  },
  {
    "human": "07.03.1991",
    "machine": "1991-03-07"
  },
  {
    "human": "1992-07-16",
    "machine": "1992-07-16"
  },
  {
    "human": "feb 19, 22",
    "machine": "2022-02-19"
  },
  {
    "human": "monday, december 5, 1983",
    "machine": "1983-12-05"
  },
  {
    "human": "7.4.12",
    "machine": "2012-04-07"
  },
  {
    "human": "oct 21, 10",
    "machine": "2010-10-21"
  },
  {
    "human": "14.05.2021",
    "machine": "2021-05-14"
  },
  {
    "human": "28-nov-1995",
    "machine": "1995-11-28"
  },
  {
    "human": "23 apr 2018",
    "machine": "2018-04-23"
  },
  {
    "human": "2021-03-12",
    "machine": "2021-03-12"
  },
  {
    "human": "1994-10-18",
    "machine": "1994-10-18"
  },
  {
    "human": "7-oct-2006",
    "machine": "2006-10-07"
  },
  {
    "human": "4/1/08",
    "machine": "2008-04-01"
  },
  {
    "human": "05.10.1981",
    "machine": "1981-10-05"
  },
  {
    "human": "7/14/91",
    "machine": "1991-07-14"
  },
  {
    "human": "1 sep 2005",
    "machine": "2005-09-01"
  },
  {
    "human": "1/19/85",
    "machine": "1985-01-19"
  },
  {
    "human": "1976-01-3",
    "machine": "1976-01-03"
  },
  {
    "human": "98.08.3",
    "machine": "1998-08-03"
  },
  {
    "human": "apr 16, 1983",
    "machine": "1983-04-16"
  },
  {
    "human": "1995-04-13",
    "machine": "1995-04-13"
  },
  {
    "human": "mar 16 2008",
    "machine": "2008-03-16"
  },
  {
    "human": "87.06.16",
    "machine": "1987-06-16"
  },
  {
    "human": "1977/03/18",
    "machine": "1977-03-18"
  },
  {
    "human": "29.06.1973",
    "machine": "1973-06-29"
  },
  {
    "human": "june 25, 1985",
    "machine": "1985-06-25"
  },
  {
    "human": "83.07.15",
    "machine": "1983-07-15"
  },
  {
    "human": "07 june 1978",
    "machine": "1978-06-07"
  },
  {
    "human": "3/12/05",
    "machine": "2005-03-12"
  },
  {
    "human": "26 may 1982",
    "machine": "1982-05-26"
  },
  {
    "human": "thursday, september 14, 1995",
    "machine": "1995-09-14"
  },
  {
    "human": "01/29/1999",
    "machine": "1999-01-29"
  },
  {
    "human": "4-may-1972",
    "machine": "1972-05-04"
  },
  {
    "human": "11-jan-1979",
    "machine": "1979-01-11"
  },
  {
    "human": "sep 22, 2007",
    "machine": "2007-09-22"
  },
  {
    "human": "may 12, 2004",
    "machine": "2004-05-12"
  },
  {
    "human": "4/18/01",
    "machine": "2001-04-18"
  },
  {
    "human": "2/3/79",
    "machine": "1979-02-03"
  },
  {
    "human": "12/11/2011",
    "machine": "2011-12-11"
  },
  {
    "human": "saturday, october 23, 1999",
    "machine": "1999-10-23"
  },
  {
    "human": "sunday, november 3, 2019",
    "machine": "2019-11-03"
  },
  {
    "human": "march 30, 2004",
    "machine": "2004-03-30"
  },
  {
    "human": "14-09-15",
    "machine": "2014-09-15"
  },
  {
    "human": "19.4.08",
    "machine": "2008-04-19"
  },
  {
    "human": "80-02-12",
    "machine": "1980-02-12"
  },
  {
    "human": "2021.10.24 ad",
    "machine": "2021-10-24"
  },
  {
    "human": "07-16-85",
    "machine": "1985-07-16"
  },
  {
    "human": "06, nov 2006",
    "machine": "2006-11-06"
  },
  {
    "human": "wednesday, august 4, 1976",
    "machine": "1976-08-04"
  },
  {
    "human": "10 feb 1987",
    "machine": "1987-02-10"
  },
  {
    "human": "25-oct-2004",
    "machine": "2004-10-25"
  },
  {
    "human": "3 june 2020",
    "machine": "2020-06-03"
  },
  {
    "human": "feb 23 1977",
    "machine": "1977-02-23"
  },
  {
    "human": "81.10.22",
    "machine": "1981-10-22"
  },
  {
    "human": "february 24, 1997",
    "machine": "1997-02-24"
  },
  {
    "human": "dec 30 2009",
    "machine": "2009-12-30"
  },
  {
    "human": "sunday, august 1, 1982",
    "machine": "1982-08-01"
  },
  {
    "human": "friday, november 15, 1985",
    "machine": "1985-11-15"
  },
  {
    "human": "10 september 1970",
    "machine": "1970-09-10"
  },
  {
    "human": "oct 19, 1983",
    "machine": "1983-10-19"
  },
  {
    "human": "01 january 1975",
    "machine": "1975-01-01"
  },
  {
    "human": "sat, jan 12, 74",
    "machine": "1974-01-12"
  },
  {
    "human": "2017/02/02",
    "machine": "2017-02-02"
  },
  {
    "human": "september 18, 1973",
    "machine": "1973-09-18"
  },
  {
    "human": "4/21/20",
    "machine": "2020-04-21"
  },
  {
    "human": "october 21, 2014",
    "machine": "2014-10-21"
  },
  {
    "human": "10/10/1985",
    "machine": "1985-10-10"
  },
  {
    "human": "24, apr 1972",
    "machine": "1972-04-24"
  },
  {
    "human": "sat, aug 3, 85",
    "machine": "1985-08-03"
  },
  {
    "human": "jul 12, 74",
    "machine": "1974-07-12"
  },
  {
    "human": "nov 25 2016",
    "machine": "2016-11-25"
  },
  {
    "human": "9 july 1977",
    "machine": "1977-07-09"
  },
  {
    "human": "friday, april 7, 2017",
    "machine": "2017-04-07"
  },
  {
    "human": "8/29/04",
    "machine": "2004-08-29"
  },
  {
    "human": "sunday, october 18, 2009",
    "machine": "2009-10-18"
  },
  {
    "human": "11.03.1973",
    "machine": "1973-03-11"
  },
  {
    "human": "18.12.1971",
    "machine": "1971-12-18"
  },
  {
    "human": "may 26 1993",
    "machine": "1993-05-26"
  },
  {
    "human": "3/16/82",
    "machine": "1982-03-16"
  },
  {
    "human": "03/22/1987",
    "machine": "1987-03-22"
  },
  {
    "human": "thursday, july 12, 1979",
    "machine": "1979-07-12"
  },
  {
    "human": "may 30, 1986",
    "machine": "1986-05-30"
  },
  {
    "human": "1978/02/28",
    "machine": "1978-02-28"
  },
  {
    "human": "8/6/08",
    "machine": "2008-08-06"
  },
  {
    "human": "7/4/04",
    "machine": "2004-07-04"
  },
  {
    "human": "27 january 1992",
    "machine": "1992-01-27"
  },
  {
    "human": "84-06-07",
    "machine": "1984-06-07"
  },
  {
    "human": "05/08/1977",
    "machine": "1977-05-08"
  },
  {
    "human": "02-03-18",
    "machine": "2002-03-18"
  },
  {
    "human": "dec 13 1998",
    "machine": "1998-12-13"
  },
  {
    "human": "03.05.1973",
    "machine": "1973-05-03"
  },
  {
    "human": "25 sep 2005",
    "machine": "2005-09-25"
  },
  {
    "human": "3/7/86",
    "machine": "1986-03-07"
  },
  {
    "human": "2 jul, 2012",
    "machine": "2012-07-02"
  },
  {
    "human": "2023-07-21",
    "machine": "2023-07-21"
  },
  {
    "human": "october 29, 2000",
    "machine": "2000-10-29"
  },
  {
    "human": "14-apr-2021",
    "machine": "2021-04-14"
  },
  {
    "human": "08, mar 2001",
    "machine": "2001-03-08"
  },
  {
    "human": "tue, jan 3, 17",
    "machine": "2017-01-03"
  },
  {
    "human": "1993/10/12",
    "machine": "1993-10-12"
  },
  {
    "human": "september 05, 2009",
    "machine": "2009-09-05"
  },
  {
    "human": "26.11.1981",
    "machine": "1981-11-26"
  },
  {
    "human": "19, jan 2022",
    "machine": "2022-01-19"
  },
  {
    "human": "13/06/1975",
    "machine": "1975-06-13"
  },
  {
    "human": "jan 10, 97",
    "machine": "1997-01-10"
  },
  {
    "human": "23 november 1998",
    "machine": "1998-11-23"
  },
  {
    "human": "11-04-94",
    "machine": "1994-11-04"
  },
  {
    "human": "sun, feb 22, 87",
    "machine": "1987-02-22"
  },
  {
    "human": "16 aug 2004",
    "machine": "2004-08-16"
  },
  {
    "human": "2012/09/01",
    "machine": "2012-09-01"
  },
  {
    "human": "29/02/2020",
    "machine": "2020-02-29"
  },
  {
    "human": "2025-11-25",
    "machine": "2025-11-25"
  },
  {
    "human": "thursday, january 25, 2018",
    "machine": "2018-01-25"
  },
  {
    "human": "jul 3 2009",
    "machine": "2009-07-03"
  },
  {
    "human": "november 25, 1980",
    "machine": "1980-11-25"
  },
  {
    "human": "08/23/1972",
    "machine": "1972-08-23"
  },
  {
    "human": "february 21, 2013",
    "machine": "2013-02-21"
  },
  {
    "human": "nov 10 2007",
    "machine": "2007-11-10"
  },
  {
    "human": "friday, july 22, 1977",
    "machine": "1977-07-22"
  },
  {
    "human": "sunday, march 31, 1974",
    "machine": "1974-03-31"
  },
  {
    "human": "wednesday, july 17, 1974",
    "machine": "1974-07-17"
  },
  {
    "human": "24, dec 2022",
    "machine": "2022-12-24"
  },
  {
    "human": "january 30, 1977",
    "machine": "1977-01-30"
  },
  {
    "human": "2016-10-11",
    "machine": "2016-10-11"
  },
  {
    "human": "december 12, 1987",
    "machine": "1987-12-12"
  },
  {
    "human": "1974-10-11",
    "machine": "1974-10-11"
  },
  {
    "human": "12 oct 1975",
    "machine": "1975-10-12"
  },
  {
    "human": "tue, may 13, 80",
    "machine": "1980-05-13"
  },
  {
    "human": "tuesday, october 21, 2025",
    "machine": "2025-10-21"
  },
  {
    "human": "apr 18, 1976",
    "machine": "1976-04-18"
  },
  {
    "human": "sep 30, 70",
    "machine": "1970-09-30"
  },
  {
    "human": "14, aug 1999",
    "machine": "1999-08-14"
  },
  {
    "human": "december 29, 1993",
    "machine": "1993-12-29"
  },
  {
    "human": "sun, may 29, 77",
    "machine": "1977-05-29"
  },
  {
    "human": "29 march 1987",
    "machine": "1987-03-29"
  },
  {
    "human": "february 22, 2021",
    "machine": "2021-02-22"
  },
  {
    "human": "1996-06-03",
    "machine": "1996-06-03"
  },
  {
    "human": "1991.08.30 ad",
    "machine": "1991-08-30"
  },
  {
    "human": "09 september 2025",
    "machine": "2025-09-09"
  },
  {
    "human": "1973.09.07 ad",
    "machine": "1973-09-07"
  },
  {
    "human": "09/22/2024",
    "machine": "2024-09-22"
  },
  {
    "human": "17 oct, 1972",
    "machine": "1972-10-17"
  },
  {
    "human": "25/09/1997",
    "machine": "1997-09-25"
  },
  {
    "human": "2002-07-17",
    "machine": "2002-07-17"
  },
  {
    "human": "jun 22, 88",
    "machine": "1988-06-22"
  },
  {
    "human": "saturday, december 7, 2024",
    "machine": "2024-12-07"
  },
  {
    "human": "august 02, 1971",
    "machine": "1971-08-02"
  },
  {
    "human": "17 november 1999",
    "machine": "1999-11-17"
  },
  {
    "human": "friday, january 1, 2010",
    "machine": "2010-01-01"
  },
  {
    "human": "4 mar, 1983",
    "machine": "1983-03-04"
  },
  {
    "human": "saturday, july 17, 1993",
    "machine": "1993-07-17"
  },
  {
    "human": "10.09.2005",
    "machine": "2005-09-10"
  },
  {
    "human": "10/27/25",
    "machine": "2025-10-27"
  },
  {
    "human": "1983-03-21",
    "machine": "1983-03-21"
  },
  {
    "human": "jul 11 1988",
    "machine": "1988-07-11"
  },
  {
    "human": "73.10.3",
    "machine": "1973-10-03"
  },
  {
    "human": "wednesday, february 1, 1989",
    "machine": "1989-02-01"
  },
  {
    "human": "sunday, december 21, 1986",
    "machine": "1986-12-21"
  },
  {
    "human": "dec 11, 1981",
    "machine": "1981-12-11"
  },
  {
    "human": "sunday, november 30, 2003",
    "machine": "2003-11-30"
  },
  {
    "human": "10, jul 1978",
    "machine": "1978-07-10"
  },
  {
    "human": "1994.04.15 ad",
    "machine": "1994-04-15"
  },
  {
    "human": "78-10-13",
    "machine": "1978-10-13"
  },
  {
    "human": "04, aug 2008",
    "machine": "2008-08-04"
  },
  {
    "human": "22.6.95",
    "machine": "1995-06-22"
  },
  {
    "human": "5/19/21",
    "machine": "2021-05-19"
  },
  {
    "human": "friday, august 26, 1994",
    "machine": "1994-08-26"
  },
  {
    "human": "6/2/04",
    "machine": "2004-06-02"
  },
  {
    "human": "9 jul 1993",
    "machine": "1993-07-09"
  },
  {
    "human": "thursday, november 16, 1978",
    "machine": "1978-11-16"
  },
  {
    "human": "29/12/1989",
    "machine": "1989-12-29"
  },
  {
    "human": "29/01/2025",
    "machine": "2025-01-29"
  },
  {
    "human": "11 december 1990",
    "machine": "1990-12-11"
  },
  {
    "human": "friday, july 23, 2004",
    "machine": "2004-07-23"
  },
  {
    "human": "2020-09-15",
    "machine": "2020-09-15"
  },
  {
    "human": "8 jun, 1987",
    "machine": "1987-06-08"
  },
  {
    "human": "8/11/91",
    "machine": "1991-08-11"
  },
  {
    "human": "8/04/1987",
    "machine": "1987-04-08"
  },
  {
    "human": "2015-10-14",
    "machine": "2015-10-14"
  },
  {
    "human": "6-may-1985",
    "machine": "1985-05-06"
  },
  {
    "human": "2024.07.29 ad",
    "machine": "2024-07-29"
  },
  {
    "human": "aug 6, 2013",
    "machine": "2013-08-06"
  },
  {
    "human": "sunday, june 18, 1972",
    "machine": "1972-06-18"
  },
  {
    "human": "12.06.5",
    "machine": "2012-06-05"
  },
  {
    "human": "08.02.2007",
    "machine": "2007-02-08"
  },
  {
    "human": "sunday, march 29, 1998",
    "machine": "1998-03-29"
  },
  {
    "human": "8/10/2019",
    "machine": "2019-10-08"
  },
  {
    "human": "8/26/01",
    "machine": "2001-08-26"
  },
  {
    "human": "1970-09-27",
    "machine": "1970-09-27"
  },
  {
    "human": "13.03.18",
    "machine": "2013-03-18"
  },
  {
    "human": "sunday, december 25, 2022",
    "machine": "2022-12-25"
  },
  {
    "human": "september 15, 2011",
    "machine": "2011-09-15"
  },
  {
    "human": "aug 22, 13",
    "machine": "2013-08-22"
  },
  {
    "human": "sun, mar 20, 05",
    "machine": "2005-03-20"
  },
  {
    "human": "11/28/94",
    "machine": "1994-11-28"
  },
  {
    "human": "monday, september 10, 2001",
    "machine": "2001-09-10"
  },
  {
    "human": "thursday, august 10, 2000",
    "machine": "2000-08-10"
  },
  {
    "human": "aug 13, 1972",
    "machine": "1972-08-13"
  },
  {
    "human": "04-30-05",
    "machine": "2005-04-30"
  },
  {
    "human": "15-10-11",
    "machine": "2015-10-11"
  },
  {
    "human": "16 november 2018",
    "machine": "2018-11-16"
  },
  {
    "human": "16, aug 2025",
    "machine": "2025-08-16"
  },
  {
    "human": "25.04.27",
    "machine": "2025-04-27"
  },
  {
    "human": "mon, nov 20, 89",
    "machine": "1989-11-20"
  },
  {
    "human": "25 aug, 2022",
    "machine": "2022-08-25"
  },
  {
    "human": "11 may 2012",
    "machine": "2012-05-11"
  },
  {
    "human": "5/14/98",
    "machine": "1998-05-14"
  },
  {
    "human": "89-03-02",
    "machine": "1989-03-02"
  },
  {
    "human": "17-jan-1993",
    "machine": "1993-01-17"
  },
  {
    "human": "friday, march 24, 2006",
    "machine": "2006-03-24"
  },
  {
    "human": "03-09-75",
    "machine": "1975-03-09"
  },
  {
    "human": "05-27-11",
    "machine": "2011-05-27"
  },
  {
    "human": "23-jun-1997",
    "machine": "1997-06-23"
  },
  {
    "human": "1990-06-03",
    "machine": "1990-06-03"
  },
  {
    "human": "1991/01/30",
    "machine": "1991-01-30"
  },
  {
    "human": "12/19/2016",
    "machine": "2016-12-19"
  },
  {
    "human": "fri, may 4, 84",
    "machine": "1984-05-04"
  },
  {
    "human": "7/31/96",
    "machine": "1996-07-31"
  },
  {
    "human": "7-apr-1973",
    "machine": "1973-04-07"
  },
  {
    "human": "friday, july 1, 1983",
    "machine": "1983-07-01"
  },
  {
    "human": "23-oct-2022",
    "machine": "2022-10-23"
  },
  {
    "human": "19.10.98",
    "machine": "1998-10-19"
  },
  {
    "human": "2-apr-2016",
    "machine": "2016-04-02"
  },
  {
    "human": "09-22-25",
    "machine": "2025-09-22"
  },
  {
    "human": "1.11.22",
    "machine": "2022-11-01"
  },
  {
    "human": "27, dec 1982",
    "machine": "1982-12-27"
  },
  {
    "human": "03/13/1976",
    "machine": "1976-03-13"
  },
  {
    "human": "2016.07.23 ad",
    "machine": "2016-07-23"
  },
  {
    "human": "oct 8 2015",
    "machine": "2015-10-08"
  },
  {
    "human": "6 jan 2007",
    "machine": "2007-01-06"
  },
  {
    "human": "11/20/94",
    "machine": "1994-11-20"
  },
  {
    "human": "04/22/1987",
    "machine": "1987-04-22"
  },
  {
    "human": "74.04.16",
    "machine": "1974-04-16"
  },
  {
    "human": "10-17-92",
    "machine": "1992-10-17"
  },
  {
    "human": "2010.06.08 ad",
    "machine": "2010-06-08"
  },
  {
    "human": "thu, jan 12, 17",
    "machine": "2017-01-12"
  },
  {
    "human": "1987/12/17",
    "machine": "1987-12-17"
  },
  {
    "human": "wednesday, march 11, 2020",
    "machine": "2020-03-11"
  },
  {
    "human": "22 oct, 2016",
    "machine": "2016-10-22"
  },
  {
    "human": "26.9.77",
    "machine": "1977-09-26"
  },
  {
    "human": "march 28, 2020",
    "machine": "2020-03-28"
  },
  {
    "human": "11-27-93",
    "machine": "1993-11-27"
  },
  {
    "human": "27.7.81",
    "machine": "1981-07-27"
  },
  {
    "human": "2.5.77",
    "machine": "1977-05-02"
  },
  {
    "human": "14/08/1999",
    "machine": "1999-08-14"
  },
  {
    "human": "2005/11/13",
    "machine": "2005-11-13"
  },
  {
    "human": "10 february 1996",
    "machine": "1996-02-10"
  },
  {
    "human": "31 august 1970",
    "machine": "1970-08-31"
  },
  {
    "human": "01-26-21",
    "machine": "2021-01-26"
  },
  {
    "human": "3/3/93",
    "machine": "1993-03-03"
  },
  {
    "human": "30 september 2015",
    "machine": "2015-09-30"
  },
  {
    "human": "10/07/2024",
    "machine": "2024-07-10"
  },
  {
    "human": "mar 13 2005",
    "machine": "2005-03-13"
  },
  {
    "human": "sunday, november 7, 1976",
    "machine": "1976-11-07"
  },
  {
    "human": "2 sep 2001",
    "machine": "2001-09-02"
  },
  {
    "human": "wed, nov 13, 24",
    "machine": "2024-11-13"
  },
  {
    "human": "06/02/2011",
    "machine": "2011-06-02"
  },
  {
    "human": "february 21, 1992",
    "machine": "1992-02-21"
  },
  {
    "human": "thursday, november 7, 2013",
    "machine": "2013-11-07"
  },
  {
    "human": "6/5/08",
    "machine": "2008-06-05"
  },
  {
    "human": "29/12/1975",
    "machine": "1975-12-29"
  },
  {
    "human": "2/28/00",
    "machine": "2000-02-28"
  },
  {
    "human": "august 22, 2000",
    "machine": "2000-08-22"
  },
  {
    "human": "10 nov 1983",
    "machine": "1983-11-10"
  },
  {
    "human": "april 6, 2013",
    "machine": "2013-04-06"
  },
  {
    "human": "76.07.16",
    "machine": "1976-07-16"
  },
  {
    "human": "friday, september 20, 2019",
    "machine": "2019-09-20"
  },
  {
    "human": "3/22/70",
    "machine": "1970-03-22"
  },
  {
    "human": "11-jan-1988",
    "machine": "1988-01-11"
  },
  {
    "human": "12/28/10",
    "machine": "2010-12-28"
  },
  {
    "human": "sep 25 2018",
    "machine": "2018-09-25"
  },
  {
    "human": "77.08.28",
    "machine": "1977-08-28"
  },
  {
    "human": "12/15/79",
    "machine": "1979-12-15"
  },
  {
    "human": "27, oct 1977",
    "machine": "1977-10-27"
  },
  {
    "human": "8-oct-1994",
    "machine": "1994-10-08"
  },
  {
    "human": "8/22/18",
    "machine": "2018-08-22"
  },
  {
    "human": "october 25, 1999",
    "machine": "1999-10-25"
  },
  {
    "human": "08/06/2024",
    "machine": "2024-08-06"
  },
  {
    "human": "93-11-07",
    "machine": "1993-11-07"
  },
  {
    "human": "november 09, 2025",
    "machine": "2025-11-09"
  },
  {
    "human": "jul 15 1984",
    "machine": "1984-07-15"
  },
  {
    "human": "2019/11/26",
    "machine": "2019-11-26"
  },
  {
    "human": "march 31, 2022",
    "machine": "2022-03-31"
  },
  {
    "human": "08.03.1971",
    "machine": "1971-03-08"
  },
  {
    "human": "may 5, 1996",
    "machine": "1996-05-05"
  },
  {
    "human": "07/04/1971",
    "machine": "1971-07-04"
  },
  {
    "human": "27.10.1987",
    "machine": "1987-10-27"
  },
  {
    "human": "1 may 1996",
    "machine": "1996-05-01"
  },
  {
    "human": "5 jul, 1990",
    "machine": "1990-07-05"
  },
  {
    "human": "25/08/1976",
    "machine": "1976-08-25"
  },
  {
    "human": "june 1, 2013",
    "machine": "2013-06-01"
  },
  {
    "human": "13 july 1977",
    "machine": "1977-07-13"
  },
  {
    "human": "89.01.26",
    "machine": "1989-01-26"
  },
  {
    "human": "77-08-23",
    "machine": "1977-08-23"
  },
  {
    "human": "thursday, december 18, 1986",
    "machine": "1986-12-18"
  },
  {
    "human": "wednesday, october 18, 2000",
    "machine": "2000-10-18"
  },
  {
    "human": "23.06.9",
    "machine": "2023-06-09"
  },
  {
    "human": "1994/03/20",
    "machine": "1994-03-20"
  },
  {
    "human": "september 28, 1993",
    "machine": "1993-09-28"
  },
  {
    "human": "march 29, 1985",
    "machine": "1985-03-29"
  },
  {
    "human": "19 april 1995",
    "machine": "1995-04-19"
  },
  {
    "human": "20 aug 2022",
    "machine": "2022-08-20"
  },
  {
    "human": "tuesday, may 18, 1993",
    "machine": "1993-05-18"
  },
  {
    "human": "1980/09/27",
    "machine": "1980-09-27"
  },
  {
    "human": "1979/08/26",
    "machine": "1979-08-26"
  },
  {
    "human": "apr 16 1977",
    "machine": "1977-04-16"
  },
  {
    "human": "1985/03/08",
    "machine": "1985-03-08"
  },
  {
    "human": "feb 16, 24",
    "machine": "2024-02-16"
  },
  {
    "human": "29, jan 1971",
    "machine": "1971-01-29"
  },
  {
    "human": "1985-04-07",
    "machine": "1985-04-07"
  },
  {
    "human": "1971-06-12",
    "machine": "1971-06-12"
  },
  {
    "human": "6.8.06",
    "machine": "2006-08-06"
  },
  {
    "human": "7 apr 1974",
    "machine": "1974-04-07"
  },
  {
    "human": "98-12-09",
    "machine": "1998-12-09"
  },
  {
    "human": "08/28/2006",
    "machine": "2006-08-28"
  },
  {
    "human": "5/23/72",
    "machine": "1972-05-23"
  },
  {
    "human": "12.4.94",
    "machine": "1994-04-12"
  },
  {
    "human": "25, aug 2011",
    "machine": "2011-08-25"
  },
  {
    "human": "07, aug 2008",
    "machine": "2008-08-07"
  },
  {
    "human": "1972.06.16 ad",
    "machine": "1972-06-16"
  },
  {
    "human": "12/13/24",
    "machine": "2024-12-13"
  },
  {
    "human": "27.12.2017",
    "machine": "2017-12-27"
  },
  {
    "human": "april 13, 1998",
    "machine": "1998-04-13"
  },
  {
    "human": "17-nov-2000",
    "machine": "2000-11-17"
  },
  {
    "human": "dec 10 2000",
    "machine": "2000-12-10"
  },
  {
    "human": "jul 9, 1975",
    "machine": "1975-07-09"
  },
  {
    "human": "30 aug, 2001",
    "machine": "2001-08-30"
  },
  {
    "human": "apr 15 1987",
    "machine": "1987-04-15"
  },
  {
    "human": "29 jan 2003",
    "machine": "2003-01-29"
  },
  {
    "human": "friday, april 23, 1993",
    "machine": "1993-04-23"
  },
  {
    "human": "17/04/1970",
    "machine": "1970-04-17"
  },
  {
    "human": "1993/01/29",
    "machine": "1993-01-29"
  },
  {
    "human": "5 apr, 2002",
    "machine": "2002-04-05"
  },
  {
    "human": "12-18-12",
    "machine": "2012-12-18"
  },
  {
    "human": "7/9/78",
    "machine": "1978-07-09"
  },
  {
    "human": "13/04/2025",
    "machine": "2025-04-13"
  },
  {
    "human": "sunday, february 22, 1998",
    "machine": "1998-02-22"
  },
  {
    "human": "14.11.8",
    "machine": "2014-11-08"
  },
  {
    "human": "may 26, 2004",
    "machine": "2004-05-26"
  },
  {
    "human": "jul 8 2022",
    "machine": "2022-07-08"
  },
  {
    "human": "26 oct, 2001",
    "machine": "2001-10-26"
  },
  {
    "human": "sun, jul 3, 83",
    "machine": "1983-07-03"
  },
  {
    "human": "90.10.31",
    "machine": "1990-10-31"
  },
  {
    "human": "03-01-21",
    "machine": "2003-01-21"
  },
  {
    "human": "sat, mar 2, 02",
    "machine": "2002-03-02"
  },
  {
    "human": "august 29, 2024",
    "machine": "2024-08-29"
  },
  {
    "human": "12, apr 1991",
    "machine": "1991-04-12"
  },
  {
    "human": "1982.05.25 ad",
    "machine": "1982-05-25"
  },
  {
    "human": "07 july 1981",
    "machine": "1981-07-07"
  },
  {
    "human": "november 15, 2020",
    "machine": "2020-11-15"
  },
  {
    "human": "13.02.2000",
    "machine": "2000-02-13"
  },
  {
    "human": "19.04.2004",
    "machine": "2004-04-19"
  },
  {
    "human": "26 august 2012",
    "machine": "2012-08-26"
  },
  {
    "human": "1992-08-20",
    "machine": "1992-08-20"
  },
  {
    "human": "80.06.30",
    "machine": "1980-06-30"
  },
  {
    "human": "28.03.2000",
    "machine": "2000-03-28"
  },
  {
    "human": "jan 30, 1986",
    "machine": "1986-01-30"
  },
  {
    "human": "75-05-12",
    "machine": "1975-05-12"
  },
  {
    "human": "may 28, 2018",
    "machine": "2018-05-28"
  },
  {
    "human": "1986-05-21",
    "machine": "1986-05-21"
  },
  {
    "human": "20.06.1986",
    "machine": "1986-06-20"
  },
  {
    "human": "saturday, march 22, 1986",
    "machine": "1986-03-22"
  },
  {
    "human": "86-08-16",
    "machine": "1986-08-16"
  },
  {
    "human": "6 oct, 2001",
    "machine": "2001-10-06"
  },
  {
    "human": "1997-05-19",
    "machine": "1997-05-19"
  },
  {
    "human": "1/10/01",
    "machine": "2001-01-10"
  },
  {
    "human": "30 january 1987",
    "machine": "1987-01-30"
  },
  {
    "human": "16, oct 2016",
    "machine": "2016-10-16"
  },
  {
    "human": "july 21, 2023",
    "machine": "2023-07-21"
  },
  {
    "human": "2010-07-11",
    "machine": "2010-07-11"
  },
  {
    "human": "sunday, june 8, 2008",
    "machine": "2008-06-08"
  },
  {
    "human": "monday, september 14, 1987",
    "machine": "1987-09-14"
  },
  {
    "human": "26 feb 1979",
    "machine": "1979-02-26"
  },
  {
    "human": "02/07/2019",
    "machine": "2019-02-07"
  },
  {
    "human": "25 feb, 2021",
    "machine": "2021-02-25"
  },
  {
    "human": "10-06-18",
    "machine": "2010-06-18"
  },
  {
    "human": "75.01.11",
    "machine": "1975-01-11"
  },
  {
    "human": "10/31/2010",
    "machine": "2010-10-31"
  },
  {
    "human": "wednesday, august 22, 2007",
    "machine": "2007-08-22"
  },
  {
    "human": "monday, april 24, 2017",
    "machine": "2017-04-24"
  },
  {
    "human": "16 aug 1998",
    "machine": "1998-08-16"
  },
  {
    "human": "1999-01-12",
    "machine": "1999-01-12"
  },
  {
    "human": "dec 18, 2001",
    "machine": "2001-12-18"
  },
  {
    "human": "sunday, january 29, 2017",
    "machine": "2017-01-29"
  },
  {
    "human": "1993-05-7",
    "machine": "1993-05-07"
  },
  {
    "human": "august 22, 1997",
    "machine": "1997-08-22"
  },
  {
    "human": "jun 4, 1984",
    "machine": "1984-06-04"
  },
  {
    "human": "28, feb 1992",
    "machine": "1992-02-28"
  },
  {
    "human": "22 sep, 1974",
    "machine": "1974-09-22"
  },
  {
    "human": "feb 3, 1996",
    "machine": "1996-02-03"
  },
  {
    "human": "4/08/1986",
    "machine": "1986-08-04"
  },
  {
    "human": "dec 23, 70",
    "machine": "1970-12-23"
  },
  {
    "human": "1997-05-27",
    "machine": "1997-05-27"
  },
  {
    "human": "2014-12-28",
    "machine": "2014-12-28"
  },
  {
    "human": "may 22, 2016",
    "machine": "2016-05-22"
  },
  {
    "human": "1995-02-18",
    "machine": "1995-02-18"
  },
  {
    "human": "december 17, 1984",
    "machine": "1984-12-17"
  },
  {
    "human": "6/06/2024",
    "machine": "2024-06-06"
  },
  {
    "human": "30 mar, 1989",
    "machine": "1989-03-30"
  },
  {
    "human": "friday, january 11, 2013",
    "machine": "2013-01-11"
  },
  {
    "human": "21/12/1994",
    "machine": "1994-12-21"
  },
  {
    "human": "17, dec 2015",
    "machine": "2015-12-17"
  },
  {
    "human": "nov 28 2021",
    "machine": "2021-11-28"
  },
  {
    "human": "24, jan 1996",
    "machine": "1996-01-24"
  },
  {
    "human": "28 nov, 1991",
    "machine": "1991-11-28"
  },
  {
    "human": "april 30, 1995",
    "machine": "1995-04-30"
  },
  {
    "human": "july 30, 2002",
    "machine": "2002-07-30"
  },
  {
    "human": "03/12/1992",
    "machine": "1992-03-12"
  },
  {
    "human": "mon, dec 20, 93",
    "machine": "1993-12-20"
  },
  {
    "human": "15 jul, 2021",
    "machine": "2021-07-15"
  },
  {
    "human": "1983-12-16",
    "machine": "1983-12-16"
  },
  {
    "human": "29.4.08",
    "machine": "2008-04-29"
  },
  {
    "human": "7.9.22",
    "machine": "2022-09-07"
  },
  {
    "human": "27.2.08",
    "machine": "2008-02-27"
  },
  {
    "human": "3/10/01",
    "machine": "2001-03-10"
  },
  {
    "human": "20 january 2000",
    "machine": "2000-01-20"
  },
  {
    "human": "oct 21 1993",
    "machine": "1993-10-21"
  },
  {
    "human": "16 july 1983",
    "machine": "1983-07-16"
  },
  {
    "human": "23 jul 1993",
    "machine": "1993-07-23"
  },
  {
    "human": "9/02/1979",
    "machine": "1979-02-09"
  },
  {
    "human": "4 june 2020",
    "machine": "2020-06-04"
  },
  {
    "human": "07 july 2009",
    "machine": "2009-07-07"
  },
  {
    "human": "may 27, 1972",
    "machine": "1972-05-27"
  },
  {
    "human": "september 22, 1993",
    "machine": "1993-09-22"
  },
  {
    "human": "january 15, 2014",
    "machine": "2014-01-15"
  },
  {
    "human": "nov 12, 1994",
    "machine": "1994-11-12"
  },
  {
    "human": "28.01.2021",
    "machine": "2021-01-28"
  },
  {
    "human": "2023-10-5",
    "machine": "2023-10-05"
  },
  {
    "human": "october 29, 2010",
    "machine": "2010-10-29"
  },
  {
    "human": "thu, feb 3, 72",
    "machine": "1972-02-03"
  },
  {
    "human": "1988.06.24 ad",
    "machine": "1988-06-24"
  },
  {
    "human": "17 january 1980",
    "machine": "1980-01-17"
  },
  {
    "human": "11/6/06",
    "machine": "2006-11-06"
  },
  {
    "human": "31 aug 1983",
    "machine": "1983-08-31"
  },
  {
    "human": "06.04.1997",
    "machine": "1997-04-06"
  },
  {
    "human": "28/03/1987",
    "machine": "1987-03-28"
  },
  {
    "human": "07/23/1996",
    "machine": "1996-07-23"
  },
  {
    "human": "2021/10/05",
    "machine": "2021-10-05"
  },
  {
    "human": "26 august 1992",
    "machine": "1992-08-26"
  },
  {
    "human": "06/23/2010",
    "machine": "2010-06-23"
  },
  {
    "human": "february 04, 1986",
    "machine": "1986-02-04"
  },
  {
    "human": "28 jul, 1998",
    "machine": "1998-07-28"
  },
  {
    "human": "21 feb 1989",
    "machine": "1989-02-21"
  },
  {
    "human": "feb 6, 17",
    "machine": "2017-02-06"
  },
  {
    "human": "11-29-98",
    "machine": "1998-11-29"
  },
  {
    "human": "88.10.26",
    "machine": "1988-10-26"
  },
  {
    "human": "fri, oct 30, 98",
    "machine": "1998-10-30"
  },
  {
    "human": "88-11-29",
    "machine": "1988-11-29"
  },
  {
    "human": "sep 19 1978",
    "machine": "1978-09-19"
  },
  {
    "human": "december 24, 2011",
    "machine": "2011-12-24"
  },
  {
    "human": "08-05-28",
    "machine": "2008-05-28"
  },
  {
    "human": "sep 20 1987",
    "machine": "1987-09-20"
  },
  {
    "human": "december 9, 1994",
    "machine": "1994-12-09"
  },
  {
    "human": "saturday, march 25, 2023",
    "machine": "2023-03-25"
  },
  {
    "human": "jun 29, 06",
    "machine": "2006-06-29"
  },
  {
    "human": "01-07-06",
    "machine": "2006-01-07"
  },
  {
    "human": "93.07.27",
    "machine": "1993-07-27"
  },
  {
    "human": "06-24-21",
    "machine": "2021-06-24"
  },
  {
    "human": "10/08/1983",
    "machine": "1983-10-08"
  },
  {
    "human": "may 06, 1987",
    "machine": "1987-05-06"
  },
  {
    "human": "2020-12-26",
    "machine": "2020-12-26"
  },
  {
    "human": "18 april 1997",
    "machine": "1997-04-18"
  },
  {
    "human": "nov 10 1977",
    "machine": "1977-11-10"
  },
  {
    "human": "2015-07-1",
    "machine": "2015-07-01"
  },
  {
    "human": "87-04-29",
    "machine": "1987-04-29"
  },
  {
    "human": "15 jul, 1993",
    "machine": "1993-07-15"
  },
  {
    "human": "03/15/1997",
    "machine": "1997-03-15"
  },
  {
    "human": "9.5.21",
    "machine": "2021-05-09"
  },
  {
    "human": "january 25, 1981",
    "machine": "1981-01-25"
  },
  {
    "human": "08-12-71",
    "machine": "1971-08-12"
  },
  {
    "human": "12/04/2016",
    "machine": "2016-12-04"
  },
  {
    "human": "1984-05-05",
    "machine": "1984-05-05"
  },
  {
    "human": "17 apr, 1971",
    "machine": "1971-04-17"
  },
  {
    "human": "29.08.1992",
    "machine": "1992-08-29"
  },
  {
    "human": "70-03-11",
    "machine": "1970-03-11"
  },
  {
    "human": "february 28, 2004",
    "machine": "2004-02-28"
  },
  {
    "human": "sunday, november 22, 2020",
    "machine": "2020-11-22"
  },
  {
    "human": "01/03/2025",
    "machine": "2025-01-03"
  },
  {
    "human": "thu, jul 5, 84",
    "machine": "1984-07-05"
  },
  {
    "human": "16.11.07",
    "machine": "2007-11-16"
  },
  {
    "human": "29, jan 2000",
    "machine": "2000-01-29"
  },
  {
    "human": "25 mar, 1993",
    "machine": "1993-03-25"
  },
  {
    "human": "14 november 1992",
    "machine": "1992-11-14"
  },
  {
    "human": "05-24-00",
    "machine": "2000-05-24"
  },
  {
    "human": "december 3, 1974",
    "machine": "1974-12-03"
  },
  {
    "human": "monday, november 13, 2006",
    "machine": "2006-11-13"
  },
  {
    "human": "28/04/2017",
    "machine": "2017-04-28"
  },
  {
    "human": "01-03-18",
    "machine": "2001-03-18"
  },
  {
    "human": "23.6.89",
    "machine": "1989-06-23"
  },
  {
    "human": "jun 12, 2013",
    "machine": "2013-06-12"
  },
  {
    "human": "83.01.18",
    "machine": "1983-01-18"
  },
  {
    "human": "03-12-21",
    "machine": "2003-12-21"
  },
  {
    "human": "12 january 2006",
    "machine": "2006-01-12"
  },
  {
    "human": "9/07/1973",
    "machine": "1973-07-09"
  },
  {
    "human": "february 13, 1996",
    "machine": "1996-02-13"
  },
  {
    "human": "30 december 2016",
    "machine": "2016-12-30"
  },
  {
    "human": "99-12-15",
    "machine": "1999-12-15"
  },
  {
    "human": "august 28, 2017",
    "machine": "2017-08-28"
  },
  {
    "human": "wednesday, july 1, 2020",
    "machine": "2020-07-01"
  },
  {
    "human": "09-07-31",
    "machine": "2009-07-31"
  },
  {
    "human": "tue, jul 29, 75",
    "machine": "1975-07-29"
  },
  {
    "human": "29.06.2008",
    "machine": "2008-06-29"
  },
  {
    "human": "oct 31, 2017",
    "machine": "2017-10-31"
  },
  {
    "human": "21-feb-1990",
    "machine": "1990-02-21"
  },
  {
    "human": "may 23, 2019",
    "machine": "2019-05-23"
  },
  {
    "human": "1980.10.08 ad",
    "machine": "1980-10-08"
  },
  {
    "human": "2001-09-18",
    "machine": "2001-09-18"
  },
  {
    "human": "sep 22 1982",
    "machine": "1982-09-22"
  },
  {
    "human": "3/17/82",
    "machine": "1982-03-17"
  },
  {
    "human": "29/04/2005",
    "machine": "2005-04-29"
  },
  {
    "human": "19.5.91",
    "machine": "1991-05-19"
  },
  {
    "human": "2 june 2019",
    "machine": "2019-06-02"
  },
  {
    "human": "07 november 2020",
    "machine": "2020-11-07"
  },
  {
    "human": "january 31, 2015",
    "machine": "2015-01-31"
  },
  {
    "human": "4/7/16",
    "machine": "2016-04-07"
  },
  {
    "human": "18-09-30",
    "machine": "2018-09-30"
  },
  {
    "human": "jun 14, 1987",
    "machine": "1987-06-14"
  },
  {
    "human": "sunday, june 12, 2016",
    "machine": "2016-06-12"
  },
  {
    "human": "6/12/10",
    "machine": "2010-06-12"
  },
  {
    "human": "12/20/09",
    "machine": "2009-12-20"
  },
  {
    "human": "99-01-02",
    "machine": "1999-01-02"
  },
  {
    "human": "may 27, 76",
    "machine": "1976-05-27"
  },
  {
    "human": "1996-05-9",
    "machine": "1996-05-09"
  },
  {
    "human": "9/24/05",
    "machine": "2005-09-24"
  },
  {
    "human": "january 18, 1977",
    "machine": "1977-01-18"
  },
  {
    "human": "sat, sep 17, 16",
    "machine": "2016-09-17"
  },
  {
    "human": "9/5/07",
    "machine": "2007-09-05"
  },
  {
    "human": "march 08, 2016",
    "machine": "2016-03-08"
  },
  {
    "human": "10 jul, 1977",
    "machine": "1977-07-10"
  },
  {
    "human": "2005-07-26",
    "machine": "2005-07-26"
  },
  {
    "human": "2004-12-09",
    "machine": "2004-12-09"
  },
  {
    "human": "04.04.21",
    "machine": "2004-04-21"
  },
  {
    "human": "sunday, june 24, 1984",
    "machine": "1984-06-24"
  },
  {
    "human": "sunday, august 31, 2025",
    "machine": "2025-08-31"
  },
  {
    "human": "2006-06-12",
    "machine": "2006-06-12"
  },
  {
    "human": "saturday, march 20, 1999",
    "machine": "1999-03-20"
  },
  {
    "human": "2014-05-21",
    "machine": "2014-05-21"
  },
  {
    "human": "mon, apr 10, 72",
    "machine": "1972-04-10"
  },
  {
    "human": "december 19, 2018",
    "machine": "2018-12-19"
  },
  {
    "human": "2024-08-03",
    "machine": "2024-08-03"
  },
  {
    "human": "14 dec, 1983",
    "machine": "1983-12-14"
  },
  {
    "human": "2022/09/30",
    "machine": "2022-09-30"
  },
  {
    "human": "22.6.88",
    "machine": "1988-06-22"
  },
  {
    "human": "97-08-23",
    "machine": "1997-08-23"
  },
  {
    "human": "07.01.1995",
    "machine": "1995-01-07"
  },
  {
    "human": "29/06/1994",
    "machine": "1994-06-29"
  },
  {
    "human": "thursday, august 26, 1971",
    "machine": "1971-08-26"
  },
  {
    "human": "14 mar, 2011",
    "machine": "2011-03-14"
  },
  {
    "human": "83-01-14",
    "machine": "1983-01-14"
  },
  {
    "human": "19 aug, 2002",
    "machine": "2002-08-19"
  },
  {
    "human": "30.8.15",
    "machine": "2015-08-30"
  },
  {
    "human": "saturday, december 9, 2000",
    "machine": "2000-12-09"
  },
  {
    "human": "1984-05-29",
    "machine": "1984-05-29"
  },
  {
    "human": "2 jun, 2020",
    "machine": "2020-06-02"
  },
  {
    "human": "00-04-10",
    "machine": "2000-04-10"
  },
  {
    "human": "7-jan-1991",
    "machine": "1991-01-07"
  },
  {
    "human": "5/28/72",
    "machine": "1972-05-28"
  },
  {
    "human": "2022/08/04",
    "machine": "2022-08-04"
  },
  {
    "human": "28 february 2013",
    "machine": "2013-02-28"
  },
  {
    "human": "27 sep 2016",
    "machine": "2016-09-27"
  },
  {
    "human": "feb 24, 1974",
    "machine": "1974-02-24"
  },
  {
    "human": "10.1.19",
    "machine": "2019-01-10"
  },
  {
    "human": "28-feb-2021",
    "machine": "2021-02-28"
  },
  {
    "human": "13.1.98",
    "machine": "1998-01-13"
  },
  {
    "human": "november 08, 2017",
    "machine": "2017-11-08"
  },
  {
    "human": "10-jul-1998",
    "machine": "1998-07-10"
  },
  {
    "human": "02, jan 1975",
    "machine": "1975-01-02"
  },
  {
    "human": "6/17/73",
    "machine": "1973-06-17"
  },
  {
    "human": "03 march 1994",
    "machine": "1994-03-03"
  },
  {
    "human": "thursday, october 8, 2020",
    "machine": "2020-10-08"
  },
  {
    "human": "friday, april 6, 2001",
    "machine": "2001-04-06"
  },
  {
    "human": "fri, aug 4, 00",
    "machine": "2000-08-04"
  },
  {
    "human": "1971/05/13",
    "machine": "1971-05-13"
  },
  {
    "human": "20, aug 2015",
    "machine": "2015-08-20"
  },
  {
    "human": "06-26-75",
    "machine": "1975-06-26"
  },
  {
    "human": "march 31, 2004",
    "machine": "2004-03-31"
  },
  {
    "human": "07, oct 2025",
    "machine": "2025-10-07"
  },
  {
    "human": "6/10/2005",
    "machine": "2005-10-06"
  },
  {
    "human": "04 april 2012",
    "machine": "2012-04-04"
  },
  {
    "human": "apr 1 2013",
    "machine": "2013-04-01"
  },
  {
    "human": "6/14/75",
    "machine": "1975-06-14"
  },
  {
    "human": "2020.11.01 ad",
    "machine": "2020-11-01"
  },
  {
    "human": "10-09-99",
    "machine": "1999-10-09"
  },
  {
    "human": "fri, apr 28, 72",
    "machine": "1972-04-28"
  },
  {
    "human": "friday, may 30, 2008",
    "machine": "2008-05-30"
  },
  {
    "human": "oct 13 2003",
    "machine": "2003-10-13"
  },
  {
    "human": "mar 10, 1979",
    "machine": "1979-03-10"
  },
  {
    "human": "february 04, 1970",
    "machine": "1970-02-04"
  },
  {
    "human": "16 february 1979",
    "machine": "1979-02-16"
  },
  {
    "human": "25 apr 1989",
    "machine": "1989-04-25"
  },
  {
    "human": "1977-03-17",
    "machine": "1977-03-17"
  },
  {
    "human": "november 26, 2006",
    "machine": "2006-11-26"
  },
  {
    "human": "15.04.1974",
    "machine": "1974-04-15"
  },
  {
    "human": "friday, august 30, 2019",
    "machine": "2019-08-30"
  },
  {
    "human": "1972-09-21",
    "machine": "1972-09-21"
  },
  {
    "human": "84.02.24",
    "machine": "1984-02-24"
  },
  {
    "human": "sunday, september 2, 1990",
    "machine": "1990-09-02"
  },
  {
    "human": "1984.03.30 ad",
    "machine": "1984-03-30"
  },
  {
    "human": "10/02/2008",
    "machine": "2008-10-02"
  },
  {
    "human": "1993-06-12",
    "machine": "1993-06-12"
  },
  {
    "human": "1971.03.02 ad",
    "machine": "1971-03-02"
  },
  {
    "human": "10/03/1974",
    "machine": "1974-03-10"
  },
  {
    "human": "2015.02.25 ad",
    "machine": "2015-02-25"
  },
  {
    "human": "friday, april 27, 2001",
    "machine": "2001-04-27"
  },
  {
    "human": "2025-09-18",
    "machine": "2025-09-18"
  },
  {
    "human": "3/20/25",
    "machine": "2025-03-20"
  },
  {
    "human": "sat, jun 18, 05",
    "machine": "2005-06-18"
  },
  {
    "human": "15.11.2014",
    "machine": "2014-11-15"
  },
  {
    "human": "2006.05.21 ad",
    "machine": "2006-05-21"
  },
  {
    "human": "jul 28, 1991",
    "machine": "1991-07-28"
  },
  {
    "human": "03.08.21",
    "machine": "2003-08-21"
  },
  {
    "human": "october 19, 1998",
    "machine": "1998-10-19"
  },
  {
    "human": "2016/11/23",
    "machine": "2016-11-23"
  },
  {
    "human": "18 june 1972",
    "machine": "1972-06-18"
  },
  {
    "human": "29.10.12",
    "machine": "2012-10-29"
  },
  {
    "human": "08-10-95",
    "machine": "1995-08-10"
  },
  {
    "human": "27/12/2023",
    "machine": "2023-12-27"
  },
  {
    "human": "13 april 1976",
    "machine": "1976-04-13"
  },
  {
    "human": "14.2.82",
    "machine": "1982-02-14"
  },
  {
    "human": "sunday, january 11, 2009",
    "machine": "2009-01-11"
  },
  {
    "human": "wednesday, february 26, 1992",
    "machine": "1992-02-26"
  },
  {
    "human": "fri, jun 19, 09",
    "machine": "2009-06-19"
  },
  {
    "human": "march 03, 1987",
    "machine": "1987-03-03"
  },
  {
    "human": "august 11, 2025",
    "machine": "2025-08-11"
  },
  {
    "human": "2023/06/26",
    "machine": "2023-06-26"
  },
  {
    "human": "24-12-29",
    "machine": "2024-12-29"
  },
  {
    "human": "tue, feb 3, 15",
    "machine": "2015-02-03"
  },
  {
    "human": "august 21, 2013",
    "machine": "2013-08-21"
  },
  {
    "human": "4/28/99",
    "machine": "1999-04-28"
  },
  {
    "human": "may 01, 1980",
    "machine": "1980-05-01"
  },
  {
    "human": "wed, oct 15, 86",
    "machine": "1986-10-15"
  },
  {
    "human": "1997-12-07",
    "machine": "1997-12-07"
  },
  {
    "human": "25-nov-1985",
    "machine": "1985-11-25"
  },
  {
    "human": "23 oct, 2022",
    "machine": "2022-10-23"
  },
  {
    "human": "31 october 1980",
    "machine": "1980-10-31"
  },
  {
    "human": "11/28/72",
    "machine": "1972-11-28"
  },
  {
    "human": "7 december 2008",
    "machine": "2008-12-07"
  },
  {
    "human": "tue, feb 27, 96",
    "machine": "1996-02-27"
  },
  {
    "human": "tuesday, january 7, 2014",
    "machine": "2014-01-07"
  },
  {
    "human": "15.07.1980",
    "machine": "1980-07-15"
  },
  {
    "human": "27 may 1985",
    "machine": "1985-05-27"
  },
  {
    "human": "fri, aug 21, 70",
    "machine": "1970-08-21"
  },
  {
    "human": "10 november 1997",
    "machine": "1997-11-10"
  },
  {
    "human": "14-aug-1987",
    "machine": "1987-08-14"
  },
  {
    "human": "19.12.78",
    "machine": "1978-12-19"
  },
  {
    "human": "sep 5, 2012",
    "machine": "2012-09-05"
  },
  {
    "human": "12/9/19",
    "machine": "2019-12-09"
  },
  {
    "human": "12-02-27",
    "machine": "2012-02-27"
  },
  {
    "human": "31.1.95",
    "machine": "1995-01-31"
  },
  {
    "human": "13.11.91",
    "machine": "1991-11-13"
  },
  {
    "human": "august 19, 2024",
    "machine": "2024-08-19"
  },
  {
    "human": "04/02/2005",
    "machine": "2005-04-02"
  },
  {
    "human": "1/04/2005",
    "machine": "2005-04-01"
  },
  {
    "human": "sunday, november 1, 1998",
    "machine": "1998-11-01"
  },
  {
    "human": "7/20/86",
    "machine": "1986-07-20"
  },
  {
    "human": "27, aug 2017",
    "machine": "2017-08-27"
  },
  {
    "human": "tue, aug 24, 10",
    "machine": "2010-08-24"
  },
  {
    "human": "19 jan 1983",
    "machine": "1983-01-19"
  },
  {
    "human": "may 28, 85",
    "machine": "1985-05-28"
  },
  {
    "human": "9 oct 1995",
    "machine": "1995-10-09"
  },
  {
    "human": "monday, january 19, 2015",
    "machine": "2015-01-19"
  },
  {
    "human": "15, dec 1974",
    "machine": "1974-12-15"
  },
  {
    "human": "1/2/23",
    "machine": "2023-01-02"
  },
  {
    "human": "14, may 1993",
    "machine": "1993-05-14"
  },
  {
    "human": "17.05.1981",
    "machine": "1981-05-17"
  },
  {
    "human": "27.09.2001",
    "machine": "2001-09-27"
  },
  {
    "human": "may 13 1975",
    "machine": "1975-05-13"
  },
  {
    "human": "saturday, december 24, 2022",
    "machine": "2022-12-24"
  },
  {
    "human": "1970-09-30",
    "machine": "1970-09-30"
  },
  {
    "human": "2019/02/28",
    "machine": "2019-02-28"
  },
  {
    "human": "19-feb-1979",
    "machine": "1979-02-19"
  },
  {
    "human": "4/14/80",
    "machine": "1980-04-14"
  },
  {
    "human": "14 november 2006",
    "machine": "2006-11-14"
  },
  {
    "human": "dec 8, 10",
    "machine": "2010-12-08"
  },
  {
    "human": "13/04/1970",
    "machine": "1970-04-13"
  },
  {
    "human": "2002-11-18",
    "machine": "2002-11-18"
  },
  {
    "human": "april 11, 1978",
    "machine": "1978-04-11"
  },
  {
    "human": "1987/01/17",
    "machine": "1987-01-17"
  },
  {
    "human": "february 25, 1988",
    "machine": "1988-02-25"
  },
  {
    "human": "sunday, february 17, 2013",
    "machine": "2013-02-17"
  },
  {
    "human": "11/28/1972",
    "machine": "1972-11-28"
  },
  {
    "human": "saturday, may 20, 1995",
    "machine": "1995-05-20"
  },
  {
    "human": "2018/10/19",
    "machine": "2018-10-19"
  },
  {
    "human": "2017.11.09 ad",
    "machine": "2017-11-09"
  },
  {
    "human": "23-jul-1975",
    "machine": "1975-07-23"
  },
  {
    "human": "2021-08-05",
    "machine": "2021-08-05"
  },
  {
    "human": "03-12-08",
    "machine": "2008-03-12"
  },
  {
    "human": "8/4/94",
    "machine": "1994-08-04"
  },
  {
    "human": "2017.05.17 ad",
    "machine": "2017-05-17"
  },
  {
    "human": "09, dec 2008",
    "machine": "2008-12-09"
  },
  {
    "human": "08/23/1981",
    "machine": "1981-08-23"
  },
  {
    "human": "13 may, 2009",
    "machine": "2009-05-13"
  },
  {
    "human": "aug 22, 2019",
    "machine": "2019-08-22"
  },
  {
    "human": "21.7.22",
    "machine": "2022-07-21"
  },
  {
    "human": "06, may 1974",
    "machine": "1974-05-06"
  },
  {
    "human": "06.03.23",
    "machine": "2006-03-23"
  },
  {
    "human": "december 20, 2003",
    "machine": "2003-12-20"
  },
  {
    "human": "24.06.2002",
    "machine": "2002-06-24"
  },
  {
    "human": "1980-12-04",
    "machine": "1980-12-04"
  },
  {
    "human": "dec 2, 09",
    "machine": "2009-12-02"
  },
  {
    "human": "october 28, 2006",
    "machine": "2006-10-28"
  },
  {
    "human": "15 march 1991",
    "machine": "1991-03-15"
  },
  {
    "human": "jun 11 2014",
    "machine": "2014-06-11"
  },
  {
    "human": "23, sep 2012",
    "machine": "2012-09-23"
  },
  {
    "human": "mon, nov 10, 14",
    "machine": "2014-11-10"
  },
  {
    "human": "monday, october 3, 1977",
    "machine": "1977-10-03"
  },
  {
    "human": "07/13/2003",
    "machine": "2003-07-13"
  },
  {
    "human": "04/07/2013",
    "machine": "2013-04-07"
  },
  {
    "human": "1973.08.29 ad",
    "machine": "1973-08-29"
  },
  {
    "human": "6/02/2012",
    "machine": "2012-02-06"
  },
  {
    "human": "sat, sep 17, 94",
    "machine": "1994-09-17"
  },
  {
    "human": "1995.01.05 ad",
    "machine": "1995-01-05"
  },
  {
    "human": "aug 24, 2020",
    "machine": "2020-08-24"
  },
  {
    "human": "29 nov, 1971",
    "machine": "1971-11-29"
  },
  {
    "human": "2/12/03",
    "machine": "2003-02-12"
  },
  {
    "human": "7/08/1992",
    "machine": "1992-08-07"
  },
  {
    "human": "2010-03-18",
    "machine": "2010-03-18"
  },
  {
    "human": "21 oct, 1996",
    "machine": "1996-10-21"
  },
  {
    "human": "june 2, 1988",
    "machine": "1988-06-02"
  },
  {
    "human": "2-sep-2007",
    "machine": "2007-09-02"
  },
  {
    "human": "8/4/24",
    "machine": "2024-08-04"
  },
  {
    "human": "08-05-11",
    "machine": "2008-05-11"
  },
  {
    "human": "april 29, 1996",
    "machine": "1996-04-29"
  },
  {
    "human": "2020-06-5",
    "machine": "2020-06-05"
  },
  {
    "human": "mar 31 1986",
    "machine": "1986-03-31"
  },
  {
    "human": "30.5.84",
    "machine": "1984-05-30"
  },
  {
    "human": "02 november 2020",
    "machine": "2020-11-02"
  },
  {
    "human": "friday, april 20, 1990",
    "machine": "1990-04-20"
  },
  {
    "human": "wed, oct 10, 07",
    "machine": "2007-10-10"
  },
  {
    "human": "friday, november 3, 2006",
    "machine": "2006-11-03"
  },
  {
    "human": "5/17/85",
    "machine": "1985-05-17"
  },
  {
    "human": "august 20, 2022",
    "machine": "2022-08-20"
  },
  {
    "human": "2010-10-17",
    "machine": "2010-10-17"
  },
  {
    "human": "sunday, january 21, 1996",
    "machine": "1996-01-21"
  },
  {
    "human": "2007.12.19 ad",
    "machine": "2007-12-19"
  },
  {
    "human": "18.10.10",
    "machine": "2010-10-18"
  },
  {
    "human": "25.05.2014",
    "machine": "2014-05-25"
  },
  {
    "human": "10 september 2005",
    "machine": "2005-09-10"
  },
  {
    "human": "sep 20 1982",
    "machine": "1982-09-20"
  },
  {
    "human": "june 3, 2016",
    "machine": "2016-06-03"
  },
  {
    "human": "jan 24 1971",
    "machine": "1971-01-24"
  },
  {
    "human": "sun, jun 6, 76",
    "machine": "1976-06-06"
  },
  {
    "human": "09.10.2004",
    "machine": "2004-10-09"
  },
  {
    "human": "07 may 2024",
    "machine": "2024-05-07"
  },
  {
    "human": "feb 2, 70",
    "machine": "1970-02-02"
  },
  {
    "human": "may 5, 2004",
    "machine": "2004-05-05"
  },
  {
    "human": "2/10/1978",
    "machine": "1978-10-02"
  },
  {
    "human": "tue, mar 17, 81",
    "machine": "1981-03-17"
  },
  {
    "human": "sep 29, 01",
    "machine": "2001-09-29"
  },
  {
    "human": "mon, jan 30, 78",
    "machine": "1978-01-30"
  },
  {
    "human": "18-may-1978",
    "machine": "1978-05-18"
  },
  {
    "human": "9 jun, 1997",
    "machine": "1997-06-09"
  },
  {
    "human": "november 10, 1981",
    "machine": "1981-11-10"
  },
  {
    "human": "5/1/71",
    "machine": "1971-05-01"
  },
  {
    "human": "3 oct 1973",
    "machine": "1973-10-03"
  },
  {
    "human": "2006-09-26",
    "machine": "2006-09-26"
  },
  {
    "human": "sunday, september 30, 2012",
    "machine": "2012-09-30"
  },
  {
    "human": "83-11-30",
    "machine": "1983-11-30"
  },
  {
    "human": "2021-07-17",
    "machine": "2021-07-17"
  },
  {
    "human": "4/24/11",
    "machine": "2011-04-24"
  },
  {
    "human": "28.08.1994",
    "machine": "1994-08-28"
  },
  {
    "human": "1980-01-11",
    "machine": "1980-01-11"
  },
  {
    "human": "2000/06/17",
    "machine": "2000-06-17"
  },
  {
    "human": "2004/08/27",
    "machine": "2004-08-27"
  },
  {
    "human": "aug 13 2019",
    "machine": "2019-08-13"
  },
  {
    "human": "saturday, february 4, 1995",
    "machine": "1995-02-04"
  },
  {
    "human": "11/16/1980",
    "machine": "1980-11-16"
  },
  {
    "human": "7/9/12",
    "machine": "2012-07-09"
  },
  {
    "human": "17.11.1998",
    "machine": "1998-11-17"
  },
  {
    "human": "6.8.87",
    "machine": "1987-08-06"
  },
  {
    "human": "29 mar, 1976",
    "machine": "1976-03-29"
  },
  {
    "human": "05.09.6",
    "machine": "2005-09-06"
  },
  {
    "human": "apr 10, 23",
    "machine": "2023-04-10"
  },
  {
    "human": "saturday, november 19, 1988",
    "machine": "1988-11-19"
  },
  {
    "human": "april 7, 1985",
    "machine": "1985-04-07"
  },
  {
    "human": "october 26, 1984",
    "machine": "1984-10-26"
  },
  {
    "human": "sep 29, 2006",
    "machine": "2006-09-29"
  },
  {
    "human": "7/13/22",
    "machine": "2022-07-13"
  },
  {
    "human": "10, jun 1991",
    "machine": "1991-06-10"
  },
  {
    "human": "1974.07.20 ad",
    "machine": "1974-07-20"
  },
  {
    "human": "september 28, 2010",
    "machine": "2010-09-28"
  },
  {
    "human": "1979.05.12 ad",
    "machine": "1979-05-12"
  },
  {
    "human": "14 november 2025",
    "machine": "2025-11-14"
  },
  {
    "human": "01, jul 2018",
    "machine": "2018-07-01"
  },
  {
    "human": "19-apr-1990",
    "machine": "1990-04-19"
  },
  {
    "human": "28 nov, 1975",
    "machine": "1975-11-28"
  },
  {
    "human": "2020-02-18",
    "machine": "2020-02-18"
  },
  {
    "human": "12-30-85",
    "machine": "1985-12-30"
  },
  {
    "human": "19 march 2015",
    "machine": "2015-03-19"
  },
  {
    "human": "02, aug 2024",
    "machine": "2024-08-02"
  },
  {
    "human": "14 aug, 2014",
    "machine": "2014-08-14"
  },
  {
    "human": "1973-09-10",
    "machine": "1973-09-10"
  },
  {
    "human": "9/13/15",
    "machine": "2015-09-13"
  },
  {
    "human": "sunday, january 16, 2011",
    "machine": "2011-01-16"
  },
  {
    "human": "1986.06.19 ad",
    "machine": "1986-06-19"
  },
  {
    "human": "apr 20, 2012",
    "machine": "2012-04-20"
  },
  {
    "human": "21 may, 2002",
    "machine": "2002-05-21"
  },
  {
    "human": "12-09-23",
    "machine": "2012-09-23"
  },
  {
    "human": "1/08/2021",
    "machine": "2021-08-01"
  },
  {
    "human": "13, mar 2020",
    "machine": "2020-03-13"
  },
  {
    "human": "1/02/1980",
    "machine": "1980-02-01"
  },
  {
    "human": "28, dec 1982",
    "machine": "1982-12-28"
  },
  {
    "human": "march 13, 2021",
    "machine": "2021-03-13"
  },
  {
    "human": "20 december 2004",
    "machine": "2004-12-20"
  },
  {
    "human": "1972.04.03 ad",
    "machine": "1972-04-03"
  },
  {
    "human": "wednesday, december 24, 2008",
    "machine": "2008-12-24"
  },
  {
    "human": "73-04-26",
    "machine": "1973-04-26"
  },
  {
    "human": "10.05.2007",
    "machine": "2007-05-10"
  },
  {
    "human": "1984-08-15",
    "machine": "1984-08-15"
  },
  {
    "human": "nov 8, 97",
    "machine": "1997-11-08"
  },
  {
    "human": "oct 31 1993",
    "machine": "1993-10-31"
  },
  {
    "human": "10 feb 1977",
    "machine": "1977-02-10"
  },
  {
    "human": "nov 6, 2004",
    "machine": "2004-11-06"
  },
  {
    "human": "apr 10, 80",
    "machine": "1980-04-10"
  },
  {
    "human": "january 31, 1972",
    "machine": "1972-01-31"
  },
  {
    "human": "8-dec-1974",
    "machine": "1974-12-08"
  },
  {
    "human": "99.04.21",
    "machine": "1999-04-21"
  },
  {
    "human": "06-24-82",
    "machine": "1982-06-24"
  },
  {
    "human": "15-oct-2003",
    "machine": "2003-10-15"
  },
  {
    "human": "16 july 1977",
    "machine": "1977-07-16"
  },
  {
    "human": "sep 5, 2008",
    "machine": "2008-09-05"
  },
  {
    "human": "11/18/1978",
    "machine": "1978-11-18"
  },
  {
    "human": "monday, april 24, 2006",
    "machine": "2006-04-24"
  },
  {
    "human": "30.12.1996",
    "machine": "1996-12-30"
  },
  {
    "human": "mar 2, 1981",
    "machine": "1981-03-02"
  },
  {
    "human": "1994-08-28",
    "machine": "1994-08-28"
  },
  {
    "human": "12-19-22",
    "machine": "2022-12-19"
  },
  {
    "human": "04/22/2001",
    "machine": "2001-04-22"
  },
  {
    "human": "june 7, 1986",
    "machine": "1986-06-07"
  },
  {
    "human": "11 october 2019",
    "machine": "2019-10-11"
  },
  {
    "human": "nov 29 1978",
    "machine": "1978-11-29"
  },
  {
    "human": "28-nov-1979",
    "machine": "1979-11-28"
  },
  {
    "human": "9-oct-2011",
    "machine": "2011-10-09"
  },
  {
    "human": "wednesday, november 12, 2025",
    "machine": "2025-11-12"
  },
  {
    "human": "nov 8, 14",
    "machine": "2014-11-08"
  },
  {
    "human": "thu, nov 1, 73",
    "machine": "1973-11-01"
  },
  {
    "human": "aug 31 1978",
    "machine": "1978-08-31"
  },
  {
    "human": "26 january 1984",
    "machine": "1984-01-26"
  },
  {
    "human": "5/30/03",
    "machine": "2003-05-30"
  },
  {
    "human": "6.6.13",
    "machine": "2013-06-06"
  },
  {
    "human": "02 june 2010",
    "machine": "2010-06-02"
  },
  {
    "human": "4.8.02",
    "machine": "2002-08-04"
  },
  {
    "human": "29 oct 1976",
    "machine": "1976-10-29"
  },
  {
    "human": "26/06/1997",
    "machine": "1997-06-26"
  },
  {
    "human": "19 may 1981",
    "machine": "1981-05-19"
  },
  {
    "human": "1991-02-18",
    "machine": "1991-02-18"
  },
  {
    "human": "2016/01/10",
    "machine": "2016-01-10"
  },
  {
    "human": "1979.06.20 ad",
    "machine": "1979-06-20"
  },
  {
    "human": "10/30/01",
    "machine": "2001-10-30"
  },
  {
    "human": "march 18, 1998",
    "machine": "1998-03-18"
  },
  {
    "human": "70.02.7",
    "machine": "1970-02-07"
  },
  {
    "human": "1992/10/14",
    "machine": "1992-10-14"
  },
  {
    "human": "09/18/1987",
    "machine": "1987-09-18"
  },
  {
    "human": "6.12.82",
    "machine": "1982-12-06"
  },
  {
    "human": "march 20, 2010",
    "machine": "2010-03-20"
  },
  {
    "human": "jan 29 1996",
    "machine": "1996-01-29"
  },
  {
    "human": "sep 17, 84",
    "machine": "1984-09-17"
  },
  {
    "human": "06-21-86",
    "machine": "1986-06-21"
  },
  {
    "human": "august 17, 1974",
    "machine": "1974-08-17"
  },
  {
    "human": "04 may 1996",
    "machine": "1996-05-04"
  },
  {
    "human": "thursday, april 24, 1986",
    "machine": "1986-04-24"
  },
  {
    "human": "1989-06-12",
    "machine": "1989-06-12"
  },
  {
    "human": "93.08.26",
    "machine": "1993-08-26"
  },
  {
    "human": "81.01.29",
    "machine": "1981-01-29"
  },
  {
    "human": "nov 3, 04",
    "machine": "2004-11-03"
  },
  {
    "human": "july 09, 2010",
    "machine": "2010-07-09"
  },
  {
    "human": "jul 31, 80",
    "machine": "1980-07-31"
  },
  {
    "human": "mar 29, 97",
    "machine": "1997-03-29"
  },
  {
    "human": "1996-11-01",
    "machine": "1996-11-01"
  },
  {
    "human": "22-12-03",
    "machine": "2022-12-03"
  },
  {
    "human": "6 dec, 1996",
    "machine": "1996-12-06"
  },
  {
    "human": "13-sep-1971",
    "machine": "1971-09-13"
  },
  {
    "human": "97-05-05",
    "machine": "1997-05-05"
  },
  {
    "human": "2013-02-11",
    "machine": "2013-02-11"
  },
  {
    "human": "03-25-14",
    "machine": "2014-03-25"
  },
  {
    "human": "1997-09-25",
    "machine": "1997-09-25"
  },
  {
    "human": "mon, feb 24, 97",
    "machine": "1997-02-24"
  },
  {
    "human": "17 april 1997",
    "machine": "1997-04-17"
  },
  {
    "human": "31 october 2022",
    "machine": "2022-10-31"
  },
  {
    "human": "1985-03-05",
    "machine": "1985-03-05"
  },
  {
    "human": "2023-11-17",
    "machine": "2023-11-17"
  },
  {
    "human": "april 09, 1997",
    "machine": "1997-04-09"
  },
  {
    "human": "29, nov 1992",
    "machine": "1992-11-29"
  },
  {
    "human": "26.8.93",
    "machine": "1993-08-26"
  },
  {
    "human": "tue, oct 17, 23",
    "machine": "2023-10-17"
  },
  {
    "human": "july 24, 1988",
    "machine": "1988-07-24"
  },
  {
    "human": "05.06.2007",
    "machine": "2007-06-05"
  },
  {
    "human": "january 2, 2022",
    "machine": "2022-01-02"
  },
  {
    "human": "13.12.12",
    "machine": "2013-12-12"
  },
  {
    "human": "25.3.07",
    "machine": "2007-03-25"
  },
  {
    "human": "4/14/79",
    "machine": "1979-04-14"
  },
  {
    "human": "14 oct, 1979",
    "machine": "1979-10-14"
  },
  {
    "human": "2-sep-2023",
    "machine": "2023-09-02"
  },
  {
    "human": "2021.11.24 ad",
    "machine": "2021-11-24"
  },
  {
    "human": "monday, april 12, 1993",
    "machine": "1993-04-12"
  },
  {
    "human": "friday, april 3, 1987",
    "machine": "1987-04-03"
  },
  {
    "human": "7/16/24",
    "machine": "2024-07-16"
  },
  {
    "human": "29.10.01",
    "machine": "2001-10-29"
  },
  {
    "human": "08 june 1990",
    "machine": "1990-06-08"
  },
  {
    "human": "1978-03-12",
    "machine": "1978-03-12"
  },
  {
    "human": "06-05-70",
    "machine": "1970-06-05"
  },
  {
    "human": "10/25/2024",
    "machine": "2024-10-25"
  },
  {
    "human": "27/09/1991",
    "machine": "1991-09-27"
  },
  {
    "human": "1998.03.14 ad",
    "machine": "1998-03-14"
  },
  {
    "human": "april 28, 2022",
    "machine": "2022-04-28"
  },
  {
    "human": "sun, may 13, 18",
    "machine": "2018-05-13"
  },
  {
    "human": "09, dec 1972",
    "machine": "1972-12-09"
  },
  {
    "human": "2019-06-15",
    "machine": "2019-06-15"
  },
  {
    "human": "94.03.10",
    "machine": "1994-03-10"
  },
  {
    "human": "18 jun 2011",
    "machine": "2011-06-18"
  },
  {
    "human": "2019.12.28 ad",
    "machine": "2019-12-28"
  },
  {
    "human": "tuesday, august 6, 1985",
    "machine": "1985-08-06"
  },
  {
    "human": "31-oct-2002",
    "machine": "2002-10-31"
  },
  {
    "human": "22 feb 1972",
    "machine": "1972-02-22"
  },
  {
    "human": "1971.11.09 ad",
    "machine": "1971-11-09"
  },
  {
    "human": "18 aug 2016",
    "machine": "2016-08-18"
  },
  {
    "human": "friday, june 1, 2018",
    "machine": "2018-06-01"
  },
  {
    "human": "monday, march 14, 1983",
    "machine": "1983-03-14"
  },
  {
    "human": "jun 29, 2025",
    "machine": "2025-06-29"
  },
  {
    "human": "09.05.1974",
    "machine": "1974-05-09"
  },
  {
    "human": "8/16/20",
    "machine": "2020-08-16"
  },
  {
    "human": "00.06.11",
    "machine": "2000-06-11"
  },
  {
    "human": "friday, march 28, 2025",
    "machine": "2025-03-28"
  },
  {
    "human": "04-08-71",
    "machine": "1971-04-08"
  },
  {
    "human": "25-09-13",
    "machine": "2025-09-13"
  },
  {
    "human": "june 13, 1989",
    "machine": "1989-06-13"
  },
  {
    "human": "27 september 1973",
    "machine": "1973-09-27"
  },
  {
    "human": "oct 11 1983",
    "machine": "1983-10-11"
  },
  {
    "human": "sun, feb 17, 13",
    "machine": "2013-02-17"
  },
  {
    "human": "saturday, march 15, 2025",
    "machine": "2025-03-15"
  },
  {
    "human": "31.5.14",
    "machine": "2014-05-31"
  },
  {
    "human": "sep 13, 90",
    "machine": "1990-09-13"
  },
  {
    "human": "friday, may 11, 2007",
    "machine": "2007-05-11"
  },
  {
    "human": "3.10.73",
    "machine": "1973-10-03"
  },
  {
    "human": "mon, jul 6, 92",
    "machine": "1992-07-06"
  },
  {
    "human": "81-02-23",
    "machine": "1981-02-23"
  },
  {
    "human": "24, jun 2024",
    "machine": "2024-06-24"
  },
  {
    "human": "22.11.70",
    "machine": "1970-11-22"
  },
  {
    "human": "87-04-08",
    "machine": "1987-04-08"
  },
  {
    "human": "thursday, august 14, 1980",
    "machine": "1980-08-14"
  },
  {
    "human": "2012.09.07 ad",
    "machine": "2012-09-07"
  },
  {
    "human": "06-03-28",
    "machine": "2006-03-28"
  },
  {
    "human": "2022/04/12",
    "machine": "2022-04-12"
  },
  {
    "human": "thursday, february 12, 2015",
    "machine": "2015-02-12"
  },
  {
    "human": "2001/09/25",
    "machine": "2001-09-25"
  },
  {
    "human": "sun, nov 9, 03",
    "machine": "2003-11-09"
  },
  {
    "human": "30-oct-2016",
    "machine": "2016-10-30"
  },
  {
    "human": "2003-04-5",
    "machine": "2003-04-05"
  },
  {
    "human": "08.05.19",
    "machine": "2008-05-19"
  },
  {
    "human": "12/09/2021",
    "machine": "2021-09-12"
  },
  {
    "human": "sunday, january 26, 2025",
    "machine": "2025-01-26"
  },
  {
    "human": "1993-09-13",
    "machine": "1993-09-13"
  },
  {
    "human": "july 27, 1975",
    "machine": "1975-07-27"
  },
  {
    "human": "15 apr 2007",
    "machine": "2007-04-15"
  },
  {
    "human": "7 feb, 1981",
    "machine": "1981-02-07"
  },
  {
    "human": "1988/10/15",
    "machine": "1988-10-15"
  },
  {
    "human": "08.01.18",
    "machine": "2008-01-18"
  },
  {
    "human": "3.8.04",
    "machine": "2004-08-03"
  },
  {
    "human": "sunday, october 11, 1992",
    "machine": "1992-10-11"
  },
  {
    "human": "81-04-20",
    "machine": "1981-04-20"
  },
  {
    "human": "october 15, 2002",
    "machine": "2002-10-15"
  },
  {
    "human": "1971-05-8",
    "machine": "1971-05-08"
  },
  {
    "human": "monday, october 10, 2005",
    "machine": "2005-10-10"
  },
  {
    "human": "20/02/2011",
    "machine": "2011-02-20"
  },
  {
    "human": "wednesday, november 22, 1972",
    "machine": "1972-11-22"
  },
  {
    "human": "mar 19, 82",
    "machine": "1982-03-19"
  },
  {
    "human": "01.07.29",
    "machine": "2001-07-29"
  },
  {
    "human": "5/12/1972",
    "machine": "1972-12-05"
  },
  {
    "human": "2015-12-28",
    "machine": "2015-12-28"
  },
  {
    "human": "05 april 1992",
    "machine": "1992-04-05"
  },
  {
    "human": "2018/05/30",
    "machine": "2018-05-30"
  },
  {
    "human": "01 may 2023",
    "machine": "2023-05-01"
  },
  {
    "human": "mar 9 2016",
    "machine": "2016-03-09"
  },
  {
    "human": "jul 9, 78",
    "machine": "1978-07-09"
  },
  {
    "human": "thursday, december 28, 2023",
    "machine": "2023-12-28"
  },
  {
    "human": "8 october 2021",
    "machine": "2021-10-08"
  },
  {
    "human": "28 october 1975",
    "machine": "1975-10-28"
  },
  {
    "human": "10 july 2019",
    "machine": "2019-07-10"
  },
  {
    "human": "22-04-03",
    "machine": "2022-04-03"
  },
  {
    "human": "21.2.90",
    "machine": "1990-02-21"
  },
  {
    "human": "80-12-20",
    "machine": "1980-12-20"
  },
  {
    "human": "march 27, 2016",
    "machine": "2016-03-27"
  },
  {
    "human": "9/14/86",
    "machine": "1986-09-14"
  },
  {
    "human": "nov 11, 1974",
    "machine": "1974-11-11"
  },
  {
    "human": "02/10/1989",
    "machine": "1989-02-10"
  },
  {
    "human": "august 28, 1985",
    "machine": "1985-08-28"
  },
  {
    "human": "23-jan-1991",
    "machine": "1991-01-23"
  },
  {
    "human": "3/12/22",
    "machine": "2022-03-12"
  },
  {
    "human": "20.02.7",
    "machine": "2020-02-07"
  },
  {
    "human": "17-jun-1986",
    "machine": "1986-06-17"
  },
  {
    "human": "29 march 1987",
    "machine": "1987-03-29"
  },
  {
    "human": "9 may, 2004",
    "machine": "2004-05-09"
  },
  {
    "human": "10/19/89",
    "machine": "1989-10-19"
  },
  {
    "human": "2019.08.26 ad",
    "machine": "2019-08-26"
  },
  {
    "human": "02/28/2003",
    "machine": "2003-02-28"
  },
  {
    "human": "08.10.15",
    "machine": "2008-10-15"
  },
  {
    "human": "1973-10-10",
    "machine": "1973-10-10"
  },
  {
    "human": "3/10/10",
    "machine": "2010-03-10"
  },
  {
    "human": "27.4.93",
    "machine": "1993-04-27"
  },
  {
    "human": "7-jan-1979",
    "machine": "1979-01-07"
  },
  {
    "human": "february 19, 2016",
    "machine": "2016-02-19"
  },
  {
    "human": "07.10.2010",
    "machine": "2010-10-07"
  },
  {
    "human": "2/3/74",
    "machine": "1974-02-03"
  },
  {
    "human": "20 january 2021",
    "machine": "2021-01-20"
  },
  {
    "human": "may 17, 2019",
    "machine": "2019-05-17"
  },
  {
    "human": "8/19/90",
    "machine": "1990-08-19"
  },
  {
    "human": "1976-04-22",
    "machine": "1976-04-22"
  },
  {
    "human": "monday, january 26, 1976",
    "machine": "1976-01-26"
  },
  {
    "human": "20.01.3",
    "machine": "2020-01-03"
  },
  {
    "human": "december 30, 1989",
    "machine": "1989-12-30"
  },
  {
    "human": "2015-02-7",
    "machine": "2015-02-07"
  },
  {
    "human": "march 4, 2003",
    "machine": "2003-03-04"
  },
  {
    "human": "2011-02-24",
    "machine": "2011-02-24"
  },
  {
    "human": "1992-05-06",
    "machine": "1992-05-06"
  },
  {
    "human": "04/08/2019",
    "machine": "2019-04-08"
  },
  {
    "human": "3.3.80",
    "machine": "1980-03-03"
  },
  {
    "human": "09-29-73",
    "machine": "1973-09-29"
  },
  {
    "human": "1989-11-30",
    "machine": "1989-11-30"
  },
  {
    "human": "december 13, 1996",
    "machine": "1996-12-13"
  },
  {
    "human": "1994-12-5",
    "machine": "1994-12-05"
  },
  {
    "human": "05-11-08",
    "machine": "2008-05-11"
  },
  {
    "human": "mon, may 21, 12",
    "machine": "2012-05-21"
  },
  {
    "human": "91-01-25",
    "machine": "1991-01-25"
  },
  {
    "human": "2004-07-13",
    "machine": "2004-07-13"
  },
  {
    "human": "2013.02.10 ad",
    "machine": "2013-02-10"
  },
  {
    "human": "17.05.2010",
    "machine": "2010-05-17"
  },
  {
    "human": "15-12-25",
    "machine": "2015-12-25"
  },
  {
    "human": "30-jun-1980",
    "machine": "1980-06-30"
  },
  {
    "human": "wed, nov 19, 25",
    "machine": "2025-11-19"
  },
  {
    "human": "nov 30 2015",
    "machine": "2015-11-30"
  },
  {
    "human": "thursday, august 16, 1984",
    "machine": "1984-08-16"
  },
  {
    "human": "2011/08/11",
    "machine": "2011-08-11"
  },
  {
    "human": "9 february 2009",
    "machine": "2009-02-09"
  },
  {
    "human": "10/28/1975",
    "machine": "1975-10-28"
  },
  {
    "human": "17.01.23",
    "machine": "2017-01-23"
  },
  {
    "human": "27 apr, 1977",
    "machine": "1977-04-27"
  },
  {
    "human": "fri, apr 4, 75",
    "machine": "1975-04-04"
  },
  {
    "human": "1971.05.22 ad",
    "machine": "1971-05-22"
  },
  {
    "human": "february 28, 1983",
    "machine": "1983-02-28"
  },
  {
    "human": "06.09.21",
    "machine": "2006-09-21"
  },
  {
    "human": "10-17-16",
    "machine": "2016-10-17"
  },
  {
    "human": "1993.03.01 ad",
    "machine": "1993-03-01"
  },
  {
    "human": "1995-02-04",
    "machine": "1995-02-04"
  },
  {
    "human": "1972.12.12 ad",
    "machine": "1972-12-12"
  },
  {
    "human": "friday, may 20, 1977",
    "machine": "1977-05-20"
  },
  {
    "human": "saturday, october 5, 1974",
    "machine": "1974-10-05"
  },
  {
    "human": "02-07-75",
    "machine": "1975-02-07"
  },
  {
    "human": "may 27, 71",
    "machine": "1971-05-27"
  },
  {
    "human": "22 august 1971",
    "machine": "1971-08-22"
  },
  {
    "human": "1997/05/10",
    "machine": "1997-05-10"
  },
  {
    "human": "2/21/18",
    "machine": "2018-02-21"
  },
  {
    "human": "tuesday, september 25, 2007",
    "machine": "2007-09-25"
  },
  {
    "human": "2022-01-07",
    "machine": "2022-01-07"
  },
  {
    "human": "13.12.2006",
    "machine": "2006-12-13"
  },
  {
    "human": "01 october 2005",
    "machine": "2005-10-01"
  },
  {
    "human": "18.02.2012",
    "machine": "2012-02-18"
  },
  {
    "human": "11 february 2007",
    "machine": "2007-02-11"
  },
  {
    "human": "1978/10/24",
    "machine": "1978-10-24"
  },
  {
    "human": "june 11, 1979",
    "machine": "1979-06-11"
  },
  {
    "human": "05-14-23",
    "machine": "2023-05-14"
  },
  {
    "human": "12-14-21",
    "machine": "2021-12-14"
  },
  {
    "human": "jan 3 1993",
    "machine": "1993-01-03"
  },
  {
    "human": "2010.08.06 ad",
    "machine": "2010-08-06"
  },
  {
    "human": "1980-11-15",
    "machine": "1980-11-15"
  },
  {
    "human": "01-25-95",
    "machine": "1995-01-25"
  },
  {
    "human": "22.01.1993",
    "machine": "1993-01-22"
  },
  {
    "human": "2/15/97",
    "machine": "1997-02-15"
  },
  {
    "human": "21.05.11",
    "machine": "2021-05-11"
  },
  {
    "human": "may 9, 2007",
    "machine": "2007-05-09"
  },
  {
    "human": "81.08.4",
    "machine": "1981-08-04"
  },
  {
    "human": "sep 20, 82",
    "machine": "1982-09-20"
  },
  {
    "human": "29.11.2023",
    "machine": "2023-11-29"
  },
  {
    "human": "05-17-73",
    "machine": "1973-05-17"
  },
  {
    "human": "2012.10.18 ad",
    "machine": "2012-10-18"
  },
  {
    "human": "03.03.2005",
    "machine": "2005-03-03"
  },
  {
    "human": "27 jun 2010",
    "machine": "2010-06-27"
  },
  {
    "human": "07-12-25",
    "machine": "2025-07-12"
  },
  {
    "human": "8/8/05",
    "machine": "2005-08-08"
  },
  {
    "human": "10/6/72",
    "machine": "1972-10-06"
  },
  {
    "human": "thu, jan 11, 90",
    "machine": "1990-01-11"
  },
  {
    "human": "10, mar 1971",
    "machine": "1971-03-10"
  },
  {
    "human": "11 october 1987",
    "machine": "1987-10-11"
  },
  {
    "human": "monday, may 17, 1999",
    "machine": "1999-05-17"
  },
  {
    "human": "friday, january 20, 2012",
    "machine": "2012-01-20"
  },
  {
    "human": "friday, august 23, 2024",
    "machine": "2024-08-23"
  },
  {
    "human": "12/28/19",
    "machine": "2019-12-28"
  },
  {
    "human": "february 17, 1983",
    "machine": "1983-02-17"
  },
  {
    "human": "2020-07-12",
    "machine": "2020-07-12"
  },
  {
    "human": "23 oct 1983",
    "machine": "1983-10-23"
  },
  {
    "human": "february 13, 2018",
    "machine": "2018-02-13"
  },
  {
    "human": "january 27, 2025",
    "machine": "2025-01-27"
  },
  {
    "human": "2001-10-02",
    "machine": "2001-10-02"
  },
  {
    "human": "12 jul 2015",
    "machine": "2015-07-12"
  },
  {
    "human": "14 september 1992",
    "machine": "1992-09-14"
  },
  {
    "human": "6 jan, 1998",
    "machine": "1998-01-06"
  },
  {
    "human": "aug 6, 78",
    "machine": "1978-08-06"
  },
  {
    "human": "february 07, 2012",
    "machine": "2012-02-07"
  },
  {
    "human": "13/06/2020",
    "machine": "2020-06-13"
  },
  {
    "human": "2002-08-27",
    "machine": "2002-08-27"
  },
  {
    "human": "6 november 1970",
    "machine": "1970-11-06"
  },
  {
    "human": "1986-09-04",
    "machine": "1986-09-04"
  },
  {
    "human": "01, mar 1971",
    "machine": "1971-03-01"
  },
  {
    "human": "11/20/2019",
    "machine": "2019-11-20"
  },
  {
    "human": "29-jun-2003",
    "machine": "2003-06-29"
  },
  {
    "human": "18 february 2009",
    "machine": "2009-02-18"
  },
  {
    "human": "jul 6, 1986",
    "machine": "1986-07-06"
  },
  {
    "human": "90-04-27",
    "machine": "1990-04-27"
  },
  {
    "human": "9-apr-2023",
    "machine": "2023-04-09"
  },
  {
    "human": "02/07/1996",
    "machine": "1996-02-07"
  },
  {
    "human": "1996/06/17",
    "machine": "1996-06-17"
  },
  {
    "human": "27.10.1986",
    "machine": "1986-10-27"
  },
  {
    "human": "april 2, 1994",
    "machine": "1994-04-02"
  },
  {
    "human": "2-oct-1992",
    "machine": "1992-10-02"
  },
  {
    "human": "11, sep 2012",
    "machine": "2012-09-11"
  },
  {
    "human": "23.8.07",
    "machine": "2007-08-23"
  },
  {
    "human": "2/15/16",
    "machine": "2016-02-15"
  },
  {
    "human": "jul 17 2015",
    "machine": "2015-07-17"
  },
  {
    "human": "nov 21, 97",
    "machine": "1997-11-21"
  },
  {
    "human": "sep 24, 2009",
    "machine": "2009-09-24"
  },
  {
    "human": "12-dec-1983",
    "machine": "1983-12-12"
  },
  {
    "human": "dec 12, 20",
    "machine": "2020-12-12"
  },
  {
    "human": "1970/05/15",
    "machine": "1970-05-15"
  },
  {
    "human": "2/2/04",
    "machine": "2004-02-02"
  },
  {
    "human": "april 2, 1974",
    "machine": "1974-04-02"
  },
  {
    "human": "nov 10, 1992",
    "machine": "1992-11-10"
  },
  {
    "human": "1972/09/19",
    "machine": "1972-09-19"
  },
  {
    "human": "march 12, 2005",
    "machine": "2005-03-12"
  },
  {
    "human": "07/07/2014",
    "machine": "2014-07-07"
  },
  {
    "human": "16-05-31",
    "machine": "2016-05-31"
  },
  {
    "human": "93.01.11",
    "machine": "1993-01-11"
  },
  {
    "human": "70.11.25",
    "machine": "1970-11-25"
  },
  {
    "human": "july 13, 1979",
    "machine": "1979-07-13"
  },
  {
    "human": "28/07/1975",
    "machine": "1975-07-28"
  },
  {
    "human": "6 dec, 1978",
    "machine": "1978-12-06"
  },
  {
    "human": "1999.02.16 ad",
    "machine": "1999-02-16"
  },
  {
    "human": "21-07-30",
    "machine": "2021-07-30"
  },
  {
    "human": "10-jan-1979",
    "machine": "1979-01-10"
  },
  {
    "human": "10/17/1970",
    "machine": "1970-10-17"
  },
  {
    "human": "apr 17, 2002",
    "machine": "2002-04-17"
  },
  {
    "human": "6 sep, 1992",
    "machine": "1992-09-06"
  },
  {
    "human": "1970.11.21 ad",
    "machine": "1970-11-21"
  },
  {
    "human": "6 jul, 1991",
    "machine": "1991-07-06"
  },
  {
    "human": "15.08.2022",
    "machine": "2022-08-15"
  },
  {
    "human": "sat, sep 23, 06",
    "machine": "2006-09-23"
  },
  {
    "human": "11-14-82",
    "machine": "1982-11-14"
  },
  {
    "human": "27 may 1981",
    "machine": "1981-05-27"
  },
  {
    "human": "12-11-28",
    "machine": "2012-11-28"
  },
  {
    "human": "march 24, 2006",
    "machine": "2006-03-24"
  },
  {
    "human": "december 22, 1973",
    "machine": "1973-12-22"
  },
  {
    "human": "sunday, september 28, 2025",
    "machine": "2025-09-28"
  },
  {
    "human": "1981/05/03",
    "machine": "1981-05-03"
  },
  {
    "human": "1995-01-31",
    "machine": "1995-01-31"
  },
  {
    "human": "1970/07/11",
    "machine": "1970-07-11"
  },
  {
    "human": "2000-04-04",
    "machine": "2000-04-04"
  },
  {
    "human": "2012-09-11",
    "machine": "2012-09-11"
  },
  {
    "human": "2007.01.14 ad",
    "machine": "2007-01-14"
  },
  {
    "human": "2008-06-29",
    "machine": "2008-06-29"
  },
  {
    "human": "december 31, 2024",
    "machine": "2024-12-31"
  },
  {
    "human": "mar 18 2006",
    "machine": "2006-03-18"
  },
  {
    "human": "1978-08-18",
    "machine": "1978-08-18"
  },
  {
    "human": "january 18, 2021",
    "machine": "2021-01-18"
  },
  {
    "human": "friday, september 23, 1988",
    "machine": "1988-09-23"
  },
  {
    "human": "11/10/71",
    "machine": "1971-11-10"
  },
  {
    "human": "29.4.96",
    "machine": "1996-04-29"
  },
  {
    "human": "11/14/15",
    "machine": "2015-11-14"
  },
  {
    "human": "friday, august 7, 2015",
    "machine": "2015-08-07"
  },
  {
    "human": "october 13, 1972",
    "machine": "1972-10-13"
  },
  {
    "human": "31 july 2021",
    "machine": "2021-07-31"
  },
  {
    "human": "29 mar 2008",
    "machine": "2008-03-29"
  },
  {
    "human": "07/19/1973",
    "machine": "1973-07-19"
  },
  {
    "human": "85.11.12",
    "machine": "1985-11-12"
  },
  {
    "human": "4-feb-2021",
    "machine": "2021-02-04"
  },
  {
    "human": "15.09.26",
    "machine": "2015-09-26"
  },
  {
    "human": "1987.07.20 ad",
    "machine": "1987-07-20"
  },
  {
    "human": "2013-11-13",
    "machine": "2013-11-13"
  },
  {
    "human": "5 may, 1999",
    "machine": "1999-05-05"
  },
  {
    "human": "17 dec 1983",
    "machine": "1983-12-17"
  },
  {
    "human": "02.01.2021",
    "machine": "2021-01-02"
  },
  {
    "human": "09-24-89",
    "machine": "1989-09-24"
  },
  {
    "human": "02-21-87",
    "machine": "1987-02-21"
  },
  {
    "human": "16.07.1990",
    "machine": "1990-07-16"
  },
  {
    "human": "16 oct, 1970",
    "machine": "1970-10-16"
  },
  {
    "human": "03-30-13",
    "machine": "2013-03-30"
  },
  {
    "human": "jul 2, 01",
    "machine": "2001-07-02"
  },
  {
    "human": "sep 28 2002",
    "machine": "2002-09-28"
  },
  {
    "human": "monday, august 29, 2016",
    "machine": "2016-08-29"
  },
  {
    "human": "17, nov 1989",
    "machine": "1989-11-17"
  },
  {
    "human": "tuesday, october 31, 2000",
    "machine": "2000-10-31"
  },
  {
    "human": "1997/05/28",
    "machine": "1997-05-28"
  },
  {
    "human": "mon, nov 17, 86",
    "machine": "1986-11-17"
  },
  {
    "human": "tue, apr 22, 97",
    "machine": "1997-04-22"
  },
  {
    "human": "98.10.17",
    "machine": "1998-10-17"
  },
  {
    "human": "sep 27, 2015",
    "machine": "2015-09-27"
  },
  {
    "human": "17-03-17",
    "machine": "2017-03-17"
  },
  {
    "human": "dec 5, 01",
    "machine": "2001-12-05"
  },
  {
    "human": "27.05.2024",
    "machine": "2024-05-27"
  },
  {
    "human": "february 5, 1981",
    "machine": "1981-02-05"
  },
  {
    "human": "aug 5, 87",
    "machine": "1987-08-05"
  },
  {
    "human": "thursday, june 6, 2019",
    "machine": "2019-06-06"
  },
  {
    "human": "friday, january 29, 2021",
    "machine": "2021-01-29"
  },
  {
    "human": "5/28/79",
    "machine": "1979-05-28"
  },
  {
    "human": "october 30, 2017",
    "machine": "2017-10-30"
  },
  {
    "human": "21, apr 2005",
    "machine": "2005-04-21"
  },
  {
    "human": "wednesday, may 10, 1972",
    "machine": "1972-05-10"
  },
  {
    "human": "3.5.73",
    "machine": "1973-05-03"
  },
  {
    "human": "2017-12-31",
    "machine": "2017-12-31"
  },
  {
    "human": "91.07.16",
    "machine": "1991-07-16"
  },
  {
    "human": "02-19-91",
    "machine": "1991-02-19"
  },
  {
    "human": "16.4.04",
    "machine": "2004-04-16"
  },
  {
    "human": "7 apr 1990",
    "machine": "1990-04-07"
  },
  {
    "human": "august 19, 2007",
    "machine": "2007-08-19"
  },
  {
    "human": "10/26/87",
    "machine": "1987-10-26"
  },
  {
    "human": "01/08/2017",
    "machine": "2017-01-08"
  },
  {
    "human": "tuesday, april 11, 1995",
    "machine": "1995-04-11"
  },
  {
    "human": "2005-10-27",
    "machine": "2005-10-27"
  },
  {
    "human": "12-09-08",
    "machine": "2008-12-09"
  },
  {
    "human": "wed, jul 14, 76",
    "machine": "1976-07-14"
  },
  {
    "human": "sep 9, 18",
    "machine": "2018-09-09"
  },
  {
    "human": "18 mar, 1999",
    "machine": "1999-03-18"
  },
  {
    "human": "08, feb 2018",
    "machine": "2018-02-08"
  },
  {
    "human": "08-14-17",
    "machine": "2017-08-14"
  },
  {
    "human": "aug 23, 83",
    "machine": "1983-08-23"
  },
  {
    "human": "october 24, 2012",
    "machine": "2012-10-24"
  },
  {
    "human": "12.06.16",
    "machine": "2012-06-16"
  },
  {
    "human": "1972-01-01",
    "machine": "1972-01-01"
  },
  {
    "human": "10-14-93",
    "machine": "1993-10-14"
  },
  {
    "human": "thursday, october 30, 2014",
    "machine": "2014-10-30"
  },
  {
    "human": "28-aug-2020",
    "machine": "2020-08-28"
  },
  {
    "human": "2010-06-11",
    "machine": "2010-06-11"
  },
  {
    "human": "28-apr-2014",
    "machine": "2014-04-28"
  },
  {
    "human": "saturday, march 2, 1996",
    "machine": "1996-03-02"
  },
  {
    "human": "12-sep-2011",
    "machine": "2011-09-12"
  },
  {
    "human": "29 november 2014",
    "machine": "2014-11-29"
  },
  {
    "human": "09 june 2012",
    "machine": "2012-06-09"
  },
  {
    "human": "1990.08.25 ad",
    "machine": "1990-08-25"
  },
  {
    "human": "jan 19, 70",
    "machine": "1970-01-19"
  },
  {
    "human": "2/20/24",
    "machine": "2024-02-20"
  },
  {
    "human": "jan 25, 1977",
    "machine": "1977-01-25"
  },
  {
    "human": "1974-08-12",
    "machine": "1974-08-12"
  },
  {
    "human": "thursday, march 19, 1998",
    "machine": "1998-03-19"
  },
  {
    "human": "august 14, 2005",
    "machine": "2005-08-14"
  },
  {
    "human": "14 jun 2006",
    "machine": "2006-06-14"
  },
  {
    "human": "07/01/1972",
    "machine": "1972-07-01"
  },
  {
    "human": "5/4/90",
    "machine": "1990-05-04"
  },
  {
    "human": "1986-11-08",
    "machine": "1986-11-08"
  },
  {
    "human": "05/01/1973",
    "machine": "1973-05-01"
  },
  {
    "human": "08.11.23",
    "machine": "2008-11-23"
  },
  {
    "human": "23-aug-1987",
    "machine": "1987-08-23"
  },
  {
    "human": "8/14/74",
    "machine": "1974-08-14"
  },
  {
    "human": "11, jul 2011",
    "machine": "2011-07-11"
  },
  {
    "human": "19.06.5",
    "machine": "2019-06-05"
  },
  {
    "human": "02/06/2023",
    "machine": "2023-02-06"
  },
  {
    "human": "5 oct, 1988",
    "machine": "1988-10-05"
  },
  {
    "human": "03, oct 2002",
    "machine": "2002-10-03"
  },
  {
    "human": "79-02-27",
    "machine": "1979-02-27"
  },
  {
    "human": "29/02/2024",
    "machine": "2024-02-29"
  },
  {
    "human": "1982/05/24",
    "machine": "1982-05-24"
  },
  {
    "human": "79-03-14",
    "machine": "1979-03-14"
  },
  {
    "human": "05 june 2001",
    "machine": "2001-06-05"
  },
  {
    "human": "sunday, february 27, 2022",
    "machine": "2022-02-27"
  },
  {
    "human": "wednesday, december 26, 2007",
    "machine": "2007-12-26"
  },
  {
    "human": "70-09-07",
    "machine": "1970-09-07"
  },
  {
    "human": "71-11-11",
    "machine": "1971-11-11"
  },
  {
    "human": "12-07-84",
    "machine": "1984-12-07"
  },
  {
    "human": "2001/07/11",
    "machine": "2001-07-11"
  },
  {
    "human": "1/12/05",
    "machine": "2005-01-12"
  },
  {
    "human": "92-01-07",
    "machine": "1992-01-07"
  },
  {
    "human": "1975-01-17",
    "machine": "1975-01-17"
  },
  {
    "human": "13 aug 2024",
    "machine": "2024-08-13"
  },
  {
    "human": "may 30, 1994",
    "machine": "1994-05-30"
  },
  {
    "human": "2017-12-3",
    "machine": "2017-12-03"
  },
  {
    "human": "january 17, 2015",
    "machine": "2015-01-17"
  },
  {
    "human": "8 mar 1987",
    "machine": "1987-03-08"
  },
  {
    "human": "sep 14, 83",
    "machine": "1983-09-14"
  },
  {
    "human": "11-22-19",
    "machine": "2019-11-22"
  },
  {
    "human": "17 feb, 1975",
    "machine": "1975-02-17"
  },
  {
    "human": "5 march 2005",
    "machine": "2005-03-05"
  },
  {
    "human": "11/08/2004",
    "machine": "2004-11-08"
  },
  {
    "human": "02-24-75",
    "machine": "1975-02-24"
  },
  {
    "human": "22, jan 2012",
    "machine": "2012-01-22"
  },
  {
    "human": "26.07.1992",
    "machine": "1992-07-26"
  },
  {
    "human": "november 28, 2014",
    "machine": "2014-11-28"
  },
  {
    "human": "october 26, 1978",
    "machine": "1978-10-26"
  },
  {
    "human": "2011-05-8",
    "machine": "2011-05-08"
  },
  {
    "human": "july 24, 1984",
    "machine": "1984-07-24"
  },
  {
    "human": "july 2, 1990",
    "machine": "1990-07-02"
  },
  {
    "human": "3 aug, 2014",
    "machine": "2014-08-03"
  },
  {
    "human": "12/23/1977",
    "machine": "1977-12-23"
  },
  {
    "human": "jul 30 1970",
    "machine": "1970-07-30"
  },
  {
    "human": "sat, feb 18, 23",
    "machine": "2023-02-18"
  },
  {
    "human": "february 26, 1976",
    "machine": "1976-02-26"
  },
  {
    "human": "17.07.1991",
    "machine": "1991-07-17"
  },
  {
    "human": "26/12/1995",
    "machine": "1995-12-26"
  },
  {
    "human": "08/03/1992",
    "machine": "1992-08-03"
  },
  {
    "human": "september 28, 1992",
    "machine": "1992-09-28"
  },
  {
    "human": "26-sep-2011",
    "machine": "2011-09-26"
  },
  {
    "human": "2018/03/04",
    "machine": "2018-03-04"
  },
  {
    "human": "21-feb-1976",
    "machine": "1976-02-21"
  },
  {
    "human": "2025-01-30",
    "machine": "2025-01-30"
  },
  {
    "human": "2015-08-02",
    "machine": "2015-08-02"
  },
  {
    "human": "94-09-04",
    "machine": "1994-09-04"
  },
  {
    "human": "12/24/2017",
    "machine": "2017-12-24"
  },
  {
    "human": "09 november 2025",
    "machine": "2025-11-09"
  },
  {
    "human": "25 jul, 2021",
    "machine": "2021-07-25"
  },
  {
    "human": "11/22/20",
    "machine": "2020-11-22"
  },
  {
    "human": "11-23-90",
    "machine": "1990-11-23"
  },
  {
    "human": "25.9.94",
    "machine": "1994-09-25"
  },
  {
    "human": "sunday, june 9, 2024",
    "machine": "2024-06-09"
  },
  {
    "human": "29, nov 2006",
    "machine": "2006-11-29"
  },
  {
    "human": "28, sep 2003",
    "machine": "2003-09-28"
  },
  {
    "human": "01/04/1986",
    "machine": "1986-01-04"
  },
  {
    "human": "18.08.1994",
    "machine": "1994-08-18"
  },
  {
    "human": "1992-01-31",
    "machine": "1992-01-31"
  },
  {
    "human": "9/14/13",
    "machine": "2013-09-14"
  },
  {
    "human": "8 july 1970",
    "machine": "1970-07-08"
  },
  {
    "human": "jan 1, 2022",
    "machine": "2022-01-01"
  },
  {
    "human": "thursday, november 4, 1993",
    "machine": "1993-11-04"
  },
  {
    "human": "17 nov 1985",
    "machine": "1985-11-17"
  },
  {
    "human": "30 january 1971",
    "machine": "1971-01-30"
  },
  {
    "human": "28 june 1982",
    "machine": "1982-06-28"
  },
  {
    "human": "25.11.11",
    "machine": "2011-11-25"
  },
  {
    "human": "tue, dec 20, 88",
    "machine": "1988-12-20"
  },
  {
    "human": "thursday, november 6, 2008",
    "machine": "2008-11-06"
  },
  {
    "human": "saturday, december 23, 1995",
    "machine": "1995-12-23"
  },
  {
    "human": "3/02/2002",
    "machine": "2002-02-03"
  },
  {
    "human": "11-apr-1999",
    "machine": "1999-04-11"
  },
  {
    "human": "17/04/2021",
    "machine": "2021-04-17"
  },
  {
    "human": "2018/06/02",
    "machine": "2018-06-02"
  },
  {
    "human": "january 23, 1994",
    "machine": "1994-01-23"
  },
  {
    "human": "sep 10 2008",
    "machine": "2008-09-10"
  },
  {
    "human": "1977.08.17 ad",
    "machine": "1977-08-17"
  },
  {
    "human": "tuesday, november 8, 1988",
    "machine": "1988-11-08"
  },
  {
    "human": "9/25/25",
    "machine": "2025-09-25"
  },
  {
    "human": "2004-01-20",
    "machine": "2004-01-20"
  },
  {
    "human": "22.6.87",
    "machine": "1987-06-22"
  },
  {
    "human": "july 26, 2019",
    "machine": "2019-07-26"
  },
  {
    "human": "october 22, 1979",
    "machine": "1979-10-22"
  },
  {
    "human": "07 may 2007",
    "machine": "2007-05-07"
  },
  {
    "human": "81.01.24",
    "machine": "1981-01-24"
  },
  {
    "human": "21 jan 1984",
    "machine": "1984-01-21"
  },
  {
    "human": "sunday, march 17, 2013",
    "machine": "2013-03-17"
  },
  {
    "human": "18-oct-1997",
    "machine": "1997-10-18"
  },
  {
    "human": "december 21, 1995",
    "machine": "1995-12-21"
  },
  {
    "human": "sunday, september 21, 2014",
    "machine": "2014-09-21"
  },
  {
    "human": "25/03/2016",
    "machine": "2016-03-25"
  },
  {
    "human": "1998.01.27 ad",
    "machine": "1998-01-27"
  },
  {
    "human": "dec 18, 2015",
    "machine": "2015-12-18"
  },
  {
    "human": "24-02-05",
    "machine": "2024-02-05"
  },
  {
    "human": "jun 28 1983",
    "machine": "1983-06-28"
  },
  {
    "human": "23 august 2018",
    "machine": "2018-08-23"
  },
  {
    "human": "october 13, 2021",
    "machine": "2021-10-13"
  },
  {
    "human": "oct 12, 1980",
    "machine": "1980-10-12"
  },
  {
    "human": "2005-11-9",
    "machine": "2005-11-09"
  },
  {
    "human": "1972/01/27",
    "machine": "1972-01-27"
  },
  {
    "human": "8/16/98",
    "machine": "1998-08-16"
  },
  {
    "human": "19-aug-2012",
    "machine": "2012-08-19"
  },
  {
    "human": "19.01.2007",
    "machine": "2007-01-19"
  },
  {
    "human": "1987-05-20",
    "machine": "1987-05-20"
  },
  {
    "human": "02/07/1999",
    "machine": "1999-02-07"
  },
  {
    "human": "march 14, 1999",
    "machine": "1999-03-14"
  },
  {
    "human": "08 april 2000",
    "machine": "2000-04-08"
  },
  {
    "human": "11 january 2000",
    "machine": "2000-01-11"
  },
  {
    "human": "08-17-13",
    "machine": "2013-08-17"
  },
  {
    "human": "30, apr 2017",
    "machine": "2017-04-30"
  },
  {
    "human": "jan 27, 2023",
    "machine": "2023-01-27"
  },
  {
    "human": "7-oct-1982",
    "machine": "1982-10-07"
  },
  {
    "human": "14 july 1988",
    "machine": "1988-07-14"
  },
  {
    "human": "2005.02.12 ad",
    "machine": "2005-02-12"
  },
  {
    "human": "05.06.1995",
    "machine": "1995-06-05"
  },
  {
    "human": "tue, aug 5, 03",
    "machine": "2003-08-05"
  },
  {
    "human": "4-jul-2018",
    "machine": "2018-07-04"
  },
  {
    "human": "may 28, 1981",
    "machine": "1981-05-28"
  },
  {
    "human": "8 september 2008",
    "machine": "2008-09-08"
  },
  {
    "human": "1978/01/24",
    "machine": "1978-01-24"
  },
  {
    "human": "81-12-05",
    "machine": "1981-12-05"
  },
  {
    "human": "00-06-23",
    "machine": "2000-06-23"
  },
  {
    "human": "5.6.84",
    "machine": "1984-06-05"
  },
  {
    "human": "2006/03/26",
    "machine": "2006-03-26"
  },
  {
    "human": "11/04/1976",
    "machine": "1976-04-11"
  },
  {
    "human": "march 23, 1991",
    "machine": "1991-03-23"
  },
  {
    "human": "fri, oct 7, 77",
    "machine": "1977-10-07"
  },
  {
    "human": "07.08.2022",
    "machine": "2022-08-07"
  },
  {
    "human": "13 august 2005",
    "machine": "2005-08-13"
  },
  {
    "human": "saturday, november 26, 1977",
    "machine": "1977-11-26"
  },
  {
    "human": "feb 15, 03",
    "machine": "2003-02-15"
  },
  {
    "human": "1/17/81",
    "machine": "1981-01-17"
  },
  {
    "human": "11/5/88",
    "machine": "1988-11-05"
  },
  {
    "human": "81.05.14",
    "machine": "1981-05-14"
  },
  {
    "human": "8 sep, 2023",
    "machine": "2023-09-08"
  },
  {
    "human": "dec 20, 1998",
    "machine": "1998-12-20"
  },
  {
    "human": "30, dec 1993",
    "machine": "1993-12-30"
  },
  {
    "human": "10.10.1996",
    "machine": "1996-10-10"
  },
  {
    "human": "29 nov 2013",
    "machine": "2013-11-29"
  },
  {
    "human": "apr 17 1997",
    "machine": "1997-04-17"
  },
  {
    "human": "30-aug-2016",
    "machine": "2016-08-30"
  },
  {
    "human": "december 04, 1998",
    "machine": "1998-12-04"
  },
  {
    "human": "07-15-81",
    "machine": "1981-07-15"
  },
  {
    "human": "thursday, july 3, 2008",
    "machine": "2008-07-03"
  },
  {
    "human": "9/09/2022",
    "machine": "2022-09-09"
  },
  {
    "human": "thursday, march 2, 1989",
    "machine": "1989-03-02"
  },
  {
    "human": "aug 4 2006",
    "machine": "2006-08-04"
  },
  {
    "human": "19 oct 1996",
    "machine": "1996-10-19"
  },
  {
    "human": "1977/07/23",
    "machine": "1977-07-23"
  },
  {
    "human": "oct 14, 2006",
    "machine": "2006-10-14"
  },
  {
    "human": "22 oct 2019",
    "machine": "2019-10-22"
  },
  {
    "human": "sunday, april 15, 1979",
    "machine": "1979-04-15"
  },
  {
    "human": "may 13, 12",
    "machine": "2012-05-13"
  },
  {
    "human": "friday, december 8, 1978",
    "machine": "1978-12-08"
  },
  {
    "human": "wednesday, january 12, 2000",
    "machine": "2000-01-12"
  },
  {
    "human": "98.10.4",
    "machine": "1998-10-04"
  },
  {
    "human": "2/28/73",
    "machine": "1973-02-28"
  },
  {
    "human": "2020-01-16",
    "machine": "2020-01-16"
  },
  {
    "human": "07/05/1991",
    "machine": "1991-07-05"
  },
  {
    "human": "saturday, october 28, 2000",
    "machine": "2000-10-28"
  },
  {
    "human": "30 oct, 1987",
    "machine": "1987-10-30"
  },
  {
    "human": "11/20/1984",
    "machine": "1984-11-20"
  },
  {
    "human": "29.12.00",
    "machine": "2000-12-29"
  },
  {
    "human": "saturday, january 30, 1971",
    "machine": "1971-01-30"
  },
  {
    "human": "06-06-24",
    "machine": "2024-06-06"
  },
  {
    "human": "december 07, 2001",
    "machine": "2001-12-07"
  },
  {
    "human": "15.1.73",
    "machine": "1973-01-15"
  },
  {
    "human": "72.07.14",
    "machine": "1972-07-14"
  },
  {
    "human": "jan 5 1992",
    "machine": "1992-01-05"
  },
  {
    "human": "3-aug-2006",
    "machine": "2006-08-03"
  },
  {
    "human": "14.12.1987",
    "machine": "1987-12-14"
  },
  {
    "human": "4 apr, 1986",
    "machine": "1986-04-04"
  },
  {
    "human": "09.05.1991",
    "machine": "1991-05-09"
  },
  {
    "human": "3 august 1982",
    "machine": "1982-08-03"
  },
  {
    "human": "sep 12, 1970",
    "machine": "1970-09-12"
  },
  {
    "human": "20, may 2004",
    "machine": "2004-05-20"
  },
  {
    "human": "april 27, 1989",
    "machine": "1989-04-27"
  },
  {
    "human": "06, sep 1971",
    "machine": "1971-09-06"
  },
  {
    "human": "18 december 1971",
    "machine": "1971-12-18"
  },
  {
    "human": "21 jun 1998",
    "machine": "1998-06-21"
  },
  {
    "human": "16 august 1983",
    "machine": "1983-08-16"
  },
  {
    "human": "01.05.28",
    "machine": "2001-05-28"
  },
  {
    "human": "november 19, 1998",
    "machine": "1998-11-19"
  },
  {
    "human": "83.10.2",
    "machine": "1983-10-02"
  },
  {
    "human": "26 may 1990",
    "machine": "1990-05-26"
  },
  {
    "human": "2001/09/07",
    "machine": "2001-09-07"
  },
  {
    "human": "may 3, 2011",
    "machine": "2011-05-03"
  },
  {
    "human": "29 may, 2013",
    "machine": "2013-05-29"
  },
  {
    "human": "07.11.2022",
    "machine": "2022-11-07"
  },
  {
    "human": "23/02/2007",
    "machine": "2007-02-23"
  },
  {
    "human": "2009-10-06",
    "machine": "2009-10-06"
  },
  {
    "human": "september 10, 1976",
    "machine": "1976-09-10"
  },
  {
    "human": "5 aug 1986",
    "machine": "1986-08-05"
  },
  {
    "human": "april 3, 1982",
    "machine": "1982-04-03"
  },
  {
    "human": "aug 28, 1971",
    "machine": "1971-08-28"
  },
  {
    "human": "02/09/1996",
    "machine": "1996-02-09"
  },
  {
    "human": "13 november 2003",
    "machine": "2003-11-13"
  },
  {
    "human": "september 9, 2017",
    "machine": "2017-09-09"
  },
  {
    "human": "1982.03.06 ad",
    "machine": "1982-03-06"
  },
  {
    "human": "2004-12-9",
    "machine": "2004-12-09"
  },
  {
    "human": "february 25, 1974",
    "machine": "1974-02-25"
  },
  {
    "human": "jul 13 2011",
    "machine": "2011-07-13"
  },
  {
    "human": "2016/11/09",
    "machine": "2016-11-09"
  },
  {
    "human": "sat, sep 17, 83",
    "machine": "1983-09-17"
  },
  {
    "human": "24 jun, 2020",
    "machine": "2020-06-24"
  },
  {
    "human": "24 may 1970",
    "machine": "1970-05-24"
  },
  {
    "human": "86-05-22",
    "machine": "1986-05-22"
  },
  {
    "human": "11/21/07",
    "machine": "2007-11-21"
  },
  {
    "human": "september 03, 2013",
    "machine": "2013-09-03"
  },
  {
    "human": "september 9, 1986",
    "machine": "1986-09-09"
  },
  {
    "human": "06-08-07",
    "machine": "2007-06-08"
  },
  {
    "human": "11 may 2003",
    "machine": "2003-05-11"
  },
  {
    "human": "7/15/00",
    "machine": "2000-07-15"
  },
  {
    "human": "jan 28, 2014",
    "machine": "2014-01-28"
  },
  {
    "human": "20 apr 1997",
    "machine": "1997-04-20"
  },
  {
    "human": "10 april 2023",
    "machine": "2023-04-10"
  },
  {
    "human": "2016/05/09",
    "machine": "2016-05-09"
  },
  {
    "human": "fri, aug 29, 86",
    "machine": "1986-08-29"
  },
  {
    "human": "70.06.17",
    "machine": "1970-06-17"
  },
  {
    "human": "97.06.27",
    "machine": "1997-06-27"
  },
  {
    "human": "06-13-19",
    "machine": "2019-06-13"
  },
  {
    "human": "29 april 2017",
    "machine": "2017-04-29"
  },
  {
    "human": "friday, august 11, 1995",
    "machine": "1995-08-11"
  },
  {
    "human": "feb 25, 1983",
    "machine": "1983-02-25"
  },
  {
    "human": "1972/03/20",
    "machine": "1972-03-20"
  },
  {
    "human": "20 january 2015",
    "machine": "2015-01-20"
  },
  {
    "human": "tue, jan 9, 07",
    "machine": "2007-01-09"
  },
  {
    "human": "2002/04/26",
    "machine": "2002-04-26"
  },
  {
    "human": "12-sep-2025",
    "machine": "2025-09-12"
  },
  {
    "human": "3/8/10",
    "machine": "2010-03-08"
  },
  {
    "human": "1970-09-10",
    "machine": "1970-09-10"
  },
  {
    "human": "jan 14, 86",
    "machine": "1986-01-14"
  },
  {
    "human": "2021-07-18",
    "machine": "2021-07-18"
  },
  {
    "human": "2012/05/06",
    "machine": "2012-05-06"
  },
  {
    "human": "07/14/1979",
    "machine": "1979-07-14"
  },
  {
    "human": "26 july 1975",
    "machine": "1975-07-26"
  },
  {
    "human": "september 15, 2013",
    "machine": "2013-09-15"
  },
  {
    "human": "9 apr, 2011",
    "machine": "2011-04-09"
  },
  {
    "human": "sat, feb 29, 92",
    "machine": "1992-02-29"
  },
  {
    "human": "march 18, 2014",
    "machine": "2014-03-18"
  },
  {
    "human": "22/06/1997",
    "machine": "1997-06-22"
  },
  {
    "human": "1981-05-9",
    "machine": "1981-05-09"
  },
  {
    "human": "dec 11 2022",
    "machine": "2022-12-11"
  },
  {
    "human": "1970-05-02",
    "machine": "1970-05-02"
  },
  {
    "human": "sun, jan 21, 73",
    "machine": "1973-01-21"
  },
  {
    "human": "13 november 2006",
    "machine": "2006-11-13"
  },
  {
    "human": "2 sep, 2002",
    "machine": "2002-09-02"
  },
  {
    "human": "24.12.97",
    "machine": "1997-12-24"
  },
  {
    "human": "11-10-91",
    "machine": "1991-11-10"
  },
  {
    "human": "apr 21, 1979",
    "machine": "1979-04-21"
  },
  {
    "human": "07.08.1973",
    "machine": "1973-08-07"
  },
  {
    "human": "2013-10-30",
    "machine": "2013-10-30"
  },
  {
    "human": "24 jun 1986",
    "machine": "1986-06-24"
  },
  {
    "human": "15 september 1971",
    "machine": "1971-09-15"
  },
  {
    "human": "12/19/1976",
    "machine": "1976-12-19"
  },
  {
    "human": "10 june 2000",
    "machine": "2000-06-10"
  },
  {
    "human": "march 4, 2001",
    "machine": "2001-03-04"
  },
  {
    "human": "12 december 1998",
    "machine": "1998-12-12"
  },
  {
    "human": "1999.11.18 ad",
    "machine": "1999-11-18"
  },
  {
    "human": "november 01, 2009",
    "machine": "2009-11-01"
  },
  {
    "human": "4-oct-2021",
    "machine": "2021-10-04"
  },
  {
    "human": "saturday, december 23, 1972",
    "machine": "1972-12-23"
  },
  {
    "human": "march 28, 1997",
    "machine": "1997-03-28"
  },
  {
    "human": "3.6.06",
    "machine": "2006-06-03"
  },
  {
    "human": "03/30/1982",
    "machine": "1982-03-30"
  },
  {
    "human": "1970-02-10",
    "machine": "1970-02-10"
  },
  {
    "human": "30-may-1980",
    "machine": "1980-05-30"
  },
  {
    "human": "1984-05-28",
    "machine": "1984-05-28"
  },
  {
    "human": "2002/11/17",
    "machine": "2002-11-17"
  },
  {
    "human": "14/05/1984",
    "machine": "1984-05-14"
  },
  {
    "human": "2001-01-28",
    "machine": "2001-01-28"
  },
  {
    "human": "1984/07/07",
    "machine": "1984-07-07"
  },
  {
    "human": "september 01, 2005",
    "machine": "2005-09-01"
  },
  {
    "human": "february 02, 1998",
    "machine": "1998-02-02"
  },
  {
    "human": "13-10-29",
    "machine": "2013-10-29"
  },
  {
    "human": "29 oct 2017",
    "machine": "2017-10-29"
  },
  {
    "human": "tue, aug 4, 20",
    "machine": "2020-08-04"
  },
  {
    "human": "march 30, 1987",
    "machine": "1987-03-30"
  },
  {
    "human": "2012/01/17",
    "machine": "2012-01-17"
  },
  {
    "human": "16, oct 2010",
    "machine": "2010-10-16"
  },
  {
    "human": "july 28, 2012",
    "machine": "2012-07-28"
  },
  {
    "human": "april 7, 2018",
    "machine": "2018-04-07"
  },
  {
    "human": "11-14-96",
    "machine": "1996-11-14"
  },
  {
    "human": "08-01-04",
    "machine": "2008-01-04"
  },
  {
    "human": "25 october 1980",
    "machine": "1980-10-25"
  },
  {
    "human": "october 9, 2000",
    "machine": "2000-10-09"
  },
  {
    "human": "october 16, 2019",
    "machine": "2019-10-16"
  },
  {
    "human": "3-dec-1992",
    "machine": "1992-12-03"
  },
  {
    "human": "09, dec 1978",
    "machine": "1978-12-09"
  },
  {
    "human": "oct 28, 1994",
    "machine": "1994-10-28"
  },
  {
    "human": "9/27/08",
    "machine": "2008-09-27"
  },
  {
    "human": "thursday, march 31, 2016",
    "machine": "2016-03-31"
  },
  {
    "human": "10/01/2006",
    "machine": "2006-10-01"
  },
  {
    "human": "1997-06-14",
    "machine": "1997-06-14"
  },
  {
    "human": "76.11.22",
    "machine": "1976-11-22"
  },
  {
    "human": "3/12/04",
    "machine": "2004-03-12"
  },
  {
    "human": "16.06.2013",
    "machine": "2013-06-16"
  },
  {
    "human": "december 29, 1978",
    "machine": "1978-12-29"
  },
  {
    "human": "jan 17 1980",
    "machine": "1980-01-17"
  },
  {
    "human": "tuesday, july 30, 2013",
    "machine": "2013-07-30"
  },
  {
    "human": "28 august 2014",
    "machine": "2014-08-28"
  },
  {
    "human": "1971.11.01 ad",
    "machine": "1971-11-01"
  },
  {
    "human": "monday, february 5, 2001",
    "machine": "2001-02-05"
  },
  {
    "human": "07.03.1987",
    "machine": "1987-03-07"
  },
  {
    "human": "13 may 2021",
    "machine": "2021-05-13"
  },
  {
    "human": "20-nov-2008",
    "machine": "2008-11-20"
  },
  {
    "human": "8/29/70",
    "machine": "1970-08-29"
  },
  {
    "human": "18.12.24",
    "machine": "2024-12-18"
  },
  {
    "human": "25, feb 2011",
    "machine": "2011-02-25"
  },
  {
    "human": "18 jul 2000",
    "machine": "2000-07-18"
  },
  {
    "human": "30 september 1975",
    "machine": "1975-09-30"
  },
  {
    "human": "28 apr, 1995",
    "machine": "1995-04-28"
  },
  {
    "human": "20 january 1986",
    "machine": "1986-01-20"
  },
  {
    "human": "1981/12/01",
    "machine": "1981-12-01"
  },
  {
    "human": "june 07, 1983",
    "machine": "1983-06-07"
  },
  {
    "human": "01-09-99",
    "machine": "1999-01-09"
  },
  {
    "human": "1981-08-5",
    "machine": "1981-08-05"
  },
  {
    "human": "09.07.11",
    "machine": "2009-07-11"
  },
  {
    "human": "11.2.14",
    "machine": "2014-02-11"
  },
  {
    "human": "18.08.2017",
    "machine": "2017-08-18"
  },
  {
    "human": "97-06-24",
    "machine": "1997-06-24"
  },
  {
    "human": "fri, mar 11, 94",
    "machine": "1994-03-11"
  },
  {
    "human": "jun 12 2006",
    "machine": "2006-06-12"
  },
  {
    "human": "june 27, 2000",
    "machine": "2000-06-27"
  },
  {
    "human": "1987-07-09",
    "machine": "1987-07-09"
  },
  {
    "human": "03 september 2023",
    "machine": "2023-09-03"
  },
  {
    "human": "january 23, 1989",
    "machine": "1989-01-23"
  },
  {
    "human": "05 march 1986",
    "machine": "1986-03-05"
  },
  {
    "human": "2000-10-31",
    "machine": "2000-10-31"
  },
  {
    "human": "11, jan 2009",
    "machine": "2009-01-11"
  },
  {
    "human": "february 19, 2022",
    "machine": "2022-02-19"
  },
  {
    "human": "25.2.81",
    "machine": "1981-02-25"
  },
  {
    "human": "15 november 2002",
    "machine": "2002-11-15"
  },
  {
    "human": "18/04/2022",
    "machine": "2022-04-18"
  },
  {
    "human": "29 apr 2015",
    "machine": "2015-04-29"
  },
  {
    "human": "1989.01.29 ad",
    "machine": "1989-01-29"
  },
  {
    "human": "1970-04-10",
    "machine": "1970-04-10"
  },
  {
    "human": "jun 13, 2000",
    "machine": "2000-06-13"
  },
  {
    "human": "6/8/95",
    "machine": "1995-06-08"
  },
  {
    "human": "75.11.3",
    "machine": "1975-11-03"
  },
  {
    "human": "2021.01.25 ad",
    "machine": "2021-01-25"
  },
  {
    "human": "thu, jun 1, 17",
    "machine": "2017-06-01"
  },
  {
    "human": "3.2.02",
    "machine": "2002-02-03"
  },
  {
    "human": "11 august 2022",
    "machine": "2022-08-11"
  },
  {
    "human": "26 dec, 1983",
    "machine": "1983-12-26"
  },
  {
    "human": "29.12.2001",
    "machine": "2001-12-29"
  },
  {
    "human": "december 04, 1981",
    "machine": "1981-12-04"
  },
  {
    "human": "sat, mar 20, 04",
    "machine": "2004-03-20"
  },
  {
    "human": "sun, may 25, 80",
    "machine": "1980-05-25"
  },
  {
    "human": "20/01/1996",
    "machine": "1996-01-20"
  },
  {
    "human": "4/17/75",
    "machine": "1975-04-17"
  },
  {
    "human": "7/9/05",
    "machine": "2005-07-09"
  },
  {
    "human": "2018-12-15",
    "machine": "2018-12-15"
  },
  {
    "human": "3 dec 2008",
    "machine": "2008-12-03"
  },
  {
    "human": "sunday, october 28, 2012",
    "machine": "2012-10-28"
  },
  {
    "human": "feb 8, 1993",
    "machine": "1993-02-08"
  },
  {
    "human": "august 13, 1985",
    "machine": "1985-08-13"
  },
  {
    "human": "october 28, 2024",
    "machine": "2024-10-28"
  },
  {
    "human": "13.02.2",
    "machine": "2013-02-02"
  },
  {
    "human": "saturday, november 24, 1979",
    "machine": "1979-11-24"
  },
  {
    "human": "8.5.97",
    "machine": "1997-05-08"
  },
  {
    "human": "17/08/1995",
    "machine": "1995-08-17"
  },
  {
    "human": "23 sep 1976",
    "machine": "1976-09-23"
  },
  {
    "human": "26 may 2019",
    "machine": "2019-05-26"
  },
  {
    "human": "05/14/1976",
    "machine": "1976-05-14"
  },
  {
    "human": "2/2/92",
    "machine": "1992-02-02"
  },
  {
    "human": "2021-07-29",
    "machine": "2021-07-29"
  },
  {
    "human": "26, jul 2015",
    "machine": "2015-07-26"
  },
  {
    "human": "1987-04-11",
    "machine": "1987-04-11"
  },
  {
    "human": "23.7.04",
    "machine": "2004-07-23"
  },
  {
    "human": "11 mar 2018",
    "machine": "2018-03-11"
  },
  {
    "human": "march 1, 1981",
    "machine": "1981-03-01"
  },
  {
    "human": "11/08/1991",
    "machine": "1991-11-08"
  },
  {
    "human": "thu, nov 29, 79",
    "machine": "1979-11-29"
  },
  {
    "human": "nov 14 2020",
    "machine": "2020-11-14"
  },
  {
    "human": "1988/02/21",
    "machine": "1988-02-21"
  },
  {
    "human": "1984-05-25",
    "machine": "1984-05-25"
  },
  {
    "human": "december 11, 1986",
    "machine": "1986-12-11"
  },
  {
    "human": "22-11-21",
    "machine": "2022-11-21"
  },
  {
    "human": "jun 1, 92",
    "machine": "1992-06-01"
  },
  {
    "human": "1999-12-26",
    "machine": "1999-12-26"
  },
  {
    "human": "11/11/1998",
    "machine": "1998-11-11"
  },
  {
    "human": "may 7 2008",
    "machine": "2008-05-07"
  },
  {
    "human": "1985-04-13",
    "machine": "1985-04-13"
  },
  {
    "human": "friday, october 10, 2003",
    "machine": "2003-10-10"
  },
  {
    "human": "2.5.99",
    "machine": "1999-05-02"
  },
  {
    "human": "10/11/1976",
    "machine": "1976-11-10"
  },
  {
    "human": "sep 17, 1974",
    "machine": "1974-09-17"
  },
  {
    "human": "05 june 1978",
    "machine": "1978-06-05"
  },
  {
    "human": "3 jul 1985",
    "machine": "1985-07-03"
  },
  {
    "human": "14 mar, 1999",
    "machine": "1999-03-14"
  },
  {
    "human": "january 30, 1973",
    "machine": "1973-01-30"
  },
  {
    "human": "wednesday, september 16, 1970",
    "machine": "1970-09-16"
  },
  {
    "human": "15-oct-2021",
    "machine": "2021-10-15"
  },
  {
    "human": "08/29/2012",
    "machine": "2012-08-29"
  },
  {
    "human": "4/30/14",
    "machine": "2014-04-30"
  },
  {
    "human": "2013.12.06 ad",
    "machine": "2013-12-06"
  },
  {
    "human": "05.02.1985",
    "machine": "1985-02-05"
  },
  {
    "human": "jan 8, 11",
    "machine": "2011-01-08"
  },
  {
    "human": "08/10/1990",
    "machine": "1990-08-10"
  },
  {
    "human": "8 jun 1985",
    "machine": "1985-06-08"
  },
  {
    "human": "1976-02-2",
    "machine": "1976-02-02"
  },
  {
    "human": "10-oct-1984",
    "machine": "1984-10-10"
  },
  {
    "human": "01/24/2015",
    "machine": "2015-01-24"
  },
  {
    "human": "26.04.2011",
    "machine": "2011-04-26"
  },
  {
    "human": "8 january 1983",
    "machine": "1983-01-08"
  },
  {
    "human": "14 september 1992",
    "machine": "1992-09-14"
  },
  {
    "human": "6 may 1980",
    "machine": "1980-05-06"
  },
  {
    "human": "tuesday, may 27, 2014",
    "machine": "2014-05-27"
  },
  {
    "human": "30-jun-1982",
    "machine": "1982-06-30"
  },
  {
    "human": "05.01.2011",
    "machine": "2011-01-05"
  },
  {
    "human": "12-28-76",
    "machine": "1976-12-28"
  },
  {
    "human": "october 2, 1977",
    "machine": "1977-10-02"
  },
  {
    "human": "jul 26, 23",
    "machine": "2023-07-26"
  },
  {
    "human": "16/06/1991",
    "machine": "1991-06-16"
  },
  {
    "human": "13.05.2021",
    "machine": "2021-05-13"
  },
  {
    "human": "june 24, 1985",
    "machine": "1985-06-24"
  },
  {
    "human": "21.10.06",
    "machine": "2006-10-21"
  },
  {
    "human": "2023-05-17",
    "machine": "2023-05-17"
  },
  {
    "human": "17.01.2013",
    "machine": "2013-01-17"
  },
  {
    "human": "2023-04-03",
    "machine": "2023-04-03"
  },
  {
    "human": "7 may, 1997",
    "machine": "1997-05-07"
  },
  {
    "human": "00-06-11",
    "machine": "2000-06-11"
  },
  {
    "human": "15 jan, 1991",
    "machine": "1991-01-15"
  },
  {
    "human": "01/14/2012",
    "machine": "2012-01-14"
  },
  {
    "human": "8/6/83",
    "machine": "1983-08-06"
  },
  {
    "human": "08-22-13",
    "machine": "2013-08-22"
  },
  {
    "human": "90-09-10",
    "machine": "1990-09-10"
  },
  {
    "human": "mar 27 1999",
    "machine": "1999-03-27"
  },
  {
    "human": "18/12/2007",
    "machine": "2007-12-18"
  },
  {
    "human": "8/28/21",
    "machine": "2021-08-28"
  },
  {
    "human": "03, jul 2017",
    "machine": "2017-07-03"
  },
  {
    "human": "august 28, 1972",
    "machine": "1972-08-28"
  },
  {
    "human": "17.12.96",
    "machine": "1996-12-17"
  },
  {
    "human": "friday, june 18, 2004",
    "machine": "2004-06-18"
  },
  {
    "human": "2023-10-05",
    "machine": "2023-10-05"
  },
  {
    "human": "feb 14, 1997",
    "machine": "1997-02-14"
  },
  {
    "human": "10/20/07",
    "machine": "2007-10-20"
  },
  {
    "human": "2023/01/28",
    "machine": "2023-01-28"
  },
  {
    "human": "august 26, 1986",
    "machine": "1986-08-26"
  },
  {
    "human": "15.06.2024",
    "machine": "2024-06-15"
  },
  {
    "human": "20 sep 2014",
    "machine": "2014-09-20"
  },
  {
    "human": "10 february 2006",
    "machine": "2006-02-10"
  },
  {
    "human": "15 october 2023",
    "machine": "2023-10-15"
  },
  {
    "human": "01-17-71",
    "machine": "1971-01-17"
  },
  {
    "human": "24.11.79",
    "machine": "1979-11-24"
  },
  {
    "human": "wednesday, june 4, 1975",
    "machine": "1975-06-04"
  },
  {
    "human": "18.09.1983",
    "machine": "1983-09-18"
  },
  {
    "human": "80.09.13",
    "machine": "1980-09-13"
  },
  {
    "human": "7/15/13",
    "machine": "2013-07-15"
  },
  {
    "human": "06/09/2003",
    "machine": "2003-06-09"
  },
  {
    "human": "september 04, 2021",
    "machine": "2021-09-04"
  },
  {
    "human": "12-13-05",
    "machine": "2005-12-13"
  },
  {
    "human": "wednesday, march 24, 2021",
    "machine": "2021-03-24"
  },
  {
    "human": "monday, june 17, 1985",
    "machine": "1985-06-17"
  },
  {
    "human": "10/17/2011",
    "machine": "2011-10-17"
  },
  {
    "human": "saturday, january 14, 1978",
    "machine": "1978-01-14"
  },
  {
    "human": "2023-09-27",
    "machine": "2023-09-27"
  },
  {
    "human": "30-jul-2022",
    "machine": "2022-07-30"
  },
  {
    "human": "1999-12-27",
    "machine": "1999-12-27"
  },
  {
    "human": "19.9.04",
    "machine": "2004-09-19"
  },
  {
    "human": "may 11, 1989",
    "machine": "1989-05-11"
  },
  {
    "human": "18/02/1982",
    "machine": "1982-02-18"
  },
  {
    "human": "sunday, august 25, 1996",
    "machine": "1996-08-25"
  },
  {
    "human": "12/14/2001",
    "machine": "2001-12-14"
  },
  {
    "human": "1995.05.30 ad",
    "machine": "1995-05-30"
  },
  {
    "human": "saturday, march 12, 2011",
    "machine": "2011-03-12"
  },
  {
    "human": "6/10/23",
    "machine": "2023-06-10"
  },
  {
    "human": "20.5.72",
    "machine": "1972-05-20"
  },
  {
    "human": "2 jul, 1997",
    "machine": "1997-07-02"
  },
  {
    "human": "jun 16, 89",
    "machine": "1989-06-16"
  },
  {
    "human": "2024-03-2",
    "machine": "2024-03-02"
  },
  {
    "human": "2001-01-1",
    "machine": "2001-01-01"
  },
  {
    "human": "1/13/81",
    "machine": "1981-01-13"
  },
  {
    "human": "nov 11, 89",
    "machine": "1989-11-11"
  },
  {
    "human": "1971.05.13 ad",
    "machine": "1971-05-13"
  },
  {
    "human": "sunday, december 11, 1994",
    "machine": "1994-12-11"
  },
  {
    "human": "04/07/2022",
    "machine": "2022-04-07"
  },
  {
    "human": "11/09/1976",
    "machine": "1976-11-09"
  },
  {
    "human": "11-apr-2002",
    "machine": "2002-04-11"
  },
  {
    "human": "oct 3, 16",
    "machine": "2016-10-03"
  },
  {
    "human": "march 20, 2011",
    "machine": "2011-03-20"
  },
  {
    "human": "4/22/83",
    "machine": "1983-04-22"
  },
  {
    "human": "4/20/99",
    "machine": "1999-04-20"
  },
  {
    "human": "december 18, 2021",
    "machine": "2021-12-18"
  },
  {
    "human": "january 3, 1993",
    "machine": "1993-01-03"
  },
  {
    "human": "02-16-09",
    "machine": "2009-02-16"
  },
  {
    "human": "5 sep, 1974",
    "machine": "1974-09-05"
  },
  {
    "human": "2015-03-23",
    "machine": "2015-03-23"
  },
  {
    "human": "saturday, august 20, 1988",
    "machine": "1988-08-20"
  },
  {
    "human": "august 14, 1977",
    "machine": "1977-08-14"
  },
  {
    "human": "15 jun, 1986",
    "machine": "1986-06-15"
  },
  {
    "human": "79-01-09",
    "machine": "1979-01-09"
  },
  {
    "human": "april 18, 1976",
    "machine": "1976-04-18"
  },
  {
    "human": "79-10-04",
    "machine": "1979-10-04"
  },
  {
    "human": "14 feb, 1981",
    "machine": "1981-02-14"
  },
  {
    "human": "17/06/2005",
    "machine": "2005-06-17"
  },
  {
    "human": "31/10/1971",
    "machine": "1971-10-31"
  },
  {
    "human": "apr 7, 2009",
    "machine": "2009-04-07"
  },
  {
    "human": "27 march 2004",
    "machine": "2004-03-27"
  },
  {
    "human": "sunday, december 21, 2008",
    "machine": "2008-12-21"
  },
  {
    "human": "april 17, 1999",
    "machine": "1999-04-17"
  },
  {
    "human": "04-02-04",
    "machine": "2004-04-02"
  },
  {
    "human": "december 16, 1993",
    "machine": "1993-12-16"
  },
  {
    "human": "tuesday, september 15, 1992",
    "machine": "1992-09-15"
  },
  {
    "human": "90.08.23",
    "machine": "1990-08-23"
  },
  {
    "human": "august 12, 1980",
    "machine": "1980-08-12"
  },
  {
    "human": "19 april 2012",
    "machine": "2012-04-19"
  },
  {
    "human": "03/12/1984",
    "machine": "1984-03-12"
  },
  {
    "human": "92.05.9",
    "machine": "1992-05-09"
  },
  {
    "human": "23-aug-2019",
    "machine": "2019-08-23"
  },
  {
    "human": "1978/09/15",
    "machine": "1978-09-15"
  },
  {
    "human": "august 28, 1978",
    "machine": "1978-08-28"
  },
  {
    "human": "8 dec 2016",
    "machine": "2016-12-08"
  },
  {
    "human": "94-09-19",
    "machine": "1994-09-19"
  },
  {
    "human": "sep 20, 92",
    "machine": "1992-09-20"
  },
  {
    "human": "5/9/09",
    "machine": "2009-05-09"
  },
  {
    "human": "may 24, 2008",
    "machine": "2008-05-24"
  },
  {
    "human": "1982-09-5",
    "machine": "1982-09-05"
  },
  {
    "human": "31.12.74",
    "machine": "1974-12-31"
  },
  {
    "human": "november 26, 1977",
    "machine": "1977-11-26"
  },
  {
    "human": "friday, july 17, 2020",
    "machine": "2020-07-17"
  },
  {
    "human": "april 29, 1996",
    "machine": "1996-04-29"
  },
  {
    "human": "mon, aug 26, 85",
    "machine": "1985-08-26"
  },
  {
    "human": "6/10/16",
    "machine": "2016-06-10"
  },
  {
    "human": "08-14-83",
    "machine": "1983-08-14"
  },
  {
    "human": "2008-08-28",
    "machine": "2008-08-28"
  },
  {
    "human": "1977-09-20",
    "machine": "1977-09-20"
  },
  {
    "human": "aug 5 1988",
    "machine": "1988-08-05"
  },
  {
    "human": "12/10/21",
    "machine": "2021-12-10"
  },
  {
    "human": "16 sep 2001",
    "machine": "2001-09-16"
  },
  {
    "human": "21 march 2005",
    "machine": "2005-03-21"
  },
  {
    "human": "1987.09.13 ad",
    "machine": "1987-09-13"
  },
  {
    "human": "1/29/93",
    "machine": "1993-01-29"
  },
  {
    "human": "friday, may 14, 1971",
    "machine": "1971-05-14"
  },
  {
    "human": "monday, may 19, 2003",
    "machine": "2003-05-19"
  },
  {
    "human": "1/15/82",
    "machine": "1982-01-15"
  },
  {
    "human": "3/14/87",
    "machine": "1987-03-14"
  },
  {
    "human": "august 08, 2012",
    "machine": "2012-08-08"
  },
  {
    "human": "jun 6, 81",
    "machine": "1981-06-06"
  },
  {
    "human": "wed, mar 21, 79",
    "machine": "1979-03-21"
  },
  {
    "human": "may 26, 1987",
    "machine": "1987-05-26"
  },
  {
    "human": "3/24/09",
    "machine": "2009-03-24"
  },
  {
    "human": "december 15, 1973",
    "machine": "1973-12-15"
  },
  {
    "human": "oct 26 2006",
    "machine": "2006-10-26"
  },
  {
    "human": "saturday, november 26, 1994",
    "machine": "1994-11-26"
  },
  {
    "human": "jul 15 2017",
    "machine": "2017-07-15"
  },
  {
    "human": "may 02, 1980",
    "machine": "1980-05-02"
  },
  {
    "human": "september 02, 2017",
    "machine": "2017-09-02"
  },
  {
    "human": "oct 8 1994",
    "machine": "1994-10-08"
  },
  {
    "human": "11/10/2007",
    "machine": "2007-11-10"
  },
  {
    "human": "18 september 1972",
    "machine": "1972-09-18"
  },
  {
    "human": "21 apr, 1990",
    "machine": "1990-04-21"
  },
  {
    "human": "september 1, 2007",
    "machine": "2007-09-01"
  },
  {
    "human": "13.07.19",
    "machine": "2013-07-19"
  },
  {
    "human": "84.12.7",
    "machine": "1984-12-07"
  },
  {
    "human": "08/23/1979",
    "machine": "1979-08-23"
  },
  {
    "human": "26/05/2001",
    "machine": "2001-05-26"
  },
  {
    "human": "may 21, 2014",
    "machine": "2014-05-21"
  },
  {
    "human": "16/10/2000",
    "machine": "2000-10-16"
  },
  {
    "human": "6.3.82",
    "machine": "1982-03-06"
  },
  {
    "human": "1972/01/06",
    "machine": "1972-01-06"
  },
  {
    "human": "1993/01/14",
    "machine": "1993-01-14"
  },
  {
    "human": "26 jan, 1997",
    "machine": "1997-01-26"
  },
  {
    "human": "01.02.1985",
    "machine": "1985-02-01"
  },
  {
    "human": "sat, oct 27, 18",
    "machine": "2018-10-27"
  },
  {
    "human": "july 26, 2012",
    "machine": "2012-07-26"
  },
  {
    "human": "nov 15 2015",
    "machine": "2015-11-15"
  },
  {
    "human": "7/7/91",
    "machine": "1991-07-07"
  },
  {
    "human": "23/10/2012",
    "machine": "2012-10-23"
  },
  {
    "human": "30 may 1988",
    "machine": "1988-05-30"
  },
  {
    "human": "25 october 2013",
    "machine": "2013-10-25"
  },
  {
    "human": "09/19/2024",
    "machine": "2024-09-19"
  },
  {
    "human": "9 dec 1977",
    "machine": "1977-12-09"
  },
  {
    "human": "monday, february 16, 2009",
    "machine": "2009-02-16"
  },
  {
    "human": "aug 5, 2009",
    "machine": "2009-08-05"
  },
  {
    "human": "saturday, march 8, 2003",
    "machine": "2003-03-08"
  },
  {
    "human": "jun 12 2010",
    "machine": "2010-06-12"
  },
  {
    "human": "may 14, 1970",
    "machine": "1970-05-14"
  },
  {
    "human": "wed, nov 2, 16",
    "machine": "2016-11-02"
  },
  {
    "human": "08/15/1973",
    "machine": "1973-08-15"
  },
  {
    "human": "dec 9 2006",
    "machine": "2006-12-09"
  },
  {
    "human": "june 14, 1992",
    "machine": "1992-06-14"
  },
  {
    "human": "tuesday, december 31, 2002",
    "machine": "2002-12-31"
  },
  {
    "human": "1980-05-27",
    "machine": "1980-05-27"
  },
  {
    "human": "9/4/70",
    "machine": "1970-09-04"
  },
  {
    "human": "10/24/87",
    "machine": "1987-10-24"
  },
  {
    "human": "26 may 2003",
    "machine": "2003-05-26"
  },
  {
    "human": "28 june 2024",
    "machine": "2024-06-28"
  },
  {
    "human": "1989-09-19",
    "machine": "1989-09-19"
  },
  {
    "human": "july 23, 1975",
    "machine": "1975-07-23"
  },
  {
    "human": "nov 16, 2009",
    "machine": "2009-11-16"
  },
  {
    "human": "feb 9, 1999",
    "machine": "1999-02-09"
  },
  {
    "human": "15.06.10",
    "machine": "2015-06-10"
  },
  {
    "human": "dec 16, 2014",
    "machine": "2014-12-16"
  },
  {
    "human": "3 may 2018",
    "machine": "2018-05-03"
  },
  {
    "human": "monday, march 1, 1976",
    "machine": "1976-03-01"
  },
  {
    "human": "5/17/18",
    "machine": "2018-05-17"
  },
  {
    "human": "mon, aug 19, 96",
    "machine": "1996-08-19"
  },
  {
    "human": "7/10/94",
    "machine": "1994-07-10"
  },
  {
    "human": "6 october 1979",
    "machine": "1979-10-06"
  },
  {
    "human": "31-jan-2015",
    "machine": "2015-01-31"
  },
  {
    "human": "july 24, 1981",
    "machine": "1981-07-24"
  },
  {
    "human": "86.10.12",
    "machine": "1986-10-12"
  },
  {
    "human": "3 may, 1994",
    "machine": "1994-05-03"
  },
  {
    "human": "december 16, 1981",
    "machine": "1981-12-16"
  },
  {
    "human": "28.7.81",
    "machine": "1981-07-28"
  },
  {
    "human": "1 december 2005",
    "machine": "2005-12-01"
  },
  {
    "human": "01-12-31",
    "machine": "2001-12-31"
  },
  {
    "human": "2003-05-14",
    "machine": "2003-05-14"
  },
  {
    "human": "10 july 2007",
    "machine": "2007-07-10"
  },
  {
    "human": "1991/07/01",
    "machine": "1991-07-01"
  },
  {
    "human": "dec 12 1994",
    "machine": "1994-12-12"
  },
  {
    "human": "feb 18, 07",
    "machine": "2007-02-18"
  },
  {
    "human": "1994/03/01",
    "machine": "1994-03-01"
  },
  {
    "human": "2025-07-27",
    "machine": "2025-07-27"
  },
  {
    "human": "3 july 2019",
    "machine": "2019-07-03"
  },
  {
    "human": "jul 3, 1985",
    "machine": "1985-07-03"
  },
  {
    "human": "15.04.1977",
    "machine": "1977-04-15"
  },
  {
    "human": "13, may 1995",
    "machine": "1995-05-13"
  },
  {
    "human": "fri, jul 25, 03",
    "machine": "2003-07-25"
  },
  {
    "human": "84-03-29",
    "machine": "1984-03-29"
  },
  {
    "human": "15.4.71",
    "machine": "1971-04-15"
  },
  {
    "human": "03/07/1994",
    "machine": "1994-03-07"
  },
  {
    "human": "26.04.1981",
    "machine": "1981-04-26"
  },
  {
    "human": "14.11.19",
    "machine": "2014-11-19"
  },
  {
    "human": "04-28-70",
    "machine": "1970-04-28"
  },
  {
    "human": "1970/10/27",
    "machine": "1970-10-27"
  },
  {
    "human": "05-05-00",
    "machine": "2000-05-05"
  },
  {
    "human": "nov 11, 07",
    "machine": "2007-11-11"
  },
  {
    "human": "1993.02.01 ad",
    "machine": "1993-02-01"
  },
  {
    "human": "dec 19 2000",
    "machine": "2000-12-19"
  },
  {
    "human": "wednesday, may 15, 1985",
    "machine": "1985-05-15"
  },
  {
    "human": "25.08.18",
    "machine": "2025-08-18"
  },
  {
    "human": "09/05/1992",
    "machine": "1992-09-05"
  },
  {
    "human": "2004/08/03",
    "machine": "2004-08-03"
  },
  {
    "human": "03-30-71",
    "machine": "1971-03-30"
  },
  {
    "human": "1992-08-11",
    "machine": "1992-08-11"
  },
  {
    "human": "june 07, 1982",
    "machine": "1982-06-07"
  },
  {
    "human": "6/15/91",
    "machine": "1991-06-15"
  },
  {
    "human": "1999.06.16 ad",
    "machine": "1999-06-16"
  },
  {
    "human": "1973-03-17",
    "machine": "1973-03-17"
  },
  {
    "human": "aug 25, 24",
    "machine": "2024-08-25"
  },
  {
    "human": "3.4.85",
    "machine": "1985-04-03"
  },
  {
    "human": "21.05.1997",
    "machine": "1997-05-21"
  },
  {
    "human": "wed, dec 12, 73",
    "machine": "1973-12-12"
  },
  {
    "human": "03/16/2011",
    "machine": "2011-03-16"
  },
  {
    "human": "february 26, 1984",
    "machine": "1984-02-26"
  },
  {
    "human": "2014/12/01",
    "machine": "2014-12-01"
  },
  {
    "human": "mar 13, 1995",
    "machine": "1995-03-13"
  },
  {
    "human": "mar 29 1981",
    "machine": "1981-03-29"
  },
  {
    "human": "march 30, 1974",
    "machine": "1974-03-30"
  },
  {
    "human": "2015.10.13 ad",
    "machine": "2015-10-13"
  },
  {
    "human": "6/20/09",
    "machine": "2009-06-20"
  },
  {
    "human": "5/31/94",
    "machine": "1994-05-31"
  },
  {
    "human": "14.02.2021",
    "machine": "2021-02-14"
  },
  {
    "human": "january 3, 2025",
    "machine": "2025-01-03"
  },
  {
    "human": "2005/03/10",
    "machine": "2005-03-10"
  },
  {
    "human": "17 oct 2008",
    "machine": "2008-10-17"
  },
  {
    "human": "12-23-09",
    "machine": "2009-12-23"
  },
  {
    "human": "sep 4, 92",
    "machine": "1992-09-04"
  },
  {
    "human": "01-22-96",
    "machine": "1996-01-22"
  },
  {
    "human": "17.10.1988",
    "machine": "1988-10-17"
  },
  {
    "human": "11 july 1985",
    "machine": "1985-07-11"
  },
  {
    "human": "14 september 2010",
    "machine": "2010-09-14"
  },
  {
    "human": "01-28-11",
    "machine": "2011-01-28"
  },
  {
    "human": "feb 14, 18",
    "machine": "2018-02-14"
  },
  {
    "human": "1985-05-28",
    "machine": "1985-05-28"
  },
  {
    "human": "09/09/1988",
    "machine": "1988-09-09"
  },
  {
    "human": "2008/04/25",
    "machine": "2008-04-25"
  },
  {
    "human": "fri, nov 5, 21",
    "machine": "2021-11-05"
  },
  {
    "human": "07/13/1999",
    "machine": "1999-07-13"
  },
  {
    "human": "2003/02/16",
    "machine": "2003-02-16"
  },
  {
    "human": "19 november 2020",
    "machine": "2020-11-19"
  },
  {
    "human": "1976-03-25",
    "machine": "1976-03-25"
  },
  {
    "human": "october 26, 2007",
    "machine": "2007-10-26"
  },
  {
    "human": "1973-02-14",
    "machine": "1973-02-14"
  },
  {
    "human": "10/12/16",
    "machine": "2016-10-12"
  },
  {
    "human": "27/12/1977",
    "machine": "1977-12-27"
  },
  {
    "human": "00.03.18",
    "machine": "2000-03-18"
  },
  {
    "human": "1970-01-30",
    "machine": "1970-01-30"
  },
  {
    "human": "11.11.16",
    "machine": "2011-11-16"
  },
  {
    "human": "10/03/2005",
    "machine": "2005-10-03"
  },
  {
    "human": "1 oct 2021",
    "machine": "2021-10-01"
  },
  {
    "human": "14, jan 2017",
    "machine": "2017-01-14"
  },
  {
    "human": "28/01/2004",
    "machine": "2004-01-28"
  },
  {
    "human": "1998-02-02",
    "machine": "1998-02-02"
  },
  {
    "human": "86-01-17",
    "machine": "1986-01-17"
  },
  {
    "human": "4/27/03",
    "machine": "2003-04-27"
  },
  {
    "human": "monday, january 11, 1999",
    "machine": "1999-01-11"
  },
  {
    "human": "tue, dec 8, 15",
    "machine": "2015-12-08"
  },
  {
    "human": "wednesday, july 22, 1987",
    "machine": "1987-07-22"
  },
  {
    "human": "1975-11-22",
    "machine": "1975-11-22"
  },
  {
    "human": "may 06, 1987",
    "machine": "1987-05-06"
  },
  {
    "human": "wednesday, july 16, 2008",
    "machine": "2008-07-16"
  },
  {
    "human": "monday, february 13, 1989",
    "machine": "1989-02-13"
  },
  {
    "human": "02.12.21",
    "machine": "2002-12-21"
  },
  {
    "human": "15 october 1985",
    "machine": "1985-10-15"
  },
  {
    "human": "2009/08/02",
    "machine": "2009-08-02"
  },
  {
    "human": "1981-01-16",
    "machine": "1981-01-16"
  },
  {
    "human": "1987.03.19 ad",
    "machine": "1987-03-19"
  },
  {
    "human": "9/09/2000",
    "machine": "2000-09-09"
  },
  {
    "human": "august 27, 2010",
    "machine": "2010-08-27"
  },
  {
    "human": "19-oct-2025",
    "machine": "2025-10-19"
  },
  {
    "human": "06.08.1986",
    "machine": "1986-08-06"
  },
  {
    "human": "friday, may 13, 1994",
    "machine": "1994-05-13"
  },
  {
    "human": "1-aug-1994",
    "machine": "1994-08-01"
  },
  {
    "human": "11-16-02",
    "machine": "2002-11-16"
  },
  {
    "human": "mon, jun 18, 79",
    "machine": "1979-06-18"
  },
  {
    "human": "2010/02/13",
    "machine": "2010-02-13"
  },
  {
    "human": "02/07/1970",
    "machine": "1970-02-07"
  },
  {
    "human": "05 august 1979",
    "machine": "1979-08-05"
  },
  {
    "human": "2017/05/06",
    "machine": "2017-05-06"
  },
  {
    "human": "23 jun, 2005",
    "machine": "2005-06-23"
  },
  {
    "human": "1987-01-9",
    "machine": "1987-01-09"
  },
  {
    "human": "96.10.27",
    "machine": "1996-10-27"
  },
  {
    "human": "08/17/1988",
    "machine": "1988-08-17"
  },
  {
    "human": "1/5/10",
    "machine": "2010-01-05"
  },
  {
    "human": "2018-05-03",
    "machine": "2018-05-03"
  },
  {
    "human": "6/02/1990",
    "machine": "1990-02-06"
  },
  {
    "human": "27 jun 1993",
    "machine": "1993-06-27"
  },
  {
    "human": "october 20, 2022",
    "machine": "2022-10-20"
  },
  {
    "human": "22, jan 1978",
    "machine": "1978-01-22"
  },
  {
    "human": "sunday, august 14, 1977",
    "machine": "1977-08-14"
  },
  {
    "human": "78-07-26",
    "machine": "1978-07-26"
  },
  {
    "human": "10/13/80",
    "machine": "1980-10-13"
  },
  {
    "human": "9/2/03",
    "machine": "2003-09-02"
  },
  {
    "human": "98-07-19",
    "machine": "1998-07-19"
  },
  {
    "human": "6 oct 2002",
    "machine": "2002-10-06"
  },
  {
    "human": "1994/12/04",
    "machine": "1994-12-04"
  },
  {
    "human": "may 11, 1993",
    "machine": "1993-05-11"
  },
  {
    "human": "13-jan-2013",
    "machine": "2013-01-13"
  },
  {
    "human": "sep 30, 80",
    "machine": "1980-09-30"
  },
  {
    "human": "2025-07-28",
    "machine": "2025-07-28"
  },
  {
    "human": "november 9, 1998",
    "machine": "1998-11-09"
  },
  {
    "human": "15 november 1991",
    "machine": "1991-11-15"
  },
  {
    "human": "feb 24 1972",
    "machine": "1972-02-24"
  },
  {
    "human": "01/25/2006",
    "machine": "2006-01-25"
  },
  {
    "human": "2006.11.28 ad",
    "machine": "2006-11-28"
  },
  {
    "human": "15, jun 1983",
    "machine": "1983-06-15"
  },
  {
    "human": "1985-07-6",
    "machine": "1985-07-06"
  },
  {
    "human": "3/4/24",
    "machine": "2024-03-04"
  },
  {
    "human": "july 08, 1971",
    "machine": "1971-07-08"
  },
  {
    "human": "28 dec, 2022",
    "machine": "2022-12-28"
  },
  {
    "human": "76-09-15",
    "machine": "1976-09-15"
  },
  {
    "human": "18 jan, 2004",
    "machine": "2004-01-18"
  },
  {
    "human": "08 september 1972",
    "machine": "1972-09-08"
  },
  {
    "human": "jun 15, 08",
    "machine": "2008-06-15"
  },
  {
    "human": "dec 7, 2011",
    "machine": "2011-12-07"
  },
  {
    "human": "24 october 1987",
    "machine": "1987-10-24"
  },
  {
    "human": "4/02/2001",
    "machine": "2001-02-04"
  },
  {
    "human": "2013/09/08",
    "machine": "2013-09-08"
  },
  {
    "human": "october 8, 1977",
    "machine": "1977-10-08"
  },
  {
    "human": "07.04.1986",
    "machine": "1986-04-07"
  },
  {
    "human": "july 10, 1992",
    "machine": "1992-07-10"
  },
  {
    "human": "2012-12-12",
    "machine": "2012-12-12"
  },
  {
    "human": "fri, feb 1, 85",
    "machine": "1985-02-01"
  },
  {
    "human": "16/04/2000",
    "machine": "2000-04-16"
  },
  {
    "human": "jul 14 1989",
    "machine": "1989-07-14"
  },
  {
    "human": "26, apr 1993",
    "machine": "1993-04-26"
  },
  {
    "human": "1980.06.10 ad",
    "machine": "1980-06-10"
  },
  {
    "human": "february 25, 1996",
    "machine": "1996-02-25"
  },
  {
    "human": "13 january 1999",
    "machine": "1999-01-13"
  },
  {
    "human": "1991-11-23",
    "machine": "1991-11-23"
  },
  {
    "human": "26/07/1970",
    "machine": "1970-07-26"
  },
  {
    "human": "2021-10-20",
    "machine": "2021-10-20"
  },
  {
    "human": "06.10.5",
    "machine": "2006-10-05"
  },
  {
    "human": "6/01/2001",
    "machine": "2001-01-06"
  },
  {
    "human": "31.8.02",
    "machine": "2002-08-31"
  },
  {
    "human": "fri, apr 26, 19",
    "machine": "2019-04-26"
  },
  {
    "human": "feb 11, 17",
    "machine": "2017-02-11"
  },
  {
    "human": "nov 26 2021",
    "machine": "2021-11-26"
  },
  {
    "human": "14 dec, 2013",
    "machine": "2013-12-14"
  },
  {
    "human": "july 2, 1987",
    "machine": "1987-07-02"
  },
  {
    "human": "13, sep 2008",
    "machine": "2008-09-13"
  },
  {
    "human": "april 23, 2023",
    "machine": "2023-04-23"
  },
  {
    "human": "mon, apr 22, 74",
    "machine": "1974-04-22"
  },
  {
    "human": "mar 2, 90",
    "machine": "1990-03-02"
  },
  {
    "human": "5/01/1996",
    "machine": "1996-01-05"
  },
  {
    "human": "09, jul 2017",
    "machine": "2017-07-09"
  },
  {
    "human": "4/27/82",
    "machine": "1982-04-27"
  },
  {
    "human": "15.08.1994",
    "machine": "1994-08-15"
  },
  {
    "human": "17 apr 2017",
    "machine": "2017-04-17"
  },
  {
    "human": "10 nov, 1996",
    "machine": "1996-11-10"
  },
  {
    "human": "1978.08.26 ad",
    "machine": "1978-08-26"
  },
  {
    "human": "09/24/1987",
    "machine": "1987-09-24"
  },
  {
    "human": "1991-03-4",
    "machine": "1991-03-04"
  },
  {
    "human": "8 dec, 2017",
    "machine": "2017-12-08"
  },
  {
    "human": "1994-12-15",
    "machine": "1994-12-15"
  },
  {
    "human": "2/27/71",
    "machine": "1971-02-27"
  },
  {
    "human": "friday, august 21, 2009",
    "machine": "2009-08-21"
  },
  {
    "human": "1986-09-20",
    "machine": "1986-09-20"
  },
  {
    "human": "23 oct 2013",
    "machine": "2013-10-23"
  },
  {
    "human": "07-25-73",
    "machine": "1973-07-25"
  },
  {
    "human": "17, nov 2023",
    "machine": "2023-11-17"
  },
  {
    "human": "16 december 2013",
    "machine": "2013-12-16"
  },
  {
    "human": "30 mar, 1986",
    "machine": "1986-03-30"
  },
  {
    "human": "saturday, march 21, 1987",
    "machine": "1987-03-21"
  },
  {
    "human": "1 oct 1994",
    "machine": "1994-10-01"
  },
  {
    "human": "sep 22, 12",
    "machine": "2012-09-22"
  },
  {
    "human": "mar 5, 99",
    "machine": "1999-03-05"
  },
  {
    "human": "18-apr-1976",
    "machine": "1976-04-18"
  },
  {
    "human": "3.11.96",
    "machine": "1996-11-03"
  },
  {
    "human": "05/11/2019",
    "machine": "2019-05-11"
  },
  {
    "human": "08-11-04",
    "machine": "2004-08-11"
  },
  {
    "human": "mar 7 1994",
    "machine": "1994-03-07"
  },
  {
    "human": "feb 11, 75",
    "machine": "1975-02-11"
  },
  {
    "human": "08, sep 1977",
    "machine": "1977-09-08"
  },
  {
    "human": "5/13/88",
    "machine": "1988-05-13"
  },
  {
    "human": "90-11-06",
    "machine": "1990-11-06"
  },
  {
    "human": "12-17-12",
    "machine": "2012-12-17"
  },
  {
    "human": "12 november 2000",
    "machine": "2000-11-12"
  },
  {
    "human": "24, jul 1998",
    "machine": "1998-07-24"
  },
  {
    "human": "31.5.12",
    "machine": "2012-05-31"
  },
  {
    "human": "02/12/1970",
    "machine": "1970-02-12"
  },
  {
    "human": "2012-12-07",
    "machine": "2012-12-07"
  },
  {
    "human": "12/13/02",
    "machine": "2002-12-13"
  },
  {
    "human": "september 5, 1976",
    "machine": "1976-09-05"
  },
  {
    "human": "dec 31 1973",
    "machine": "1973-12-31"
  },
  {
    "human": "may 16, 2000",
    "machine": "2000-05-16"
  },
  {
    "human": "april 24, 2003",
    "machine": "2003-04-24"
  },
  {
    "human": "21 nov 2012",
    "machine": "2012-11-21"
  },
  {
    "human": "sep 24 2010",
    "machine": "2010-09-24"
  },
  {
    "human": "19.03.4",
    "machine": "2019-03-04"
  },
  {
    "human": "2 august 1997",
    "machine": "1997-08-02"
  },
  {
    "human": "2025/01/17",
    "machine": "2025-01-17"
  },
  {
    "human": "25 oct, 1983",
    "machine": "1983-10-25"
  },
  {
    "human": "11 nov 1993",
    "machine": "1993-11-11"
  },
  {
    "human": "may 20 1979",
    "machine": "1979-05-20"
  },
  {
    "human": "feb 14 2001",
    "machine": "2001-02-14"
  },
  {
    "human": "feb 12 2011",
    "machine": "2011-02-12"
  },
  {
    "human": "2011.01.17 ad",
    "machine": "2011-01-17"
  },
  {
    "human": "dec 21 1986",
    "machine": "1986-12-21"
  },
  {
    "human": "06.05.2010",
    "machine": "2010-05-06"
  },
  {
    "human": "2018-07-8",
    "machine": "2018-07-08"
  },
  {
    "human": "april 9, 1988",
    "machine": "1988-04-09"
  },
  {
    "human": "2004-05-26",
    "machine": "2004-05-26"
  },
  {
    "human": "06, sep 2001",
    "machine": "2001-09-06"
  },
  {
    "human": "1979.08.27 ad",
    "machine": "1979-08-27"
  },
  {
    "human": "sep 25, 19",
    "machine": "2019-09-25"
  },
  {
    "human": "28/02/1972",
    "machine": "1972-02-28"
  },
  {
    "human": "21 feb 2000",
    "machine": "2000-02-21"
  },
  {
    "human": "08/22/2017",
    "machine": "2017-08-22"
  },
  {
    "human": "15-mar-1989",
    "machine": "1989-03-15"
  },
  {
    "human": "03/08/2024",
    "machine": "2024-03-08"
  },
  {
    "human": "2.9.06",
    "machine": "2006-09-02"
  },
  {
    "human": "02-12-08",
    "machine": "2008-02-12"
  },
  {
    "human": "june 22, 2001",
    "machine": "2001-06-22"
  },
  {
    "human": "sun, jun 22, 03",
    "machine": "2003-06-22"
  },
  {
    "human": "12 march 1997",
    "machine": "1997-03-12"
  },
  {
    "human": "3-mar-1984",
    "machine": "1984-03-03"
  },
  {
    "human": "2010.01.20 ad",
    "machine": "2010-01-20"
  },
  {
    "human": "wed, sep 3, 25",
    "machine": "2025-09-03"
  },
  {
    "human": "15.12.23",
    "machine": "2023-12-15"
  },
  {
    "human": "06, jun 1998",
    "machine": "1998-06-06"
  },
  {
    "human": "99.09.12",
    "machine": "1999-09-12"
  },
  {
    "human": "jan 31, 1983",
    "machine": "1983-01-31"
  },
  {
    "human": "2011-07-23",
    "machine": "2011-07-23"
  },
  {
    "human": "12-02-89",
    "machine": "1989-12-02"
  },
  {
    "human": "27 apr, 2017",
    "machine": "2017-04-27"
  },
  {
    "human": "1 may, 1980",
    "machine": "1980-05-01"
  },
  {
    "human": "19.03.2002",
    "machine": "2002-03-19"
  },
  {
    "human": "1994-03-20",
    "machine": "1994-03-20"
  },
  {
    "human": "15.3.91",
    "machine": "1991-03-15"
  },
  {
    "human": "72.03.2",
    "machine": "1972-03-02"
  },
  {
    "human": "1981/12/10",
    "machine": "1981-12-10"
  },
  {
    "human": "07/09/2012",
    "machine": "2012-07-09"
  },
  {
    "human": "04.03.2018",
    "machine": "2018-03-04"
  },
  {
    "human": "27 june 1996",
    "machine": "1996-06-27"
  },
  {
    "human": "30 aug, 2020",
    "machine": "2020-08-30"
  },
  {
    "human": "sep 6 2011",
    "machine": "2011-09-06"
  },
  {
    "human": "2013-07-7",
    "machine": "2013-07-07"
  },
  {
    "human": "jul 24, 10",
    "machine": "2010-07-24"
  },
  {
    "human": "4 nov 1994",
    "machine": "1994-11-04"
  },
  {
    "human": "17.2.18",
    "machine": "2018-02-17"
  },
  {
    "human": "april 9, 2014",
    "machine": "2014-04-09"
  },
  {
    "human": "1-sep-1998",
    "machine": "1998-09-01"
  },
  {
    "human": "2004.01.16 ad",
    "machine": "2004-01-16"
  },
  {
    "human": "29.05.2014",
    "machine": "2014-05-29"
  },
  {
    "human": "march 3, 1984",
    "machine": "1984-03-03"
  },
  {
    "human": "18 november 1978",
    "machine": "1978-11-18"
  },
  {
    "human": "april 27, 2021",
    "machine": "2021-04-27"
  },
  {
    "human": "04-08-09",
    "machine": "2009-04-08"
  },
  {
    "human": "1/12/1984",
    "machine": "1984-12-01"
  },
  {
    "human": "june 14, 1985",
    "machine": "1985-06-14"
  },
  {
    "human": "12/10/88",
    "machine": "1988-12-10"
  },
  {
    "human": "2025/10/02",
    "machine": "2025-10-02"
  },
  {
    "human": "13.07.26",
    "machine": "2013-07-26"
  },
  {
    "human": "2011-08-09",
    "machine": "2011-08-09"
  },
  {
    "human": "07.02.10",
    "machine": "2007-02-10"
  },
  {
    "human": "8/9/86",
    "machine": "1986-08-09"
  },
  {
    "human": "15/08/2016",
    "machine": "2016-08-15"
  },
  {
    "human": "thursday, april 28, 1988",
    "machine": "1988-04-28"
  },
  {
    "human": "07-06-20",
    "machine": "2020-07-06"
  },
  {
    "human": "10/31/1970",
    "machine": "1970-10-31"
  },
  {
    "human": "1974/12/02",
    "machine": "1974-12-02"
  },
  {
    "human": "15.5.85",
    "machine": "1985-05-15"
  },
  {
    "human": "dec 19, 00",
    "machine": "2000-12-19"
  },
  {
    "human": "13, apr 2013",
    "machine": "2013-04-13"
  },
  {
    "human": "7/12/2005",
    "machine": "2005-12-07"
  },
  {
    "human": "27, jul 1993",
    "machine": "1993-07-27"
  },
  {
    "human": "november 15, 2021",
    "machine": "2021-11-15"
  },
  {
    "human": "05, mar 2020",
    "machine": "2020-03-05"
  },
  {
    "human": "jul 28 2024",
    "machine": "2024-07-28"
  },
  {
    "human": "february 12, 2012",
    "machine": "2012-02-12"
  },
  {
    "human": "oct 28, 1971",
    "machine": "1971-10-28"
  },
  {
    "human": "2000-09-20",
    "machine": "2000-09-20"
  },
  {
    "human": "25 september 2002",
    "machine": "2002-09-25"
  },
  {
    "human": "05 march 1977",
    "machine": "1977-03-05"
  },
  {
    "human": "dec 10, 1995",
    "machine": "1995-12-10"
  },
  {
    "human": "tuesday, december 17, 2002",
    "machine": "2002-12-17"
  },
  {
    "human": "1979-10-14",
    "machine": "1979-10-14"
  },
  {
    "human": "8/10/2009",
    "machine": "2009-10-08"
  },
  {
    "human": "11.11.15",
    "machine": "2011-11-15"
  },
  {
    "human": "6/17/71",
    "machine": "1971-06-17"
  },
  {
    "human": "12 jul 1985",
    "machine": "1985-07-12"
  },
  {
    "human": "30-oct-2005",
    "machine": "2005-10-30"
  },
  {
    "human": "1980-08-3",
    "machine": "1980-08-03"
  },
  {
    "human": "oct 30 1983",
    "machine": "1983-10-30"
  },
  {
    "human": "20.08.13",
    "machine": "2020-08-13"
  },
  {
    "human": "1976-02-20",
    "machine": "1976-02-20"
  },
  {
    "human": "2/7/24",
    "machine": "2024-02-07"
  },
  {
    "human": "25, dec 2014",
    "machine": "2014-12-25"
  },
  {
    "human": "2020-06-18",
    "machine": "2020-06-18"
  },
  {
    "human": "tue, may 22, 12",
    "machine": "2012-05-22"
  },
  {
    "human": "5/18/05",
    "machine": "2005-05-18"
  },
  {
    "human": "10/30/1994",
    "machine": "1994-10-30"
  },
  {
    "human": "december 19, 1976",
    "machine": "1976-12-19"
  },
  {
    "human": "2023/06/24",
    "machine": "2023-06-24"
  },
  {
    "human": "8/03/1991",
    "machine": "1991-03-08"
  },
  {
    "human": "21 december 2012",
    "machine": "2012-12-21"
  },
  {
    "human": "tuesday, january 30, 1973",
    "machine": "1973-01-30"
  },
  {
    "human": "14.07.1997",
    "machine": "1997-07-14"
  },
  {
    "human": "fri, oct 25, 85",
    "machine": "1985-10-25"
  },
  {
    "human": "26/08/2020",
    "machine": "2020-08-26"
  },
  {
    "human": "7 april 2000",
    "machine": "2000-04-07"
  },
  {
    "human": "nov 1 1997",
    "machine": "1997-11-01"
  },
  {
    "human": "27.8.79",
    "machine": "1979-08-27"
  },
  {
    "human": "november 20, 2025",
    "machine": "2025-11-20"
  },
  {
    "human": "1974-09-18",
    "machine": "1974-09-18"
  },
  {
    "human": "wednesday, september 27, 2006",
    "machine": "2006-09-27"
  },
  {
    "human": "15.10.23",
    "machine": "2015-10-23"
  },
  {
    "human": "mar 27, 1999",
    "machine": "1999-03-27"
  },
  {
    "human": "8/26/22",
    "machine": "2022-08-26"
  },
  {
    "human": "9/16/03",
    "machine": "2003-09-16"
  },
  {
    "human": "december 16, 1986",
    "machine": "1986-12-16"
  },
  {
    "human": "december 3, 1998",
    "machine": "1998-12-03"
  },
  {
    "human": "4/18/90",
    "machine": "1990-04-18"
  },
  {
    "human": "4 aug 1978",
    "machine": "1978-08-04"
  },
  {
    "human": "october 18, 2022",
    "machine": "2022-10-18"
  },
  {
    "human": "10 march 2005",
    "machine": "2005-03-10"
  },
  {
    "human": "aug 4, 90",
    "machine": "1990-08-04"
  },
  {
    "human": "02/24/2017",
    "machine": "2017-02-24"
  },
  {
    "human": "1972-02-24",
    "machine": "1972-02-24"
  },
  {
    "human": "07/28/2015",
    "machine": "2015-07-28"
  },
  {
    "human": "december 23, 1988",
    "machine": "1988-12-23"
  },
  {
    "human": "10 may 1995",
    "machine": "1995-05-10"
  },
  {
    "human": "10/27/16",
    "machine": "2016-10-27"
  },
  {
    "human": "9 october 1977",
    "machine": "1977-10-09"
  },
  {
    "human": "20-mar-2006",
    "machine": "2006-03-20"
  },
  {
    "human": "06-18-74",
    "machine": "1974-06-18"
  },
  {
    "human": "december 19, 2000",
    "machine": "2000-12-19"
  },
  {
    "human": "8 jan 1994",
    "machine": "1994-01-08"
  },
  {
    "human": "september 05, 2024",
    "machine": "2024-09-05"
  },
  {
    "human": "87.03.10",
    "machine": "1987-03-10"
  },
  {
    "human": "02-08-23",
    "machine": "2023-02-08"
  },
  {
    "human": "08-16-12",
    "machine": "2012-08-16"
  },
  {
    "human": "1996-03-6",
    "machine": "1996-03-06"
  },
  {
    "human": "jul 3, 2023",
    "machine": "2023-07-03"
  },
  {
    "human": "02-01-71",
    "machine": "1971-02-01"
  },
  {
    "human": "april 26, 1980",
    "machine": "1980-04-26"
  },
  {
    "human": "28 jun, 2021",
    "machine": "2021-06-28"
  },
  {
    "human": "2002-02-20",
    "machine": "2002-02-20"
  },
  {
    "human": "jan 13, 1971",
    "machine": "1971-01-13"
  },
  {
    "human": "3/1/77",
    "machine": "1977-03-01"
  },
  {
    "human": "23 december 2011",
    "machine": "2011-12-23"
  },
  {
    "human": "7/8/74",
    "machine": "1974-07-08"
  },
  {
    "human": "sun, apr 18, 04",
    "machine": "2004-04-18"
  },
  {
    "human": "25-jan-2007",
    "machine": "2007-01-25"
  },
  {
    "human": "sep 20 2019",
    "machine": "2019-09-20"
  },
  {
    "human": "12 december 2007",
    "machine": "2007-12-12"
  },
  {
    "human": "nov 26, 2017",
    "machine": "2017-11-26"
  },
  {
    "human": "1999-09-11",
    "machine": "1999-09-11"
  },
  {
    "human": "aug 12, 1978",
    "machine": "1978-08-12"
  },
  {
    "human": "may 15 2025",
    "machine": "2025-05-15"
  },
  {
    "human": "26, apr 1988",
    "machine": "1988-04-26"
  },
  {
    "human": "feb 17, 1974",
    "machine": "1974-02-17"
  },
  {
    "human": "2014/12/27",
    "machine": "2014-12-27"
  },
  {
    "human": "31-jul-1977",
    "machine": "1977-07-31"
  },
  {
    "human": "sat, nov 12, 11",
    "machine": "2011-11-12"
  },
  {
    "human": "sun, apr 1, 07",
    "machine": "2007-04-01"
  },
  {
    "human": "5.1.73",
    "machine": "1973-01-05"
  },
  {
    "human": "01/15/2008",
    "machine": "2008-01-15"
  },
  {
    "human": "13, jul 1975",
    "machine": "1975-07-13"
  },
  {
    "human": "sat, aug 13, 88",
    "machine": "1988-08-13"
  },
  {
    "human": "1997-12-27",
    "machine": "1997-12-27"
  },
  {
    "human": "01.06.24",
    "machine": "2001-06-24"
  },
  {
    "human": "3/19/21",
    "machine": "2021-03-19"
  },
  {
    "human": "14.11.72",
    "machine": "1972-11-14"
  },
  {
    "human": "february 6, 2004",
    "machine": "2004-02-06"
  },
  {
    "human": "mar 27, 97",
    "machine": "1997-03-27"
  },
  {
    "human": "1980.08.08 ad",
    "machine": "1980-08-08"
  },
  {
    "human": "september 25, 1977",
    "machine": "1977-09-25"
  },
  {
    "human": "2022/09/15",
    "machine": "2022-09-15"
  },
  {
    "human": "1991.06.27 ad",
    "machine": "1991-06-27"
  },
  {
    "human": "26 apr, 1974",
    "machine": "1974-04-26"
  },
  {
    "human": "dec 22 2012",
    "machine": "2012-12-22"
  },
  {
    "human": "may 12, 2013",
    "machine": "2013-05-12"
  },
  {
    "human": "friday, september 21, 1990",
    "machine": "1990-09-21"
  },
  {
    "human": "23 january 2016",
    "machine": "2016-01-23"
  },
  {
    "human": "5/1/77",
    "machine": "1977-05-01"
  },
  {
    "human": "3/10/91",
    "machine": "1991-03-10"
  },
  {
    "human": "26.5.19",
    "machine": "2019-05-26"
  },
  {
    "human": "75.10.9",
    "machine": "1975-10-09"
  },
  {
    "human": "19 apr, 2009",
    "machine": "2009-04-19"
  },
  {
    "human": "1987.03.01 ad",
    "machine": "1987-03-01"
  },
  {
    "human": "07/22/2017",
    "machine": "2017-07-22"
  },
  {
    "human": "1983-10-31",
    "machine": "1983-10-31"
  },
  {
    "human": "05, jan 1985",
    "machine": "1985-01-05"
  },
  {
    "human": "13/03/2022",
    "machine": "2022-03-13"
  },
  {
    "human": "fri, apr 15, 11",
    "machine": "2011-04-15"
  },
  {
    "human": "12/12/1989",
    "machine": "1989-12-12"
  },
  {
    "human": "02, oct 2004",
    "machine": "2004-10-02"
  },
  {
    "human": "may 14, 1979",
    "machine": "1979-05-14"
  },
  {
    "human": "18 jul 2017",
    "machine": "2017-07-18"
  },
  {
    "human": "10/10/1994",
    "machine": "1994-10-10"
  },
  {
    "human": "12/28/2001",
    "machine": "2001-12-28"
  },
  {
    "human": "30-nov-1975",
    "machine": "1975-11-30"
  },
  {
    "human": "6/24/08",
    "machine": "2008-06-24"
  },
  {
    "human": "17, mar 2008",
    "machine": "2008-03-17"
  },
  {
    "human": "9/1/11",
    "machine": "2011-09-01"
  },
  {
    "human": "1 jan, 2001",
    "machine": "2001-01-01"
  },
  {
    "human": "5 apr, 2001",
    "machine": "2001-04-05"
  },
  {
    "human": "2018-06-17",
    "machine": "2018-06-17"
  },
  {
    "human": "jul 3, 18",
    "machine": "2018-07-03"
  },
  {
    "human": "feb 25 1996",
    "machine": "1996-02-25"
  },
  {
    "human": "march 30, 2012",
    "machine": "2012-03-30"
  },
  {
    "human": "tuesday, november 22, 1983",
    "machine": "1983-11-22"
  },
  {
    "human": "21 september 1996",
    "machine": "1996-09-21"
  },
  {
    "human": "06.12.12",
    "machine": "2006-12-12"
  },
  {
    "human": "5-mar-1978",
    "machine": "1978-03-05"
  },
  {
    "human": "17-mar-1980",
    "machine": "1980-03-17"
  },
  {
    "human": "feb 19 1983",
    "machine": "1983-02-19"
  },
  {
    "human": "1981-08-5",
    "machine": "1981-08-05"
  },
  {
    "human": "11-27-76",
    "machine": "1976-11-27"
  },
  {
    "human": "20/12/1995",
    "machine": "1995-12-20"
  },
  {
    "human": "29, mar 2012",
    "machine": "2012-03-29"
  },
  {
    "human": "05/16/2017",
    "machine": "2017-05-16"
  },
  {
    "human": "09-26-12",
    "machine": "2012-09-26"
  },
  {
    "human": "22.11.24",
    "machine": "2022-11-24"
  },
  {
    "human": "wed, may 21, 80",
    "machine": "1980-05-21"
  },
  {
    "human": "may 19, 17",
    "machine": "2017-05-19"
  },
  {
    "human": "jun 7, 2006",
    "machine": "2006-06-07"
  },
  {
    "human": "4/26/03",
    "machine": "2003-04-26"
  },
  {
    "human": "24 apr, 1975",
    "machine": "1975-04-24"
  },
  {
    "human": "saturday, april 26, 1997",
    "machine": "1997-04-26"
  },
  {
    "human": "11/19/81",
    "machine": "1981-11-19"
  },
  {
    "human": "2024-07-20",
    "machine": "2024-07-20"
  },
  {
    "human": "6/07/2016",
    "machine": "2016-07-06"
  },
  {
    "human": "jan 16, 1975",
    "machine": "1975-01-16"
  },
  {
    "human": "mon, apr 23, 01",
    "machine": "2001-04-23"
  },
  {
    "human": "sun, may 12, 96",
    "machine": "1996-05-12"
  },
  {
    "human": "2021/05/25",
    "machine": "2021-05-25"
  },
  {
    "human": "1971-03-17",
    "machine": "1971-03-17"
  },
  {
    "human": "september 05, 1975",
    "machine": "1975-09-05"
  },
  {
    "human": "1999.09.24 ad",
    "machine": "1999-09-24"
  },
  {
    "human": "24 sep, 1989",
    "machine": "1989-09-24"
  },
  {
    "human": "feb 18 1972",
    "machine": "1972-02-18"
  },
  {
    "human": "06.01.5",
    "machine": "2006-01-05"
  },
  {
    "human": "26, mar 2013",
    "machine": "2013-03-26"
  },
  {
    "human": "12.04.8",
    "machine": "2012-04-08"
  },
  {
    "human": "nov 8, 13",
    "machine": "2013-11-08"
  },
  {
    "human": "1/24/72",
    "machine": "1972-01-24"
  },
  {
    "human": "june 14, 1993",
    "machine": "1993-06-14"
  },
  {
    "human": "2014-01-3",
    "machine": "2014-01-03"
  },
  {
    "human": "19 may 2001",
    "machine": "2001-05-19"
  },
  {
    "human": "21.10.97",
    "machine": "1997-10-21"
  },
  {
    "human": "july 20, 2007",
    "machine": "2007-07-20"
  },
  {
    "human": "may 5, 1991",
    "machine": "1991-05-05"
  },
  {
    "human": "april 22, 1973",
    "machine": "1973-04-22"
  },
  {
    "human": "5 apr 1984",
    "machine": "1984-04-05"
  },
  {
    "human": "jun 9 1988",
    "machine": "1988-06-09"
  },
  {
    "human": "26/11/2024",
    "machine": "2024-11-26"
  },
  {
    "human": "84-09-16",
    "machine": "1984-09-16"
  },
  {
    "human": "dec 5 2023",
    "machine": "2023-12-05"
  },
  {
    "human": "05, jun 1982",
    "machine": "1982-06-05"
  },
  {
    "human": "8 february 2003",
    "machine": "2003-02-08"
  },
  {
    "human": "18 november 1999",
    "machine": "1999-11-18"
  },
  {
    "human": "24.02.1999",
    "machine": "1999-02-24"
  },
  {
    "human": "27.3.08",
    "machine": "2008-03-27"
  },
  {
    "human": "06-26-11",
    "machine": "2011-06-26"
  },
  {
    "human": "17.03.1",
    "machine": "2017-03-01"
  },
  {
    "human": "july 4, 1994",
    "machine": "1994-07-04"
  },
  {
    "human": "30.1.03",
    "machine": "2003-01-30"
  },
  {
    "human": "tuesday, may 28, 1996",
    "machine": "1996-05-28"
  },
  {
    "human": "tuesday, march 14, 2000",
    "machine": "2000-03-14"
  },
  {
    "human": "thursday, february 25, 2021",
    "machine": "2021-02-25"
  },
  {
    "human": "27 may 1993",
    "machine": "1993-05-27"
  },
  {
    "human": "1/21/19",
    "machine": "2019-01-21"
  },
  {
    "human": "9/1/19",
    "machine": "2019-09-01"
  },
  {
    "human": "08/05/1996",
    "machine": "1996-08-05"
  },
  {
    "human": "24 april 2019",
    "machine": "2019-04-24"
  },
  {
    "human": "monday, january 28, 2013",
    "machine": "2013-01-28"
  },
  {
    "human": "01/17/2008",
    "machine": "2008-01-17"
  },
  {
    "human": "30.08.1993",
    "machine": "1993-08-30"
  },
  {
    "human": "14, jul 2005",
    "machine": "2005-07-14"
  },
  {
    "human": "09-26-08",
    "machine": "2008-09-26"
  },
  {
    "human": "72-10-01",
    "machine": "1972-10-01"
  },
  {
    "human": "5 may, 2009",
    "machine": "2009-05-05"
  },
  {
    "human": "wed, jan 17, 73",
    "machine": "1973-01-17"
  },
  {
    "human": "feb 19, 87",
    "machine": "1987-02-19"
  },
  {
    "human": "13.07.18",
    "machine": "2013-07-18"
  },
  {
    "human": "11/7/91",
    "machine": "1991-11-07"
  },
  {
    "human": "december 9, 1989",
    "machine": "1989-12-09"
  },
  {
    "human": "march 1, 2004",
    "machine": "2004-03-01"
  },
  {
    "human": "2001/05/12",
    "machine": "2001-05-12"
  },
  {
    "human": "3/24/78",
    "machine": "1978-03-24"
  },
  {
    "human": "11.03.7",
    "machine": "2011-03-07"
  },
  {
    "human": "nov 10, 1984",
    "machine": "1984-11-10"
  },
  {
    "human": "28/03/2009",
    "machine": "2009-03-28"
  },
  {
    "human": "1979.02.23 ad",
    "machine": "1979-02-23"
  },
  {
    "human": "23-oct-1999",
    "machine": "1999-10-23"
  },
  {
    "human": "23.06.2010",
    "machine": "2010-06-23"
  },
  {
    "human": "sunday, september 28, 1997",
    "machine": "1997-09-28"
  },
  {
    "human": "august 04, 2008",
    "machine": "2008-08-04"
  },
  {
    "human": "thu, jul 5, 07",
    "machine": "2007-07-05"
  },
  {
    "human": "2/6/95",
    "machine": "1995-02-06"
  },
  {
    "human": "12 apr, 1970",
    "machine": "1970-04-12"
  },
  {
    "human": "24 july 1994",
    "machine": "1994-07-24"
  },
  {
    "human": "12/6/87",
    "machine": "1987-12-06"
  },
  {
    "human": "7/5/08",
    "machine": "2008-07-05"
  },
  {
    "human": "2012/09/09",
    "machine": "2012-09-09"
  },
  {
    "human": "24/09/1982",
    "machine": "1982-09-24"
  },
  {
    "human": "9.7.77",
    "machine": "1977-07-09"
  },
  {
    "human": "october 07, 2014",
    "machine": "2014-10-07"
  },
  {
    "human": "07.05.1989",
    "machine": "1989-05-07"
  },
  {
    "human": "2019-07-13",
    "machine": "2019-07-13"
  },
  {
    "human": "29-jul-1993",
    "machine": "1993-07-29"
  },
  {
    "human": "march 25, 1992",
    "machine": "1992-03-25"
  },
  {
    "human": "00.07.31",
    "machine": "2000-07-31"
  },
  {
    "human": "november 28, 2001",
    "machine": "2001-11-28"
  },
  {
    "human": "25 july 1999",
    "machine": "1999-07-25"
  },
  {
    "human": "22 jun 2015",
    "machine": "2015-06-22"
  },
  {
    "human": "31, may 2006",
    "machine": "2006-05-31"
  },
  {
    "human": "22 sep 2010",
    "machine": "2010-09-22"
  },
  {
    "human": "jan 5, 87",
    "machine": "1987-01-05"
  },
  {
    "human": "01/11/2002",
    "machine": "2002-01-11"
  },
  {
    "human": "3/07/1972",
    "machine": "1972-07-03"
  },
  {
    "human": "jun 9 1974",
    "machine": "1974-06-09"
  },
  {
    "human": "04-27-93",
    "machine": "1993-04-27"
  },
  {
    "human": "02.02.1998",
    "machine": "1998-02-02"
  },
  {
    "human": "11 aug, 2015",
    "machine": "2015-08-11"
  },
  {
    "human": "5/26/92",
    "machine": "1992-05-26"
  },
  {
    "human": "mon, jun 1, 98",
    "machine": "1998-06-01"
  },
  {
    "human": "06-05-25",
    "machine": "2025-06-05"
  },
  {
    "human": "28 may 2013",
    "machine": "2013-05-28"
  },
  {
    "human": "thu, oct 7, 76",
    "machine": "1976-10-07"
  },
  {
    "human": "07/07/2002",
    "machine": "2002-07-07"
  },
  {
    "human": "1979-07-29",
    "machine": "1979-07-29"
  },
  {
    "human": "75-10-08",
    "machine": "1975-10-08"
  },
  {
    "human": "jan 23, 2012",
    "machine": "2012-01-23"
  },
  {
    "human": "2014-01-12",
    "machine": "2014-01-12"
  },
  {
    "human": "6/12/13",
    "machine": "2013-06-12"
  },
  {
    "human": "1981.11.21 ad",
    "machine": "1981-11-21"
  },
  {
    "human": "13.1.90",
    "machine": "1990-01-13"
  },
  {
    "human": "22, sep 1977",
    "machine": "1977-09-22"
  },
  {
    "human": "4 may 2025",
    "machine": "2025-05-04"
  },
  {
    "human": "september 02, 2005",
    "machine": "2005-09-02"
  },
  {
    "human": "10-16-74",
    "machine": "1974-10-16"
  },
  {
    "human": "sunday, may 13, 1984",
    "machine": "1984-05-13"
  },
  {
    "human": "wed, nov 6, 96",
    "machine": "1996-11-06"
  },
  {
    "human": "1 nov 2001",
    "machine": "2001-11-01"
  },
  {
    "human": "13.8.10",
    "machine": "2010-08-13"
  },
  {
    "human": "05/18/2016",
    "machine": "2016-05-18"
  },
  {
    "human": "02.06.1976",
    "machine": "1976-06-02"
  },
  {
    "human": "4/18/93",
    "machine": "1993-04-18"
  },
  {
    "human": "22 december 1985",
    "machine": "1985-12-22"
  },
  {
    "human": "nov 18, 13",
    "machine": "2013-11-18"
  },
  {
    "human": "27 april 1995",
    "machine": "1995-04-27"
  },
  {
    "human": "26 november 1999",
    "machine": "1999-11-26"
  },
  {
    "human": "26.2.86",
    "machine": "1986-02-26"
  },
  {
    "human": "12 may 1992",
    "machine": "1992-05-12"
  },
  {
    "human": "3/05/1983",
    "machine": "1983-05-03"
  },
  {
    "human": "08/17/2019",
    "machine": "2019-08-17"
  },
  {
    "human": "1982/04/10",
    "machine": "1982-04-10"
  },
  {
    "human": "2019/09/20",
    "machine": "2019-09-20"
  },
  {
    "human": "1985/02/28",
    "machine": "1985-02-28"
  },
  {
    "human": "11.5.90",
    "machine": "1990-05-11"
  },
  {
    "human": "thu, aug 6, 87",
    "machine": "1987-08-06"
  },
  {
    "human": "27/11/2005",
    "machine": "2005-11-27"
  },
  {
    "human": "jan 29, 2012",
    "machine": "2012-01-29"
  },
  {
    "human": "thursday, july 19, 2012",
    "machine": "2012-07-19"
  },
  {
    "human": "05.11.2007",
    "machine": "2007-11-05"
  },
  {
    "human": "february 06, 2017",
    "machine": "2017-02-06"
  },
  {
    "human": "09-28-82",
    "machine": "1982-09-28"
  },
  {
    "human": "31-mar-2023",
    "machine": "2023-03-31"
  },
  {
    "human": "1 feb, 2018",
    "machine": "2018-02-01"
  },
  {
    "human": "24/12/2023",
    "machine": "2023-12-24"
  },
  {
    "human": "10-02-12",
    "machine": "2012-10-02"
  },
  {
    "human": "12.08.1981",
    "machine": "1981-08-12"
  },
  {
    "human": "friday, january 28, 2011",
    "machine": "2011-01-28"
  },
  {
    "human": "1973-08-10",
    "machine": "1973-08-10"
  },
  {
    "human": "1983.12.15 ad",
    "machine": "1983-12-15"
  },
  {
    "human": "05.02.1977",
    "machine": "1977-02-05"
  },
  {
    "human": "december 26, 1971",
    "machine": "1971-12-26"
  },
  {
    "human": "january 7, 1970",
    "machine": "1970-01-07"
  },
  {
    "human": "97.02.1",
    "machine": "1997-02-01"
  },
  {
    "human": "september 28, 1990",
    "machine": "1990-09-28"
  },
  {
    "human": "wed, jul 26, 89",
    "machine": "1989-07-26"
  },
  {
    "human": "2015-04-17",
    "machine": "2015-04-17"
  },
  {
    "human": "21.8.09",
    "machine": "2009-08-21"
  },
  {
    "human": "15.06.2014",
    "machine": "2014-06-15"
  },
  {
    "human": "26/08/1971",
    "machine": "1971-08-26"
  },
  {
    "human": "wed, apr 12, 06",
    "machine": "2006-04-12"
  },
  {
    "human": "february 15, 2011",
    "machine": "2011-02-15"
  },
  {
    "human": "1989-02-24",
    "machine": "1989-02-24"
  },
  {
    "human": "1999.05.30 ad",
    "machine": "1999-05-30"
  },
  {
    "human": "13 november 2014",
    "machine": "2014-11-13"
  },
  {
    "human": "may 8, 2018",
    "machine": "2018-05-08"
  },
  {
    "human": "16 june 1999",
    "machine": "1999-06-16"
  },
  {
    "human": "wednesday, march 18, 1998",
    "machine": "1998-03-18"
  },
  {
    "human": "thursday, october 25, 1973",
    "machine": "1973-10-25"
  },
  {
    "human": "94.04.2",
    "machine": "1994-04-02"
  },
  {
    "human": "1999.11.26 ad",
    "machine": "1999-11-26"
  },
  {
    "human": "11/25/2007",
    "machine": "2007-11-25"
  },
  {
    "human": "apr 16, 1985",
    "machine": "1985-04-16"
  },
  {
    "human": "01-02-03",
    "machine": "2001-02-03"
  },
  {
    "human": "6 july 1991",
    "machine": "1991-07-06"
  },
  {
    "human": "january 15, 1996",
    "machine": "1996-01-15"
  },
  {
    "human": "05.10.2001",
    "machine": "2001-10-05"
  },
  {
    "human": "january 15, 2009",
    "machine": "2009-01-15"
  },
  {
    "human": "19 jun, 2013",
    "machine": "2013-06-19"
  },
  {
    "human": "04.05.1",
    "machine": "2004-05-01"
  },
  {
    "human": "tue, mar 10, 70",
    "machine": "1970-03-10"
  },
  {
    "human": "26 dec, 2011",
    "machine": "2011-12-26"
  },
  {
    "human": "06-20-13",
    "machine": "2013-06-20"
  },
  {
    "human": "09 march 2024",
    "machine": "2024-03-09"
  },
  {
    "human": "5 jul, 1975",
    "machine": "1975-07-05"
  },
  {
    "human": "2009-09-28",
    "machine": "2009-09-28"
  },
  {
    "human": "11/22/15",
    "machine": "2015-11-22"
  },
  {
    "human": "7 jun, 1972",
    "machine": "1972-06-07"
  },
  {
    "human": "20 february 1989",
    "machine": "1989-02-20"
  },
  {
    "human": "september 1, 1989",
    "machine": "1989-09-01"
  },
  {
    "human": "1975.09.28 ad",
    "machine": "1975-09-28"
  },
  {
    "human": "12/29/2009",
    "machine": "2009-12-29"
  },
  {
    "human": "may 25 1975",
    "machine": "1975-05-25"
  },
  {
    "human": "2000-05-8",
    "machine": "2000-05-08"
  },
  {
    "human": "jan 12 1982",
    "machine": "1982-01-12"
  },
  {
    "human": "1988-12-14",
    "machine": "1988-12-14"
  },
  {
    "human": "1972-02-20",
    "machine": "1972-02-20"
  },
  {
    "human": "december 17, 1977",
    "machine": "1977-12-17"
  },
  {
    "human": "apr 25, 07",
    "machine": "2007-04-25"
  },
  {
    "human": "january 16, 1996",
    "machine": "1996-01-16"
  },
  {
    "human": "tuesday, january 7, 2003",
    "machine": "2003-01-07"
  },
  {
    "human": "9 may 2016",
    "machine": "2016-05-09"
  },
  {
    "human": "aug 13, 16",
    "machine": "2016-08-13"
  },
  {
    "human": "saturday, april 25, 2015",
    "machine": "2015-04-25"
  },
  {
    "human": "25 april 2010",
    "machine": "2010-04-25"
  },
  {
    "human": "31-dec-1989",
    "machine": "1989-12-31"
  },
  {
    "human": "9/23/79",
    "machine": "1979-09-23"
  },
  {
    "human": "aug 6, 2013",
    "machine": "2013-08-06"
  },
  {
    "human": "october 21, 2011",
    "machine": "2011-10-21"
  },
  {
    "human": "apr 22, 1987",
    "machine": "1987-04-22"
  },
  {
    "human": "july 15, 1981",
    "machine": "1981-07-15"
  },
  {
    "human": "10, oct 2000",
    "machine": "2000-10-10"
  },
  {
    "human": "22.2.84",
    "machine": "1984-02-22"
  },
  {
    "human": "1973-06-17",
    "machine": "1973-06-17"
  },
  {
    "human": "1996/06/14",
    "machine": "1996-06-14"
  },
  {
    "human": "09-05-18",
    "machine": "2009-05-18"
  },
  {
    "human": "91.03.1",
    "machine": "1991-03-01"
  },
  {
    "human": "sat, apr 6, 13",
    "machine": "2013-04-06"
  },
  {
    "human": "friday, june 4, 1982",
    "machine": "1982-06-04"
  },
  {
    "human": "12.04.2012",
    "machine": "2012-04-12"
  },
  {
    "human": "11.01.8",
    "machine": "2011-01-08"
  },
  {
    "human": "73.04.5",
    "machine": "1973-04-05"
  },
  {
    "human": "mar 31, 2009",
    "machine": "2009-03-31"
  },
  {
    "human": "nov 24, 1989",
    "machine": "1989-11-24"
  },
  {
    "human": "8 jul 2007",
    "machine": "2007-07-08"
  },
  {
    "human": "08.04.1979",
    "machine": "1979-04-08"
  },
  {
    "human": "2002.10.05 ad",
    "machine": "2002-10-05"
  },
  {
    "human": "1986-09-28",
    "machine": "1986-09-28"
  },
  {
    "human": "march 29, 1991",
    "machine": "1991-03-29"
  },
  {
    "human": "98.06.16",
    "machine": "1998-06-16"
  },
  {
    "human": "12/24/2019",
    "machine": "2019-12-24"
  },
  {
    "human": "08/03/2007",
    "machine": "2007-08-03"
  },
  {
    "human": "02 november 1999",
    "machine": "1999-11-02"
  },
  {
    "human": "wednesday, january 24, 1990",
    "machine": "1990-01-24"
  },
  {
    "human": "26 march 2006",
    "machine": "2006-03-26"
  },
  {
    "human": "jun 29, 71",
    "machine": "1971-06-29"
  },
  {
    "human": "wednesday, may 2, 2007",
    "machine": "2007-05-02"
  },
  {
    "human": "5/2/78",
    "machine": "1978-05-02"
  },
  {
    "human": "16, jan 1991",
    "machine": "1991-01-16"
  },
  {
    "human": "tue, mar 17, 09",
    "machine": "2009-03-17"
  },
  {
    "human": "mar 3, 1996",
    "machine": "1996-03-03"
  },
  {
    "human": "june 22, 2002",
    "machine": "2002-06-22"
  },
  {
    "human": "sunday, january 15, 2012",
    "machine": "2012-01-15"
  },
  {
    "human": "mon, jun 5, 06",
    "machine": "2006-06-05"
  },
  {
    "human": "saturday, november 9, 2002",
    "machine": "2002-11-09"
  },
  {
    "human": "monday, october 20, 2025",
    "machine": "2025-10-20"
  },
  {
    "human": "07/07/2011",
    "machine": "2011-07-07"
  },
  {
    "human": "10-15-99",
    "machine": "1999-10-15"
  },
  {
    "human": "20-09-27",
    "machine": "2020-09-27"
  },
  {
    "human": "october 01, 1972",
    "machine": "1972-10-01"
  },
  {
    "human": "93-05-12",
    "machine": "1993-05-12"
  },
  {
    "human": "6 september 2018",
    "machine": "2018-09-06"
  },
  {
    "human": "sat, nov 22, 80",
    "machine": "1980-11-22"
  },
  {
    "human": "12/5/94",
    "machine": "1994-12-05"
  },
  {
    "human": "1970/07/29",
    "machine": "1970-07-29"
  },
  {
    "human": "september 22, 2008",
    "machine": "2008-09-22"
  },
  {
    "human": "3-oct-2020",
    "machine": "2020-10-03"
  },
  {
    "human": "april 6, 2002",
    "machine": "2002-04-06"
  },
  {
    "human": "1975-09-28",
    "machine": "1975-09-28"
  },
  {
    "human": "23 june 1979",
    "machine": "1979-06-23"
  },
  {
    "human": "2001.10.07 ad",
    "machine": "2001-10-07"
  },
  {
    "human": "2022-05-19",
    "machine": "2022-05-19"
  },
  {
    "human": "25.03.26",
    "machine": "2025-03-26"
  },
  {
    "human": "21 dec 1974",
    "machine": "1974-12-21"
  },
  {
    "human": "2005/09/29",
    "machine": "2005-09-29"
  },
  {
    "human": "mar 20, 2008",
    "machine": "2008-03-20"
  },
  {
    "human": "dec 27, 03",
    "machine": "2003-12-27"
  },
  {
    "human": "6 sep 1970",
    "machine": "1970-09-06"
  },
  {
    "human": "10 jan 1993",
    "machine": "1993-01-10"
  },
  {
    "human": "dec 27, 2005",
    "machine": "2005-12-27"
  },
  {
    "human": "1970-03-12",
    "machine": "1970-03-12"
  },
  {
    "human": "19-dec-2002",
    "machine": "2002-12-19"
  },
  {
    "human": "2 january 2010",
    "machine": "2010-01-02"
  },
  {
    "human": "05-22-98",
    "machine": "1998-05-22"
  },
  {
    "human": "24 jun 2022",
    "machine": "2022-06-24"
  },
  {
    "human": "11.6.96",
    "machine": "1996-06-11"
  },
  {
    "human": "1987-12-25",
    "machine": "1987-12-25"
  },
  {
    "human": "6 aug 1991",
    "machine": "1991-08-06"
  },
  {
    "human": "20 october 2006",
    "machine": "2006-10-20"
  },
  {
    "human": "sat, feb 23, 08",
    "machine": "2008-02-23"
  },
  {
    "human": "25.02.25",
    "machine": "2025-02-25"
  },
  {
    "human": "8 may 1996",
    "machine": "1996-05-08"
  },
  {
    "human": "12.05.1978",
    "machine": "1978-05-12"
  },
  {
    "human": "15.1.88",
    "machine": "1988-01-15"
  },
  {
    "human": "3 may 2004",
    "machine": "2004-05-03"
  },
  {
    "human": "17, oct 1972",
    "machine": "1972-10-17"
  },
  {
    "human": "1970.05.07 ad",
    "machine": "1970-05-07"
  },
  {
    "human": "august 28, 1978",
    "machine": "1978-08-28"
  },
  {
    "human": "thursday, december 31, 1998",
    "machine": "1998-12-31"
  },
  {
    "human": "wed, jul 15, 87",
    "machine": "1987-07-15"
  },
  {
    "human": "july 15, 1991",
    "machine": "1991-07-15"
  },
  {
    "human": "06.02.1989",
    "machine": "1989-02-06"
  },
  {
    "human": "2015/09/30",
    "machine": "2015-09-30"
  },
  {
    "human": "12/29/2013",
    "machine": "2013-12-29"
  },
  {
    "human": "21 jan 2007",
    "machine": "2007-01-21"
  },
  {
    "human": "1998-07-22",
    "machine": "1998-07-22"
  },
  {
    "human": "26, apr 2003",
    "machine": "2003-04-26"
  },
  {
    "human": "05, nov 1998",
    "machine": "1998-11-05"
  },
  {
    "human": "5 september 2012",
    "machine": "2012-09-05"
  },
  {
    "human": "29/03/2014",
    "machine": "2014-03-29"
  },
  {
    "human": "12 june 1980",
    "machine": "1980-06-12"
  },
  {
    "human": "1/27/71",
    "machine": "1971-01-27"
  },
  {
    "human": "12, jun 1982",
    "machine": "1982-06-12"
  },
  {
    "human": "friday, november 19, 2010",
    "machine": "2010-11-19"
  },
  {
    "human": "12-11-19",
    "machine": "2019-12-11"
  },
  {
    "human": "23-aug-2023",
    "machine": "2023-08-23"
  },
  {
    "human": "9/22/94",
    "machine": "1994-09-22"
  },
  {
    "human": "05, nov 2021",
    "machine": "2021-11-05"
  },
  {
    "human": "1982-09-16",
    "machine": "1982-09-16"
  },
  {
    "human": "2020/03/11",
    "machine": "2020-03-11"
  },
  {
    "human": "july 10, 1991",
    "machine": "1991-07-10"
  },
  {
    "human": "2015-12-27",
    "machine": "2015-12-27"
  },
  {
    "human": "18 december 1971",
    "machine": "1971-12-18"
  },
  {
    "human": "2000.06.27 ad",
    "machine": "2000-06-27"
  },
  {
    "human": "oct 3, 1988",
    "machine": "1988-10-03"
  },
  {
    "human": "31/03/1983",
    "machine": "1983-03-31"
  },
  {
    "human": "13, sep 2004",
    "machine": "2004-09-13"
  },
  {
    "human": "10/29/91",
    "machine": "1991-10-29"
  },
  {
    "human": "2019.11.17 ad",
    "machine": "2019-11-17"
  },
  {
    "human": "11-11-19",
    "machine": "2019-11-11"
  },
  {
    "human": "9/22/71",
    "machine": "1971-09-22"
  },
  {
    "human": "98-12-21",
    "machine": "1998-12-21"
  },
  {
    "human": "mar 25, 1997",
    "machine": "1997-03-25"
  },
  {
    "human": "5 october 2001",
    "machine": "2001-10-05"
  },
  {
    "human": "2018-04-09",
    "machine": "2018-04-09"
  },
  {
    "human": "jun 30, 25",
    "machine": "2025-06-30"
  },
  {
    "human": "monday, february 21, 1977",
    "machine": "1977-02-21"
  },
  {
    "human": "20, jun 1985",
    "machine": "1985-06-20"
  },
  {
    "human": "71-01-28",
    "machine": "1971-01-28"
  },
  {
    "human": "14.2.19",
    "machine": "2019-02-14"
  },
  {
    "human": "apr 11, 09",
    "machine": "2009-04-11"
  },
  {
    "human": "1992.01.08 ad",
    "machine": "1992-01-08"
  },
  {
    "human": "06.03.17",
    "machine": "2006-03-17"
  },
  {
    "human": "september 14, 1989",
    "machine": "1989-09-14"
  },
  {
    "human": "31 march 2008",
    "machine": "2008-03-31"
  },
  {
    "human": "wed, sep 10, 75",
    "machine": "1975-09-10"
  },
  {
    "human": "2/1/15",
    "machine": "2015-02-01"
  },
  {
    "human": "7/10/12",
    "machine": "2012-07-10"
  },
  {
    "human": "07/13/1970",
    "machine": "1970-07-13"
  },
  {
    "human": "03-07-17",
    "machine": "2017-03-07"
  },
  {
    "human": "96-04-15",
    "machine": "1996-04-15"
  },
  {
    "human": "12/31/77",
    "machine": "1977-12-31"
  },
  {
    "human": "sep 11, 94",
    "machine": "1994-09-11"
  },
  {
    "human": "13 july 1992",
    "machine": "1992-07-13"
  },
  {
    "human": "1/11/06",
    "machine": "2006-01-11"
  },
  {
    "human": "05/24/1974",
    "machine": "1974-05-24"
  },
  {
    "human": "february 02, 1992",
    "machine": "1992-02-02"
  },
  {
    "human": "7.8.04",
    "machine": "2004-08-07"
  },
  {
    "human": "20.1.11",
    "machine": "2011-01-20"
  },
  {
    "human": "may 25, 2014",
    "machine": "2014-05-25"
  },
  {
    "human": "fri, sep 5, 80",
    "machine": "1980-09-05"
  },
  {
    "human": "thursday, october 15, 1998",
    "machine": "1998-10-15"
  },
  {
    "human": "11-02-02",
    "machine": "2011-02-02"
  },
  {
    "human": "1986/08/14",
    "machine": "1986-08-14"
  },
  {
    "human": "23.9.10",
    "machine": "2010-09-23"
  },
  {
    "human": "friday, may 9, 2014",
    "machine": "2014-05-09"
  },
  {
    "human": "07 may 1981",
    "machine": "1981-05-07"
  },
  {
    "human": "1974-06-27",
    "machine": "1974-06-27"
  },
  {
    "human": "2002-04-13",
    "machine": "2002-04-13"
  },
  {
    "human": "august 5, 1988",
    "machine": "1988-08-05"
  },
  {
    "human": "03, jan 1977",
    "machine": "1977-01-03"
  },
  {
    "human": "august 6, 1980",
    "machine": "1980-08-06"
  },
  {
    "human": "jun 26 1990",
    "machine": "1990-06-26"
  },
  {
    "human": "aug 24, 75",
    "machine": "1975-08-24"
  },
  {
    "human": "6/8/89",
    "machine": "1989-06-08"
  },
  {
    "human": "june 23, 2022",
    "machine": "2022-06-23"
  },
  {
    "human": "march 14, 1996",
    "machine": "1996-03-14"
  },
  {
    "human": "12/04/1985",
    "machine": "1985-04-12"
  },
  {
    "human": "aug 7 1986",
    "machine": "1986-08-07"
  },
  {
    "human": "wed, jun 25, 08",
    "machine": "2008-06-25"
  },
  {
    "human": "jun 22, 2009",
    "machine": "2009-06-22"
  },
  {
    "human": "mon, apr 22, 02",
    "machine": "2002-04-22"
  },
  {
    "human": "12/17/89",
    "machine": "1989-12-17"
  },
  {
    "human": "21/05/2014",
    "machine": "2014-05-21"
  },
  {
    "human": "15.02.2003",
    "machine": "2003-02-15"
  },
  {
    "human": "19.4.94",
    "machine": "1994-04-19"
  },
  {
    "human": "september 27, 2001",
    "machine": "2001-09-27"
  },
  {
    "human": "september 25, 2018",
    "machine": "2018-09-25"
  },
  {
    "human": "1979.10.07 ad",
    "machine": "1979-10-07"
  },
  {
    "human": "6 october 1986",
    "machine": "1986-10-06"
  },
  {
    "human": "2012.10.17 ad",
    "machine": "2012-10-17"
  },
  {
    "human": "august 11, 1987",
    "machine": "1987-08-11"
  },
  {
    "human": "10, oct 2018",
    "machine": "2018-10-10"
  },
  {
    "human": "31-may-1985",
    "machine": "1985-05-31"
  },
  {
    "human": "3/6/86",
    "machine": "1986-03-06"
  },
  {
    "human": "23 may 1978",
    "machine": "1978-05-23"
  },
  {
    "human": "jun 18, 00",
    "machine": "2000-06-18"
  },
  {
    "human": "25.11.2019",
    "machine": "2019-11-25"
  },
  {
    "human": "tue, jan 30, 18",
    "machine": "2018-01-30"
  },
  {
    "human": "1975-04-21",
    "machine": "1975-04-21"
  },
  {
    "human": "1986-10-1",
    "machine": "1986-10-01"
  },
  {
    "human": "oct 3 1987",
    "machine": "1987-10-03"
  },
  {
    "human": "2011-08-17",
    "machine": "2011-08-17"
  },
  {
    "human": "12/13/21",
    "machine": "2021-12-13"
  },
  {
    "human": "23/05/2003",
    "machine": "2003-05-23"
  },
  {
    "human": "thursday, november 13, 1986",
    "machine": "1986-11-13"
  },
  {
    "human": "thursday, march 21, 1996",
    "machine": "1996-03-21"
  },
  {
    "human": "20-03-15",
    "machine": "2020-03-15"
  },
  {
    "human": "5/17/14",
    "machine": "2014-05-17"
  },
  {
    "human": "31 mar 1991",
    "machine": "1991-03-31"
  },
  {
    "human": "3/1/07",
    "machine": "2007-03-01"
  },
  {
    "human": "24 sep, 1989",
    "machine": "1989-09-24"
  },
  {
    "human": "2/28/20",
    "machine": "2020-02-28"
  },
  {
    "human": "june 24, 1984",
    "machine": "1984-06-24"
  },
  {
    "human": "12/26/07",
    "machine": "2007-12-26"
  },
  {
    "human": "july 10, 1980",
    "machine": "1980-07-10"
  },
  {
    "human": "11/23/74",
    "machine": "1974-11-23"
  },
  {
    "human": "november 09, 2016",
    "machine": "2016-11-09"
  },
  {
    "human": "dec 18, 1991",
    "machine": "1991-12-18"
  },
  {
    "human": "jan 31 2011",
    "machine": "2011-01-31"
  },
  {
    "human": "12/23/98",
    "machine": "1998-12-23"
  },
  {
    "human": "26, jun 1997",
    "machine": "1997-06-26"
  },
  {
    "human": "12/14/96",
    "machine": "1996-12-14"
  },
  {
    "human": "december 07, 1973",
    "machine": "1973-12-07"
  },
  {
    "human": "03-24-84",
    "machine": "1984-03-24"
  },
  {
    "human": "nov 9, 20",
    "machine": "2020-11-09"
  },
  {
    "human": "14 jan 2006",
    "machine": "2006-01-14"
  },
  {
    "human": "january 12, 1983",
    "machine": "1983-01-12"
  },
  {
    "human": "1998-11-12",
    "machine": "1998-11-12"
  },
  {
    "human": "jun 24, 2014",
    "machine": "2014-06-24"
  },
  {
    "human": "12 may 2020",
    "machine": "2020-05-12"
  },
  {
    "human": "1973/10/21",
    "machine": "1973-10-21"
  },
  {
    "human": "september 18, 2011",
    "machine": "2011-09-18"
  },
  {
    "human": "10/19/98",
    "machine": "1998-10-19"
  },
  {
    "human": "2020/05/30",
    "machine": "2020-05-30"
  },
  {
    "human": "22 december 2017",
    "machine": "2017-12-22"
  },
  {
    "human": "24 jul, 1982",
    "machine": "1982-07-24"
  },
  {
    "human": "friday, october 3, 2014",
    "machine": "2014-10-03"
  },
  {
    "human": "jun 9 2008",
    "machine": "2008-06-09"
  },
  {
    "human": "26 feb 2006",
    "machine": "2006-02-26"
  },
  {
    "human": "6 december 1971",
    "machine": "1971-12-06"
  },
  {
    "human": "11-10-06",
    "machine": "2011-10-06"
  },
  {
    "human": "friday, march 9, 1984",
    "machine": "1984-03-09"
  },
  {
    "human": "24, may 1984",
    "machine": "1984-05-24"
  },
  {
    "human": "1998/09/30",
    "machine": "1998-09-30"
  },
  {
    "human": "17.10.2007",
    "machine": "2007-10-17"
  },
  {
    "human": "september 7, 1975",
    "machine": "1975-09-07"
  },
  {
    "human": "nov 16 2012",
    "machine": "2012-11-16"
  },
  {
    "human": "apr 14, 1985",
    "machine": "1985-04-14"
  },
  {
    "human": "apr 1, 00",
    "machine": "2000-04-01"
  },
  {
    "human": "7/24/76",
    "machine": "1976-07-24"
  },
  {
    "human": "14/09/2024",
    "machine": "2024-09-14"
  },
  {
    "human": "nov 12, 72",
    "machine": "1972-11-12"
  },
  {
    "human": "30.07.2015",
    "machine": "2015-07-30"
  },
  {
    "human": "25 jan, 1991",
    "machine": "1991-01-25"
  },
  {
    "human": "april 25, 2019",
    "machine": "2019-04-25"
  },
  {
    "human": "2008-05-23",
    "machine": "2008-05-23"
  },
  {
    "human": "jul 22, 70",
    "machine": "1970-07-22"
  },
  {
    "human": "2013-08-10",
    "machine": "2013-08-10"
  },
  {
    "human": "sunday, september 21, 2008",
    "machine": "2008-09-21"
  },
  {
    "human": "06-16-91",
    "machine": "1991-06-16"
  },
  {
    "human": "07.08.2016",
    "machine": "2016-08-07"
  },
  {
    "human": "10-11-08",
    "machine": "2010-11-08"
  },
  {
    "human": "1974-05-08",
    "machine": "1974-05-08"
  },
  {
    "human": "february 16, 1990",
    "machine": "1990-02-16"
  },
  {
    "human": "sep 18 2010",
    "machine": "2010-09-18"
  },
  {
    "human": "nov 2, 09",
    "machine": "2009-11-02"
  },
  {
    "human": "2/9/92",
    "machine": "1992-02-09"
  },
  {
    "human": "16.02.25",
    "machine": "2016-02-25"
  },
  {
    "human": "25 nov, 1980",
    "machine": "1980-11-25"
  },
  {
    "human": "thursday, june 28, 2007",
    "machine": "2007-06-28"
  },
  {
    "human": "may 12, 1995",
    "machine": "1995-05-12"
  },
  {
    "human": "1993/02/13",
    "machine": "1993-02-13"
  },
  {
    "human": "may 5 1987",
    "machine": "1987-05-05"
  },
  {
    "human": "11.9.98",
    "machine": "1998-09-11"
  },
  {
    "human": "07.01.2018",
    "machine": "2018-01-07"
  },
  {
    "human": "01/10/2016",
    "machine": "2016-01-10"
  },
  {
    "human": "april 7, 1981",
    "machine": "1981-04-07"
  },
  {
    "human": "80-12-28",
    "machine": "1980-12-28"
  },
  {
    "human": "december 29, 2014",
    "machine": "2014-12-29"
  },
  {
    "human": "13-05-06",
    "machine": "2013-05-06"
  },
  {
    "human": "05-08-08",
    "machine": "2005-08-08"
  },
  {
    "human": "2006-11-14",
    "machine": "2006-11-14"
  },
  {
    "human": "12-12-26",
    "machine": "2012-12-26"
  },
  {
    "human": "87-02-16",
    "machine": "1987-02-16"
  },
  {
    "human": "2011-01-09",
    "machine": "2011-01-09"
  },
  {
    "human": "2012/07/04",
    "machine": "2012-07-04"
  },
  {
    "human": "wednesday, february 23, 1983",
    "machine": "1983-02-23"
  },
  {
    "human": "october 17, 1982",
    "machine": "1982-10-17"
  },
  {
    "human": "1985-08-22",
    "machine": "1985-08-22"
  },
  {
    "human": "13 february 1983",
    "machine": "1983-02-13"
  },
  {
    "human": "friday, july 9, 2021",
    "machine": "2021-07-09"
  },
  {
    "human": "01/02/2002",
    "machine": "2002-01-02"
  },
  {
    "human": "dec 24 1994",
    "machine": "1994-12-24"
  },
  {
    "human": "18-nov-1976",
    "machine": "1976-11-18"
  },
  {
    "human": "mon, feb 20, 23",
    "machine": "2023-02-20"
  },
  {
    "human": "sun, jul 16, 89",
    "machine": "1989-07-16"
  },
  {
    "human": "03 october 1977",
    "machine": "1977-10-03"
  },
  {
    "human": "29, nov 1982",
    "machine": "1982-11-29"
  },
  {
    "human": "7/27/71",
    "machine": "1971-07-27"
  },
  {
    "human": "jan 15, 1998",
    "machine": "1998-01-15"
  },
  {
    "human": "2020/02/04",
    "machine": "2020-02-04"
  },
  {
    "human": "31 march 1989",
    "machine": "1989-03-31"
  },
  {
    "human": "13, nov 2002",
    "machine": "2002-11-13"
  },
  {
    "human": "december 14, 2010",
    "machine": "2010-12-14"
  },
  {
    "human": "06-28-06",
    "machine": "2006-06-28"
  },
  {
    "human": "26-dec-1986",
    "machine": "1986-12-26"
  },
  {
    "human": "12/30/74",
    "machine": "1974-12-30"
  },
  {
    "human": "feb 1 2005",
    "machine": "2005-02-01"
  },
  {
    "human": "dec 19, 82",
    "machine": "1982-12-19"
  },
  {
    "human": "jul 2 2020",
    "machine": "2020-07-02"
  },
  {
    "human": "oct 6 1985",
    "machine": "1985-10-06"
  },
  {
    "human": "1996-05-18",
    "machine": "1996-05-18"
  },
  {
    "human": "12 april 2017",
    "machine": "2017-04-12"
  },
  {
    "human": "may 05, 1979",
    "machine": "1979-05-05"
  },
  {
    "human": "friday, december 2, 2005",
    "machine": "2005-12-02"
  },
  {
    "human": "1995-10-27",
    "machine": "1995-10-27"
  },
  {
    "human": "7 jun, 2009",
    "machine": "2009-06-07"
  },
  {
    "human": "apr 11, 06",
    "machine": "2006-04-11"
  },
  {
    "human": "28, sep 1985",
    "machine": "1985-09-28"
  },
  {
    "human": "sunday, august 8, 1999",
    "machine": "1999-08-08"
  },
  {
    "human": "mar 16, 2006",
    "machine": "2006-03-16"
  },
  {
    "human": "17.09.2013",
    "machine": "2013-09-17"
  },
  {
    "human": "2005/11/03",
    "machine": "2005-11-03"
  },
  {
    "human": "04-23-24",
    "machine": "2024-04-23"
  },
  {
    "human": "17 mar 1999",
    "machine": "1999-03-17"
  },
  {
    "human": "16.12.05",
    "machine": "2005-12-16"
  },
  {
    "human": "30.7.06",
    "machine": "2006-07-30"
  },
  {
    "human": "2016.12.16 ad",
    "machine": "2016-12-16"
  },
  {
    "human": "fri, oct 29, 82",
    "machine": "1982-10-29"
  },
  {
    "human": "3 apr, 1987",
    "machine": "1987-04-03"
  },
  {
    "human": "july 30, 1970",
    "machine": "1970-07-30"
  },
  {
    "human": "thursday, september 5, 2002",
    "machine": "2002-09-05"
  },
  {
    "human": "october 01, 2012",
    "machine": "2012-10-01"
  },
  {
    "human": "05.06.2019",
    "machine": "2019-06-05"
  },
  {
    "human": "01/11/1971",
    "machine": "1971-01-11"
  },
  {
    "human": "1981-01-30",
    "machine": "1981-01-30"
  },
  {
    "human": "february 25, 2009",
    "machine": "2009-02-25"
  },
  {
    "human": "2017.12.27 ad",
    "machine": "2017-12-27"
  },
  {
    "human": "2 september 2016",
    "machine": "2016-09-02"
  },
  {
    "human": "19 sep 1998",
    "machine": "1998-09-19"
  },
  {
    "human": "march 22, 2011",
    "machine": "2011-03-22"
  },
  {
    "human": "jun 29, 2012",
    "machine": "2012-06-29"
  },
  {
    "human": "31 january 1991",
    "machine": "1991-01-31"
  },
  {
    "human": "23 may 2025",
    "machine": "2025-05-23"
  },
  {
    "human": "thu, may 6, 21",
    "machine": "2021-05-06"
  },
  {
    "human": "july 16, 2008",
    "machine": "2008-07-16"
  },
  {
    "human": "1979/07/04",
    "machine": "1979-07-04"
  },
  {
    "human": "13 december 1978",
    "machine": "1978-12-13"
  },
  {
    "human": "84-09-22",
    "machine": "1984-09-22"
  },
  {
    "human": "12-22-22",
    "machine": "2022-12-22"
  },
  {
    "human": "friday, february 1, 1980",
    "machine": "1980-02-01"
  },
  {
    "human": "03.05.25",
    "machine": "2003-05-25"
  },
  {
    "human": "april 23, 2017",
    "machine": "2017-04-23"
  },
  {
    "human": "8-mar-1994",
    "machine": "1994-03-08"
  },
  {
    "human": "1983/08/13",
    "machine": "1983-08-13"
  },
  {
    "human": "1982/04/26",
    "machine": "1982-04-26"
  },
  {
    "human": "8/10/2006",
    "machine": "2006-10-08"
  },
  {
    "human": "30 may 1997",
    "machine": "1997-05-30"
  },
  {
    "human": "9/28/09",
    "machine": "2009-09-28"
  },
  {
    "human": "5.6.15",
    "machine": "2015-06-05"
  },
  {
    "human": "february 23, 2002",
    "machine": "2002-02-23"
  },
  {
    "human": "dec 31, 2007",
    "machine": "2007-12-31"
  },
  {
    "human": "27 march 1984",
    "machine": "1984-03-27"
  },
  {
    "human": "saturday, may 1, 2004",
    "machine": "2004-05-01"
  },
  {
    "human": "tuesday, february 22, 1994",
    "machine": "1994-02-22"
  },
  {
    "human": "1974.08.21 ad",
    "machine": "1974-08-21"
  },
  {
    "human": "2013.11.04 ad",
    "machine": "2013-11-04"
  },
  {
    "human": "april 14, 2009",
    "machine": "2009-04-14"
  },
  {
    "human": "22 may 1998",
    "machine": "1998-05-22"
  },
  {
    "human": "85-02-23",
    "machine": "1985-02-23"
  },
  {
    "human": "1989-06-10",
    "machine": "1989-06-10"
  },
  {
    "human": "fri, aug 25, 95",
    "machine": "1995-08-25"
  },
  {
    "human": "september 25, 2003",
    "machine": "2003-09-25"
  },
  {
    "human": "1/07/1977",
    "machine": "1977-07-01"
  },
  {
    "human": "mon, sep 12, 11",
    "machine": "2011-09-12"
  },
  {
    "human": "21 september 1994",
    "machine": "1994-09-21"
  },
  {
    "human": "27-nov-2013",
    "machine": "2013-11-27"
  },
  {
    "human": "14.12.1991",
    "machine": "1991-12-14"
  },
  {
    "human": "2003-10-22",
    "machine": "2003-10-22"
  },
  {
    "human": "1989-01-15",
    "machine": "1989-01-15"
  },
  {
    "human": "1985/10/18",
    "machine": "1985-10-18"
  },
  {
    "human": "february 7, 2022",
    "machine": "2022-02-07"
  },
  {
    "human": "february 29, 1984",
    "machine": "1984-02-29"
  },
  {
    "human": "07-16-94",
    "machine": "1994-07-16"
  },
  {
    "human": "9/17/70",
    "machine": "1970-09-17"
  },
  {
    "human": "tue, jul 14, 70",
    "machine": "1970-07-14"
  },
  {
    "human": "nov 1, 1995",
    "machine": "1995-11-01"
  },
  {
    "human": "october 8, 1998",
    "machine": "1998-10-08"
  },
  {
    "human": "january 16, 1970",
    "machine": "1970-01-16"
  },
  {
    "human": "jul 21, 89",
    "machine": "1989-07-21"
  },
  {
    "human": "2007.04.13 ad",
    "machine": "2007-04-13"
  },
  {
    "human": "july 27, 1979",
    "machine": "1979-07-27"
  },
  {
    "human": "january 22, 1986",
    "machine": "1986-01-22"
  },
  {
    "human": "22 june 1977",
    "machine": "1977-06-22"
  },
  {
    "human": "07/20/2012",
    "machine": "2012-07-20"
  },
  {
    "human": "march 05, 1998",
    "machine": "1998-03-05"
  },
  {
    "human": "tuesday, november 9, 1982",
    "machine": "1982-11-09"
  },
  {
    "human": "mar 21, 2005",
    "machine": "2005-03-21"
  },
  {
    "human": "2015-05-13",
    "machine": "2015-05-13"
  },
  {
    "human": "11-16-25",
    "machine": "2025-11-16"
  },
  {
    "human": "10-jun-1990",
    "machine": "1990-06-10"
  },
  {
    "human": "23/08/1990",
    "machine": "1990-08-23"
  },
  {
    "human": "1981-07-22",
    "machine": "1981-07-22"
  },
  {
    "human": "2025-08-9",
    "machine": "2025-08-09"
  },
  {
    "human": "86.11.21",
    "machine": "1986-11-21"
  },
  {
    "human": "4-apr-2017",
    "machine": "2017-04-04"
  },
  {
    "human": "oct 2, 2010",
    "machine": "2010-10-02"
  },
  {
    "human": "1970-11-07",
    "machine": "1970-11-07"
  },
  {
    "human": "25 september 2014",
    "machine": "2014-09-25"
  },
  {
    "human": "18.10.16",
    "machine": "2016-10-18"
  },
  {
    "human": "03.06.29",
    "machine": "2003-06-29"
  },
  {
    "human": "july 19, 1988",
    "machine": "1988-07-19"
  },
  {
    "human": "03.06.1988",
    "machine": "1988-06-03"
  },
  {
    "human": "06.02.2006",
    "machine": "2006-02-06"
  },
  {
    "human": "06.06.2019",
    "machine": "2019-06-06"
  },
  {
    "human": "apr 3 1997",
    "machine": "1997-04-03"
  },
  {
    "human": "sunday, june 10, 2001",
    "machine": "2001-06-10"
  },
  {
    "human": "11-06-20",
    "machine": "2011-06-20"
  },
  {
    "human": "80.05.30",
    "machine": "1980-05-30"
  },
  {
    "human": "06-11-24",
    "machine": "2024-06-11"
  },
  {
    "human": "2007-01-27",
    "machine": "2007-01-27"
  },
  {
    "human": "nov 26, 87",
    "machine": "1987-11-26"
  },
  {
    "human": "24.06.18",
    "machine": "2024-06-18"
  },
  {
    "human": "3/6/12",
    "machine": "2012-03-06"
  },
  {
    "human": "9/28/71",
    "machine": "1971-09-28"
  },
  {
    "human": "08, dec 2003",
    "machine": "2003-12-08"
  },
  {
    "human": "1987/01/30",
    "machine": "1987-01-30"
  },
  {
    "human": "11-24-90",
    "machine": "1990-11-24"
  },
  {
    "human": "20 november 2020",
    "machine": "2020-11-20"
  },
  {
    "human": "1 jul, 1996",
    "machine": "1996-07-01"
  },
  {
    "human": "06.08.17",
    "machine": "2006-08-17"
  },
  {
    "human": "06/25/1970",
    "machine": "1970-06-25"
  },
  {
    "human": "95.11.21",
    "machine": "1995-11-21"
  },
  {
    "human": "10/14/92",
    "machine": "1992-10-14"
  },
  {
    "human": "6/29/72",
    "machine": "1972-06-29"
  },
  {
    "human": "21, jun 2013",
    "machine": "2013-06-21"
  },
  {
    "human": "25-jul-2010",
    "machine": "2010-07-25"
  },
  {
    "human": "january 02, 1981",
    "machine": "1981-01-02"
  },
  {
    "human": "1980.11.28 ad",
    "machine": "1980-11-28"
  },
  {
    "human": "11 june 1995",
    "machine": "1995-06-11"
  },
  {
    "human": "14.03.1997",
    "machine": "1997-03-14"
  },
  {
    "human": "1997/09/08",
    "machine": "1997-09-08"
  },
  {
    "human": "01 march 2013",
    "machine": "2013-03-01"
  },
  {
    "human": "5/07/2021",
    "machine": "2021-07-05"
  },
  {
    "human": "sun, jan 3, 71",
    "machine": "1971-01-03"
  },
  {
    "human": "january 28, 1990",
    "machine": "1990-01-28"
  },
  {
    "human": "4.6.18",
    "machine": "2018-06-04"
  },
  {
    "human": "may 8, 2007",
    "machine": "2007-05-08"
  },
  {
    "human": "1 november 2002",
    "machine": "2002-11-01"
  },
  {
    "human": "15-jan-1994",
    "machine": "1994-01-15"
  },
  {
    "human": "04, mar 1980",
    "machine": "1980-03-04"
  },
  {
    "human": "08, jun 1981",
    "machine": "1981-06-08"
  },
  {
    "human": "1.11.03",
    "machine": "2003-11-01"
  },
  {
    "human": "aug 21 2011",
    "machine": "2011-08-21"
  },
  {
    "human": "1975-11-13",
    "machine": "1975-11-13"
  },
  {
    "human": "24-feb-1981",
    "machine": "1981-02-24"
  },
  {
    "human": "10/13/85",
    "machine": "1985-10-13"
  },
  {
    "human": "1971.05.01 ad",
    "machine": "1971-05-01"
  },
  {
    "human": "9/16/15",
    "machine": "2015-09-16"
  },
  {
    "human": "2003-06-18",
    "machine": "2003-06-18"
  },
  {
    "human": "28 jul, 1975",
    "machine": "1975-07-28"
  },
  {
    "human": "2025.10.30 ad",
    "machine": "2025-10-30"
  },
  {
    "human": "72.05.7",
    "machine": "1972-05-07"
  },
  {
    "human": "2015/02/05",
    "machine": "2015-02-05"
  },
  {
    "human": "07.08.1973",
    "machine": "1973-08-07"
  },
  {
    "human": "january 14, 2008",
    "machine": "2008-01-14"
  },
  {
    "human": "08/03/1998",
    "machine": "1998-08-03"
  },
  {
    "human": "2019/12/28",
    "machine": "2019-12-28"
  },
  {
    "human": "mon, feb 24, 03",
    "machine": "2003-02-24"
  },
  {
    "human": "2014/11/10",
    "machine": "2014-11-10"
  },
  {
    "human": "jun 21, 20",
    "machine": "2020-06-21"
  },
  {
    "human": "3/13/97",
    "machine": "1997-03-13"
  },
  {
    "human": "october 04, 2019",
    "machine": "2019-10-04"
  },
  {
    "human": "october 18, 1984",
    "machine": "1984-10-18"
  },
  {
    "human": "3/3/82",
    "machine": "1982-03-03"
  },
  {
    "human": "29/03/2017",
    "machine": "2017-03-29"
  },
  {
    "human": "1997-01-16",
    "machine": "1997-01-16"
  },
  {
    "human": "april 18, 1986",
    "machine": "1986-04-18"
  },
  {
    "human": "9/18/00",
    "machine": "2000-09-18"
  },
  {
    "human": "24 apr, 1984",
    "machine": "1984-04-24"
  },
  {
    "human": "6/19/04",
    "machine": "2004-06-19"
  },
  {
    "human": "27.02.2018",
    "machine": "2018-02-27"
  },
  {
    "human": "sunday, march 17, 1974",
    "machine": "1974-03-17"
  },
  {
    "human": "29.05.2012",
    "machine": "2012-05-29"
  },
  {
    "human": "81-06-02",
    "machine": "1981-06-02"
  },
  {
    "human": "01.07.1998",
    "machine": "1998-07-01"
  },
  {
    "human": "19 jun, 2009",
    "machine": "2009-06-19"
  },
  {
    "human": "dec 11, 2016",
    "machine": "2016-12-11"
  },
  {
    "human": "sep 3, 77",
    "machine": "1977-09-03"
  },
  {
    "human": "08 january 2008",
    "machine": "2008-01-08"
  },
  {
    "human": "1/30/92",
    "machine": "1992-01-30"
  },
  {
    "human": "23.9.85",
    "machine": "1985-09-23"
  },
  {
    "human": "2003-04-08",
    "machine": "2003-04-08"
  },
  {
    "human": "oct 24, 81",
    "machine": "1981-10-24"
  },
  {
    "human": "1995.08.17 ad",
    "machine": "1995-08-17"
  },
  {
    "human": "february 11, 1985",
    "machine": "1985-02-11"
  },
  {
    "human": "75-03-21",
    "machine": "1975-03-21"
  },
  {
    "human": "wednesday, may 2, 2018",
    "machine": "2018-05-02"
  },
  {
    "human": "26 jan, 1994",
    "machine": "1994-01-26"
  },
  {
    "human": "18, apr 2011",
    "machine": "2011-04-18"
  },
  {
    "human": "05.08.2025",
    "machine": "2025-08-05"
  },
  {
    "human": "05-26-83",
    "machine": "1983-05-26"
  },
  {
    "human": "january 31, 1996",
    "machine": "1996-01-31"
  },
  {
    "human": "february 21, 1993",
    "machine": "1993-02-21"
  },
  {
    "human": "thursday, january 26, 1995",
    "machine": "1995-01-26"
  },
  {
    "human": "jan 30, 18",
    "machine": "2018-01-30"
  },
  {
    "human": "22.3.86",
    "machine": "1986-03-22"
  },
  {
    "human": "fri, feb 17, 95",
    "machine": "1995-02-17"
  },
  {
    "human": "07-25-01",
    "machine": "2001-07-25"
  },
  {
    "human": "9/2/86",
    "machine": "1986-09-02"
  },
  {
    "human": "12/13/73",
    "machine": "1973-12-13"
  },
  {
    "human": "fri, oct 21, 16",
    "machine": "2016-10-21"
  },
  {
    "human": "28 september 2014",
    "machine": "2014-09-28"
  },
  {
    "human": "2008/01/26",
    "machine": "2008-01-26"
  },
  {
    "human": "21 apr 1984",
    "machine": "1984-04-21"
  },
  {
    "human": "monday, may 16, 2011",
    "machine": "2011-05-16"
  },
  {
    "human": "9/11/1990",
    "machine": "1990-11-09"
  },
  {
    "human": "4 jun, 1971",
    "machine": "1971-06-04"
  },
  {
    "human": "6/8/85",
    "machine": "1985-06-08"
  },
  {
    "human": "jun 29, 93",
    "machine": "1993-06-29"
  },
  {
    "human": "06/13/2019",
    "machine": "2019-06-13"
  },
  {
    "human": "1996.04.07 ad",
    "machine": "1996-04-07"
  },
  {
    "human": "4 feb, 2013",
    "machine": "2013-02-04"
  },
  {
    "human": "sunday, october 17, 1999",
    "machine": "1999-10-17"
  },
  {
    "human": "13.5.11",
    "machine": "2011-05-13"
  },
  {
    "human": "2017-03-19",
    "machine": "2017-03-19"
  },
  {
    "human": "4/10/1991",
    "machine": "1991-10-04"
  },
  {
    "human": "26.9.05",
    "machine": "2005-09-26"
  },
  {
    "human": "28.09.2021",
    "machine": "2021-09-28"
  },
  {
    "human": "oct 7, 90",
    "machine": "1990-10-07"
  },
  {
    "human": "june 08, 2022",
    "machine": "2022-06-08"
  },
  {
    "human": "14.06.1977",
    "machine": "1977-06-14"
  },
  {
    "human": "20/12/1988",
    "machine": "1988-12-20"
  },
  {
    "human": "sep 18, 2023",
    "machine": "2023-09-18"
  },
  {
    "human": "nov 22, 76",
    "machine": "1976-11-22"
  },
  {
    "human": "24.08.1998",
    "machine": "1998-08-24"
  },
  {
    "human": "6/1/82",
    "machine": "1982-06-01"
  },
  {
    "human": "14 sep, 2014",
    "machine": "2014-09-14"
  },
  {
    "human": "01-21-84",
    "machine": "1984-01-21"
  },
  {
    "human": "tuesday, january 16, 2007",
    "machine": "2007-01-16"
  },
  {
    "human": "1997-04-20",
    "machine": "1997-04-20"
  },
  {
    "human": "dec 27, 92",
    "machine": "1992-12-27"
  },
  {
    "human": "17-aug-1982",
    "machine": "1982-08-17"
  },
  {
    "human": "april 25, 2017",
    "machine": "2017-04-25"
  },
  {
    "human": "28 april 1992",
    "machine": "1992-04-28"
  },
  {
    "human": "7 oct, 2009",
    "machine": "2009-10-07"
  },
  {
    "human": "5/15/88",
    "machine": "1988-05-15"
  },
  {
    "human": "1971-06-13",
    "machine": "1971-06-13"
  },
  {
    "human": "10-21-19",
    "machine": "2019-10-21"
  },
  {
    "human": "6.10.09",
    "machine": "2009-10-06"
  },
  {
    "human": "05.09.1977",
    "machine": "1977-09-05"
  },
  {
    "human": "tuesday, august 29, 2000",
    "machine": "2000-08-29"
  },
  {
    "human": "sunday, november 11, 1984",
    "machine": "1984-11-11"
  },
  {
    "human": "september 19, 2006",
    "machine": "2006-09-19"
  },
  {
    "human": "july 18, 1992",
    "machine": "1992-07-18"
  },
  {
    "human": "march 31, 1988",
    "machine": "1988-03-31"
  },
  {
    "human": "13 feb 1990",
    "machine": "1990-02-13"
  },
  {
    "human": "02-28-95",
    "machine": "1995-02-28"
  },
  {
    "human": "mon, oct 29, 79",
    "machine": "1979-10-29"
  },
  {
    "human": "2015.03.01 ad",
    "machine": "2015-03-01"
  },
  {
    "human": "saturday, october 28, 2006",
    "machine": "2006-10-28"
  },
  {
    "human": "2005.10.09 ad",
    "machine": "2005-10-09"
  },
  {
    "human": "15 march 2010",
    "machine": "2010-03-15"
  },
  {
    "human": "sun, jan 11, 98",
    "machine": "1998-01-11"
  },
  {
    "human": "nov 23 2006",
    "machine": "2006-11-23"
  },
  {
    "human": "august 14, 1992",
    "machine": "1992-08-14"
  },
  {
    "human": "4/23/92",
    "machine": "1992-04-23"
  },
  {
    "human": "07 june 1983",
    "machine": "1983-06-07"
  },
  {
    "human": "january 18, 1997",
    "machine": "1997-01-18"
  },
  {
    "human": "5/06/1975",
    "machine": "1975-06-05"
  },
  {
    "human": "dec 15, 1989",
    "machine": "1989-12-15"
  },
  {
    "human": "february 9, 2024",
    "machine": "2024-02-09"
  },
  {
    "human": "wednesday, december 10, 2003",
    "machine": "2003-12-10"
  },
  {
    "human": "1/22/91",
    "machine": "1991-01-22"
  },
  {
    "human": "11/20/04",
    "machine": "2004-11-20"
  },
  {
    "human": "sun, mar 28, 71",
    "machine": "1971-03-28"
  },
  {
    "human": "october 2, 1983",
    "machine": "1983-10-02"
  },
  {
    "human": "85-06-12",
    "machine": "1985-06-12"
  },
  {
    "human": "08/05/1980",
    "machine": "1980-08-05"
  },
  {
    "human": "23/09/2011",
    "machine": "2011-09-23"
  },
  {
    "human": "6.2.82",
    "machine": "1982-02-06"
  },
  {
    "human": "august 20, 1986",
    "machine": "1986-08-20"
  },
  {
    "human": "01/13/1980",
    "machine": "1980-01-13"
  },
  {
    "human": "dec 13 2023",
    "machine": "2023-12-13"
  },
  {
    "human": "24-mar-1973",
    "machine": "1973-03-24"
  },
  {
    "human": "jan 17, 25",
    "machine": "2025-01-17"
  },
  {
    "human": "apr 28, 2001",
    "machine": "2001-04-28"
  },
  {
    "human": "5-feb-1973",
    "machine": "1973-02-05"
  },
  {
    "human": "01-14-22",
    "machine": "2022-01-14"
  },
  {
    "human": "06-03-29",
    "machine": "2006-03-29"
  },
  {
    "human": "may 07, 1989",
    "machine": "1989-05-07"
  },
  {
    "human": "july 27, 1994",
    "machine": "1994-07-27"
  },
  {
    "human": "1994-04-13",
    "machine": "1994-04-13"
  },
  {
    "human": "sun, jan 27, 13",
    "machine": "2013-01-27"
  },
  {
    "human": "76-03-02",
    "machine": "1976-03-02"
  },
  {
    "human": "5 nov 1999",
    "machine": "1999-11-05"
  },
  {
    "human": "sun, aug 15, 10",
    "machine": "2010-08-15"
  },
  {
    "human": "18 october 1983",
    "machine": "1983-10-18"
  },
  {
    "human": "5.10.79",
    "machine": "1979-10-05"
  },
  {
    "human": "saturday, february 26, 1972",
    "machine": "1972-02-26"
  },
  {
    "human": "12 december 2022",
    "machine": "2022-12-12"
  },
  {
    "human": "11.11.81",
    "machine": "1981-11-11"
  },
  {
    "human": "15.09.1997",
    "machine": "1997-09-15"
  },
  {
    "human": "02.10.31",
    "machine": "2002-10-31"
  },
  {
    "human": "sat, nov 10, 73",
    "machine": "1973-11-10"
  },
  {
    "human": "06.12.2015",
    "machine": "2015-12-06"
  },
  {
    "human": "may 26, 1989",
    "machine": "1989-05-26"
  },
  {
    "human": "81.02.26",
    "machine": "1981-02-26"
  },
  {
    "human": "may 21 2005",
    "machine": "2005-05-21"
  },
  {
    "human": "11 jul 1972",
    "machine": "1972-07-11"
  },
  {
    "human": "11-29-14",
    "machine": "2014-11-29"
  },
  {
    "human": "08/13/2025",
    "machine": "2025-08-13"
  },
  {
    "human": "20 feb, 1995",
    "machine": "1995-02-20"
  },
  {
    "human": "13 nov, 2014",
    "machine": "2014-11-13"
  },
  {
    "human": "jan 31 1972",
    "machine": "1972-01-31"
  },
  {
    "human": "november 3, 2002",
    "machine": "2002-11-03"
  },
  {
    "human": "november 20, 1976",
    "machine": "1976-11-20"
  },
  {
    "human": "2014-05-5",
    "machine": "2014-05-05"
  },
  {
    "human": "05.08.1990",
    "machine": "1990-08-05"
  },
  {
    "human": "feb 12, 2010",
    "machine": "2010-02-12"
  },
  {
    "human": "2023.01.21 ad",
    "machine": "2023-01-21"
  },
  {
    "human": "19.06.1971",
    "machine": "1971-06-19"
  },
  {
    "human": "10/13/2013",
    "machine": "2013-10-13"
  },
  {
    "human": "25-08-29",
    "machine": "2025-08-29"
  },
  {
    "human": "24 december 1977",
    "machine": "1977-12-24"
  },
  {
    "human": "7.6.91",
    "machine": "1991-06-07"
  },
  {
    "human": "17.06.1990",
    "machine": "1990-06-17"
  },
  {
    "human": "saturday, august 21, 1993",
    "machine": "1993-08-21"
  },
  {
    "human": "16 september 2021",
    "machine": "2021-09-16"
  },
  {
    "human": "78-09-27",
    "machine": "1978-09-27"
  },
  {
    "human": "1991/03/22",
    "machine": "1991-03-22"
  },
  {
    "human": "01/24/1993",
    "machine": "1993-01-24"
  },
  {
    "human": "9/20/80",
    "machine": "1980-09-20"
  },
  {
    "human": "2/11/1975",
    "machine": "1975-11-02"
  },
  {
    "human": "sunday, january 22, 1995",
    "machine": "1995-01-22"
  },
  {
    "human": "2/3/95",
    "machine": "1995-02-03"
  },
  {
    "human": "10 jul 2020",
    "machine": "2020-07-10"
  },
  {
    "human": "apr 3, 79",
    "machine": "1979-04-03"
  },
  {
    "human": "may 25, 2023",
    "machine": "2023-05-25"
  },
  {
    "human": "jun 17, 1982",
    "machine": "1982-06-17"
  },
  {
    "human": "apr 25, 1985",
    "machine": "1985-04-25"
  },
  {
    "human": "saturday, july 16, 2022",
    "machine": "2022-07-16"
  },
  {
    "human": "10.8.72",
    "machine": "1972-08-10"
  },
  {
    "human": "14, mar 2010",
    "machine": "2010-03-14"
  },
  {
    "human": "91-10-30",
    "machine": "1991-10-30"
  },
  {
    "human": "19 july 1974",
    "machine": "1974-07-19"
  },
  {
    "human": "6/03/1992",
    "machine": "1992-03-06"
  },
  {
    "human": "1994/04/14",
    "machine": "1994-04-14"
  },
  {
    "human": "sun, sep 14, 80",
    "machine": "1980-09-14"
  },
  {
    "human": "june 02, 2014",
    "machine": "2014-06-02"
  },
  {
    "human": "november 28, 1983",
    "machine": "1983-11-28"
  },
  {
    "human": "1971.05.21 ad",
    "machine": "1971-05-21"
  },
  {
    "human": "17.11.1976",
    "machine": "1976-11-17"
  },
  {
    "human": "82-05-29",
    "machine": "1982-05-29"
  },
  {
    "human": "january 15, 1977",
    "machine": "1977-01-15"
  },
  {
    "human": "2018-11-5",
    "machine": "2018-11-05"
  },
  {
    "human": "12/27/01",
    "machine": "2001-12-27"
  },
  {
    "human": "26.05.1971",
    "machine": "1971-05-26"
  },
  {
    "human": "12.04.1989",
    "machine": "1989-04-12"
  },
  {
    "human": "15.05.1981",
    "machine": "1981-05-15"
  },
  {
    "human": "2/15/70",
    "machine": "1970-02-15"
  },
  {
    "human": "july 10, 1975",
    "machine": "1975-07-10"
  },
  {
    "human": "may 27, 1975",
    "machine": "1975-05-27"
  },
  {
    "human": "15.08.5",
    "machine": "2015-08-05"
  },
  {
    "human": "thursday, november 3, 2011",
    "machine": "2011-11-03"
  },
  {
    "human": "sep 22 2022",
    "machine": "2022-09-22"
  },
  {
    "human": "thursday, april 30, 1992",
    "machine": "1992-04-30"
  },
  {
    "human": "2000/07/22",
    "machine": "2000-07-22"
  },
  {
    "human": "mon, nov 29, 10",
    "machine": "2010-11-29"
  },
  {
    "human": "thu, may 23, 74",
    "machine": "1974-05-23"
  },
  {
    "human": "friday, may 5, 2000",
    "machine": "2000-05-05"
  },
  {
    "human": "5/06/2011",
    "machine": "2011-06-05"
  },
  {
    "human": "1996-02-15",
    "machine": "1996-02-15"
  },
  {
    "human": "2006.06.29 ad",
    "machine": "2006-06-29"
  },
  {
    "human": "2021-04-09",
    "machine": "2021-04-09"
  },
  {
    "human": "sunday, january 15, 1984",
    "machine": "1984-01-15"
  },
  {
    "human": "feb 12, 2019",
    "machine": "2019-02-12"
  },
  {
    "human": "15 jan, 1978",
    "machine": "1978-01-15"
  },
  {
    "human": "july 5, 2025",
    "machine": "2025-07-05"
  },
  {
    "human": "78-12-29",
    "machine": "1978-12-29"
  },
  {
    "human": "04-28-88",
    "machine": "1988-04-28"
  },
  {
    "human": "december 28, 2011",
    "machine": "2011-12-28"
  },
  {
    "human": "friday, september 30, 2005",
    "machine": "2005-09-30"
  },
  {
    "human": "fri, dec 3, 82",
    "machine": "1982-12-03"
  },
  {
    "human": "3 may 1998",
    "machine": "1998-05-03"
  },
  {
    "human": "june 20, 1979",
    "machine": "1979-06-20"
  },
  {
    "human": "03/24/1993",
    "machine": "1993-03-24"
  },
  {
    "human": "thursday, october 2, 1997",
    "machine": "1997-10-02"
  },
  {
    "human": "january 10, 2018",
    "machine": "2018-01-10"
  },
  {
    "human": "fri, nov 27, 87",
    "machine": "1987-11-27"
  },
  {
    "human": "april 22, 1971",
    "machine": "1971-04-22"
  },
  {
    "human": "08/02/1997",
    "machine": "1997-08-02"
  },
  {
    "human": "5/22/75",
    "machine": "1975-05-22"
  },
  {
    "human": "18-oct-1972",
    "machine": "1972-10-18"
  },
  {
    "human": "11/7/75",
    "machine": "1975-11-07"
  },
  {
    "human": "16, may 1997",
    "machine": "1997-05-16"
  },
  {
    "human": "jun 11, 22",
    "machine": "2022-06-11"
  },
  {
    "human": "24 jan, 2025",
    "machine": "2025-01-24"
  },
  {
    "human": "december 15, 2015",
    "machine": "2015-12-15"
  },
  {
    "human": "15-may-2019",
    "machine": "2019-05-15"
  },
  {
    "human": "10 aug 1989",
    "machine": "1989-08-10"
  },
  {
    "human": "13.4.18",
    "machine": "2018-04-13"
  },
  {
    "human": "14-apr-1992",
    "machine": "1992-04-14"
  },
  {
    "human": "03 september 2001",
    "machine": "2001-09-03"
  },
  {
    "human": "73-03-06",
    "machine": "1973-03-06"
  },
  {
    "human": "20.8.23",
    "machine": "2023-08-20"
  },
  {
    "human": "friday, september 15, 1978",
    "machine": "1978-09-15"
  },
  {
    "human": "15-apr-2003",
    "machine": "2003-04-15"
  },
  {
    "human": "6/4/90",
    "machine": "1990-06-04"
  },
  {
    "human": "09/09/2000",
    "machine": "2000-09-09"
  },
  {
    "human": "07.09.10",
    "machine": "2007-09-10"
  },
  {
    "human": "6/9/71",
    "machine": "1971-06-09"
  },
  {
    "human": "2 july 2005",
    "machine": "2005-07-02"
  },
  {
    "human": "22/05/1970",
    "machine": "1970-05-22"
  },
  {
    "human": "2007/07/20",
    "machine": "2007-07-20"
  },
  {
    "human": "2025-02-15",
    "machine": "2025-02-15"
  },
  {
    "human": "saturday, september 29, 1990",
    "machine": "1990-09-29"
  },
  {
    "human": "2023/09/30",
    "machine": "2023-09-30"
  },
  {
    "human": "21-04-17",
    "machine": "2021-04-17"
  },
  {
    "human": "november 19, 2011",
    "machine": "2011-11-19"
  },
  {
    "human": "04-14-11",
    "machine": "2011-04-14"
  },
  {
    "human": "2005/09/02",
    "machine": "2005-09-02"
  },
  {
    "human": "24.05.1992",
    "machine": "1992-05-24"
  },
  {
    "human": "03-13-92",
    "machine": "1992-03-13"
  },
  {
    "human": "09 april 1977",
    "machine": "1977-04-09"
  },
  {
    "human": "1984-02-01",
    "machine": "1984-02-01"
  },
  {
    "human": "1/21/95",
    "machine": "1995-01-21"
  },
  {
    "human": "16 apr 1989",
    "machine": "1989-04-16"
  },
  {
    "human": "07-26-75",
    "machine": "1975-07-26"
  },
  {
    "human": "dec 1, 1990",
    "machine": "1990-12-01"
  },
  {
    "human": "12-10-00",
    "machine": "2000-12-10"
  },
  {
    "human": "13.03.2010",
    "machine": "2010-03-13"
  },
  {
    "human": "tue, mar 9, 10",
    "machine": "2010-03-09"
  },
  {
    "human": "1974-11-9",
    "machine": "1974-11-09"
  },
  {
    "human": "18 july 2003",
    "machine": "2003-07-18"
  },
  {
    "human": "12-01-29",
    "machine": "2012-01-29"
  },
  {
    "human": "12 jul, 1977",
    "machine": "1977-07-12"
  },
  {
    "human": "2006-08-23",
    "machine": "2006-08-23"
  },
  {
    "human": "july 18, 1985",
    "machine": "1985-07-18"
  },
  {
    "human": "2020-05-22",
    "machine": "2020-05-22"
  },
  {
    "human": "tue, oct 12, 99",
    "machine": "1999-10-12"
  },
  {
    "human": "26 may 1980",
    "machine": "1980-05-26"
  },
  {
    "human": "1988-05-10",
    "machine": "1988-05-10"
  },
  {
    "human": "april 5, 1988",
    "machine": "1988-04-05"
  },
  {
    "human": "25.2.98",
    "machine": "1998-02-25"
  },
  {
    "human": "27 feb, 2002",
    "machine": "2002-02-27"
  },
  {
    "human": "11.3.91",
    "machine": "1991-03-11"
  },
  {
    "human": "20, dec 1999",
    "machine": "1999-12-20"
  },
  {
    "human": "aug 11, 2008",
    "machine": "2008-08-11"
  },
  {
    "human": "2 may 1987",
    "machine": "1987-05-02"
  },
  {
    "human": "3-sep-1974",
    "machine": "1974-09-03"
  },
  {
    "human": "dec 25, 80",
    "machine": "1980-12-25"
  },
  {
    "human": "31 october 2001",
    "machine": "2001-10-31"
  },
  {
    "human": "07/10/1978",
    "machine": "1978-07-10"
  },
  {
    "human": "2009/02/10",
    "machine": "2009-02-10"
  },
  {
    "human": "03-11-79",
    "machine": "1979-03-11"
  },
  {
    "human": "13 september 2011",
    "machine": "2011-09-13"
  },
  {
    "human": "april 23, 2006",
    "machine": "2006-04-23"
  },
  {
    "human": "may 19 1983",
    "machine": "1983-05-19"
  },
  {
    "human": "sunday, august 31, 1980",
    "machine": "1980-08-31"
  },
  {
    "human": "08-29-23",
    "machine": "2023-08-29"
  },
  {
    "human": "01, may 1988",
    "machine": "1988-05-01"
  },
  {
    "human": "aug 4, 78",
    "machine": "1978-08-04"
  },
  {
    "human": "03-14-17",
    "machine": "2017-03-14"
  },
  {
    "human": "january 24, 1991",
    "machine": "1991-01-24"
  },
  {
    "human": "2003/02/18",
    "machine": "2003-02-18"
  },
  {
    "human": "25 mar 1997",
    "machine": "1997-03-25"
  },
  {
    "human": "jun 20, 2015",
    "machine": "2015-06-20"
  },
  {
    "human": "7 jul, 2006",
    "machine": "2006-07-07"
  },
  {
    "human": "05, jun 1986",
    "machine": "1986-06-05"
  },
  {
    "human": "december 11, 2007",
    "machine": "2007-12-11"
  },
  {
    "human": "24 may 1976",
    "machine": "1976-05-24"
  },
  {
    "human": "08-09-73",
    "machine": "1973-08-09"
  },
  {
    "human": "02 october 2001",
    "machine": "2001-10-02"
  },
  {
    "human": "2010/04/30",
    "machine": "2010-04-30"
  },
  {
    "human": "friday, july 25, 2014",
    "machine": "2014-07-25"
  },
  {
    "human": "02/11/1984",
    "machine": "1984-02-11"
  },
  {
    "human": "12/31/2000",
    "machine": "2000-12-31"
  },
  {
    "human": "15 dec, 1985",
    "machine": "1985-12-15"
  },
  {
    "human": "may 19, 73",
    "machine": "1973-05-19"
  },
  {
    "human": "13.11.7",
    "machine": "2013-11-07"
  },
  {
    "human": "22 november 1994",
    "machine": "1994-11-22"
  },
  {
    "human": "18 feb, 1983",
    "machine": "1983-02-18"
  },
  {
    "human": "18, feb 2018",
    "machine": "2018-02-18"
  },
  {
    "human": "july 28, 1974",
    "machine": "1974-07-28"
  },
  {
    "human": "3/11/14",
    "machine": "2014-03-11"
  },
  {
    "human": "22 feb, 2023",
    "machine": "2023-02-22"
  },
  {
    "human": "10/05/2016",
    "machine": "2016-10-05"
  },
  {
    "human": "2012.02.02 ad",
    "machine": "2012-02-02"
  },
  {
    "human": "15 feb 2023",
    "machine": "2023-02-15"
  },
  {
    "human": "13.1.91",
    "machine": "1991-01-13"
  },
  {
    "human": "18, jan 2000",
    "machine": "2000-01-18"
  },
  {
    "human": "2017.08.17 ad",
    "machine": "2017-08-17"
  },
  {
    "human": "1980/02/09",
    "machine": "1980-02-09"
  },
  {
    "human": "24-nov-1984",
    "machine": "1984-11-24"
  },
  {
    "human": "14, may 2009",
    "machine": "2009-05-14"
  },
  {
    "human": "16 january 1992",
    "machine": "1992-01-16"
  },
  {
    "human": "11-10-85",
    "machine": "1985-11-10"
  },
  {
    "human": "26-jun-1995",
    "machine": "1995-06-26"
  },
  {
    "human": "13.07.23",
    "machine": "2013-07-23"
  },
  {
    "human": "07.06.10",
    "machine": "2007-06-10"
  },
  {
    "human": "1/15/21",
    "machine": "2021-01-15"
  },
  {
    "human": "1 jun, 1989",
    "machine": "1989-06-01"
  },
  {
    "human": "4/28/88",
    "machine": "1988-04-28"
  },
  {
    "human": "12 dec 2016",
    "machine": "2016-12-12"
  },
  {
    "human": "saturday, april 9, 1977",
    "machine": "1977-04-09"
  },
  {
    "human": "august 18, 1981",
    "machine": "1981-08-18"
  },
  {
    "human": "22-11-03",
    "machine": "2022-11-03"
  },
  {
    "human": "11/06/1971",
    "machine": "1971-06-11"
  },
  {
    "human": "5 dec, 2017",
    "machine": "2017-12-05"
  },
  {
    "human": "29 dec 1988",
    "machine": "1988-12-29"
  },
  {
    "human": "28 mar, 1982",
    "machine": "1982-03-28"
  },
  {
    "human": "august 24, 2002",
    "machine": "2002-08-24"
  },
  {
    "human": "12/15/02",
    "machine": "2002-12-15"
  },
  {
    "human": "18 june 2024",
    "machine": "2024-06-18"
  },
  {
    "human": "23-aug-1979",
    "machine": "1979-08-23"
  },
  {
    "human": "90.07.16",
    "machine": "1990-07-16"
  },
  {
    "human": "1981-10-14",
    "machine": "1981-10-14"
  },
  {
    "human": "december 13, 1980",
    "machine": "1980-12-13"
  },
  {
    "human": "1978-09-28",
    "machine": "1978-09-28"
  },
  {
    "human": "23/04/1990",
    "machine": "1990-04-23"
  },
  {
    "human": "16-08-07",
    "machine": "2016-08-07"
  },
  {
    "human": "22, aug 2002",
    "machine": "2002-08-22"
  },
  {
    "human": "2006-12-30",
    "machine": "2006-12-30"
  },
  {
    "human": "feb 20 2005",
    "machine": "2005-02-20"
  },
  {
    "human": "wed, jul 28, 82",
    "machine": "1982-07-28"
  },
  {
    "human": "03, dec 2005",
    "machine": "2005-12-03"
  },
  {
    "human": "06.10.1970",
    "machine": "1970-10-06"
  },
  {
    "human": "24.2.81",
    "machine": "1981-02-24"
  },
  {
    "human": "09/15/1977",
    "machine": "1977-09-15"
  },
  {
    "human": "apr 6, 1980",
    "machine": "1980-04-06"
  },
  {
    "human": "oct 1, 11",
    "machine": "2011-10-01"
  },
  {
    "human": "august 29, 1984",
    "machine": "1984-08-29"
  },
  {
    "human": "saturday, march 25, 2006",
    "machine": "2006-03-25"
  },
  {
    "human": "wed, feb 12, 92",
    "machine": "1992-02-12"
  },
  {
    "human": "19-nov-1985",
    "machine": "1985-11-19"
  },
  {
    "human": "nov 15 2000",
    "machine": "2000-11-15"
  },
  {
    "human": "31, may 2001",
    "machine": "2001-05-31"
  },
  {
    "human": "09-14-86",
    "machine": "1986-09-14"
  },
  {
    "human": "10/22/80",
    "machine": "1980-10-22"
  },
  {
    "human": "2008-09-21",
    "machine": "2008-09-21"
  },
  {
    "human": "04-17-77",
    "machine": "1977-04-17"
  },
  {
    "human": "september 17, 1981",
    "machine": "1981-09-17"
  },
  {
    "human": "03, oct 2013",
    "machine": "2013-10-03"
  },
  {
    "human": "1/06/2015",
    "machine": "2015-06-01"
  },
  {
    "human": "1970/06/27",
    "machine": "1970-06-27"
  },
  {
    "human": "1/21/12",
    "machine": "2012-01-21"
  },
  {
    "human": "tuesday, may 12, 1987",
    "machine": "1987-05-12"
  },
  {
    "human": "18 apr 1971",
    "machine": "1971-04-18"
  },
  {
    "human": "2008-03-22",
    "machine": "2008-03-22"
  },
  {
    "human": "january 11, 2017",
    "machine": "2017-01-11"
  },
  {
    "human": "12.06.1993",
    "machine": "1993-06-12"
  },
  {
    "human": "1984-03-19",
    "machine": "1984-03-19"
  },
  {
    "human": "saturday, april 5, 2008",
    "machine": "2008-04-05"
  },
  {
    "human": "sun, oct 18, 09",
    "machine": "2009-10-18"
  },
  {
    "human": "8 mar 1990",
    "machine": "1990-03-08"
  },
  {
    "human": "08/01/2019",
    "machine": "2019-08-01"
  },
  {
    "human": "may 27 2011",
    "machine": "2011-05-27"
  },
  {
    "human": "2019-10-26",
    "machine": "2019-10-26"
  },
  {
    "human": "16 september 2007",
    "machine": "2007-09-16"
  },
  {
    "human": "07-07-21",
    "machine": "2021-07-07"
  },
  {
    "human": "9-jun-1995",
    "machine": "1995-06-09"
  },
  {
    "human": "1986/02/03",
    "machine": "1986-02-03"
  },
  {
    "human": "saturday, february 28, 1987",
    "machine": "1987-02-28"
  },
  {
    "human": "21, jan 1981",
    "machine": "1981-01-21"
  },
  {
    "human": "2008.06.05 ad",
    "machine": "2008-06-05"
  },
  {
    "human": "04-18-20",
    "machine": "2020-04-18"
  },
  {
    "human": "thursday, march 3, 1977",
    "machine": "1977-03-03"
  },
  {
    "human": "72.04.18",
    "machine": "1972-04-18"
  },
  {
    "human": "apr 22, 1990",
    "machine": "1990-04-22"
  },
  {
    "human": "jul 19, 91",
    "machine": "1991-07-19"
  },
  {
    "human": "sep 10, 2008",
    "machine": "2008-09-10"
  },
  {
    "human": "06, may 2021",
    "machine": "2021-05-06"
  },
  {
    "human": "96-04-21",
    "machine": "1996-04-21"
  },
  {
    "human": "16/02/1999",
    "machine": "1999-02-16"
  },
  {
    "human": "16/01/2020",
    "machine": "2020-01-16"
  },
  {
    "human": "06 july 2011",
    "machine": "2011-07-06"
  },
  {
    "human": "1995-08-10",
    "machine": "1995-08-10"
  },
  {
    "human": "december 26, 1993",
    "machine": "1993-12-26"
  },
  {
    "human": "2.3.75",
    "machine": "1975-03-02"
  },
  {
    "human": "06, oct 1979",
    "machine": "1979-10-06"
  },
  {
    "human": "10.11.24",
    "machine": "2024-11-10"
  },
  {
    "human": "07/20/2018",
    "machine": "2018-07-20"
  },
  {
    "human": "1992-07-18",
    "machine": "1992-07-18"
  },
  {
    "human": "10/16/95",
    "machine": "1995-10-16"
  },
  {
    "human": "17.11.2006",
    "machine": "2006-11-17"
  },
  {
    "human": "81-05-31",
    "machine": "1981-05-31"
  },
  {
    "human": "1987-11-20",
    "machine": "1987-11-20"
  },
  {
    "human": "oct 14 1986",
    "machine": "1986-10-14"
  },
  {
    "human": "15, feb 2005",
    "machine": "2005-02-15"
  },
  {
    "human": "27 mar 2020",
    "machine": "2020-03-27"
  },
  {
    "human": "16, jul 1995",
    "machine": "1995-07-16"
  },
  {
    "human": "17 april 2022",
    "machine": "2022-04-17"
  },
  {
    "human": "sat, may 15, 71",
    "machine": "1971-05-15"
  },
  {
    "human": "sun, oct 6, 74",
    "machine": "1974-10-06"
  },
  {
    "human": "oct 21 1970",
    "machine": "1970-10-21"
  },
  {
    "human": "11/06/2025",
    "machine": "2025-11-06"
  },
  {
    "human": "01/02/2003",
    "machine": "2003-01-02"
  },
  {
    "human": "3 apr 1972",
    "machine": "1972-04-03"
  },
  {
    "human": "7/19/72",
    "machine": "1972-07-19"
  },
  {
    "human": "2013.10.18 ad",
    "machine": "2013-10-18"
  },
  {
    "human": "oct 8 1972",
    "machine": "1972-10-08"
  },
  {
    "human": "11-oct-1996",
    "machine": "1996-10-11"
  },
  {
    "human": "24, may 2001",
    "machine": "2001-05-24"
  },
  {
    "human": "23.05.1984",
    "machine": "1984-05-23"
  },
  {
    "human": "05-15-08",
    "machine": "2008-05-15"
  },
  {
    "human": "jun 20, 89",
    "machine": "1989-06-20"
  },
  {
    "human": "monday, may 23, 2011",
    "machine": "2011-05-23"
  },
  {
    "human": "april 07, 1998",
    "machine": "1998-04-07"
  },
  {
    "human": "27 nov, 2007",
    "machine": "2007-11-27"
  },
  {
    "human": "mon, nov 13, 00",
    "machine": "2000-11-13"
  },
  {
    "human": "oct 13 1977",
    "machine": "1977-10-13"
  },
  {
    "human": "20-nov-1977",
    "machine": "1977-11-20"
  },
  {
    "human": "28 august 1972",
    "machine": "1972-08-28"
  },
  {
    "human": "2018.02.11 ad",
    "machine": "2018-02-11"
  },
  {
    "human": "18-mar-1987",
    "machine": "1987-03-18"
  },
  {
    "human": "2011-01-13",
    "machine": "2011-01-13"
  },
  {
    "human": "17 feb 1999",
    "machine": "1999-02-17"
  },
  {
    "human": "wed, jan 30, 91",
    "machine": "1991-01-30"
  },
  {
    "human": "02-25-86",
    "machine": "1986-02-25"
  },
  {
    "human": "11.06.1991",
    "machine": "1991-06-11"
  },
  {
    "human": "5 april 1977",
    "machine": "1977-04-05"
  },
  {
    "human": "1981.10.11 ad",
    "machine": "1981-10-11"
  },
  {
    "human": "nov 25, 1973",
    "machine": "1973-11-25"
  },
  {
    "human": "2000/08/09",
    "machine": "2000-08-09"
  },
  {
    "human": "07/27/2006",
    "machine": "2006-07-27"
  },
  {
    "human": "25 october 2014",
    "machine": "2014-10-25"
  },
  {
    "human": "9/10/2008",
    "machine": "2008-10-09"
  },
  {
    "human": "dec 4, 2005",
    "machine": "2005-12-04"
  },
  {
    "human": "june 5, 1989",
    "machine": "1989-06-05"
  },
  {
    "human": "11/16/2024",
    "machine": "2024-11-16"
  },
  {
    "human": "04/23/1992",
    "machine": "1992-04-23"
  },
  {
    "human": "24 feb 2018",
    "machine": "2018-02-24"
  },
  {
    "human": "april 21, 2017",
    "machine": "2017-04-21"
  },
  {
    "human": "1980-03-02",
    "machine": "1980-03-02"
  },
  {
    "human": "1994-10-20",
    "machine": "1994-10-20"
  },
  {
    "human": "monday, march 17, 2025",
    "machine": "2025-03-17"
  },
  {
    "human": "13, jul 1974",
    "machine": "1974-07-13"
  },
  {
    "human": "june 25, 2001",
    "machine": "2001-06-25"
  },
  {
    "human": "1979-07-28",
    "machine": "1979-07-28"
  },
  {
    "human": "february 3, 1977",
    "machine": "1977-02-03"
  },
  {
    "human": "1974-09-13",
    "machine": "1974-09-13"
  },
  {
    "human": "1984/12/17",
    "machine": "1984-12-17"
  },
  {
    "human": "06.02.2003",
    "machine": "2003-02-06"
  },
  {
    "human": "dec 21 1976",
    "machine": "1976-12-21"
  },
  {
    "human": "january 23, 1984",
    "machine": "1984-01-23"
  },
  {
    "human": "24-09-12",
    "machine": "2024-09-12"
  },
  {
    "human": "25 may 2007",
    "machine": "2007-05-25"
  },
  {
    "human": "2018-08-31",
    "machine": "2018-08-31"
  },
  {
    "human": "15 november 1987",
    "machine": "1987-11-15"
  },
  {
    "human": "saturday, june 14, 2025",
    "machine": "2025-06-14"
  },
  {
    "human": "21 apr, 1974",
    "machine": "1974-04-21"
  },
  {
    "human": "thursday, october 11, 2012",
    "machine": "2012-10-11"
  },
  {
    "human": "4 nov, 2009",
    "machine": "2009-11-04"
  },
  {
    "human": "3 may, 1992",
    "machine": "1992-05-03"
  },
  {
    "human": "10 may, 2004",
    "machine": "2004-05-10"
  },
  {
    "human": "saturday, february 11, 1984",
    "machine": "1984-02-11"
  },
  {
    "human": "july 29, 1994",
    "machine": "1994-07-29"
  },
  {
    "human": "january 30, 2011",
    "machine": "2011-01-30"
  },
  {
    "human": "mar 14 2019",
    "machine": "2019-03-14"
  },
  {
    "human": "jul 18, 1996",
    "machine": "1996-07-18"
  },
  {
    "human": "1/7/20",
    "machine": "2020-01-07"
  },
  {
    "human": "oct 8, 78",
    "machine": "1978-10-08"
  },
  {
    "human": "oct 31, 24",
    "machine": "2024-10-31"
  },
  {
    "human": "fri, aug 25, 17",
    "machine": "2017-08-25"
  },
  {
    "human": "31.8.20",
    "machine": "2020-08-31"
  },
  {
    "human": "aug 18, 85",
    "machine": "1985-08-18"
  },
  {
    "human": "23.10.11",
    "machine": "2011-10-23"
  },
  {
    "human": "1977-06-28",
    "machine": "1977-06-28"
  },
  {
    "human": "apr 5, 71",
    "machine": "1971-04-05"
  },
  {
    "human": "april 10, 1979",
    "machine": "1979-04-10"
  },
  {
    "human": "22-jan-2007",
    "machine": "2007-01-22"
  },
  {
    "human": "7-mar-2001",
    "machine": "2001-03-07"
  },
  {
    "human": "september 26, 1975",
    "machine": "1975-09-26"
  },
  {
    "human": "18/04/1986",
    "machine": "1986-04-18"
  },
  {
    "human": "11/16/00",
    "machine": "2000-11-16"
  },
  {
    "human": "04, dec 2007",
    "machine": "2007-12-04"
  },
  {
    "human": "2000.01.31 ad",
    "machine": "2000-01-31"
  },
  {
    "human": "may 10, 1980",
    "machine": "1980-05-10"
  },
  {
    "human": "05-04-96",
    "machine": "1996-05-04"
  },
  {
    "human": "12 nov 1999",
    "machine": "1999-11-12"
  },
  {
    "human": "27 may 1986",
    "machine": "1986-05-27"
  },
  {
    "human": "3 nov 2008",
    "machine": "2008-11-03"
  },
  {
    "human": "17 may 1971",
    "machine": "1971-05-17"
  },
  {
    "human": "7/07/1993",
    "machine": "1993-07-07"
  },
  {
    "human": "sun, dec 11, 05",
    "machine": "2005-12-11"
  },
  {
    "human": "sunday, february 9, 1997",
    "machine": "1997-02-09"
  },
  {
    "human": "21/08/2004",
    "machine": "2004-08-21"
  },
  {
    "human": "1985-12-1",
    "machine": "1985-12-01"
  },
  {
    "human": "sep 1 1978",
    "machine": "1978-09-01"
  },
  {
    "human": "24-feb-1971",
    "machine": "1971-02-24"
  },
  {
    "human": "11.03.23",
    "machine": "2011-03-23"
  },
  {
    "human": "31.01.2025",
    "machine": "2025-01-31"
  },
  {
    "human": "november 23, 1988",
    "machine": "1988-11-23"
  },
  {
    "human": "1977-05-19",
    "machine": "1977-05-19"
  },
  {
    "human": "may 8 1993",
    "machine": "1993-05-08"
  },
  {
    "human": "91-08-14",
    "machine": "1991-08-14"
  },
  {
    "human": "06/04/1989",
    "machine": "1989-06-04"
  },
  {
    "human": "may 11, 2006",
    "machine": "2006-05-11"
  },
  {
    "human": "thu, sep 5, 91",
    "machine": "1991-09-05"
  },
  {
    "human": "1999.12.23 ad",
    "machine": "1999-12-23"
  },
  {
    "human": "2004.06.15 ad",
    "machine": "2004-06-15"
  },
  {
    "human": "december 18, 2021",
    "machine": "2021-12-18"
  },
  {
    "human": "10/04/1980",
    "machine": "1980-10-04"
  },
  {
    "human": "aug 24 2022",
    "machine": "2022-08-24"
  },
  {
    "human": "92.12.23",
    "machine": "1992-12-23"
  },
  {
    "human": "9/11/14",
    "machine": "2014-09-11"
  },
  {
    "human": "78-07-10",
    "machine": "1978-07-10"
  },
  {
    "human": "2008-12-21",
    "machine": "2008-12-21"
  },
  {
    "human": "15-jul-2002",
    "machine": "2002-07-15"
  },
  {
    "human": "16/07/1978",
    "machine": "1978-07-16"
  },
  {
    "human": "21 august 2024",
    "machine": "2024-08-21"
  },
  {
    "human": "25, oct 2004",
    "machine": "2004-10-25"
  },
  {
    "human": "1988.03.18 ad",
    "machine": "1988-03-18"
  },
  {
    "human": "2020.12.30 ad",
    "machine": "2020-12-30"
  },
  {
    "human": "mar 29 1996",
    "machine": "1996-03-29"
  },
  {
    "human": "01/12/1973",
    "machine": "1973-01-12"
  },
  {
    "human": "1/26/79",
    "machine": "1979-01-26"
  },
  {
    "human": "oct 14, 23",
    "machine": "2023-10-14"
  },
  {
    "human": "4/19/07",
    "machine": "2007-04-19"
  },
  {
    "human": "17.11.08",
    "machine": "2008-11-17"
  },
  {
    "human": "july 8, 2021",
    "machine": "2021-07-08"
  },
  {
    "human": "jul 2, 03",
    "machine": "2003-07-02"
  },
  {
    "human": "2001-04-11",
    "machine": "2001-04-11"
  },
  {
    "human": "october 6, 1976",
    "machine": "1976-10-06"
  },
  {
    "human": "june 07, 1977",
    "machine": "1977-06-07"
  },
  {
    "human": "jul 4, 09",
    "machine": "2009-07-04"
  },
  {
    "human": "11/04/2018",
    "machine": "2018-04-11"
  },
  {
    "human": "2010/10/20",
    "machine": "2010-10-20"
  },
  {
    "human": "15 march 1993",
    "machine": "1993-03-15"
  },
  {
    "human": "9/5/88",
    "machine": "1988-09-05"
  },
  {
    "human": "16-nov-1999",
    "machine": "1999-11-16"
  },
  {
    "human": "3/10/90",
    "machine": "1990-03-10"
  },
  {
    "human": "1996-03-24",
    "machine": "1996-03-24"
  },
  {
    "human": "may 23, 1997",
    "machine": "1997-05-23"
  },
  {
    "human": "nov 28, 86",
    "machine": "1986-11-28"
  },
  {
    "human": "1980/09/20",
    "machine": "1980-09-20"
  },
  {
    "human": "10 nov 2012",
    "machine": "2012-11-10"
  },
  {
    "human": "6 october 1982",
    "machine": "1982-10-06"
  },
  {
    "human": "01/11/1970",
    "machine": "1970-01-11"
  },
  {
    "human": "october 15, 2021",
    "machine": "2021-10-15"
  },
  {
    "human": "21 february 2003",
    "machine": "2003-02-21"
  },
  {
    "human": "2018-12-05",
    "machine": "2018-12-05"
  },
  {
    "human": "jun 28, 02",
    "machine": "2002-06-28"
  },
  {
    "human": "nov 18 1992",
    "machine": "1992-11-18"
  },
  {
    "human": "17-jan-1990",
    "machine": "1990-01-17"
  },
  {
    "human": "dec 2, 07",
    "machine": "2007-12-02"
  },
  {
    "human": "2019-04-30",
    "machine": "2019-04-30"
  },
  {
    "human": "september 16, 1993",
    "machine": "1993-09-16"
  },
  {
    "human": "09.06.1971",
    "machine": "1971-06-09"
  },
  {
    "human": "5.3.71",
    "machine": "1971-03-05"
  },
  {
    "human": "21-dec-1971",
    "machine": "1971-12-21"
  },
  {
    "human": "28-sep-1983",
    "machine": "1983-09-28"
  },
  {
    "human": "11/17/1980",
    "machine": "1980-11-17"
  },
  {
    "human": "jan 3, 1997",
    "machine": "1997-01-03"
  },
  {
    "human": "sat, jan 4, 25",
    "machine": "2025-01-04"
  },
  {
    "human": "18 may 1993",
    "machine": "1993-05-18"
  },
  {
    "human": "3-apr-1989",
    "machine": "1989-04-03"
  },
  {
    "human": "17, mar 1975",
    "machine": "1975-03-17"
  },
  {
    "human": "24/10/1998",
    "machine": "1998-10-24"
  },
  {
    "human": "sunday, december 29, 1974",
    "machine": "1974-12-29"
  },
  {
    "human": "20.01.1971",
    "machine": "1971-01-20"
  },
  {
    "human": "friday, december 26, 1986",
    "machine": "1986-12-26"
  },
  {
    "human": "87.11.19",
    "machine": "1987-11-19"
  },
  {
    "human": "1971-12-31",
    "machine": "1971-12-31"
  },
  {
    "human": "02-18-71",
    "machine": "1971-02-18"
  },
  {
    "human": "jul 12, 2012",
    "machine": "2012-07-12"
  },
  {
    "human": "4/2/76",
    "machine": "1976-04-02"
  },
  {
    "human": "23 march 2024",
    "machine": "2024-03-23"
  },
  {
    "human": "06-06-03",
    "machine": "2003-06-06"
  },
  {
    "human": "30.1.17",
    "machine": "2017-01-30"
  },
  {
    "human": "14.7.95",
    "machine": "1995-07-14"
  },
  {
    "human": "10-09-01",
    "machine": "2010-09-01"
  },
  {
    "human": "fri, mar 2, 18",
    "machine": "2018-03-02"
  },
  {
    "human": "2019-10-22",
    "machine": "2019-10-22"
  },
  {
    "human": "dec 19 1998",
    "machine": "1998-12-19"
  },
  {
    "human": "august 19, 1992",
    "machine": "1992-08-19"
  },
  {
    "human": "10-feb-2009",
    "machine": "2009-02-10"
  },
  {
    "human": "1997-12-05",
    "machine": "1997-12-05"
  },
  {
    "human": "26-apr-1981",
    "machine": "1981-04-26"
  },
  {
    "human": "12/23/1976",
    "machine": "1976-12-23"
  },
  {
    "human": "fri, oct 3, 08",
    "machine": "2008-10-03"
  },
  {
    "human": "dec 15, 00",
    "machine": "2000-12-15"
  },
  {
    "human": "12/13/01",
    "machine": "2001-12-13"
  },
  {
    "human": "aug 17 1981",
    "machine": "1981-08-17"
  },
  {
    "human": "sunday, december 29, 2024",
    "machine": "2024-12-29"
  },
  {
    "human": "09-15-83",
    "machine": "1983-09-15"
  },
  {
    "human": "2/5/15",
    "machine": "2015-02-05"
  },
  {
    "human": "03/07/2000",
    "machine": "2000-03-07"
  },
  {
    "human": "02-21-06",
    "machine": "2006-02-21"
  },
  {
    "human": "22 december 1970",
    "machine": "1970-12-22"
  },
  {
    "human": "1990.11.24 ad",
    "machine": "1990-11-24"
  },
  {
    "human": "saturday, september 8, 1979",
    "machine": "1979-09-08"
  },
  {
    "human": "4/26/10",
    "machine": "2010-04-26"
  },
  {
    "human": "2003-12-02",
    "machine": "2003-12-02"
  },
  {
    "human": "06-12-18",
    "machine": "2018-06-12"
  },
  {
    "human": "friday, december 14, 2018",
    "machine": "2018-12-14"
  },
  {
    "human": "20 may 1986",
    "machine": "1986-05-20"
  },
  {
    "human": "feb 9 1998",
    "machine": "1998-02-09"
  },
  {
    "human": "29/10/2022",
    "machine": "2022-10-29"
  },
  {
    "human": "10-feb-2024",
    "machine": "2024-02-10"
  },
  {
    "human": "2011/10/03",
    "machine": "2011-10-03"
  },
  {
    "human": "20/11/1998",
    "machine": "1998-11-20"
  },
  {
    "human": "august 24, 2015",
    "machine": "2015-08-24"
  },
  {
    "human": "january 04, 2019",
    "machine": "2019-01-04"
  },
  {
    "human": "1998-09-20",
    "machine": "1998-09-20"
  },
  {
    "human": "2016-01-01",
    "machine": "2016-01-01"
  },
  {
    "human": "june 5, 1984",
    "machine": "1984-06-05"
  },
  {
    "human": "friday, november 20, 1970",
    "machine": "1970-11-20"
  },
  {
    "human": "mar 15 2003",
    "machine": "2003-03-15"
  },
  {
    "human": "06/06/2004",
    "machine": "2004-06-06"
  },
  {
    "human": "thu, jan 27, 83",
    "machine": "1983-01-27"
  },
  {
    "human": "31.03.2013",
    "machine": "2013-03-31"
  },
  {
    "human": "73-09-04",
    "machine": "1973-09-04"
  },
  {
    "human": "8 feb 2019",
    "machine": "2019-02-08"
  },
  {
    "human": "15, apr 1983",
    "machine": "1983-04-15"
  },
  {
    "human": "2009/04/26",
    "machine": "2009-04-26"
  },
  {
    "human": "07-06-25",
    "machine": "2007-06-25"
  },
  {
    "human": "2010-09-15",
    "machine": "2010-09-15"
  },
  {
    "human": "16 august 2014",
    "machine": "2014-08-16"
  },
  {
    "human": "saturday, december 14, 1991",
    "machine": "1991-12-14"
  },
  {
    "human": "03-04-23",
    "machine": "2003-04-23"
  },
  {
    "human": "6-aug-1984",
    "machine": "1984-08-06"
  },
  {
    "human": "2017-02-04",
    "machine": "2017-02-04"
  },
  {
    "human": "5/9/72",
    "machine": "1972-05-09"
  },
  {
    "human": "16/08/2019",
    "machine": "2019-08-16"
  },
  {
    "human": "06/04/1998",
    "machine": "1998-06-04"
  },
  {
    "human": "jan 30, 1998",
    "machine": "1998-01-30"
  },
  {
    "human": "apr 5, 2005",
    "machine": "2005-04-05"
  },
  {
    "human": "12 july 2006",
    "machine": "2006-07-12"
  },
  {
    "human": "14.02.2003",
    "machine": "2003-02-14"
  },
  {
    "human": "sep 18, 2019",
    "machine": "2019-09-18"
  },
  {
    "human": "june 24, 2000",
    "machine": "2000-06-24"
  },
  {
    "human": "1976.09.02 ad",
    "machine": "1976-09-02"
  },
  {
    "human": "1 september 2025",
    "machine": "2025-09-01"
  },
  {
    "human": "2024/05/02",
    "machine": "2024-05-02"
  },
  {
    "human": "20, jan 1981",
    "machine": "1981-01-20"
  },
  {
    "human": "november 29, 1985",
    "machine": "1985-11-29"
  },
  {
    "human": "2013.10.14 ad",
    "machine": "2013-10-14"
  },
  {
    "human": "1982-10-05",
    "machine": "1982-10-05"
  },
  {
    "human": "07/25/1981",
    "machine": "1981-07-25"
  },
  {
    "human": "6 feb, 2023",
    "machine": "2023-02-06"
  },
  {
    "human": "08-30-81",
    "machine": "1981-08-30"
  },
  {
    "human": "1980-02-25",
    "machine": "1980-02-25"
  },
  {
    "human": "august 23, 1999",
    "machine": "1999-08-23"
  },
  {
    "human": "15.12.1994",
    "machine": "1994-12-15"
  },
  {
    "human": "1976-12-29",
    "machine": "1976-12-29"
  },
  {
    "human": "october 1, 1971",
    "machine": "1971-10-01"
  },
  {
    "human": "1971-05-21",
    "machine": "1971-05-21"
  },
  {
    "human": "jan 11, 2017",
    "machine": "2017-01-11"
  },
  {
    "human": "28 jul 1991",
    "machine": "1991-07-28"
  },
  {
    "human": "1998/05/22",
    "machine": "1998-05-22"
  },
  {
    "human": "2/6/18",
    "machine": "2018-02-06"
  },
  {
    "human": "march 13, 1982",
    "machine": "1982-03-13"
  },
  {
    "human": "23 apr 1971",
    "machine": "1971-04-23"
  },
  {
    "human": "jan 18, 2025",
    "machine": "2025-01-18"
  },
  {
    "human": "21 jul, 1977",
    "machine": "1977-07-21"
  },
  {
    "human": "06/30/1972",
    "machine": "1972-06-30"
  },
  {
    "human": "04.11.16",
    "machine": "2004-11-16"
  },
  {
    "human": "jan 4 1974",
    "machine": "1974-01-04"
  },
  {
    "human": "15 sep 1983",
    "machine": "1983-09-15"
  },
  {
    "human": "september 7, 2022",
    "machine": "2022-09-07"
  },
  {
    "human": "sun, sep 29, 24",
    "machine": "2024-09-29"
  },
  {
    "human": "nov 27, 2023",
    "machine": "2023-11-27"
  },
  {
    "human": "4/29/99",
    "machine": "1999-04-29"
  },
  {
    "human": "mar 21 2000",
    "machine": "2000-03-21"
  },
  {
    "human": "1970-04-02",
    "machine": "1970-04-02"
  },
  {
    "human": "12/1/03",
    "machine": "2003-12-01"
  },
  {
    "human": "8 aug, 1986",
    "machine": "1986-08-08"
  },
  {
    "human": "24 jun, 2006",
    "machine": "2006-06-24"
  },
  {
    "human": "march 16, 1973",
    "machine": "1973-03-16"
  },
  {
    "human": "february 09, 1989",
    "machine": "1989-02-09"
  },
  {
    "human": "december 23, 1971",
    "machine": "1971-12-23"
  },
  {
    "human": "4/09/1992",
    "machine": "1992-09-04"
  },
  {
    "human": "1997-06-19",
    "machine": "1997-06-19"
  },
  {
    "human": "sunday, november 18, 2012",
    "machine": "2012-11-18"
  },
  {
    "human": "tuesday, may 14, 1996",
    "machine": "1996-05-14"
  },
  {
    "human": "thu, sep 9, 76",
    "machine": "1976-09-09"
  },
  {
    "human": "2024-05-21",
    "machine": "2024-05-21"
  },
  {
    "human": "1 sep 1983",
    "machine": "1983-09-01"
  },
  {
    "human": "16 february 1983",
    "machine": "1983-02-16"
  },
  {
    "human": "1986.06.02 ad",
    "machine": "1986-06-02"
  },
  {
    "human": "oct 22, 2014",
    "machine": "2014-10-22"
  },
  {
    "human": "21-aug-2013",
    "machine": "2013-08-21"
  },
  {
    "human": "thursday, february 10, 2011",
    "machine": "2011-02-10"
  },
  {
    "human": "tuesday, october 10, 1972",
    "machine": "1972-10-10"
  },
  {
    "human": "2007-12-19",
    "machine": "2007-12-19"
  },
  {
    "human": "4/29/13",
    "machine": "2013-04-29"
  },
  {
    "human": "11-20-85",
    "machine": "1985-11-20"
  },
  {
    "human": "5/9/03",
    "machine": "2003-05-09"
  },
  {
    "human": "monday, august 14, 2017",
    "machine": "2017-08-14"
  },
  {
    "human": "12/16/2018",
    "machine": "2018-12-16"
  },
  {
    "human": "03/03/2014",
    "machine": "2014-03-03"
  },
  {
    "human": "5/13/73",
    "machine": "1973-05-13"
  },
  {
    "human": "87-08-28",
    "machine": "1987-08-28"
  },
  {
    "human": "9/29/18",
    "machine": "2018-09-29"
  },
  {
    "human": "january 04, 2008",
    "machine": "2008-01-04"
  },
  {
    "human": "fri, may 4, 84",
    "machine": "1984-05-04"
  },
  {
    "human": "wed, feb 1, 89",
    "machine": "1989-02-01"
  },
  {
    "human": "aug 14, 1975",
    "machine": "1975-08-14"
  },
  {
    "human": "16 aug, 2004",
    "machine": "2004-08-16"
  },
  {
    "human": "19 jul 2023",
    "machine": "2023-07-19"
  },
  {
    "human": "24, nov 1994",
    "machine": "1994-11-24"
  },
  {
    "human": "august 5, 1991",
    "machine": "1991-08-05"
  },
  {
    "human": "may 25, 1970",
    "machine": "1970-05-25"
  },
  {
    "human": "1985-01-10",
    "machine": "1985-01-10"
  },
  {
    "human": "2003-10-06",
    "machine": "2003-10-06"
  },
  {
    "human": "1985-08-19",
    "machine": "1985-08-19"
  },
  {
    "human": "25-feb-2010",
    "machine": "2010-02-25"
  },
  {
    "human": "14 dec, 2006",
    "machine": "2006-12-14"
  },
  {
    "human": "wednesday, october 2, 2013",
    "machine": "2013-10-02"
  },
  {
    "human": "11 jan 2015",
    "machine": "2015-01-11"
  },
  {
    "human": "16.06.1986",
    "machine": "1986-06-16"
  },
  {
    "human": "3/25/22",
    "machine": "2022-03-25"
  },
  {
    "human": "apr 11, 1998",
    "machine": "1998-04-11"
  },
  {
    "human": "9.6.01",
    "machine": "2001-06-09"
  },
  {
    "human": "may 29, 2000",
    "machine": "2000-05-29"
  },
  {
    "human": "2017-10-15",
    "machine": "2017-10-15"
  },
  {
    "human": "1970-10-22",
    "machine": "1970-10-22"
  },
  {
    "human": "7/21/21",
    "machine": "2021-07-21"
  },
  {
    "human": "8.7.15",
    "machine": "2015-07-08"
  },
  {
    "human": "12.6.99",
    "machine": "1999-06-12"
  },
  {
    "human": "thursday, july 11, 2013",
    "machine": "2013-07-11"
  },
  {
    "human": "february 17, 2023",
    "machine": "2023-02-17"
  },
  {
    "human": "17, nov 2006",
    "machine": "2006-11-17"
  },
  {
    "human": "10/06/1998",
    "machine": "1998-10-06"
  },
  {
    "human": "15 march 1998",
    "machine": "1998-03-15"
  },
  {
    "human": "january 12, 1973",
    "machine": "1973-01-12"
  },
  {
    "human": "november 29, 2019",
    "machine": "2019-11-29"
  },
  {
    "human": "sunday, march 27, 2022",
    "machine": "2022-03-27"
  },
  {
    "human": "1988.05.12 ad",
    "machine": "1988-05-12"
  },
  {
    "human": "3/20/90",
    "machine": "1990-03-20"
  },
  {
    "human": "february 29, 2016",
    "machine": "2016-02-29"
  },
  {
    "human": "87.06.1",
    "machine": "1987-06-01"
  },
  {
    "human": "8/4/76",
    "machine": "1976-08-04"
  },
  {
    "human": "91-12-06",
    "machine": "1991-12-06"
  },
  {
    "human": "thursday, april 13, 1978",
    "machine": "1978-04-13"
  },
  {
    "human": "saturday, february 18, 2006",
    "machine": "2006-02-18"
  },
  {
    "human": "5 oct, 2002",
    "machine": "2002-10-05"
  },
  {
    "human": "2019.01.23 ad",
    "machine": "2019-01-23"
  },
  {
    "human": "2010-11-08",
    "machine": "2010-11-08"
  },
  {
    "human": "06/18/2006",
    "machine": "2006-06-18"
  },
  {
    "human": "28 oct, 1995",
    "machine": "1995-10-28"
  },
  {
    "human": "may 14, 2021",
    "machine": "2021-05-14"
  },
  {
    "human": "jul 31, 76",
    "machine": "1976-07-31"
  },
  {
    "human": "17-11-23",
    "machine": "2017-11-23"
  },
  {
    "human": "1994-03-7",
    "machine": "1994-03-07"
  },
  {
    "human": "monday, may 9, 1983",
    "machine": "1983-05-09"
  },
  {
    "human": "monday, september 9, 2024",
    "machine": "2024-09-09"
  },
  {
    "human": "2011.07.20 ad",
    "machine": "2011-07-20"
  },
  {
    "human": "november 1, 2002",
    "machine": "2002-11-01"
  },
  {
    "human": "7-sep-2021",
    "machine": "2021-09-07"
  },
  {
    "human": "july 21, 1980",
    "machine": "1980-07-21"
  },
  {
    "human": "aug 18, 1984",
    "machine": "1984-08-18"
  },
  {
    "human": "21 jul, 1983",
    "machine": "1983-07-21"
  },
  {
    "human": "june 7, 1981",
    "machine": "1981-06-07"
  },
  {
    "human": "2007/09/09",
    "machine": "2007-09-09"
  },
  {
    "human": "13/11/2013",
    "machine": "2013-11-13"
  },
  {
    "human": "16.12.2017",
    "machine": "2017-12-16"
  },
  {
    "human": "may 3, 1999",
    "machine": "1999-05-03"
  },
  {
    "human": "november 18, 1983",
    "machine": "1983-11-18"
  },
  {
    "human": "jan 26, 1973",
    "machine": "1973-01-26"
  },
  {
    "human": "march 31, 2019",
    "machine": "2019-03-31"
  },
  {
    "human": "05-31-97",
    "machine": "1997-05-31"
  },
  {
    "human": "2017-09-10",
    "machine": "2017-09-10"
  },
  {
    "human": "71.02.28",
    "machine": "1971-02-28"
  },
  {
    "human": "wednesday, october 29, 2003",
    "machine": "2003-10-29"
  },
  {
    "human": "thursday, january 21, 2010",
    "machine": "2010-01-21"
  },
  {
    "human": "monday, october 27, 1980",
    "machine": "1980-10-27"
  },
  {
    "human": "16/07/2007",
    "machine": "2007-07-16"
  },
  {
    "human": "9.10.76",
    "machine": "1976-10-09"
  },
  {
    "human": "october 01, 2012",
    "machine": "2012-10-01"
  },
  {
    "human": "july 24, 2022",
    "machine": "2022-07-24"
  },
  {
    "human": "18-02-01",
    "machine": "2018-02-01"
  },
  {
    "human": "july 14, 2014",
    "machine": "2014-07-14"
  },
  {
    "human": "2019-10-16",
    "machine": "2019-10-16"
  },
  {
    "human": "10-09-07",
    "machine": "2007-10-09"
  },
  {
    "human": "sunday, january 31, 1988",
    "machine": "1988-01-31"
  },
  {
    "human": "apr 24, 76",
    "machine": "1976-04-24"
  },
  {
    "human": "wednesday, july 2, 1975",
    "machine": "1975-07-02"
  },
  {
    "human": "29.05.1970",
    "machine": "1970-05-29"
  },
  {
    "human": "16-oct-1999",
    "machine": "1999-10-16"
  },
  {
    "human": "16.05.2014",
    "machine": "2014-05-16"
  },
  {
    "human": "11/2/08",
    "machine": "2008-11-02"
  },
  {
    "human": "29-jan-2023",
    "machine": "2023-01-29"
  },
  {
    "human": "16-jun-1970",
    "machine": "1970-06-16"
  },
  {
    "human": "monday, july 31, 2017",
    "machine": "2017-07-31"
  },
  {
    "human": "1974-03-28",
    "machine": "1974-03-28"
  },
  {
    "human": "84-04-24",
    "machine": "1984-04-24"
  },
  {
    "human": "10 oct, 2021",
    "machine": "2021-10-10"
  },
  {
    "human": "aug 11, 1978",
    "machine": "1978-08-11"
  },
  {
    "human": "1980/09/16",
    "machine": "1980-09-16"
  },
  {
    "human": "24 september 1988",
    "machine": "1988-09-24"
  },
  {
    "human": "6-aug-1985",
    "machine": "1985-08-06"
  },
  {
    "human": "09-09-12",
    "machine": "2012-09-09"
  },
  {
    "human": "tuesday, july 21, 1998",
    "machine": "1998-07-21"
  },
  {
    "human": "00.02.3",
    "machine": "2000-02-03"
  },
  {
    "human": "12 december 2012",
    "machine": "2012-12-12"
  },
  {
    "human": "31 march 1978",
    "machine": "1978-03-31"
  },
  {
    "human": "06 september 2010",
    "machine": "2010-09-06"
  },
  {
    "human": "23 january 2022",
    "machine": "2022-01-23"
  },
  {
    "human": "august 3, 1983",
    "machine": "1983-08-03"
  },
  {
    "human": "april 16, 2013",
    "machine": "2013-04-16"
  },
  {
    "human": "august 07, 1979",
    "machine": "1979-08-07"
  },
  {
    "human": "2024/02/15",
    "machine": "2024-02-15"
  },
  {
    "human": "2009-04-03",
    "machine": "2009-04-03"
  },
  {
    "human": "7/20/78",
    "machine": "1978-07-20"
  },
  {
    "human": "05-02-84",
    "machine": "1984-05-02"
  },
  {
    "human": "02.10.1992",
    "machine": "1992-10-02"
  },
  {
    "human": "tuesday, december 12, 2023",
    "machine": "2023-12-12"
  },
  {
    "human": "28 april 1970",
    "machine": "1970-04-28"
  },
  {
    "human": "4 august 2004",
    "machine": "2004-08-04"
  },
  {
    "human": "7/11/93",
    "machine": "1993-07-11"
  },
  {
    "human": "february 12, 2002",
    "machine": "2002-02-12"
  },
  {
    "human": "15-may-2006",
    "machine": "2006-05-15"
  },
  {
    "human": "6/12/12",
    "machine": "2012-06-12"
  },
  {
    "human": "2011-11-1",
    "machine": "2011-11-01"
  },
  {
    "human": "2018.01.18 ad",
    "machine": "2018-01-18"
  },
  {
    "human": "1981.04.15 ad",
    "machine": "1981-04-15"
  },
  {
    "human": "18, feb 1972",
    "machine": "1972-02-18"
  },
  {
    "human": "1973/11/23",
    "machine": "1973-11-23"
  },
  {
    "human": "1996/08/19",
    "machine": "1996-08-19"
  },
  {
    "human": "9 sep 2002",
    "machine": "2002-09-09"
  },
  {
    "human": "10, aug 1973",
    "machine": "1973-08-10"
  },
  {
    "human": "5/09/2013",
    "machine": "2013-09-05"
  },
  {
    "human": "jun 28, 11",
    "machine": "2011-06-28"
  },
  {
    "human": "29.04.2014",
    "machine": "2014-04-29"
  },
  {
    "human": "20/03/1993",
    "machine": "1993-03-20"
  },
  {
    "human": "09-28-72",
    "machine": "1972-09-28"
  },
  {
    "human": "aug 16, 2020",
    "machine": "2020-08-16"
  },
  {
    "human": "23-08-05",
    "machine": "2023-08-05"
  },
  {
    "human": "saturday, december 8, 2007",
    "machine": "2007-12-08"
  },
  {
    "human": "16.02.9",
    "machine": "2016-02-09"
  },
  {
    "human": "06-25-21",
    "machine": "2021-06-25"
  },
  {
    "human": "31 august 1979",
    "machine": "1979-08-31"
  },
  {
    "human": "15.06.29",
    "machine": "2015-06-29"
  },
  {
    "human": "22 may 1983",
    "machine": "1983-05-22"
  },
  {
    "human": "5-aug-1974",
    "machine": "1974-08-05"
  },
  {
    "human": "sun, oct 14, 07",
    "machine": "2007-10-14"
  },
  {
    "human": "march 5, 1986",
    "machine": "1986-03-05"
  },
  {
    "human": "jun 22, 1996",
    "machine": "1996-06-22"
  },
  {
    "human": "3/1/07",
    "machine": "2007-03-01"
  },
  {
    "human": "1973.09.27 ad",
    "machine": "1973-09-27"
  },
  {
    "human": "16 feb, 2019",
    "machine": "2019-02-16"
  },
  {
    "human": "12.06.1972",
    "machine": "1972-06-12"
  },
  {
    "human": "mar 30 1973",
    "machine": "1973-03-30"
  },
  {
    "human": "2018.06.08 ad",
    "machine": "2018-06-08"
  },
  {
    "human": "sep 2, 76",
    "machine": "1976-09-02"
  },
  {
    "human": "8/19/71",
    "machine": "1971-08-19"
  },
  {
    "human": "1981-01-22",
    "machine": "1981-01-22"
  },
  {
    "human": "sun, feb 3, 19",
    "machine": "2019-02-03"
  },
  {
    "human": "wednesday, january 1, 2003",
    "machine": "2003-01-01"
  },
  {
    "human": "6-mar-1992",
    "machine": "1992-03-06"
  },
  {
    "human": "november 22, 1983",
    "machine": "1983-11-22"
  },
  {
    "human": "october 06, 1985",
    "machine": "1985-10-06"
  },
  {
    "human": "apr 11 1990",
    "machine": "1990-04-11"
  },
  {
    "human": "feb 14, 12",
    "machine": "2012-02-14"
  },
  {
    "human": "31, oct 1989",
    "machine": "1989-10-31"
  },
  {
    "human": "feb 14 1982",
    "machine": "1982-02-14"
  },
  {
    "human": "september 5, 1995",
    "machine": "1995-09-05"
  },
  {
    "human": "1980-11-13",
    "machine": "1980-11-13"
  },
  {
    "human": "30, jan 1998",
    "machine": "1998-01-30"
  },
  {
    "human": "4/30/20",
    "machine": "2020-04-30"
  },
  {
    "human": "mon, apr 6, 92",
    "machine": "1992-04-06"
  },
  {
    "human": "06-07-80",
    "machine": "1980-06-07"
  },
  {
    "human": "22.8.76",
    "machine": "1976-08-22"
  },
  {
    "human": "2004/01/28",
    "machine": "2004-01-28"
  },
  {
    "human": "may 12, 1999",
    "machine": "1999-05-12"
  },
  {
    "human": "mar 10, 74",
    "machine": "1974-03-10"
  },
  {
    "human": "1/05/2000",
    "machine": "2000-05-01"
  },
  {
    "human": "20-05-06",
    "machine": "2020-05-06"
  },
  {
    "human": "may 24 2006",
    "machine": "2006-05-24"
  },
  {
    "human": "10 may 1988",
    "machine": "1988-05-10"
  },
  {
    "human": "12/26/91",
    "machine": "1991-12-26"
  },
  {
    "human": "20-01-07",
    "machine": "2020-01-07"
  },
  {
    "human": "2007-08-15",
    "machine": "2007-08-15"
  },
  {
    "human": "25.09.25",
    "machine": "2025-09-25"
  },
  {
    "human": "5/27/79",
    "machine": "1979-05-27"
  },
  {
    "human": "96-04-25",
    "machine": "1996-04-25"
  },
  {
    "human": "30 oct 2018",
    "machine": "2018-10-30"
  },
  {
    "human": "13, jan 2017",
    "machine": "2017-01-13"
  },
  {
    "human": "08, apr 2000",
    "machine": "2000-04-08"
  },
  {
    "human": "may 18, 2007",
    "machine": "2007-05-18"
  },
  {
    "human": "13 oct 2012",
    "machine": "2012-10-13"
  },
  {
    "human": "august 27, 2022",
    "machine": "2022-08-27"
  },
  {
    "human": "22 apr 1973",
    "machine": "1973-04-22"
  },
  {
    "human": "29 may, 1975",
    "machine": "1975-05-29"
  },
  {
    "human": "04/08/1977",
    "machine": "1977-04-08"
  },
  {
    "human": "10 jan, 2016",
    "machine": "2016-01-10"
  },
  {
    "human": "29-apr-2010",
    "machine": "2010-04-29"
  },
  {
    "human": "23, sep 1978",
    "machine": "1978-09-23"
  },
  {
    "human": "sat, jun 10, 00",
    "machine": "2000-06-10"
  },
  {
    "human": "9-jul-2015",
    "machine": "2015-07-09"
  },
  {
    "human": "october 04, 2019",
    "machine": "2019-10-04"
  },
  {
    "human": "1994.02.06 ad",
    "machine": "1994-02-06"
  },
  {
    "human": "29-dec-2018",
    "machine": "2018-12-29"
  },
  {
    "human": "1972.12.18 ad",
    "machine": "1972-12-18"
  },
  {
    "human": "8/4/17",
    "machine": "2017-08-04"
  },
  {
    "human": "12-28-95",
    "machine": "1995-12-28"
  },
  {
    "human": "15, may 2003",
    "machine": "2003-05-15"
  },
  {
    "human": "99.08.12",
    "machine": "1999-08-12"
  },
  {
    "human": "11-30-96",
    "machine": "1996-11-30"
  },
  {
    "human": "2 jul, 1995",
    "machine": "1995-07-02"
  },
  {
    "human": "2025/11/23",
    "machine": "2025-11-23"
  },
  {
    "human": "sat, aug 1, 70",
    "machine": "1970-08-01"
  },
  {
    "human": "jan 16 2020",
    "machine": "2020-01-16"
  },
  {
    "human": "mar 7 2025",
    "machine": "2025-03-07"
  },
  {
    "human": "13, feb 1983",
    "machine": "1983-02-13"
  },
  {
    "human": "17.09.1998",
    "machine": "1998-09-17"
  },
  {
    "human": "2/22/13",
    "machine": "2013-02-22"
  },
  {
    "human": "thursday, march 15, 1973",
    "machine": "1973-03-15"
  },
  {
    "human": "2008-12-23",
    "machine": "2008-12-23"
  },
  {
    "human": "25-06-03",
    "machine": "2025-06-03"
  },
  {
    "human": "2-jan-2025",
    "machine": "2025-01-02"
  },
  {
    "human": "june 28, 1982",
    "machine": "1982-06-28"
  },
  {
    "human": "thursday, november 17, 1983",
    "machine": "1983-11-17"
  },
  {
    "human": "13 jul, 1976",
    "machine": "1976-07-13"
  },
  {
    "human": "09-07-87",
    "machine": "1987-09-07"
  },
  {
    "human": "1993/08/31",
    "machine": "1993-08-31"
  },
  {
    "human": "june 17, 1971",
    "machine": "1971-06-17"
  },
  {
    "human": "monday, june 8, 1998",
    "machine": "1998-06-08"
  },
  {
    "human": "73-03-19",
    "machine": "1973-03-19"
  },
  {
    "human": "apr 29, 1985",
    "machine": "1985-04-29"
  },
  {
    "human": "16 october 1976",
    "machine": "1976-10-16"
  },
  {
    "human": "17-03-16",
    "machine": "2017-03-16"
  },
  {
    "human": "1982/06/02",
    "machine": "1982-06-02"
  },
  {
    "human": "19-02-21",
    "machine": "2019-02-21"
  },
  {
    "human": "may 4 1975",
    "machine": "1975-05-04"
  },
  {
    "human": "25 jul 1975",
    "machine": "1975-07-25"
  },
  {
    "human": "07/01/1988",
    "machine": "1988-07-01"
  },
  {
    "human": "thu, oct 15, 81",
    "machine": "1981-10-15"
  },
  {
    "human": "february 23, 2008",
    "machine": "2008-02-23"
  },
  {
    "human": "friday, february 18, 2022",
    "machine": "2022-02-18"
  },
  {
    "human": "jan 26 2008",
    "machine": "2008-01-26"
  },
  {
    "human": "15 jul 2025",
    "machine": "2025-07-15"
  },
  {
    "human": "tue, aug 8, 89",
    "machine": "1989-08-08"
  },
  {
    "human": "thu, apr 11, 96",
    "machine": "1996-04-11"
  },
  {
    "human": "24.6.82",
    "machine": "1982-06-24"
  },
  {
    "human": "26 february 1992",
    "machine": "1992-02-26"
  },
  {
    "human": "7/18/03",
    "machine": "2003-07-18"
  },
  {
    "human": "2020-12-5",
    "machine": "2020-12-05"
  },
  {
    "human": "november 25, 1988",
    "machine": "1988-11-25"
  },
  {
    "human": "jun 27 2010",
    "machine": "2010-06-27"
  },
  {
    "human": "10, may 2024",
    "machine": "2024-05-10"
  },
  {
    "human": "07-17-77",
    "machine": "1977-07-17"
  },
  {
    "human": "22-oct-1980",
    "machine": "1980-10-22"
  },
  {
    "human": "74.06.11",
    "machine": "1974-06-11"
  },
  {
    "human": "84.12.9",
    "machine": "1984-12-09"
  },
  {
    "human": "tuesday, november 3, 2015",
    "machine": "2015-11-03"
  },
  {
    "human": "09, dec 2012",
    "machine": "2012-12-09"
  },
  {
    "human": "wednesday, december 15, 1971",
    "machine": "1971-12-15"
  },
  {
    "human": "15.11.96",
    "machine": "1996-11-15"
  },
  {
    "human": "2024-08-1",
    "machine": "2024-08-01"
  },
  {
    "human": "16 february 1987",
    "machine": "1987-02-16"
  },
  {
    "human": "1973-12-29",
    "machine": "1973-12-29"
  },
  {
    "human": "apr 4, 77",
    "machine": "1977-04-04"
  },
  {
    "human": "15.09.1998",
    "machine": "1998-09-15"
  },
  {
    "human": "22/02/2009",
    "machine": "2009-02-22"
  },
  {
    "human": "4-nov-1989",
    "machine": "1989-11-04"
  },
  {
    "human": "fri, sep 1, 23",
    "machine": "2023-09-01"
  },
  {
    "human": "5.3.73",
    "machine": "1973-03-05"
  },
  {
    "human": "thursday, march 12, 2020",
    "machine": "2020-03-12"
  },
  {
    "human": "3/15/01",
    "machine": "2001-03-15"
  },
  {
    "human": "june 22, 2011",
    "machine": "2011-06-22"
  },
  {
    "human": "thursday, november 6, 2008",
    "machine": "2008-11-06"
  },
  {
    "human": "05 december 1975",
    "machine": "1975-12-05"
  },
  {
    "human": "july 16, 1975",
    "machine": "1975-07-16"
  },
  {
    "human": "oct 15 2002",
    "machine": "2002-10-15"
  },
  {
    "human": "17 dec 2001",
    "machine": "2001-12-17"
  },
  {
    "human": "5/7/86",
    "machine": "1986-05-07"
  },
  {
    "human": "12/17/79",
    "machine": "1979-12-17"
  },
  {
    "human": "21 oct, 1982",
    "machine": "1982-10-21"
  },
  {
    "human": "26.07.2008",
    "machine": "2008-07-26"
  },
  {
    "human": "3 jul, 2009",
    "machine": "2009-07-03"
  },
  {
    "human": "22 jun, 1987",
    "machine": "1987-06-22"
  },
  {
    "human": "2010-05-22",
    "machine": "2010-05-22"
  },
  {
    "human": "2 may 1981",
    "machine": "1981-05-02"
  },
  {
    "human": "2024.02.01 ad",
    "machine": "2024-02-01"
  },
  {
    "human": "13-04-04",
    "machine": "2013-04-04"
  },
  {
    "human": "july 23, 2001",
    "machine": "2001-07-23"
  },
  {
    "human": "oct 27, 71",
    "machine": "1971-10-27"
  },
  {
    "human": "3/23/78",
    "machine": "1978-03-23"
  },
  {
    "human": "8/02/1999",
    "machine": "1999-02-08"
  },
  {
    "human": "friday, august 17, 1973",
    "machine": "1973-08-17"
  },
  {
    "human": "06/06/2005",
    "machine": "2005-06-06"
  },
  {
    "human": "1993.07.11 ad",
    "machine": "1993-07-11"
  },
  {
    "human": "30 mar, 1984",
    "machine": "1984-03-30"
  },
  {
    "human": "08.02.2022",
    "machine": "2022-02-08"
  },
  {
    "human": "tuesday, may 23, 2023",
    "machine": "2023-05-23"
  },
  {
    "human": "8/17/89",
    "machine": "1989-08-17"
  },
  {
    "human": "sat, may 24, 97",
    "machine": "1997-05-24"
  },
  {
    "human": "88.12.10",
    "machine": "1988-12-10"
  },
  {
    "human": "30-oct-1995",
    "machine": "1995-10-30"
  },
  {
    "human": "8 september 2016",
    "machine": "2016-09-08"
  },
  {
    "human": "august 1, 2005",
    "machine": "2005-08-01"
  },
  {
    "human": "4/16/16",
    "machine": "2016-04-16"
  },
  {
    "human": "1997-05-04",
    "machine": "1997-05-04"
  },
  {
    "human": "sep 15, 81",
    "machine": "1981-09-15"
  },
  {
    "human": "1999-12-23",
    "machine": "1999-12-23"
  },
  {
    "human": "22, apr 2020",
    "machine": "2020-04-22"
  },
  {
    "human": "aug 5 2020",
    "machine": "2020-08-05"
  },
  {
    "human": "2007-11-15",
    "machine": "2007-11-15"
  },
  {
    "human": "monday, november 26, 1979",
    "machine": "1979-11-26"
  },
  {
    "human": "73-12-04",
    "machine": "1973-12-04"
  },
  {
    "human": "1 january 2011",
    "machine": "2011-01-01"
  },
  {
    "human": "15-08-21",
    "machine": "2015-08-21"
  },
  {
    "human": "22, jul 2006",
    "machine": "2006-07-22"
  },
  {
    "human": "31 march 1978",
    "machine": "1978-03-31"
  },
  {
    "human": "22 july 1987",
    "machine": "1987-07-22"
  },
  {
    "human": "15-aug-1981",
    "machine": "1981-08-15"
  },
  {
    "human": "october 7, 1986",
    "machine": "1986-10-07"
  },
  {
    "human": "7 jul, 2012",
    "machine": "2012-07-07"
  },
  {
    "human": "may 3, 2020",
    "machine": "2020-05-03"
  },
  {
    "human": "08-01-73",
    "machine": "1973-08-01"
  },
  {
    "human": "01.04.7",
    "machine": "2001-04-07"
  },
  {
    "human": "3/10/1972",
    "machine": "1972-10-03"
  },
  {
    "human": "7/5/85",
    "machine": "1985-07-05"
  },
  {
    "human": "22.12.2017",
    "machine": "2017-12-22"
  },
  {
    "human": "november 8, 2010",
    "machine": "2010-11-08"
  },
  {
    "human": "nov 27 1975",
    "machine": "1975-11-27"
  },
  {
    "human": "june 24, 2015",
    "machine": "2015-06-24"
  },
  {
    "human": "20 june 2022",
    "machine": "2022-06-20"
  },
  {
    "human": "10 may 2009",
    "machine": "2009-05-10"
  },
  {
    "human": "73.06.4",
    "machine": "1973-06-04"
  },
  {
    "human": "march 18, 1972",
    "machine": "1972-03-18"
  },
  {
    "human": "october 18, 2017",
    "machine": "2017-10-18"
  },
  {
    "human": "25, jul 1992",
    "machine": "1992-07-25"
  },
  {
    "human": "26-may-1996",
    "machine": "1996-05-26"
  },
  {
    "human": "24.10.1996",
    "machine": "1996-10-24"
  },
  {
    "human": "4/15/96",
    "machine": "1996-04-15"
  },
  {
    "human": "3/02/1975",
    "machine": "1975-02-03"
  },
  {
    "human": "04-11-83",
    "machine": "1983-04-11"
  },
  {
    "human": "17 feb, 2007",
    "machine": "2007-02-17"
  },
  {
    "human": "1998.08.25 ad",
    "machine": "1998-08-25"
  },
  {
    "human": "11 july 2000",
    "machine": "2000-07-11"
  },
  {
    "human": "04/10/1986",
    "machine": "1986-04-10"
  },
  {
    "human": "04 may 2008",
    "machine": "2008-05-04"
  },
  {
    "human": "jun 14 1982",
    "machine": "1982-06-14"
  },
  {
    "human": "12 october 2007",
    "machine": "2007-10-12"
  },
  {
    "human": "2 december 1970",
    "machine": "1970-12-02"
  },
  {
    "human": "apr 20, 2023",
    "machine": "2023-04-20"
  },
  {
    "human": "11 jan, 1980",
    "machine": "1980-01-11"
  },
  {
    "human": "06-02-24",
    "machine": "2024-06-02"
  },
  {
    "human": "29-aug-2001",
    "machine": "2001-08-29"
  },
  {
    "human": "jun 17 1999",
    "machine": "1999-06-17"
  },
  {
    "human": "2 january 1990",
    "machine": "1990-01-02"
  },
  {
    "human": "jan 13 2005",
    "machine": "2005-01-13"
  },
  {
    "human": "10/9/20",
    "machine": "2020-10-09"
  },
  {
    "human": "11.12.1970",
    "machine": "1970-12-11"
  },
  {
    "human": "73.05.26",
    "machine": "1973-05-26"
  },
  {
    "human": "jan 22, 1983",
    "machine": "1983-01-22"
  },
  {
    "human": "10/07/1991",
    "machine": "1991-10-07"
  },
  {
    "human": "nov 3, 14",
    "machine": "2014-11-03"
  },
  {
    "human": "2008.01.03 ad",
    "machine": "2008-01-03"
  },
  {
    "human": "5/07/2004",
    "machine": "2004-07-05"
  },
  {
    "human": "apr 12, 2000",
    "machine": "2000-04-12"
  },
  {
    "human": "19.11.79",
    "machine": "1979-11-19"
  },
  {
    "human": "13 aug, 1976",
    "machine": "1976-08-13"
  },
  {
    "human": "10/09/2011",
    "machine": "2011-10-09"
  },
  {
    "human": "9/14/90",
    "machine": "1990-09-14"
  },
  {
    "human": "sep 26, 2000",
    "machine": "2000-09-26"
  },
  {
    "human": "18 jul 1996",
    "machine": "1996-07-18"
  },
  {
    "human": "07-29-92",
    "machine": "1992-07-29"
  },
  {
    "human": "2020/11/26",
    "machine": "2020-11-26"
  },
  {
    "human": "nov 20, 1999",
    "machine": "1999-11-20"
  },
  {
    "human": "28 february 2017",
    "machine": "2017-02-28"
  },
  {
    "human": "wednesday, january 9, 1991",
    "machine": "1991-01-09"
  },
  {
    "human": "27, feb 1983",
    "machine": "1983-02-27"
  },
  {
    "human": "5/5/17",
    "machine": "2017-05-05"
  },
  {
    "human": "26, aug 1976",
    "machine": "1976-08-26"
  },
  {
    "human": "95.05.12",
    "machine": "1995-05-12"
  },
  {
    "human": "02/03/1981",
    "machine": "1981-02-03"
  },
  {
    "human": "may 4, 1998",
    "machine": "1998-05-04"
  },
  {
    "human": "08 june 1990",
    "machine": "1990-06-08"
  },
  {
    "human": "12-10-15",
    "machine": "2012-10-15"
  },
  {
    "human": "15 apr 2018",
    "machine": "2018-04-15"
  },
  {
    "human": "09/14/1987",
    "machine": "1987-09-14"
  },
  {
    "human": "2001-09-26",
    "machine": "2001-09-26"
  },
  {
    "human": "july 27, 1982",
    "machine": "1982-07-27"
  },
  {
    "human": "06-16-80",
    "machine": "1980-06-16"
  },
  {
    "human": "5/6/13",
    "machine": "2013-05-06"
  },
  {
    "human": "09/30/2014",
    "machine": "2014-09-30"
  },
  {
    "human": "29 mar 1997",
    "machine": "1997-03-29"
  },
  {
    "human": "4 jul 1976",
    "machine": "1976-07-04"
  },
  {
    "human": "71.03.21",
    "machine": "1971-03-21"
  },
  {
    "human": "13 sep, 1992",
    "machine": "1992-09-13"
  },
  {
    "human": "aug 9 2022",
    "machine": "2022-08-09"
  },
  {
    "human": "feb 9, 24",
    "machine": "2024-02-09"
  },
  {
    "human": "september 27, 1996",
    "machine": "1996-09-27"
  },
  {
    "human": "1973-09-24",
    "machine": "1973-09-24"
  },
  {
    "human": "01.03.20",
    "machine": "2001-03-20"
  },
  {
    "human": "8/20/82",
    "machine": "1982-08-20"
  },
  {
    "human": "nov 15, 70",
    "machine": "1970-11-15"
  },
  {
    "human": "13 mar, 1979",
    "machine": "1979-03-13"
  },
  {
    "human": "01-12-16",
    "machine": "2016-01-12"
  },
  {
    "human": "1978/05/30",
    "machine": "1978-05-30"
  },
  {
    "human": "5 apr, 2013",
    "machine": "2013-04-05"
  },
  {
    "human": "2024-03-3",
    "machine": "2024-03-03"
  },
  {
    "human": "14, feb 2017",
    "machine": "2017-02-14"
  },
  {
    "human": "saturday, june 27, 2009",
    "machine": "2009-06-27"
  },
  {
    "human": "march 7, 2011",
    "machine": "2011-03-07"
  },
  {
    "human": "1992-04-28",
    "machine": "1992-04-28"
  },
  {
    "human": "23 mar, 2004",
    "machine": "2004-03-23"
  },
  {
    "human": "3/10/16",
    "machine": "2016-03-10"
  },
  {
    "human": "sun, oct 3, 10",
    "machine": "2010-10-03"
  },
  {
    "human": "feb 2, 1978",
    "machine": "1978-02-02"
  },
  {
    "human": "jun 29 1976",
    "machine": "1976-06-29"
  },
  {
    "human": "mar 4, 1982",
    "machine": "1982-03-04"
  },
  {
    "human": "feb 1, 1996",
    "machine": "1996-02-01"
  },
  {
    "human": "1981-03-12",
    "machine": "1981-03-12"
  },
  {
    "human": "2018/05/25",
    "machine": "2018-05-25"
  },
  {
    "human": "sun, apr 5, 92",
    "machine": "1992-04-05"
  },
  {
    "human": "05, jul 1998",
    "machine": "1998-07-05"
  },
  {
    "human": "12 november 2008",
    "machine": "2008-11-12"
  },
  {
    "human": "28.05.1998",
    "machine": "1998-05-28"
  },
  {
    "human": "09 april 1978",
    "machine": "1978-04-09"
  },
  {
    "human": "tuesday, june 1, 1999",
    "machine": "1999-06-01"
  },
  {
    "human": "15-aug-2012",
    "machine": "2012-08-15"
  },
  {
    "human": "mar 27, 09",
    "machine": "2009-03-27"
  },
  {
    "human": "00.11.29",
    "machine": "2000-11-29"
  },
  {
    "human": "5/27/80",
    "machine": "1980-05-27"
  },
  {
    "human": "1999.07.04 ad",
    "machine": "1999-07-04"
  },
  {
    "human": "jan 24, 1983",
    "machine": "1983-01-24"
  },
  {
    "human": "april 22, 1992",
    "machine": "1992-04-22"
  },
  {
    "human": "28/02/1976",
    "machine": "1976-02-28"
  },
  {
    "human": "friday, august 7, 1992",
    "machine": "1992-08-07"
  },
  {
    "human": "apr 24, 1996",
    "machine": "1996-04-24"
  },
  {
    "human": "2011/12/09",
    "machine": "2011-12-09"
  },
  {
    "human": "24.03.25",
    "machine": "2024-03-25"
  },
  {
    "human": "1980/12/05",
    "machine": "1980-12-05"
  },
  {
    "human": "21.8.15",
    "machine": "2015-08-21"
  },
  {
    "human": "2015/10/28",
    "machine": "2015-10-28"
  },
  {
    "human": "march 16, 1981",
    "machine": "1981-03-16"
  },
  {
    "human": "22 feb, 2001",
    "machine": "2001-02-22"
  },
  {
    "human": "08/11/1974",
    "machine": "1974-08-11"
  },
  {
    "human": "12/10/1991",
    "machine": "1991-12-10"
  },
  {
    "human": "15 aug 2019",
    "machine": "2019-08-15"
  },
  {
    "human": "2010/09/02",
    "machine": "2010-09-02"
  },
  {
    "human": "03-05-06",
    "machine": "2006-03-05"
  },
  {
    "human": "tuesday, april 5, 2016",
    "machine": "2016-04-05"
  },
  {
    "human": "saturday, december 28, 2019",
    "machine": "2019-12-28"
  },
  {
    "human": "1977-07-9",
    "machine": "1977-07-09"
  },
  {
    "human": "18 december 2005",
    "machine": "2005-12-18"
  },
  {
    "human": "29 july 1978",
    "machine": "1978-07-29"
  },
  {
    "human": "14.02.26",
    "machine": "2014-02-26"
  },
  {
    "human": "94-06-15",
    "machine": "1994-06-15"
  },
  {
    "human": "jan 26 2008",
    "machine": "2008-01-26"
  },
  {
    "human": "23 may, 1985",
    "machine": "1985-05-23"
  },
  {
    "human": "5/18/80",
    "machine": "1980-05-18"
  },
  {
    "human": "1/31/11",
    "machine": "2011-01-31"
  },
  {
    "human": "sunday, september 21, 1997",
    "machine": "1997-09-21"
  },
  {
    "human": "april 13, 1970",
    "machine": "1970-04-13"
  },
  {
    "human": "25.1.24",
    "machine": "2024-01-25"
  },
  {
    "human": "01 october 2024",
    "machine": "2024-10-01"
  },
  {
    "human": "73-11-15",
    "machine": "1973-11-15"
  },
  {
    "human": "saturday, may 9, 1987",
    "machine": "1987-05-09"
  },
  {
    "human": "17 aug 1988",
    "machine": "1988-08-17"
  },
  {
    "human": "august 10, 2022",
    "machine": "2022-08-10"
  },
  {
    "human": "2014-07-30",
    "machine": "2014-07-30"
  },
  {
    "human": "08.10.13",
    "machine": "2008-10-13"
  },
  {
    "human": "12 apr 1996",
    "machine": "1996-04-12"
  },
  {
    "human": "1999.10.17 ad",
    "machine": "1999-10-17"
  },
  {
    "human": "09/24/2019",
    "machine": "2019-09-24"
  },
  {
    "human": "23 feb, 1985",
    "machine": "1985-02-23"
  },
  {
    "human": "13 october 1981",
    "machine": "1981-10-13"
  },
  {
    "human": "10/11/1995",
    "machine": "1995-11-10"
  },
  {
    "human": "february 1, 1992",
    "machine": "1992-02-01"
  },
  {
    "human": "89-10-27",
    "machine": "1989-10-27"
  },
  {
    "human": "18.08.1976",
    "machine": "1976-08-18"
  },
  {
    "human": "saturday, december 1, 1973",
    "machine": "1973-12-01"
  },
  {
    "human": "24 march 2019",
    "machine": "2019-03-24"
  },
  {
    "human": "2008.04.09 ad",
    "machine": "2008-04-09"
  },
  {
    "human": "1999/01/24",
    "machine": "1999-01-24"
  },
  {
    "human": "1986/08/28",
    "machine": "1986-08-28"
  },
  {
    "human": "18, aug 1993",
    "machine": "1993-08-18"
  },
  {
    "human": "fri, feb 21, 97",
    "machine": "1997-02-21"
  },
  {
    "human": "aug 31 1985",
    "machine": "1985-08-31"
  },
  {
    "human": "73.03.22",
    "machine": "1973-03-22"
  },
  {
    "human": "february 12, 1982",
    "machine": "1982-02-12"
  },
  {
    "human": "mar 22, 1977",
    "machine": "1977-03-22"
  },
  {
    "human": "31, jul 1985",
    "machine": "1985-07-31"
  },
  {
    "human": "25 july 2012",
    "machine": "2012-07-25"
  },
  {
    "human": "24.5.76",
    "machine": "1976-05-24"
  },
  {
    "human": "monday, march 24, 2014",
    "machine": "2014-03-24"
  },
  {
    "human": "11-20-70",
    "machine": "1970-11-20"
  },
  {
    "human": "30 jan, 2001",
    "machine": "2001-01-30"
  },
  {
    "human": "21 september 1983",
    "machine": "1983-09-21"
  },
  {
    "human": "aug 6, 2007",
    "machine": "2007-08-06"
  },
  {
    "human": "7.11.03",
    "machine": "2003-11-07"
  },
  {
    "human": "sep 29, 2020",
    "machine": "2020-09-29"
  },
  {
    "human": "jun 25 1996",
    "machine": "1996-06-25"
  },
  {
    "human": "24-06-16",
    "machine": "2024-06-16"
  },
  {
    "human": "may 12 1986",
    "machine": "1986-05-12"
  },
  {
    "human": "05 october 2016",
    "machine": "2016-10-05"
  },
  {
    "human": "25 aug 1978",
    "machine": "1978-08-25"
  },
  {
    "human": "25 nov 2004",
    "machine": "2004-11-25"
  },
  {
    "human": "1989-11-4",
    "machine": "1989-11-04"
  },
  {
    "human": "82.05.5",
    "machine": "1982-05-05"
  },
  {
    "human": "2014-02-10",
    "machine": "2014-02-10"
  },
  {
    "human": "31 jul 2021",
    "machine": "2021-07-31"
  },
  {
    "human": "17 august 1970",
    "machine": "1970-08-17"
  },
  {
    "human": "22 dec 2011",
    "machine": "2011-12-22"
  },
  {
    "human": "june 14, 1990",
    "machine": "1990-06-14"
  },
  {
    "human": "12-aug-2015",
    "machine": "2015-08-12"
  },
  {
    "human": "84-08-25",
    "machine": "1984-08-25"
  },
  {
    "human": "7 august 2015",
    "machine": "2015-08-07"
  },
  {
    "human": "7 april 2012",
    "machine": "2012-04-07"
  },
  {
    "human": "06-28-20",
    "machine": "2020-06-28"
  },
  {
    "human": "27/02/2006",
    "machine": "2006-02-27"
  },
  {
    "human": "dec 6, 87",
    "machine": "1987-12-06"
  },
  {
    "human": "march 15, 1977",
    "machine": "1977-03-15"
  },
  {
    "human": "jan 2 2003",
    "machine": "2003-01-02"
  },
  {
    "human": "dec 4, 82",
    "machine": "1982-12-04"
  },
  {
    "human": "sat, nov 9, 19",
    "machine": "2019-11-09"
  },
  {
    "human": "13 april 1995",
    "machine": "1995-04-13"
  },
  {
    "human": "10/23/76",
    "machine": "1976-10-23"
  },
  {
    "human": "2012-02-27",
    "machine": "2012-02-27"
  },
  {
    "human": "97-03-16",
    "machine": "1997-03-16"
  },
  {
    "human": "30.5.20",
    "machine": "2020-05-30"
  },
  {
    "human": "june 23, 2019",
    "machine": "2019-06-23"
  },
  {
    "human": "1989/10/15",
    "machine": "1989-10-15"
  },
  {
    "human": "1977-10-10",
    "machine": "1977-10-10"
  },
  {
    "human": "aug 24, 89",
    "machine": "1989-08-24"
  },
  {
    "human": "1974.01.01 ad",
    "machine": "1974-01-01"
  },
  {
    "human": "16 june 1985",
    "machine": "1985-06-16"
  },
  {
    "human": "29 aug 2009",
    "machine": "2009-08-29"
  },
  {
    "human": "tue, aug 19, 08",
    "machine": "2008-08-19"
  },
  {
    "human": "11/15/14",
    "machine": "2014-11-15"
  },
  {
    "human": "march 13, 1973",
    "machine": "1973-03-13"
  },
  {
    "human": "april 3, 1996",
    "machine": "1996-04-03"
  },
  {
    "human": "2006-07-28",
    "machine": "2006-07-28"
  },
  {
    "human": "3/10/95",
    "machine": "1995-03-10"
  },
  {
    "human": "22.11.2005",
    "machine": "2005-11-22"
  },
  {
    "human": "23 october 2014",
    "machine": "2014-10-23"
  },
  {
    "human": "3/19/89",
    "machine": "1989-03-19"
  },
  {
    "human": "wednesday, august 30, 2006",
    "machine": "2006-08-30"
  },
  {
    "human": "29 april 1975",
    "machine": "1975-04-29"
  },
  {
    "human": "sep 29, 1998",
    "machine": "1998-09-29"
  },
  {
    "human": "17-jun-2015",
    "machine": "2015-06-17"
  },
  {
    "human": "may 12 1971",
    "machine": "1971-05-12"
  },
  {
    "human": "13 october 1970",
    "machine": "1970-10-13"
  },
  {
    "human": "8/25/91",
    "machine": "1991-08-25"
  },
  {
    "human": "4.8.21",
    "machine": "2021-08-04"
  },
  {
    "human": "04-06-27",
    "machine": "2004-06-27"
  },
  {
    "human": "nov 2, 00",
    "machine": "2000-11-02"
  },
  {
    "human": "72.03.17",
    "machine": "1972-03-17"
  },
  {
    "human": "2005/12/19",
    "machine": "2005-12-19"
  },
  {
    "human": "19 november 1996",
    "machine": "1996-11-19"
  },
  {
    "human": "17-nov-1975",
    "machine": "1975-11-17"
  },
  {
    "human": "1995/01/01",
    "machine": "1995-01-01"
  },
  {
    "human": "7 march 1980",
    "machine": "1980-03-07"
  },
  {
    "human": "17, nov 2002",
    "machine": "2002-11-17"
  },
  {
    "human": "03-11-02",
    "machine": "2003-11-02"
  },
  {
    "human": "4/07/2008",
    "machine": "2008-07-04"
  },
  {
    "human": "4/8/73",
    "machine": "1973-04-08"
  },
  {
    "human": "1987-02-26",
    "machine": "1987-02-26"
  },
  {
    "human": "03.11.2018",
    "machine": "2018-11-03"
  },
  {
    "human": "23, jan 1989",
    "machine": "1989-01-23"
  },
  {
    "human": "1/12/15",
    "machine": "2015-01-12"
  },
  {
    "human": "15/04/2021",
    "machine": "2021-04-15"
  },
  {
    "human": "aug 28, 96",
    "machine": "1996-08-28"
  },
  {
    "human": "sep 16, 1998",
    "machine": "1998-09-16"
  },
  {
    "human": "8.5.14",
    "machine": "2014-05-08"
  },
  {
    "human": "sun, jul 14, 19",
    "machine": "2019-07-14"
  },
  {
    "human": "26 dec 1970",
    "machine": "1970-12-26"
  },
  {
    "human": "december 30, 2015",
    "machine": "2015-12-30"
  },
  {
    "human": "08-03-85",
    "machine": "1985-08-03"
  },
  {
    "human": "december 02, 1985",
    "machine": "1985-12-02"
  },
  {
    "human": "21 october 1998",
    "machine": "1998-10-21"
  },
  {
    "human": "21-aug-2005",
    "machine": "2005-08-21"
  },
  {
    "human": "08/29/1986",
    "machine": "1986-08-29"
  },
  {
    "human": "11/26/03",
    "machine": "2003-11-26"
  },
  {
    "human": "tuesday, december 13, 1977",
    "machine": "1977-12-13"
  },
  {
    "human": "03/03/1992",
    "machine": "1992-03-03"
  },
  {
    "human": "1/11/92",
    "machine": "1992-01-11"
  },
  {
    "human": "11.10.1976",
    "machine": "1976-10-11"
  },
  {
    "human": "nov 22, 2009",
    "machine": "2009-11-22"
  },
  {
    "human": "87.10.16",
    "machine": "1987-10-16"
  },
  {
    "human": "25-aug-2010",
    "machine": "2010-08-25"
  },
  {
    "human": "1982-08-15",
    "machine": "1982-08-15"
  },
  {
    "human": "24 november 2010",
    "machine": "2010-11-24"
  },
  {
    "human": "jul 9, 1974",
    "machine": "1974-07-09"
  },
  {
    "human": "08-12-28",
    "machine": "2008-12-28"
  },
  {
    "human": "17 february 1973",
    "machine": "1973-02-17"
  },
  {
    "human": "08, apr 1986",
    "machine": "1986-04-08"
  },
  {
    "human": "2016-10-28",
    "machine": "2016-10-28"
  },
  {
    "human": "03/21/2013",
    "machine": "2013-03-21"
  },
  {
    "human": "19 march 1975",
    "machine": "1975-03-19"
  },
  {
    "human": "1982-10-1",
    "machine": "1982-10-01"
  },
  {
    "human": "8/16/05",
    "machine": "2005-08-16"
  },
  {
    "human": "friday, july 25, 1975",
    "machine": "1975-07-25"
  },
  {
    "human": "september 1, 1983",
    "machine": "1983-09-01"
  },
  {
    "human": "apr 17 1994",
    "machine": "1994-04-17"
  },
  {
    "human": "10-28-18",
    "machine": "2018-10-28"
  },
  {
    "human": "mar 21, 92",
    "machine": "1992-03-21"
  },
  {
    "human": "23 jul 1999",
    "machine": "1999-07-23"
  },
  {
    "human": "mar 1 1997",
    "machine": "1997-03-01"
  },
  {
    "human": "03/03/1994",
    "machine": "1994-03-03"
  },
  {
    "human": "wed, mar 11, 87",
    "machine": "1987-03-11"
  },
  {
    "human": "nov 6, 1975",
    "machine": "1975-11-06"
  },
  {
    "human": "november 12, 2002",
    "machine": "2002-11-12"
  },
  {
    "human": "22.02.1989",
    "machine": "1989-02-22"
  },
  {
    "human": "14 march 1975",
    "machine": "1975-03-14"
  },
  {
    "human": "may 9, 2005",
    "machine": "2005-05-09"
  },
  {
    "human": "july 21, 2002",
    "machine": "2002-07-21"
  },
  {
    "human": "2011-11-18",
    "machine": "2011-11-18"
  },
  {
    "human": "05.10.2007",
    "machine": "2007-10-05"
  },
  {
    "human": "10/31/78",
    "machine": "1978-10-31"
  },
  {
    "human": "15 november 2012",
    "machine": "2012-11-15"
  },
  {
    "human": "thu, apr 12, 18",
    "machine": "2018-04-12"
  },
  {
    "human": "wed, jul 29, 15",
    "machine": "2015-07-29"
  },
  {
    "human": "19 march 2015",
    "machine": "2015-03-19"
  },
  {
    "human": "2015.07.22 ad",
    "machine": "2015-07-22"
  },
  {
    "human": "nov 18, 1982",
    "machine": "1982-11-18"
  },
  {
    "human": "apr 14 1977",
    "machine": "1977-04-14"
  },
  {
    "human": "2025.07.05 ad",
    "machine": "2025-07-05"
  },
  {
    "human": "22 march 2020",
    "machine": "2020-03-22"
  },
  {
    "human": "6/17/87",
    "machine": "1987-06-17"
  },
  {
    "human": "26 dec, 2002",
    "machine": "2002-12-26"
  },
  {
    "human": "84-03-24",
    "machine": "1984-03-24"
  },
  {
    "human": "1993.06.22 ad",
    "machine": "1993-06-22"
  },
  {
    "human": "4/1/15",
    "machine": "2015-04-01"
  },
  {
    "human": "thursday, january 1, 1987",
    "machine": "1987-01-01"
  },
  {
    "human": "2005/09/23",
    "machine": "2005-09-23"
  },
  {
    "human": "6/17/80",
    "machine": "1980-06-17"
  },
  {
    "human": "11 dec, 1977",
    "machine": "1977-12-11"
  },
  {
    "human": "24 september 2025",
    "machine": "2025-09-24"
  },
  {
    "human": "31 oct 2023",
    "machine": "2023-10-31"
  },
  {
    "human": "9 aug, 1972",
    "machine": "1972-08-09"
  },
  {
    "human": "4/06/1975",
    "machine": "1975-06-04"
  },
  {
    "human": "wednesday, august 24, 1988",
    "machine": "1988-08-24"
  },
  {
    "human": "tuesday, march 3, 1981",
    "machine": "1981-03-03"
  },
  {
    "human": "13-oct-2005",
    "machine": "2005-10-13"
  },
  {
    "human": "april 27, 2014",
    "machine": "2014-04-27"
  },
  {
    "human": "28 apr, 2021",
    "machine": "2021-04-28"
  },
  {
    "human": "jun 27, 2021",
    "machine": "2021-06-27"
  },
  {
    "human": "july 13, 2005",
    "machine": "2005-07-13"
  },
  {
    "human": "apr 24 1981",
    "machine": "1981-04-24"
  },
  {
    "human": "sat, sep 19, 92",
    "machine": "1992-09-19"
  },
  {
    "human": "1996.02.15 ad",
    "machine": "1996-02-15"
  },
  {
    "human": "1/12/11",
    "machine": "2011-01-12"
  },
  {
    "human": "2017-12-07",
    "machine": "2017-12-07"
  },
  {
    "human": "1996-01-30",
    "machine": "1996-01-30"
  },
  {
    "human": "sun, mar 15, 87",
    "machine": "1987-03-15"
  },
  {
    "human": "2025-09-22",
    "machine": "2025-09-22"
  },
  {
    "human": "jun 22, 72",
    "machine": "1972-06-22"
  },
  {
    "human": "87-07-08",
    "machine": "1987-07-08"
  },
  {
    "human": "november 18, 1971",
    "machine": "1971-11-18"
  },
  {
    "human": "september 26, 2021",
    "machine": "2021-09-26"
  },
  {
    "human": "1972-05-14",
    "machine": "1972-05-14"
  },
  {
    "human": "4 sep, 1989",
    "machine": "1989-09-04"
  },
  {
    "human": "18 oct, 1991",
    "machine": "1991-10-18"
  },
  {
    "human": "1997/11/03",
    "machine": "1997-11-03"
  },
  {
    "human": "06-25-09",
    "machine": "2009-06-25"
  },
  {
    "human": "september 7, 2019",
    "machine": "2019-09-07"
  },
  {
    "human": "may 5, 70",
    "machine": "1970-05-05"
  },
  {
    "human": "11-28-95",
    "machine": "1995-11-28"
  },
  {
    "human": "july 17, 2001",
    "machine": "2001-07-17"
  },
  {
    "human": "1 feb 2002",
    "machine": "2002-02-01"
  },
  {
    "human": "2008/03/29",
    "machine": "2008-03-29"
  },
  {
    "human": "9 march 2005",
    "machine": "2005-03-09"
  },
  {
    "human": "sunday, april 18, 2021",
    "machine": "2021-04-18"
  },
  {
    "human": "jul 3, 24",
    "machine": "2024-07-03"
  },
  {
    "human": "1994-03-17",
    "machine": "1994-03-17"
  },
  {
    "human": "oct 26, 13",
    "machine": "2013-10-26"
  },
  {
    "human": "15.09.1972",
    "machine": "1972-09-15"
  },
  {
    "human": "06-23-98",
    "machine": "1998-06-23"
  },
  {
    "human": "oct 21, 2009",
    "machine": "2009-10-21"
  },
  {
    "human": "2020/08/15",
    "machine": "2020-08-15"
  },
  {
    "human": "24-jan-1987",
    "machine": "1987-01-24"
  },
  {
    "human": "11.2.23",
    "machine": "2023-02-11"
  },
  {
    "human": "monday, september 8, 1986",
    "machine": "1986-09-08"
  },
  {
    "human": "2019/11/23",
    "machine": "2019-11-23"
  },
  {
    "human": "08-11-09",
    "machine": "2009-08-11"
  },
  {
    "human": "jan 6, 03",
    "machine": "2003-01-06"
  },
  {
    "human": "tue, may 15, 07",
    "machine": "2007-05-15"
  },
  {
    "human": "29 may 2015",
    "machine": "2015-05-29"
  },
  {
    "human": "august 15, 1990",
    "machine": "1990-08-15"
  },
  {
    "human": "january 30, 2021",
    "machine": "2021-01-30"
  },
  {
    "human": "2001-09-21",
    "machine": "2001-09-21"
  },
  {
    "human": "sep 10, 1978",
    "machine": "1978-09-10"
  },
  {
    "human": "09-22-05",
    "machine": "2005-09-22"
  },
  {
    "human": "mar 17 2024",
    "machine": "2024-03-17"
  },
  {
    "human": "10/13/70",
    "machine": "1970-10-13"
  },
  {
    "human": "14 jan, 1993",
    "machine": "1993-01-14"
  },
  {
    "human": "29, jun 2003",
    "machine": "2003-06-29"
  },
  {
    "human": "apr 12, 24",
    "machine": "2024-04-12"
  },
  {
    "human": "13 jan, 1970",
    "machine": "1970-01-13"
  },
  {
    "human": "06 july 2021",
    "machine": "2021-07-06"
  },
  {
    "human": "10 may 1980",
    "machine": "1980-05-10"
  },
  {
    "human": "8/10/20",
    "machine": "2020-08-10"
  },
  {
    "human": "01-06-11",
    "machine": "2011-01-06"
  },
  {
    "human": "9/19/88",
    "machine": "1988-09-19"
  },
  {
    "human": "18, mar 1998",
    "machine": "1998-03-18"
  },
  {
    "human": "07 october 2001",
    "machine": "2001-10-07"
  },
  {
    "human": "7/1/72",
    "machine": "1972-07-01"
  },
  {
    "human": "friday, february 1, 2002",
    "machine": "2002-02-01"
  },
  {
    "human": "30 sep, 1982",
    "machine": "1982-09-30"
  },
  {
    "human": "tuesday, october 25, 2005",
    "machine": "2005-10-25"
  },
  {
    "human": "feb 1, 1993",
    "machine": "1993-02-01"
  },
  {
    "human": "thursday, december 18, 1986",
    "machine": "1986-12-18"
  },
  {
    "human": "sat, nov 22, 14",
    "machine": "2014-11-22"
  },
  {
    "human": "07.11.3",
    "machine": "2007-11-03"
  },
  {
    "human": "84.04.19",
    "machine": "1984-04-19"
  },
  {
    "human": "9.3.03",
    "machine": "2003-03-09"
  },
  {
    "human": "11/21/18",
    "machine": "2018-11-21"
  },
  {
    "human": "24-jul-2000",
    "machine": "2000-07-24"
  },
  {
    "human": "23, sep 2013",
    "machine": "2013-09-23"
  },
  {
    "human": "jul 12, 2007",
    "machine": "2007-07-12"
  },
  {
    "human": "2005-03-24",
    "machine": "2005-03-24"
  },
  {
    "human": "1994-08-01",
    "machine": "1994-08-01"
  },
  {
    "human": "dec 8, 19",
    "machine": "2019-12-08"
  },
  {
    "human": "mar 8, 1970",
    "machine": "1970-03-08"
  },
  {
    "human": "1.1.96",
    "machine": "1996-01-01"
  },
  {
    "human": "21 april 1996",
    "machine": "1996-04-21"
  },
  {
    "human": "03/17/2015",
    "machine": "2015-03-17"
  },
  {
    "human": "feb 22, 76",
    "machine": "1976-02-22"
  },
  {
    "human": "2001.10.19 ad",
    "machine": "2001-10-19"
  },
  {
    "human": "1/23/99",
    "machine": "1999-01-23"
  },
  {
    "human": "friday, december 15, 1972",
    "machine": "1972-12-15"
  },
  {
    "human": "31.10.1978",
    "machine": "1978-10-31"
  },
  {
    "human": "may 2 2004",
    "machine": "2004-05-02"
  },
  {
    "human": "8.8.98",
    "machine": "1998-08-08"
  },
  {
    "human": "2017/08/21",
    "machine": "2017-08-21"
  },
  {
    "human": "16 may 1994",
    "machine": "1994-05-16"
  },
  {
    "human": "2003-03-22",
    "machine": "2003-03-22"
  },
  {
    "human": "05, nov 2021",
    "machine": "2021-11-05"
  },
  {
    "human": "tuesday, november 15, 2005",
    "machine": "2005-11-15"
  },
  {
    "human": "79.05.29",
    "machine": "1979-05-29"
  },
  {
    "human": "1980/06/30",
    "machine": "1980-06-30"
  },
  {
    "human": "monday, september 15, 2014",
    "machine": "2014-09-15"
  },
  {
    "human": "93-10-20",
    "machine": "1993-10-20"
  },
  {
    "human": "1980.02.03 ad",
    "machine": "1980-02-03"
  },
  {
    "human": "29 jun 1994",
    "machine": "1994-06-29"
  },
  {
    "human": "8-jun-1981",
    "machine": "1981-06-08"
  },
  {
    "human": "aug 30, 2009",
    "machine": "2009-08-30"
  },
  {
    "human": "93-12-09",
    "machine": "1993-12-09"
  },
  {
    "human": "7/6/09",
    "machine": "2009-07-06"
  },
  {
    "human": "28, feb 1987",
    "machine": "1987-02-28"
  },
  {
    "human": "31.10.01",
    "machine": "2001-10-31"
  },
  {
    "human": "23, feb 2014",
    "machine": "2014-02-23"
  },
  {
    "human": "wed, oct 11, 06",
    "machine": "2006-10-11"
  },
  {
    "human": "01, jun 2021",
    "machine": "2021-06-01"
  },
  {
    "human": "nov 16, 2022",
    "machine": "2022-11-16"
  },
  {
    "human": "11, feb 1983",
    "machine": "1983-02-11"
  },
  {
    "human": "wed, dec 27, 17",
    "machine": "2017-12-27"
  },
  {
    "human": "19 nov, 2017",
    "machine": "2017-11-19"
  },
  {
    "human": "77.12.4",
    "machine": "1977-12-04"
  },
  {
    "human": "2/21/95",
    "machine": "1995-02-21"
  },
  {
    "human": "19.9.72",
    "machine": "1972-09-19"
  },
  {
    "human": "1980-03-17",
    "machine": "1980-03-17"
  },
  {
    "human": "07/09/1976",
    "machine": "1976-07-09"
  },
  {
    "human": "feb 25 1983",
    "machine": "1983-02-25"
  },
  {
    "human": "jul 25, 2007",
    "machine": "2007-07-25"
  },
  {
    "human": "21, sep 2016",
    "machine": "2016-09-21"
  },
  {
    "human": "89-08-20",
    "machine": "1989-08-20"
  },
  {
    "human": "jan 17 2007",
    "machine": "2007-01-17"
  },
  {
    "human": "1975-01-23",
    "machine": "1975-01-23"
  },
  {
    "human": "1975.08.10 ad",
    "machine": "1975-08-10"
  },
  {
    "human": "06.01.2017",
    "machine": "2017-01-06"
  },
  {
    "human": "11/29/2000",
    "machine": "2000-11-29"
  },
  {
    "human": "96.06.11",
    "machine": "1996-06-11"
  },
  {
    "human": "21 october 1998",
    "machine": "1998-10-21"
  },
  {
    "human": "2020.01.14 ad",
    "machine": "2020-01-14"
  },
  {
    "human": "14 june 1990",
    "machine": "1990-06-14"
  },
  {
    "human": "07-17-11",
    "machine": "2011-07-17"
  },
  {
    "human": "1987-08-31",
    "machine": "1987-08-31"
  },
  {
    "human": "07-16-96",
    "machine": "1996-07-16"
  },
  {
    "human": "09-14-88",
    "machine": "1988-09-14"
  },
  {
    "human": "november 1, 1991",
    "machine": "1991-11-01"
  },
  {
    "human": "05-02-23",
    "machine": "2005-02-23"
  },
  {
    "human": "august 21, 2022",
    "machine": "2022-08-21"
  },
  {
    "human": "15 may 1973",
    "machine": "1973-05-15"
  },
  {
    "human": "71.08.3",
    "machine": "1971-08-03"
  },
  {
    "human": "jul 17, 1985",
    "machine": "1985-07-17"
  },
  {
    "human": "jul 14, 87",
    "machine": "1987-07-14"
  },
  {
    "human": "june 9, 1996",
    "machine": "1996-06-09"
  },
  {
    "human": "thursday, september 29, 1977",
    "machine": "1977-09-29"
  },
  {
    "human": "april 7, 2006",
    "machine": "2006-04-07"
  },
  {
    "human": "1985/09/01",
    "machine": "1985-09-01"
  },
  {
    "human": "22 october 1982",
    "machine": "1982-10-22"
  },
  {
    "human": "24/10/1973",
    "machine": "1973-10-24"
  },
  {
    "human": "2001-06-01",
    "machine": "2001-06-01"
  },
  {
    "human": "2/28/25",
    "machine": "2025-02-28"
  },
  {
    "human": "11.10.72",
    "machine": "1972-10-11"
  },
  {
    "human": "saturday, august 3, 2019",
    "machine": "2019-08-03"
  },
  {
    "human": "28 oct 1995",
    "machine": "1995-10-28"
  },
  {
    "human": "dec 2, 16",
    "machine": "2016-12-02"
  },
  {
    "human": "14-09-11",
    "machine": "2014-09-11"
  },
  {
    "human": "friday, october 9, 2009",
    "machine": "2009-10-09"
  },
  {
    "human": "tuesday, october 11, 2022",
    "machine": "2022-10-11"
  },
  {
    "human": "06/12/1996",
    "machine": "1996-06-12"
  },
  {
    "human": "24.12.30",
    "machine": "2024-12-30"
  },
  {
    "human": "94-12-29",
    "machine": "1994-12-29"
  },
  {
    "human": "aug 23, 1997",
    "machine": "1997-08-23"
  },
  {
    "human": "05/26/2023",
    "machine": "2023-05-26"
  },
  {
    "human": "11-14-89",
    "machine": "1989-11-14"
  },
  {
    "human": "08-09-78",
    "machine": "1978-08-09"
  },
  {
    "human": "wednesday, may 17, 2006",
    "machine": "2006-05-17"
  },
  {
    "human": "1970.11.23 ad",
    "machine": "1970-11-23"
  },
  {
    "human": "1999-02-5",
    "machine": "1999-02-05"
  },
  {
    "human": "tuesday, june 28, 2022",
    "machine": "2022-06-28"
  },
  {
    "human": "02-13-14",
    "machine": "2014-02-13"
  },
  {
    "human": "03-16-11",
    "machine": "2011-03-16"
  },
  {
    "human": "18/06/2001",
    "machine": "2001-06-18"
  },
  {
    "human": "tuesday, october 18, 2016",
    "machine": "2016-10-18"
  },
  {
    "human": "1979-05-4",
    "machine": "1979-05-04"
  },
  {
    "human": "16 april 2023",
    "machine": "2023-04-16"
  },
  {
    "human": "6/11/85",
    "machine": "1985-06-11"
  },
  {
    "human": "10 november 1988",
    "machine": "1988-11-10"
  },
  {
    "human": "19-jun-1989",
    "machine": "1989-06-19"
  },
  {
    "human": "june 28, 1982",
    "machine": "1982-06-28"
  },
  {
    "human": "81-02-05",
    "machine": "1981-02-05"
  },
  {
    "human": "may 2, 1976",
    "machine": "1976-05-02"
  },
  {
    "human": "18-jun-1975",
    "machine": "1975-06-18"
  },
  {
    "human": "92.11.10",
    "machine": "1992-11-10"
  },
  {
    "human": "nov 15, 73",
    "machine": "1973-11-15"
  },
  {
    "human": "8/16/81",
    "machine": "1981-08-16"
  },
  {
    "human": "1983-06-17",
    "machine": "1983-06-17"
  },
  {
    "human": "6 may 2017",
    "machine": "2017-05-06"
  },
  {
    "human": "nov 13, 2000",
    "machine": "2000-11-13"
  },
  {
    "human": "9 january 2007",
    "machine": "2007-01-09"
  },
  {
    "human": "31-jan-1994",
    "machine": "1994-01-31"
  },
  {
    "human": "jul 10 2015",
    "machine": "2015-07-10"
  },
  {
    "human": "02.08.28",
    "machine": "2002-08-28"
  },
  {
    "human": "10 september 1971",
    "machine": "1971-09-10"
  },
  {
    "human": "7/11/1981",
    "machine": "1981-11-07"
  },
  {
    "human": "feb 18, 91",
    "machine": "1991-02-18"
  },
  {
    "human": "sun, sep 21, 08",
    "machine": "2008-09-21"
  },
  {
    "human": "01-17-06",
    "machine": "2006-01-17"
  },
  {
    "human": "07/29/1998",
    "machine": "1998-07-29"
  },
  {
    "human": "96-02-13",
    "machine": "1996-02-13"
  },
  {
    "human": "7/11/2025",
    "machine": "2025-11-07"
  },
  {
    "human": "5/12/77",
    "machine": "1977-05-12"
  },
  {
    "human": "august 24, 1993",
    "machine": "1993-08-24"
  },
  {
    "human": "2001-12-1",
    "machine": "2001-12-01"
  },
  {
    "human": "fri, nov 28, 03",
    "machine": "2003-11-28"
  },
  {
    "human": "24, oct 2000",
    "machine": "2000-10-24"
  },
  {
    "human": "sunday, december 29, 2019",
    "machine": "2019-12-29"
  },
  {
    "human": "15 may 2004",
    "machine": "2004-05-15"
  },
  {
    "human": "3.5.70",
    "machine": "1970-05-03"
  },
  {
    "human": "30, sep 1993",
    "machine": "1993-09-30"
  },
  {
    "human": "10-jul-1981",
    "machine": "1981-07-10"
  },
  {
    "human": "1971/04/10",
    "machine": "1971-04-10"
  },
  {
    "human": "19.8.05",
    "machine": "2005-08-19"
  },
  {
    "human": "12 nov, 1997",
    "machine": "1997-11-12"
  },
  {
    "human": "sun, oct 10, 93",
    "machine": "1993-10-10"
  },
  {
    "human": "71-09-04",
    "machine": "1971-09-04"
  },
  {
    "human": "1979.06.24 ad",
    "machine": "1979-06-24"
  },
  {
    "human": "02-23-08",
    "machine": "2008-02-23"
  },
  {
    "human": "8/28/97",
    "machine": "1997-08-28"
  },
  {
    "human": "20 oct, 2008",
    "machine": "2008-10-20"
  },
  {
    "human": "14/09/1981",
    "machine": "1981-09-14"
  },
  {
    "human": "2/23/86",
    "machine": "1986-02-23"
  },
  {
    "human": "march 14, 2002",
    "machine": "2002-03-14"
  },
  {
    "human": "02-07-26",
    "machine": "2002-07-26"
  },
  {
    "human": "aug 10, 71",
    "machine": "1971-08-10"
  },
  {
    "human": "february 26, 1970",
    "machine": "1970-02-26"
  },
  {
    "human": "sunday, january 25, 2009",
    "machine": "2009-01-25"
  },
  {
    "human": "21/11/2000",
    "machine": "2000-11-21"
  },
  {
    "human": "oct 15, 01",
    "machine": "2001-10-15"
  },
  {
    "human": "16-jun-2017",
    "machine": "2017-06-16"
  },
  {
    "human": "00.12.7",
    "machine": "2000-12-07"
  },
  {
    "human": "2002.12.05 ad",
    "machine": "2002-12-05"
  },
  {
    "human": "july 29, 1992",
    "machine": "1992-07-29"
  },
  {
    "human": "dec 26 2016",
    "machine": "2016-12-26"
  },
  {
    "human": "2004-01-16",
    "machine": "2004-01-16"
  },
  {
    "human": "24/03/2024",
    "machine": "2024-03-24"
  },
  {
    "human": "feb 4 2017",
    "machine": "2017-02-04"
  },
  {
    "human": "27 october 1982",
    "machine": "1982-10-27"
  },
  {
    "human": "09/01/1976",
    "machine": "1976-09-01"
  },
  {
    "human": "04/25/1995",
    "machine": "1995-04-25"
  },
  {
    "human": "2003-05-9",
    "machine": "2003-05-09"
  },
  {
    "human": "sep 15, 2012",
    "machine": "2012-09-15"
  },
  {
    "human": "jun 3, 2004",
    "machine": "2004-06-03"
  },
  {
    "human": "december 23, 1994",
    "machine": "1994-12-23"
  },
  {
    "human": "dec 18, 24",
    "machine": "2024-12-18"
  },
  {
    "human": "july 21, 2012",
    "machine": "2012-07-21"
  },
  {
    "human": "1996-02-28",
    "machine": "1996-02-28"
  },
  {
    "human": "9-oct-2024",
    "machine": "2024-10-09"
  },
  {
    "human": "2 sep 2018",
    "machine": "2018-09-02"
  },
  {
    "human": "jan 8 1974",
    "machine": "1974-01-08"
  },
  {
    "human": "jan 27, 90",
    "machine": "1990-01-27"
  },
  {
    "human": "13.11.14",
    "machine": "2014-11-13"
  },
  {
    "human": "16.07.17",
    "machine": "2016-07-17"
  },
  {
    "human": "1972/05/25",
    "machine": "1972-05-25"
  },
  {
    "human": "2024-12-18",
    "machine": "2024-12-18"
  },
  {
    "human": "12/2/05",
    "machine": "2005-12-02"
  },
  {
    "human": "23 apr, 2003",
    "machine": "2003-04-23"
  },
  {
    "human": "16 jan, 1994",
    "machine": "1994-01-16"
  },
  {
    "human": "26 november 2022",
    "machine": "2022-11-26"
  },
  {
    "human": "may 4, 1987",
    "machine": "1987-05-04"
  },
  {
    "human": "8/03/2024",
    "machine": "2024-03-08"
  },
  {
    "human": "11.10.27",
    "machine": "2011-10-27"
  },
  {
    "human": "2024.06.18 ad",
    "machine": "2024-06-18"
  },
  {
    "human": "2003-03-18",
    "machine": "2003-03-18"
  },
  {
    "human": "thursday, july 12, 2007",
    "machine": "2007-07-12"
  },
  {
    "human": "oct 21, 2003",
    "machine": "2003-10-21"
  },
  {
    "human": "jun 18, 85",
    "machine": "1985-06-18"
  },
  {
    "human": "29, nov 1983",
    "machine": "1983-11-29"
  },
  {
    "human": "26 june 2024",
    "machine": "2024-06-26"
  },
  {
    "human": "2/2/01",
    "machine": "2001-02-02"
  },
  {
    "human": "jul 24 1973",
    "machine": "1973-07-24"
  },
  {
    "human": "05-26-96",
    "machine": "1996-05-26"
  },
  {
    "human": "sep 23, 1972",
    "machine": "1972-09-23"
  },
  {
    "human": "6/16/06",
    "machine": "2006-06-16"
  },
  {
    "human": "nov 2, 2012",
    "machine": "2012-11-02"
  },
  {
    "human": "07.10.1972",
    "machine": "1972-10-07"
  },
  {
    "human": "1/10/73",
    "machine": "1973-01-10"
  },
  {
    "human": "08/21/2021",
    "machine": "2021-08-21"
  },
  {
    "human": "wed, oct 21, 09",
    "machine": "2009-10-21"
  },
  {
    "human": "28, jun 1983",
    "machine": "1983-06-28"
  },
  {
    "human": "sunday, august 16, 2015",
    "machine": "2015-08-16"
  },
  {
    "human": "10/30/1988",
    "machine": "1988-10-30"
  },
  {
    "human": "sep 21, 2013",
    "machine": "2013-09-21"
  },
  {
    "human": "18, jun 1999",
    "machine": "1999-06-18"
  },
  {
    "human": "22.09.2022",
    "machine": "2022-09-22"
  },
  {
    "human": "2011/02/10",
    "machine": "2011-02-10"
  },
  {
    "human": "2009/01/02",
    "machine": "2009-01-02"
  },
  {
    "human": "11-21-14",
    "machine": "2014-11-21"
  },
  {
    "human": "11-may-1994",
    "machine": "1994-05-11"
  },
  {
    "human": "7/06/1980",
    "machine": "1980-06-07"
  },
  {
    "human": "june 19, 1979",
    "machine": "1979-06-19"
  },
  {
    "human": "june 28, 1992",
    "machine": "1992-06-28"
  },
  {
    "human": "2/3/71",
    "machine": "1971-02-03"
  },
  {
    "human": "23 march 2023",
    "machine": "2023-03-23"
  },
  {
    "human": "sunday, november 29, 1998",
    "machine": "1998-11-29"
  },
  {
    "human": "02.04.27",
    "machine": "2002-04-27"
  },
  {
    "human": "thursday, february 23, 2006",
    "machine": "2006-02-23"
  },
  {
    "human": "1/5/21",
    "machine": "2021-01-05"
  },
  {
    "human": "5 march 1989",
    "machine": "1989-03-05"
  },
  {
    "human": "aug 12 1990",
    "machine": "1990-08-12"
  },
  {
    "human": "22 nov, 1974",
    "machine": "1974-11-22"
  },
  {
    "human": "2006-10-15",
    "machine": "2006-10-15"
  },
  {
    "human": "11-oct-1970",
    "machine": "1970-10-11"
  },
  {
    "human": "january 08, 2016",
    "machine": "2016-01-08"
  },
  {
    "human": "1997/09/19",
    "machine": "1997-09-19"
  },
  {
    "human": "11/19/04",
    "machine": "2004-11-19"
  },
  {
    "human": "tuesday, january 4, 1994",
    "machine": "1994-01-04"
  },
  {
    "human": "11 september 1978",
    "machine": "1978-09-11"
  },
  {
    "human": "19-08-24",
    "machine": "2019-08-24"
  },
  {
    "human": "12-28-74",
    "machine": "1974-12-28"
  },
  {
    "human": "30.01.2011",
    "machine": "2011-01-30"
  },
  {
    "human": "july 23, 1991",
    "machine": "1991-07-23"
  },
  {
    "human": "thursday, october 8, 1970",
    "machine": "1970-10-08"
  },
  {
    "human": "feb 4 2008",
    "machine": "2008-02-04"
  },
  {
    "human": "thu, aug 11, 05",
    "machine": "2005-08-11"
  },
  {
    "human": "fri, nov 25, 16",
    "machine": "2016-11-25"
  },
  {
    "human": "1/8/72",
    "machine": "1972-01-08"
  },
  {
    "human": "march 06, 2000",
    "machine": "2000-03-06"
  },
  {
    "human": "15.6.25",
    "machine": "2025-06-15"
  },
  {
    "human": "27-jul-2018",
    "machine": "2018-07-27"
  },
  {
    "human": "19 april 1977",
    "machine": "1977-04-19"
  },
  {
    "human": "1974-05-23",
    "machine": "1974-05-23"
  },
  {
    "human": "6/3/01",
    "machine": "2001-06-03"
  },
  {
    "human": "05, mar 1977",
    "machine": "1977-03-05"
  },
  {
    "human": "08.08.30",
    "machine": "2008-08-30"
  },
  {
    "human": "11-jul-2016",
    "machine": "2016-07-11"
  },
  {
    "human": "2020-11-14",
    "machine": "2020-11-14"
  },
  {
    "human": "apr 3 1988",
    "machine": "1988-04-03"
  },
  {
    "human": "98.09.9",
    "machine": "1998-09-09"
  },
  {
    "human": "tue, mar 1, 05",
    "machine": "2005-03-01"
  },
  {
    "human": "april 16, 1983",
    "machine": "1983-04-16"
  },
  {
    "human": "7 february 1994",
    "machine": "1994-02-07"
  },
  {
    "human": "11/29/89",
    "machine": "1989-11-29"
  },
  {
    "human": "01-28-84",
    "machine": "1984-01-28"
  },
  {
    "human": "october 02, 1999",
    "machine": "1999-10-02"
  },
  {
    "human": "june 6, 2016",
    "machine": "2016-06-06"
  },
  {
    "human": "1976-02-15",
    "machine": "1976-02-15"
  },
  {
    "human": "12/17/2004",
    "machine": "2004-12-17"
  },
  {
    "human": "8/9/15",
    "machine": "2015-08-09"
  },
  {
    "human": "oct 8, 78",
    "machine": "1978-10-08"
  },
  {
    "human": "6/14/92",
    "machine": "1992-06-14"
  },
  {
    "human": "04, jun 2000",
    "machine": "2000-06-04"
  },
  {
    "human": "14, apr 2013",
    "machine": "2013-04-14"
  },
  {
    "human": "july 13, 1984",
    "machine": "1984-07-13"
  },
  {
    "human": "2020-06-27",
    "machine": "2020-06-27"
  },
  {
    "human": "thursday, april 6, 2023",
    "machine": "2023-04-06"
  },
  {
    "human": "monday, april 24, 1995",
    "machine": "1995-04-24"
  },
  {
    "human": "07 march 1980",
    "machine": "1980-03-07"
  },
  {
    "human": "april 25, 2025",
    "machine": "2025-04-25"
  },
  {
    "human": "dec 1 1978",
    "machine": "1978-12-01"
  },
  {
    "human": "02.04.1989",
    "machine": "1989-04-02"
  },
  {
    "human": "17, nov 1989",
    "machine": "1989-11-17"
  },
  {
    "human": "aug 10, 80",
    "machine": "1980-08-10"
  },
  {
    "human": "1988-10-26",
    "machine": "1988-10-26"
  },
  {
    "human": "26.07.2010",
    "machine": "2010-07-26"
  },
  {
    "human": "may 08, 2014",
    "machine": "2014-05-08"
  },
  {
    "human": "28.5.75",
    "machine": "1975-05-28"
  },
  {
    "human": "11 jun, 1988",
    "machine": "1988-06-11"
  },
  {
    "human": "december 25, 2023",
    "machine": "2023-12-25"
  },
  {
    "human": "october 31, 1992",
    "machine": "1992-10-31"
  },
  {
    "human": "december 19, 2021",
    "machine": "2021-12-19"
  },
  {
    "human": "tuesday, june 21, 2011",
    "machine": "2011-06-21"
  },
  {
    "human": "2024-03-26",
    "machine": "2024-03-26"
  },
  {
    "human": "nov 16, 16",
    "machine": "2016-11-16"
  },
  {
    "human": "1 july 1989",
    "machine": "1989-07-01"
  },
  {
    "human": "3-feb-2001",
    "machine": "2001-02-03"
  },
  {
    "human": "14.07.2006",
    "machine": "2006-07-14"
  },
  {
    "human": "12 october 1991",
    "machine": "1991-10-12"
  },
  {
    "human": "apr 27, 1975",
    "machine": "1975-04-27"
  },
  {
    "human": "1997/01/10",
    "machine": "1997-01-10"
  },
  {
    "human": "15 mar 1988",
    "machine": "1988-03-15"
  },
  {
    "human": "13-mar-2024",
    "machine": "2024-03-13"
  },
  {
    "human": "16, jan 1973",
    "machine": "1973-01-16"
  },
  {
    "human": "20 february 2002",
    "machine": "2002-02-20"
  },
  {
    "human": "12-08-04",
    "machine": "2004-12-08"
  },
  {
    "human": "2012-11-17",
    "machine": "2012-11-17"
  },
  {
    "human": "1978-11-10",
    "machine": "1978-11-10"
  },
  {
    "human": "may 08, 2012",
    "machine": "2012-05-08"
  },
  {
    "human": "13 sep 2005",
    "machine": "2005-09-13"
  },
  {
    "human": "11-01-70",
    "machine": "1970-11-01"
  },
  {
    "human": "aug 29, 20",
    "machine": "2020-08-29"
  },
  {
    "human": "1998-03-19",
    "machine": "1998-03-19"
  },
  {
    "human": "13.2.70",
    "machine": "1970-02-13"
  },
  {
    "human": "20 apr 1984",
    "machine": "1984-04-20"
  },
  {
    "human": "1987/03/14",
    "machine": "1987-03-14"
  },
  {
    "human": "12 apr, 2008",
    "machine": "2008-04-12"
  },
  {
    "human": "september 17, 2003",
    "machine": "2003-09-17"
  },
  {
    "human": "2007.11.30 ad",
    "machine": "2007-11-30"
  },
  {
    "human": "aug 19, 2017",
    "machine": "2017-08-19"
  },
  {
    "human": "fri, jun 6, 97",
    "machine": "1997-06-06"
  },
  {
    "human": "03 july 2008",
    "machine": "2008-07-03"
  },
  {
    "human": "13/01/2023",
    "machine": "2023-01-13"
  },
  {
    "human": "04-28-82",
    "machine": "1982-04-28"
  },
  {
    "human": "oct 27, 87",
    "machine": "1987-10-27"
  },
  {
    "human": "5-sep-2021",
    "machine": "2021-09-05"
  },
  {
    "human": "1972-04-6",
    "machine": "1972-04-06"
  },
  {
    "human": "5/18/79",
    "machine": "1979-05-18"
  },
  {
    "human": "1987.02.02 ad",
    "machine": "1987-02-02"
  },
  {
    "human": "tuesday, december 20, 2011",
    "machine": "2011-12-20"
  },
  {
    "human": "sunday, july 8, 1979",
    "machine": "1979-07-08"
  },
  {
    "human": "11 feb, 2023",
    "machine": "2023-02-11"
  },
  {
    "human": "07-27-95",
    "machine": "1995-07-27"
  },
  {
    "human": "92.01.6",
    "machine": "1992-01-06"
  },
  {
    "human": "28 feb, 1989",
    "machine": "1989-02-28"
  },
  {
    "human": "2/12/70",
    "machine": "1970-02-12"
  },
  {
    "human": "11/15/97",
    "machine": "1997-11-15"
  },
  {
    "human": "2019-01-18",
    "machine": "2019-01-18"
  },
  {
    "human": "may 31, 98",
    "machine": "1998-05-31"
  },
  {
    "human": "march 23, 1977",
    "machine": "1977-03-23"
  },
  {
    "human": "april 6, 1988",
    "machine": "1988-04-06"
  },
  {
    "human": "1/4/02",
    "machine": "2002-01-04"
  },
  {
    "human": "7/06/2002",
    "machine": "2002-06-07"
  },
  {
    "human": "september 11, 2006",
    "machine": "2006-09-11"
  },
  {
    "human": "28-jul-2013",
    "machine": "2013-07-28"
  },
  {
    "human": "6/28/22",
    "machine": "2022-06-28"
  },
  {
    "human": "2015.12.22 ad",
    "machine": "2015-12-22"
  },
  {
    "human": "9/12/11",
    "machine": "2011-09-12"
  },
  {
    "human": "mar 23, 01",
    "machine": "2001-03-23"
  },
  {
    "human": "1990-04-14",
    "machine": "1990-04-14"
  },
  {
    "human": "04.08.12",
    "machine": "2004-08-12"
  },
  {
    "human": "12, aug 1975",
    "machine": "1975-08-12"
  },
  {
    "human": "2/27/88",
    "machine": "1988-02-27"
  },
  {
    "human": "70-08-31",
    "machine": "1970-08-31"
  },
  {
    "human": "jan 25 1980",
    "machine": "1980-01-25"
  },
  {
    "human": "oct 20, 08",
    "machine": "2008-10-20"
  },
  {
    "human": "august 10, 1974",
    "machine": "1974-08-10"
  },
  {
    "human": "18.4.86",
    "machine": "1986-04-18"
  },
  {
    "human": "07, aug 2016",
    "machine": "2016-08-07"
  },
  {
    "human": "25 january 2004",
    "machine": "2004-01-25"
  },
  {
    "human": "tuesday, november 16, 1999",
    "machine": "1999-11-16"
  },
  {
    "human": "may 10 1978",
    "machine": "1978-05-10"
  },
  {
    "human": "06/08/2025",
    "machine": "2025-06-08"
  },
  {
    "human": "2003/05/23",
    "machine": "2003-05-23"
  },
  {
    "human": "16 november 1975",
    "machine": "1975-11-16"
  },
  {
    "human": "14 apr 1994",
    "machine": "1994-04-14"
  },
  {
    "human": "8 nov, 2004",
    "machine": "2004-11-08"
  },
  {
    "human": "dec 8, 23",
    "machine": "2023-12-08"
  },
  {
    "human": "friday, december 12, 2008",
    "machine": "2008-12-12"
  },
  {
    "human": "28 august 1995",
    "machine": "1995-08-28"
  },
  {
    "human": "friday, august 31, 1990",
    "machine": "1990-08-31"
  },
  {
    "human": "27 dec 2012",
    "machine": "2012-12-27"
  },
  {
    "human": "january 18, 2015",
    "machine": "2015-01-18"
  },
  {
    "human": "2/21/78",
    "machine": "1978-02-21"
  },
  {
    "human": "5.6.20",
    "machine": "2020-06-05"
  },
  {
    "human": "1977.10.26 ad",
    "machine": "1977-10-26"
  },
  {
    "human": "10/27/99",
    "machine": "1999-10-27"
  },
  {
    "human": "2.4.23",
    "machine": "2023-04-02"
  },
  {
    "human": "25.6.05",
    "machine": "2005-06-25"
  },
  {
    "human": "mar 2, 1984",
    "machine": "1984-03-02"
  },
  {
    "human": "29/07/2012",
    "machine": "2012-07-29"
  },
  {
    "human": "nov 21, 03",
    "machine": "2003-11-21"
  },
  {
    "human": "14.1.80",
    "machine": "1980-01-14"
  },
  {
    "human": "25 january 2001",
    "machine": "2001-01-25"
  },
  {
    "human": "20.01.30",
    "machine": "2020-01-30"
  },
  {
    "human": "10/26/25",
    "machine": "2025-10-26"
  },
  {
    "human": "18 march 2014",
    "machine": "2014-03-18"
  },
  {
    "human": "12.11.5",
    "machine": "2012-11-05"
  },
  {
    "human": "2 january 2015",
    "machine": "2015-01-02"
  },
  {
    "human": "august 2, 2010",
    "machine": "2010-08-02"
  },
  {
    "human": "2025-07-25",
    "machine": "2025-07-25"
  },
  {
    "human": "2006-10-26",
    "machine": "2006-10-26"
  },
  {
    "human": "1992.02.21 ad",
    "machine": "1992-02-21"
  },
  {
    "human": "17 september 2014",
    "machine": "2014-09-17"
  },
  {
    "human": "1996/11/19",
    "machine": "1996-11-19"
  },
  {
    "human": "april 22, 2006",
    "machine": "2006-04-22"
  },
  {
    "human": "sunday, january 31, 2016",
    "machine": "2016-01-31"
  },
  {
    "human": "august 16, 1981",
    "machine": "1981-08-16"
  },
  {
    "human": "04, jun 1985",
    "machine": "1985-06-04"
  },
  {
    "human": "2001/11/14",
    "machine": "2001-11-14"
  },
  {
    "human": "thu, oct 11, 84",
    "machine": "1984-10-11"
  },
  {
    "human": "1971.05.01 ad",
    "machine": "1971-05-01"
  },
  {
    "human": "april 19, 1987",
    "machine": "1987-04-19"
  },
  {
    "human": "2024.12.09 ad",
    "machine": "2024-12-09"
  },
  {
    "human": "1994.06.04 ad",
    "machine": "1994-06-04"
  },
  {
    "human": "friday, june 17, 2011",
    "machine": "2011-06-17"
  },
  {
    "human": "14 july 1981",
    "machine": "1981-07-14"
  },
  {
    "human": "wed, sep 10, 86",
    "machine": "1986-09-10"
  },
  {
    "human": "thursday, december 1, 1988",
    "machine": "1988-12-01"
  },
  {
    "human": "monday, january 3, 2011",
    "machine": "2011-01-03"
  },
  {
    "human": "1997-07-15",
    "machine": "1997-07-15"
  },
  {
    "human": "06-22-14",
    "machine": "2014-06-22"
  },
  {
    "human": "october 28, 1975",
    "machine": "1975-10-28"
  },
  {
    "human": "13.05.1978",
    "machine": "1978-05-13"
  },
  {
    "human": "saturday, february 8, 1986",
    "machine": "1986-02-08"
  },
  {
    "human": "friday, march 18, 1994",
    "machine": "1994-03-18"
  },
  {
    "human": "01-07-13",
    "machine": "2013-01-07"
  },
  {
    "human": "july 8, 1997",
    "machine": "1997-07-08"
  },
  {
    "human": "1977-06-19",
    "machine": "1977-06-19"
  },
  {
    "human": "thursday, march 30, 1989",
    "machine": "1989-03-30"
  },
  {
    "human": "14 march 2003",
    "machine": "2003-03-14"
  },
  {
    "human": "july 09, 1995",
    "machine": "1995-07-09"
  },
  {
    "human": "9/11/2012",
    "machine": "2012-11-09"
  },
  {
    "human": "1/15/75",
    "machine": "1975-01-15"
  },
  {
    "human": "25 july 2023",
    "machine": "2023-07-25"
  },
  {
    "human": "21.2.87",
    "machine": "1987-02-21"
  },
  {
    "human": "01.09.1976",
    "machine": "1976-09-01"
  },
  {
    "human": "22.09.18",
    "machine": "2022-09-18"
  },
  {
    "human": "wednesday, october 11, 2023",
    "machine": "2023-10-11"
  },
  {
    "human": "jul 19, 2005",
    "machine": "2005-07-19"
  },
  {
    "human": "dec 30, 20",
    "machine": "2020-12-30"
  },
  {
    "human": "20/06/2011",
    "machine": "2011-06-20"
  },
  {
    "human": "2012.06.27 ad",
    "machine": "2012-06-27"
  },
  {
    "human": "jan 19 1998",
    "machine": "1998-01-19"
  },
  {
    "human": "28.10.1995",
    "machine": "1995-10-28"
  },
  {
    "human": "12.06.1989",
    "machine": "1989-06-12"
  },
  {
    "human": "february 23, 1999",
    "machine": "1999-02-23"
  },
  {
    "human": "8 jan, 2016",
    "machine": "2016-01-08"
  },
  {
    "human": "20 september 1979",
    "machine": "1979-09-20"
  },
  {
    "human": "19.01.2016",
    "machine": "2016-01-19"
  },
  {
    "human": "12, mar 2008",
    "machine": "2008-03-12"
  },
  {
    "human": "sep 4 1979",
    "machine": "1979-09-04"
  },
  {
    "human": "03/19/1996",
    "machine": "1996-03-19"
  },
  {
    "human": "january 02, 2017",
    "machine": "2017-01-02"
  },
  {
    "human": "12-20-99",
    "machine": "1999-12-20"
  },
  {
    "human": "91.01.8",
    "machine": "1991-01-08"
  },
  {
    "human": "11, aug 1994",
    "machine": "1994-08-11"
  },
  {
    "human": "tue, may 11, 82",
    "machine": "1982-05-11"
  },
  {
    "human": "2011/07/31",
    "machine": "2011-07-31"
  },
  {
    "human": "1980-02-08",
    "machine": "1980-02-08"
  },
  {
    "human": "04-04-15",
    "machine": "2004-04-15"
  },
  {
    "human": "june 12, 1993",
    "machine": "1993-06-12"
  },
  {
    "human": "88-08-12",
    "machine": "1988-08-12"
  },
  {
    "human": "1/18/84",
    "machine": "1984-01-18"
  },
  {
    "human": "8 may 1983",
    "machine": "1983-05-08"
  },
  {
    "human": "april 2, 1995",
    "machine": "1995-04-02"
  },
  {
    "human": "2014.07.14 ad",
    "machine": "2014-07-14"
  },
  {
    "human": "17 jan 1984",
    "machine": "1984-01-17"
  },
  {
    "human": "94-10-18",
    "machine": "1994-10-18"
  },
  {
    "human": "05, nov 2025",
    "machine": "2025-11-05"
  },
  {
    "human": "74.11.2",
    "machine": "1974-11-02"
  },
  {
    "human": "fri, feb 24, 78",
    "machine": "1978-02-24"
  },
  {
    "human": "1974/08/18",
    "machine": "1974-08-18"
  },
  {
    "human": "20 january 1974",
    "machine": "1974-01-20"
  },
  {
    "human": "mon, sep 14, 87",
    "machine": "1987-09-14"
  },
  {
    "human": "1993/03/07",
    "machine": "1993-03-07"
  },
  {
    "human": "jun 10 1994",
    "machine": "1994-06-10"
  },
  {
    "human": "3/18/84",
    "machine": "1984-03-18"
  },
  {
    "human": "22 november 1988",
    "machine": "1988-11-22"
  },
  {
    "human": "1986-09-14",
    "machine": "1986-09-14"
  },
  {
    "human": "jul 8, 04",
    "machine": "2004-07-08"
  },
  {
    "human": "81.08.15",
    "machine": "1981-08-15"
  },
  {
    "human": "29 august 1976",
    "machine": "1976-08-29"
  },
  {
    "human": "11-18-13",
    "machine": "2013-11-18"
  },
  {
    "human": "4/8/86",
    "machine": "1986-04-08"
  },
  {
    "human": "april 23, 2005",
    "machine": "2005-04-23"
  },
  {
    "human": "08.12.25",
    "machine": "2008-12-25"
  },
  {
    "human": "28.5.96",
    "machine": "1996-05-28"
  },
  {
    "human": "78-07-01",
    "machine": "1978-07-01"
  },
  {
    "human": "87.03.5",
    "machine": "1987-03-05"
  },
  {
    "human": "nov 8 2023",
    "machine": "2023-11-08"
  },
  {
    "human": "wednesday, august 25, 1971",
    "machine": "1971-08-25"
  },
  {
    "human": "2024.03.09 ad",
    "machine": "2024-03-09"
  },
  {
    "human": "fri, feb 2, 79",
    "machine": "1979-02-02"
  },
  {
    "human": "wednesday, june 19, 2002",
    "machine": "2002-06-19"
  },
  {
    "human": "saturday, may 30, 1970",
    "machine": "1970-05-30"
  },
  {
    "human": "8-mar-1991",
    "machine": "1991-03-08"
  },
  {
    "human": "15, oct 1978",
    "machine": "1978-10-15"
  },
  {
    "human": "9/24/11",
    "machine": "2011-09-24"
  },
  {
    "human": "16.12.22",
    "machine": "2022-12-16"
  },
  {
    "human": "2003.07.01 ad",
    "machine": "2003-07-01"
  },
  {
    "human": "6 dec 2019",
    "machine": "2019-12-06"
  },
  {
    "human": "13 november 1986",
    "machine": "1986-11-13"
  },
  {
    "human": "13 september 2021",
    "machine": "2021-09-13"
  },
  {
    "human": "04/13/2004",
    "machine": "2004-04-13"
  },
  {
    "human": "march 11, 1993",
    "machine": "1993-03-11"
  },
  {
    "human": "jan 31, 73",
    "machine": "1973-01-31"
  },
  {
    "human": "23-02-09",
    "machine": "2023-02-09"
  },
  {
    "human": "oct 28, 22",
    "machine": "2022-10-28"
  },
  {
    "human": "3/01/1989",
    "machine": "1989-01-03"
  },
  {
    "human": "jun 23, 1997",
    "machine": "1997-06-23"
  },
  {
    "human": "7-apr-1987",
    "machine": "1987-04-07"
  },
  {
    "human": "13.11.1",
    "machine": "2013-11-01"
  },
  {
    "human": "april 07, 1994",
    "machine": "1994-04-07"
  },
  {
    "human": "thursday, january 4, 1979",
    "machine": "1979-01-04"
  },
  {
    "human": "2000/05/10",
    "machine": "2000-05-10"
  },
  {
    "human": "may 4, 88",
    "machine": "1988-05-04"
  },
  {
    "human": "10-10-07",
    "machine": "2007-10-10"
  },
  {
    "human": "6/4/05",
    "machine": "2005-06-04"
  },
  {
    "human": "26 may 1990",
    "machine": "1990-05-26"
  },
  {
    "human": "18.9.21",
    "machine": "2021-09-18"
  },
  {
    "human": "september 9, 2020",
    "machine": "2020-09-09"
  },
  {
    "human": "sunday, june 2, 1985",
    "machine": "1985-06-02"
  },
  {
    "human": "2019-06-15",
    "machine": "2019-06-15"
  },
  {
    "human": "22-sep-2007",
    "machine": "2007-09-22"
  },
  {
    "human": "thursday, november 4, 2010",
    "machine": "2010-11-04"
  },
  {
    "human": "1991-01-12",
    "machine": "1991-01-12"
  },
  {
    "human": "28.06.2001",
    "machine": "2001-06-28"
  },
  {
    "human": "mar 18, 2016",
    "machine": "2016-03-18"
  },
  {
    "human": "1985/04/09",
    "machine": "1985-04-09"
  },
  {
    "human": "jun 17, 71",
    "machine": "1971-06-17"
  },
  {
    "human": "11-20-10",
    "machine": "2010-11-20"
  },
  {
    "human": "sunday, february 20, 1994",
    "machine": "1994-02-20"
  },
  {
    "human": "1997.03.12 ad",
    "machine": "1997-03-12"
  },
  {
    "human": "01-05-21",
    "machine": "2001-05-21"
  },
  {
    "human": "jul 6 1999",
    "machine": "1999-07-06"
  },
  {
    "human": "28, oct 2016",
    "machine": "2016-10-28"
  },
  {
    "human": "13 june 2010",
    "machine": "2010-06-13"
  },
  {
    "human": "may 26 2023",
    "machine": "2023-05-26"
  },
  {
    "human": "28.03.1980",
    "machine": "1980-03-28"
  },
  {
    "human": "05-29-98",
    "machine": "1998-05-29"
  },
  {
    "human": "saturday, june 25, 2011",
    "machine": "2011-06-25"
  },
  {
    "human": "15 jan, 1972",
    "machine": "1972-01-15"
  },
  {
    "human": "1998.05.08 ad",
    "machine": "1998-05-08"
  },
  {
    "human": "4 may, 1986",
    "machine": "1986-05-04"
  },
  {
    "human": "1999-05-27",
    "machine": "1999-05-27"
  },
  {
    "human": "saturday, march 15, 1997",
    "machine": "1997-03-15"
  },
  {
    "human": "27-may-2014",
    "machine": "2014-05-27"
  },
  {
    "human": "2016-01-10",
    "machine": "2016-01-10"
  },
  {
    "human": "aug 31, 2003",
    "machine": "2003-08-31"
  },
  {
    "human": "18, dec 1970",
    "machine": "1970-12-18"
  },
  {
    "human": "1979/05/07",
    "machine": "1979-05-07"
  },
  {
    "human": "18 december 1995",
    "machine": "1995-12-18"
  },
  {
    "human": "15 october 2013",
    "machine": "2013-10-15"
  },
  {
    "human": "1998-07-16",
    "machine": "1998-07-16"
  },
  {
    "human": "friday, september 24, 1982",
    "machine": "1982-09-24"
  },
  {
    "human": "thursday, december 2, 1982",
    "machine": "1982-12-02"
  },
  {
    "human": "17.5.24",
    "machine": "2024-05-17"
  },
  {
    "human": "sep 24 1983",
    "machine": "1983-09-24"
  },
  {
    "human": "june 18, 2008",
    "machine": "2008-06-18"
  },
  {
    "human": "78.08.15",
    "machine": "1978-08-15"
  },
  {
    "human": "1998.10.14 ad",
    "machine": "1998-10-14"
  },
  {
    "human": "12-04-83",
    "machine": "1983-12-04"
  },
  {
    "human": "16 feb, 1989",
    "machine": "1989-02-16"
  },
  {
    "human": "1981-07-10",
    "machine": "1981-07-10"
  },
  {
    "human": "1/5/16",
    "machine": "2016-01-05"
  },
  {
    "human": "dec 12 1998",
    "machine": "1998-12-12"
  },
  {
    "human": "2004/04/16",
    "machine": "2004-04-16"
  },
  {
    "human": "21.1.05",
    "machine": "2005-01-21"
  },
  {
    "human": "wednesday, february 6, 1974",
    "machine": "1974-02-06"
  },
  {
    "human": "22 june 1986",
    "machine": "1986-06-22"
  },
  {
    "human": "oct 4, 78",
    "machine": "1978-10-04"
  },
  {
    "human": "9/27/14",
    "machine": "2014-09-27"
  },
  {
    "human": "09.06.1988",
    "machine": "1988-06-09"
  },
  {
    "human": "1972/07/14",
    "machine": "1972-07-14"
  },
  {
    "human": "07, apr 2006",
    "machine": "2006-04-07"
  },
  {
    "human": "05-10-25",
    "machine": "2005-10-25"
  },
  {
    "human": "apr 27, 1976",
    "machine": "1976-04-27"
  },
  {
    "human": "oct 24, 2013",
    "machine": "2013-10-24"
  },
  {
    "human": "6-apr-2014",
    "machine": "2014-04-06"
  },
  {
    "human": "1-mar-2015",
    "machine": "2015-03-01"
  },
  {
    "human": "sep 16 1977",
    "machine": "1977-09-16"
  },
  {
    "human": "12 april 1973",
    "machine": "1973-04-12"
  },
  {
    "human": "january 18, 2007",
    "machine": "2007-01-18"
  },
  {
    "human": "7/22/89",
    "machine": "1989-07-22"
  },
  {
    "human": "2010.04.21 ad",
    "machine": "2010-04-21"
  },
  {
    "human": "10.04.1978",
    "machine": "1978-04-10"
  },
  {
    "human": "1982/02/10",
    "machine": "1982-02-10"
  },
  {
    "human": "2024-01-3",
    "machine": "2024-01-03"
  },
  {
    "human": "thursday, october 18, 2007",
    "machine": "2007-10-18"
  },
  {
    "human": "12.12.78",
    "machine": "1978-12-12"
  },
  {
    "human": "8/7/18",
    "machine": "2018-08-07"
  },
  {
    "human": "2009-08-20",
    "machine": "2009-08-20"
  },
  {
    "human": "03 january 1975",
    "machine": "1975-01-03"
  },
  {
    "human": "73-09-15",
    "machine": "1973-09-15"
  },
  {
    "human": "1-aug-1988",
    "machine": "1988-08-01"
  },
  {
    "human": "july 30, 2004",
    "machine": "2004-07-30"
  },
  {
    "human": "1988/06/25",
    "machine": "1988-06-25"
  },
  {
    "human": "aug 28, 1976",
    "machine": "1976-08-28"
  },
  {
    "human": "friday, april 1, 2022",
    "machine": "2022-04-01"
  },
  {
    "human": "jun 3, 92",
    "machine": "1992-06-03"
  },
  {
    "human": "2000-07-1",
    "machine": "2000-07-01"
  },
  {
    "human": "22 september 1976",
    "machine": "1976-09-22"
  },
  {
    "human": "2009-05-04",
    "machine": "2009-05-04"
  },
  {
    "human": "wednesday, august 17, 1994",
    "machine": "1994-08-17"
  },
  {
    "human": "august 5, 2002",
    "machine": "2002-08-05"
  },
  {
    "human": "04, may 2001",
    "machine": "2001-05-04"
  },
  {
    "human": "31, may 1970",
    "machine": "1970-05-31"
  },
  {
    "human": "04, feb 1977",
    "machine": "1977-02-04"
  },
  {
    "human": "18.12.2005",
    "machine": "2005-12-18"
  },
  {
    "human": "06-14-16",
    "machine": "2016-06-14"
  },
  {
    "human": "4/14/84",
    "machine": "1984-04-14"
  },
  {
    "human": "14-apr-1971",
    "machine": "1971-04-14"
  },
  {
    "human": "march 16, 1985",
    "machine": "1985-03-16"
  },
  {
    "human": "1970/07/20",
    "machine": "1970-07-20"
  },
  {
    "human": "11 december 1979",
    "machine": "1979-12-11"
  },
  {
    "human": "2025/09/01",
    "machine": "2025-09-01"
  },
  {
    "human": "december 15, 1999",
    "machine": "1999-12-15"
  },
  {
    "human": "26/05/2011",
    "machine": "2011-05-26"
  },
  {
    "human": "02-09-78",
    "machine": "1978-02-09"
  },
  {
    "human": "2007.12.09 ad",
    "machine": "2007-12-09"
  },
  {
    "human": "2004-03-14",
    "machine": "2004-03-14"
  },
  {
    "human": "5-sep-2018",
    "machine": "2018-09-05"
  },
  {
    "human": "thu, apr 18, 19",
    "machine": "2019-04-18"
  },
  {
    "human": "jul 4, 2005",
    "machine": "2005-07-04"
  },
  {
    "human": "thu, apr 30, 87",
    "machine": "1987-04-30"
  },
  {
    "human": "1997-01-14",
    "machine": "1997-01-14"
  },
  {
    "human": "16-jul-1988",
    "machine": "1988-07-16"
  },
  {
    "human": "november 23, 1988",
    "machine": "1988-11-23"
  },
  {
    "human": "2017-01-28",
    "machine": "2017-01-28"
  },
  {
    "human": "mar 16, 84",
    "machine": "1984-03-16"
  },
  {
    "human": "2013-08-21",
    "machine": "2013-08-21"
  },
  {
    "human": "20.09.2010",
    "machine": "2010-09-20"
  },
  {
    "human": "june 15, 2025",
    "machine": "2025-06-15"
  },
  {
    "human": "aug 26, 88",
    "machine": "1988-08-26"
  },
  {
    "human": "2024.06.24 ad",
    "machine": "2024-06-24"
  },
  {
    "human": "27-aug-2010",
    "machine": "2010-08-27"
  },
  {
    "human": "9-feb-1987",
    "machine": "1987-02-09"
  },
  {
    "human": "february 6, 1995",
    "machine": "1995-02-06"
  },
  {
    "human": "1.6.20",
    "machine": "2020-06-01"
  },
  {
    "human": "17.02.2021",
    "machine": "2021-02-17"
  },
  {
    "human": "feb 8 2020",
    "machine": "2020-02-08"
  },
  {
    "human": "18.03.1972",
    "machine": "1972-03-18"
  },
  {
    "human": "05.01.19",
    "machine": "2005-01-19"
  },
  {
    "human": "03 june 1992",
    "machine": "1992-06-03"
  },
  {
    "human": "wed, mar 12, 25",
    "machine": "2025-03-12"
  },
  {
    "human": "1992.12.31 ad",
    "machine": "1992-12-31"
  },
  {
    "human": "7 feb 1973",
    "machine": "1973-02-07"
  },
  {
    "human": "19.09.1988",
    "machine": "1988-09-19"
  },
  {
    "human": "11/17/2011",
    "machine": "2011-11-17"
  },
  {
    "human": "2022-06-21",
    "machine": "2022-06-21"
  },
  {
    "human": "thursday, november 16, 1978",
    "machine": "1978-11-16"
  },
  {
    "human": "10/31/20",
    "machine": "2020-10-31"
  },
  {
    "human": "8-jul-1987",
    "machine": "1987-07-08"
  },
  {
    "human": "jan 10 2018",
    "machine": "2018-01-10"
  },
  {
    "human": "thursday, july 30, 1998",
    "machine": "1998-07-30"
  },
  {
    "human": "2020.05.11 ad",
    "machine": "2020-05-11"
  },
  {
    "human": "10/13/2010",
    "machine": "2010-10-13"
  },
  {
    "human": "04/05/1981",
    "machine": "1981-04-05"
  },
  {
    "human": "16.03.1976",
    "machine": "1976-03-16"
  },
  {
    "human": "16.05.18",
    "machine": "2016-05-18"
  },
  {
    "human": "14.5.73",
    "machine": "1973-05-14"
  },
  {
    "human": "sun, sep 27, 20",
    "machine": "2020-09-27"
  },
  {
    "human": "04 june 2021",
    "machine": "2021-06-04"
  },
  {
    "human": "11/01/1995",
    "machine": "1995-01-11"
  },
  {
    "human": "17/02/1980",
    "machine": "1980-02-17"
  },
  {
    "human": "22.03.11",
    "machine": "2022-03-11"
  },
  {
    "human": "september 17, 2005",
    "machine": "2005-09-17"
  },
  {
    "human": "9-may-2016",
    "machine": "2016-05-09"
  },
  {
    "human": "monday, november 23, 1992",
    "machine": "1992-11-23"
  },
  {
    "human": "april 10, 2020",
    "machine": "2020-04-10"
  },
  {
    "human": "05, feb 1978",
    "machine": "1978-02-05"
  },
  {
    "human": "01-07-15",
    "machine": "2015-01-07"
  },
  {
    "human": "may 26, 1988",
    "machine": "1988-05-26"
  },
  {
    "human": "17/05/2012",
    "machine": "2012-05-17"
  },
  {
    "human": "2025.08.03 ad",
    "machine": "2025-08-03"
  },
  {
    "human": "11-06-22",
    "machine": "2011-06-22"
  },
  {
    "human": "20 september 2002",
    "machine": "2002-09-20"
  },
  {
    "human": "04-12-98",
    "machine": "1998-04-12"
  },
  {
    "human": "01, aug 2010",
    "machine": "2010-08-01"
  },
  {
    "human": "24 february 2014",
    "machine": "2014-02-24"
  },
  {
    "human": "87-04-01",
    "machine": "1987-04-01"
  },
  {
    "human": "october 26, 1978",
    "machine": "1978-10-26"
  },
  {
    "human": "18 july 1987",
    "machine": "1987-07-18"
  },
  {
    "human": "3 jun, 1993",
    "machine": "1993-06-03"
  },
  {
    "human": "july 11, 2010",
    "machine": "2010-07-11"
  },
  {
    "human": "25 february 2018",
    "machine": "2018-02-25"
  },
  {
    "human": "3/7/81",
    "machine": "1981-03-07"
  },
  {
    "human": "1 jan, 2008",
    "machine": "2008-01-01"
  },
  {
    "human": "12 august 1992",
    "machine": "1992-08-12"
  },
  {
    "human": "2011/05/23",
    "machine": "2011-05-23"
  },
  {
    "human": "jan 1, 1994",
    "machine": "1994-01-01"
  },
  {
    "human": "12.7.24",
    "machine": "2024-07-12"
  },
  {
    "human": "26 april 1993",
    "machine": "1993-04-26"
  },
  {
    "human": "06-05-15",
    "machine": "2015-06-05"
  },
  {
    "human": "14-jan-2008",
    "machine": "2008-01-14"
  },
  {
    "human": "12/6/21",
    "machine": "2021-12-06"
  },
  {
    "human": "7 june 1980",
    "machine": "1980-06-07"
  },
  {
    "human": "jan 29, 1978",
    "machine": "1978-01-29"
  },
  {
    "human": "feb 28 2025",
    "machine": "2025-02-28"
  },
  {
    "human": "november 30, 1992",
    "machine": "1992-11-30"
  },
  {
    "human": "june 26, 1986",
    "machine": "1986-06-26"
  },
  {
    "human": "5/8/23",
    "machine": "2023-05-08"
  },
  {
    "human": "1988.02.18 ad",
    "machine": "1988-02-18"
  },
  {
    "human": "oct 18, 72",
    "machine": "1972-10-18"
  },
  {
    "human": "1972/12/08",
    "machine": "1972-12-08"
  },
  {
    "human": "25-jun-1997",
    "machine": "1997-06-25"
  },
  {
    "human": "16 may 1980",
    "machine": "1980-05-16"
  },
  {
    "human": "03.04.1982",
    "machine": "1982-04-03"
  },
  {
    "human": "7/31/05",
    "machine": "2005-07-31"
  },
  {
    "human": "1 may 1971",
    "machine": "1971-05-01"
  },
  {
    "human": "sep 13, 1985",
    "machine": "1985-09-13"
  },
  {
    "human": "19.4.99",
    "machine": "1999-04-19"
  },
  {
    "human": "1988-12-1",
    "machine": "1988-12-01"
  },
  {
    "human": "6/17/72",
    "machine": "1972-06-17"
  },
  {
    "human": "saturday, august 19, 2000",
    "machine": "2000-08-19"
  },
  {
    "human": "99-06-30",
    "machine": "1999-06-30"
  },
  {
    "human": "2013.04.27 ad",
    "machine": "2013-04-27"
  },
  {
    "human": "19 december 1989",
    "machine": "1989-12-19"
  },
  {
    "human": "04-02-23",
    "machine": "2023-04-02"
  },
  {
    "human": "dec 28, 2001",
    "machine": "2001-12-28"
  },
  {
    "human": "dec 28 1990",
    "machine": "1990-12-28"
  },
  {
    "human": "november 10, 1979",
    "machine": "1979-11-10"
  },
  {
    "human": "4/12/15",
    "machine": "2015-04-12"
  },
  {
    "human": "may 24, 2022",
    "machine": "2022-05-24"
  },
  {
    "human": "january 06, 2005",
    "machine": "2005-01-06"
  },
  {
    "human": "january 29, 2009",
    "machine": "2009-01-29"
  },
  {
    "human": "7-sep-2005",
    "machine": "2005-09-07"
  },
  {
    "human": "dec 23, 89",
    "machine": "1989-12-23"
  },
  {
    "human": "1/03/1980",
    "machine": "1980-03-01"
  },
  {
    "human": "mon, sep 6, 82",
    "machine": "1982-09-06"
  },
  {
    "human": "2012-02-16",
    "machine": "2012-02-16"
  },
  {
    "human": "aug 23, 1995",
    "machine": "1995-08-23"
  },
  {
    "human": "13 jul, 1985",
    "machine": "1985-07-13"
  },
  {
    "human": "dec 8 1988",
    "machine": "1988-12-08"
  },
  {
    "human": "09.12.1990",
    "machine": "1990-12-09"
  },
  {
    "human": "09-14-06",
    "machine": "2006-09-14"
  },
  {
    "human": "25.11.2025",
    "machine": "2025-11-25"
  },
  {
    "human": "21.10.01",
    "machine": "2001-10-21"
  },
  {
    "human": "august 23, 2016",
    "machine": "2016-08-23"
  },
  {
    "human": "21 september 1973",
    "machine": "1973-09-21"
  },
  {
    "human": "january 09, 2006",
    "machine": "2006-01-09"
  },
  {
    "human": "19 dec 1988",
    "machine": "1988-12-19"
  },
  {
    "human": "2009-12-8",
    "machine": "2009-12-08"
  },
  {
    "human": "jun 23 1973",
    "machine": "1973-06-23"
  },
  {
    "human": "05/11/1976",
    "machine": "1976-05-11"
  },
  {
    "human": "05/27/1992",
    "machine": "1992-05-27"
  },
  {
    "human": "02-24-87",
    "machine": "1987-02-24"
  },
  {
    "human": "friday, december 1, 2017",
    "machine": "2017-12-01"
  },
  {
    "human": "december 19, 2015",
    "machine": "2015-12-19"
  },
  {
    "human": "24.8.80",
    "machine": "1980-08-24"
  },
  {
    "human": "28 december 2018",
    "machine": "2018-12-28"
  },
  {
    "human": "06.04.28",
    "machine": "2006-04-28"
  },
  {
    "human": "7.2.19",
    "machine": "2019-02-07"
  },
  {
    "human": "31 jan 1999",
    "machine": "1999-01-31"
  },
  {
    "human": "5/05/1978",
    "machine": "1978-05-05"
  },
  {
    "human": "10.05.1988",
    "machine": "1988-05-10"
  },
  {
    "human": "1990-08-06",
    "machine": "1990-08-06"
  },
  {
    "human": "2000-11-18",
    "machine": "2000-11-18"
  },
  {
    "human": "2009-02-12",
    "machine": "2009-02-12"
  },
  {
    "human": "1985-12-28",
    "machine": "1985-12-28"
  },
  {
    "human": "07-05-26",
    "machine": "2007-05-26"
  },
  {
    "human": "wednesday, may 19, 1982",
    "machine": "1982-05-19"
  },
  {
    "human": "05-18-01",
    "machine": "2001-05-18"
  },
  {
    "human": "10.11.13",
    "machine": "2010-11-13"
  },
  {
    "human": "02, feb 2023",
    "machine": "2023-02-02"
  },
  {
    "human": "may 20 2007",
    "machine": "2007-05-20"
  },
  {
    "human": "thursday, march 24, 1977",
    "machine": "1977-03-24"
  },
  {
    "human": "1995-04-23",
    "machine": "1995-04-23"
  },
  {
    "human": "08-14-15",
    "machine": "2015-08-14"
  },
  {
    "human": "september 18, 2007",
    "machine": "2007-09-18"
  },
  {
    "human": "7/5/09",
    "machine": "2009-07-05"
  },
  {
    "human": "08, jan 1991",
    "machine": "1991-01-08"
  },
  {
    "human": "3 may 2017",
    "machine": "2017-05-03"
  },
  {
    "human": "28, aug 2015",
    "machine": "2015-08-28"
  },
  {
    "human": "09, oct 1990",
    "machine": "1990-10-09"
  },
  {
    "human": "july 22, 2020",
    "machine": "2020-07-22"
  },
  {
    "human": "11 january 2008",
    "machine": "2008-01-11"
  },
  {
    "human": "12/15/1985",
    "machine": "1985-12-15"
  },
  {
    "human": "19.04.2011",
    "machine": "2011-04-19"
  },
  {
    "human": "friday, september 20, 1996",
    "machine": "1996-09-20"
  },
  {
    "human": "thursday, march 13, 1980",
    "machine": "1980-03-13"
  },
  {
    "human": "25.04.2006",
    "machine": "2006-04-25"
  },
  {
    "human": "24, may 1992",
    "machine": "1992-05-24"
  },
  {
    "human": "06.04.13",
    "machine": "2006-04-13"
  },
  {
    "human": "6/18/82",
    "machine": "1982-06-18"
  },
  {
    "human": "01.08.1995",
    "machine": "1995-08-01"
  },
  {
    "human": "sep 12, 2008",
    "machine": "2008-09-12"
  },
  {
    "human": "12/20/2005",
    "machine": "2005-12-20"
  },
  {
    "human": "4 november 1998",
    "machine": "1998-11-04"
  },
  {
    "human": "09-12-71",
    "machine": "1971-09-12"
  },
  {
    "human": "22 july 1995",
    "machine": "1995-07-22"
  },
  {
    "human": "11/13/13",
    "machine": "2013-11-13"
  },
  {
    "human": "1980-08-4",
    "machine": "1980-08-04"
  },
  {
    "human": "dec 20, 1979",
    "machine": "1979-12-20"
  },
  {
    "human": "jul 29, 17",
    "machine": "2017-07-29"
  },
  {
    "human": "2009.02.27 ad",
    "machine": "2009-02-27"
  },
  {
    "human": "jul 23, 1974",
    "machine": "1974-07-23"
  },
  {
    "human": "2/27/96",
    "machine": "1996-02-27"
  },
  {
    "human": "dec 28 1972",
    "machine": "1972-12-28"
  },
  {
    "human": "tuesday, april 18, 1978",
    "machine": "1978-04-18"
  },
  {
    "human": "april 29, 1995",
    "machine": "1995-04-29"
  },
  {
    "human": "25/09/2024",
    "machine": "2024-09-25"
  },
  {
    "human": "19-oct-1978",
    "machine": "1978-10-19"
  },
  {
    "human": "1971.08.14 ad",
    "machine": "1971-08-14"
  },
  {
    "human": "20.09.2014",
    "machine": "2014-09-20"
  },
  {
    "human": "06-10-95",
    "machine": "1995-06-10"
  },
  {
    "human": "july 09, 1974",
    "machine": "1974-07-09"
  },
  {
    "human": "06 june 2001",
    "machine": "2001-06-06"
  },
  {
    "human": "1980-02-9",
    "machine": "1980-02-09"
  },
  {
    "human": "04-21-07",
    "machine": "2007-04-21"
  },
  {
    "human": "june 24, 2023",
    "machine": "2023-06-24"
  },
  {
    "human": "thu, nov 3, 22",
    "machine": "2022-11-03"
  },
  {
    "human": "tue, dec 1, 98",
    "machine": "1998-12-01"
  },
  {
    "human": "02/15/1973",
    "machine": "1973-02-15"
  },
  {
    "human": "12-16-89",
    "machine": "1989-12-16"
  },
  {
    "human": "87-02-11",
    "machine": "1987-02-11"
  },
  {
    "human": "1985-07-16",
    "machine": "1985-07-16"
  },
  {
    "human": "10/30/1986",
    "machine": "1986-10-30"
  },
  {
    "human": "28 oct, 2023",
    "machine": "2023-10-28"
  },
  {
    "human": "2024-10-11",
    "machine": "2024-10-11"
  },
  {
    "human": "friday, april 9, 1993",
    "machine": "1993-04-09"
  },
  {
    "human": "mar 9 1977",
    "machine": "1977-03-09"
  },
  {
    "human": "2007.11.09 ad",
    "machine": "2007-11-09"
  },
  {
    "human": "2014/10/30",
    "machine": "2014-10-30"
  },
  {
    "human": "12-jan-2025",
    "machine": "2025-01-12"
  },
  {
    "human": "19 nov 1995",
    "machine": "1995-11-19"
  },
  {
    "human": "thursday, may 27, 1999",
    "machine": "1999-05-27"
  },
  {
    "human": "5/16/03",
    "machine": "2003-05-16"
  },
  {
    "human": "apr 21, 12",
    "machine": "2012-04-21"
  },
  {
    "human": "7-mar-1980",
    "machine": "1980-03-07"
  },
  {
    "human": "21, may 2024",
    "machine": "2024-05-21"
  },
  {
    "human": "july 21, 1976",
    "machine": "1976-07-21"
  },
  {
    "human": "25, dec 2013",
    "machine": "2013-12-25"
  },
  {
    "human": "10/01/1995",
    "machine": "1995-10-01"
  },
  {
    "human": "70-02-21",
    "machine": "1970-02-21"
  },
  {
    "human": "nov 3 1995",
    "machine": "1995-11-03"
  },
  {
    "human": "24-apr-2000",
    "machine": "2000-04-24"
  },
  {
    "human": "24 jun, 2009",
    "machine": "2009-06-24"
  },
  {
    "human": "1 march 1997",
    "machine": "1997-03-01"
  },
  {
    "human": "87.11.19",
    "machine": "1987-11-19"
  },
  {
    "human": "aug 29 1975",
    "machine": "1975-08-29"
  },
  {
    "human": "1978-04-10",
    "machine": "1978-04-10"
  },
  {
    "human": "tue, aug 5, 97",
    "machine": "1997-08-05"
  },
  {
    "human": "26 dec 1984",
    "machine": "1984-12-26"
  },
  {
    "human": "79-11-06",
    "machine": "1979-11-06"
  },
  {
    "human": "29.04.2016",
    "machine": "2016-04-29"
  },
  {
    "human": "1974.03.10 ad",
    "machine": "1974-03-10"
  },
  {
    "human": "06.02.27",
    "machine": "2006-02-27"
  },
  {
    "human": "aug 24 1980",
    "machine": "1980-08-24"
  },
  {
    "human": "dec 16, 70",
    "machine": "1970-12-16"
  },
  {
    "human": "27-mar-1990",
    "machine": "1990-03-27"
  },
  {
    "human": "tuesday, february 23, 1999",
    "machine": "1999-02-23"
  },
  {
    "human": "8/16/87",
    "machine": "1987-08-16"
  },
  {
    "human": "1987-12-17",
    "machine": "1987-12-17"
  },
  {
    "human": "29.8.12",
    "machine": "2012-08-29"
  },
  {
    "human": "26, aug 2004",
    "machine": "2004-08-26"
  },
  {
    "human": "may 05, 2002",
    "machine": "2002-05-05"
  },
  {
    "human": "1989-06-13",
    "machine": "1989-06-13"
  },
  {
    "human": "1972-03-5",
    "machine": "1972-03-05"
  },
  {
    "human": "30/09/2005",
    "machine": "2005-09-30"
  },
  {
    "human": "6/10/1997",
    "machine": "1997-10-06"
  },
  {
    "human": "tue, jan 29, 74",
    "machine": "1974-01-29"
  },
  {
    "human": "saturday, september 5, 1987",
    "machine": "1987-09-05"
  },
  {
    "human": "nov 29, 1996",
    "machine": "1996-11-29"
  },
  {
    "human": "october 21, 2000",
    "machine": "2000-10-21"
  },
  {
    "human": "july 30, 2024",
    "machine": "2024-07-30"
  },
  {
    "human": "september 15, 2009",
    "machine": "2009-09-15"
  },
  {
    "human": "sunday, september 7, 2014",
    "machine": "2014-09-07"
  },
  {
    "human": "29 november 1979",
    "machine": "1979-11-29"
  },
  {
    "human": "nov 21, 96",
    "machine": "1996-11-21"
  },
  {
    "human": "1/15/78",
    "machine": "1978-01-15"
  },
  {
    "human": "04-11-93",
    "machine": "1993-04-11"
  },
  {
    "human": "jan 13, 2017",
    "machine": "2017-01-13"
  },
  {
    "human": "05-07-07",
    "machine": "2007-05-07"
  },
  {
    "human": "24.04.4",
    "machine": "2024-04-04"
  },
  {
    "human": "05/01/2023",
    "machine": "2023-05-01"
  },
  {
    "human": "friday, april 9, 2010",
    "machine": "2010-04-09"
  },
  {
    "human": "2015/03/04",
    "machine": "2015-03-04"
  },
  {
    "human": "friday, june 14, 1996",
    "machine": "1996-06-14"
  },
  {
    "human": "november 11, 1985",
    "machine": "1985-11-11"
  },
  {
    "human": "03.10.1991",
    "machine": "1991-10-03"
  },
  {
    "human": "1/11/21",
    "machine": "2021-01-11"
  },
  {
    "human": "4/27/01",
    "machine": "2001-04-27"
  },
  {
    "human": "01-06-09",
    "machine": "2001-06-09"
  },
  {
    "human": "27 dec 1997",
    "machine": "1997-12-27"
  },
  {
    "human": "09-10-05",
    "machine": "2009-10-05"
  },
  {
    "human": "dec 2 1981",
    "machine": "1981-12-02"
  },
  {
    "human": "17, jun 2002",
    "machine": "2002-06-17"
  },
  {
    "human": "11.7.05",
    "machine": "2005-07-11"
  },
  {
    "human": "mar 13, 73",
    "machine": "1973-03-13"
  },
  {
    "human": "8/11/2006",
    "machine": "2006-11-08"
  },
  {
    "human": "15.11.85",
    "machine": "1985-11-15"
  },
  {
    "human": "april 12, 2005",
    "machine": "2005-04-12"
  },
  {
    "human": "1986/08/01",
    "machine": "1986-08-01"
  },
  {
    "human": "77.02.11",
    "machine": "1977-02-11"
  },
  {
    "human": "25 may 1997",
    "machine": "1997-05-25"
  },
  {
    "human": "11-29-71",
    "machine": "1971-11-29"
  },
  {
    "human": "12-sep-2016",
    "machine": "2016-09-12"
  },
  {
    "human": "14.7.91",
    "machine": "1991-07-14"
  },
  {
    "human": "26, jan 2020",
    "machine": "2020-01-26"
  },
  {
    "human": "january 18, 2021",
    "machine": "2021-01-18"
  },
  {
    "human": "sep 30 2003",
    "machine": "2003-09-30"
  },
  {
    "human": "87-07-05",
    "machine": "1987-07-05"
  },
  {
    "human": "8/05/1979",
    "machine": "1979-05-08"
  },
  {
    "human": "79-12-13",
    "machine": "1979-12-13"
  },
  {
    "human": "7.6.74",
    "machine": "1974-06-07"
  },
  {
    "human": "8 feb, 1981",
    "machine": "1981-02-08"
  },
  {
    "human": "february 24, 1975",
    "machine": "1975-02-24"
  },
  {
    "human": "1987/06/22",
    "machine": "1987-06-22"
  },
  {
    "human": "2007.05.14 ad",
    "machine": "2007-05-14"
  },
  {
    "human": "wednesday, february 6, 2008",
    "machine": "2008-02-06"
  },
  {
    "human": "1983-03-21",
    "machine": "1983-03-21"
  },
  {
    "human": "feb 3 2019",
    "machine": "2019-02-03"
  },
  {
    "human": "2 jul, 1977",
    "machine": "1977-07-02"
  },
  {
    "human": "24-06-26",
    "machine": "2024-06-26"
  },
  {
    "human": "aug 24 2011",
    "machine": "2011-08-24"
  },
  {
    "human": "14.6.87",
    "machine": "1987-06-14"
  },
  {
    "human": "1988.11.12 ad",
    "machine": "1988-11-12"
  },
  {
    "human": "2013-09-21",
    "machine": "2013-09-21"
  },
  {
    "human": "1997-07-19",
    "machine": "1997-07-19"
  },
  {
    "human": "76.03.10",
    "machine": "1976-03-10"
  },
  {
    "human": "2017/05/26",
    "machine": "2017-05-26"
  },
  {
    "human": "2013-09-13",
    "machine": "2013-09-13"
  },
  {
    "human": "03-03-75",
    "machine": "1975-03-03"
  },
  {
    "human": "may 11, 2013",
    "machine": "2013-05-11"
  },
  {
    "human": "1.8.71",
    "machine": "1971-08-01"
  },
  {
    "human": "apr 6, 95",
    "machine": "1995-04-06"
  },
  {
    "human": "7 nov, 1993",
    "machine": "1993-11-07"
  },
  {
    "human": "06 february 2020",
    "machine": "2020-02-06"
  },
  {
    "human": "14.8.90",
    "machine": "1990-08-14"
  },
  {
    "human": "11 january 1978",
    "machine": "1978-01-11"
  },
  {
    "human": "saturday, april 26, 2008",
    "machine": "2008-04-26"
  },
  {
    "human": "6/10/00",
    "machine": "2000-06-10"
  },
  {
    "human": "tuesday, october 25, 1988",
    "machine": "1988-10-25"
  },
  {
    "human": "2024/05/08",
    "machine": "2024-05-08"
  },
  {
    "human": "friday, december 5, 1975",
    "machine": "1975-12-05"
  },
  {
    "human": "29-jul-2001",
    "machine": "2001-07-29"
  },
  {
    "human": "17.10.19",
    "machine": "2019-10-17"
  },
  {
    "human": "07-01-24",
    "machine": "2024-07-01"
  },
  {
    "human": "17 may 1981",
    "machine": "1981-05-17"
  },
  {
    "human": "may 23, 2017",
    "machine": "2017-05-23"
  },
  {
    "human": "6/11/1970",
    "machine": "1970-11-06"
  },
  {
    "human": "5/09/1995",
    "machine": "1995-09-05"
  },
  {
    "human": "31 mar, 1975",
    "machine": "1975-03-31"
  },
  {
    "human": "85-04-04",
    "machine": "1985-04-04"
  },
  {
    "human": "fri, jul 12, 91",
    "machine": "1991-07-12"
  },
  {
    "human": "tue, nov 1, 77",
    "machine": "1977-11-01"
  },
  {
    "human": "1975/04/02",
    "machine": "1975-04-02"
  },
  {
    "human": "9/22/13",
    "machine": "2013-09-22"
  },
  {
    "human": "02-05-09",
    "machine": "2009-02-05"
  },
  {
    "human": "12/19/2024",
    "machine": "2024-12-19"
  },
  {
    "human": "5 january 1991",
    "machine": "1991-01-05"
  },
  {
    "human": "01-20-76",
    "machine": "1976-01-20"
  },
  {
    "human": "2005.07.06 ad",
    "machine": "2005-07-06"
  },
  {
    "human": "monday, june 23, 2025",
    "machine": "2025-06-23"
  },
  {
    "human": "07-07-30",
    "machine": "2007-07-30"
  },
  {
    "human": "04-16-73",
    "machine": "1973-04-16"
  },
  {
    "human": "1987.01.16 ad",
    "machine": "1987-01-16"
  },
  {
    "human": "7/24/86",
    "machine": "1986-07-24"
  },
  {
    "human": "02.03.1992",
    "machine": "1992-03-02"
  },
  {
    "human": "jan 1, 1980",
    "machine": "1980-01-01"
  },
  {
    "human": "21.01.19",
    "machine": "2021-01-19"
  },
  {
    "human": "jan 25, 10",
    "machine": "2010-01-25"
  },
  {
    "human": "25 apr, 2002",
    "machine": "2002-04-25"
  },
  {
    "human": "tue, jan 16, 24",
    "machine": "2024-01-16"
  },
  {
    "human": "10/8/85",
    "machine": "1985-10-08"
  },
  {
    "human": "thursday, september 12, 2013",
    "machine": "2013-09-12"
  },
  {
    "human": "24 september 2021",
    "machine": "2021-09-24"
  },
  {
    "human": "24, oct 2020",
    "machine": "2020-10-24"
  },
  {
    "human": "20.4.94",
    "machine": "1994-04-20"
  },
  {
    "human": "2003-04-04",
    "machine": "2003-04-04"
  },
  {
    "human": "march 9, 1985",
    "machine": "1985-03-09"
  },
  {
    "human": "mar 1, 83",
    "machine": "1983-03-01"
  },
  {
    "human": "thu, aug 6, 87",
    "machine": "1987-08-06"
  },
  {
    "human": "feb 21 2020",
    "machine": "2020-02-21"
  },
  {
    "human": "oct 25, 97",
    "machine": "1997-10-25"
  },
  {
    "human": "may 6, 2003",
    "machine": "2003-05-06"
  },
  {
    "human": "20/10/2018",
    "machine": "2018-10-20"
  },
  {
    "human": "2016/06/23",
    "machine": "2016-06-23"
  },
  {
    "human": "july 5, 1971",
    "machine": "1971-07-05"
  },
  {
    "human": "2012/08/23",
    "machine": "2012-08-23"
  },
  {
    "human": "14-may-1973",
    "machine": "1973-05-14"
  },
  {
    "human": "thursday, december 30, 1976",
    "machine": "1976-12-30"
  },
  {
    "human": "feb 13 2018",
    "machine": "2018-02-13"
  },
  {
    "human": "august 28, 1983",
    "machine": "1983-08-28"
  },
  {
    "human": "06/22/1972",
    "machine": "1972-06-22"
  },
  {
    "human": "2011-09-7",
    "machine": "2011-09-07"
  },
  {
    "human": "january 13, 1972",
    "machine": "1972-01-13"
  },
  {
    "human": "8.9.81",
    "machine": "1981-09-08"
  },
  {
    "human": "2017/04/25",
    "machine": "2017-04-25"
  },
  {
    "human": "2/24/16",
    "machine": "2016-02-24"
  },
  {
    "human": "4/10/22",
    "machine": "2022-04-10"
  },
  {
    "human": "september 22, 1975",
    "machine": "1975-09-22"
  },
  {
    "human": "20 november 1986",
    "machine": "1986-11-20"
  },
  {
    "human": "95-05-28",
    "machine": "1995-05-28"
  },
  {
    "human": "oct 3 2009",
    "machine": "2009-10-03"
  },
  {
    "human": "nov 27, 10",
    "machine": "2010-11-27"
  },
  {
    "human": "16 may 1981",
    "machine": "1981-05-16"
  },
  {
    "human": "01-25-17",
    "machine": "2017-01-25"
  },
  {
    "human": "11/12/2000",
    "machine": "2000-11-12"
  },
  {
    "human": "friday, august 23, 1985",
    "machine": "1985-08-23"
  },
  {
    "human": "february 16, 1981",
    "machine": "1981-02-16"
  },
  {
    "human": "11/25/2014",
    "machine": "2014-11-25"
  },
  {
    "human": "1998-01-29",
    "machine": "1998-01-29"
  },
  {
    "human": "13, jan 1995",
    "machine": "1995-01-13"
  },
  {
    "human": "1981-06-19",
    "machine": "1981-06-19"
  },
  {
    "human": "january 18, 2020",
    "machine": "2020-01-18"
  },
  {
    "human": "1987-02-23",
    "machine": "1987-02-23"
  },
  {
    "human": "22-aug-1978",
    "machine": "1978-08-22"
  },
  {
    "human": "8/13/16",
    "machine": "2016-08-13"
  },
  {
    "human": "jul 1, 1974",
    "machine": "1974-07-01"
  },
  {
    "human": "25/05/2022",
    "machine": "2022-05-25"
  },
  {
    "human": "31.12.95",
    "machine": "1995-12-31"
  },
  {
    "human": "2005-06-23",
    "machine": "2005-06-23"
  },
  {
    "human": "july 19, 1976",
    "machine": "1976-07-19"
  },
  {
    "human": "10, jun 2024",
    "machine": "2024-06-10"
  },
  {
    "human": "sunday, december 8, 2002",
    "machine": "2002-12-08"
  },
  {
    "human": "saturday, july 23, 1994",
    "machine": "1994-07-23"
  },
  {
    "human": "wednesday, october 8, 1997",
    "machine": "1997-10-08"
  },
  {
    "human": "3/21/02",
    "machine": "2002-03-21"
  },
  {
    "human": "8/15/82",
    "machine": "1982-08-15"
  },
  {
    "human": "2007-06-17",
    "machine": "2007-06-17"
  },
  {
    "human": "10/1/73",
    "machine": "1973-10-01"
  },
  {
    "human": "jul 14, 1996",
    "machine": "1996-07-14"
  },
  {
    "human": "06-24-19",
    "machine": "2019-06-24"
  },
  {
    "human": "28-jul-1996",
    "machine": "1996-07-28"
  },
  {
    "human": "sunday, december 3, 1989",
    "machine": "1989-12-03"
  },
  {
    "human": "saturday, may 30, 2015",
    "machine": "2015-05-30"
  },
  {
    "human": "08-25-93",
    "machine": "1993-08-25"
  },
  {
    "human": "6 jun, 2000",
    "machine": "2000-06-06"
  },
  {
    "human": "august 11, 1981",
    "machine": "1981-08-11"
  },
  {
    "human": "77.02.22",
    "machine": "1977-02-22"
  },
  {
    "human": "20 april 2005",
    "machine": "2005-04-20"
  },
  {
    "human": "2/24/75",
    "machine": "1975-02-24"
  },
  {
    "human": "1982.07.13 ad",
    "machine": "1982-07-13"
  },
  {
    "human": "2008/06/10",
    "machine": "2008-06-10"
  },
  {
    "human": "17/04/2006",
    "machine": "2006-04-17"
  },
  {
    "human": "1974-06-19",
    "machine": "1974-06-19"
  },
  {
    "human": "july 20, 1984",
    "machine": "1984-07-20"
  },
  {
    "human": "1970/10/08",
    "machine": "1970-10-08"
  },
  {
    "human": "september 30, 1982",
    "machine": "1982-09-30"
  },
  {
    "human": "june 12, 1994",
    "machine": "1994-06-12"
  },
  {
    "human": "dec 1, 2017",
    "machine": "2017-12-01"
  },
  {
    "human": "9/3/74",
    "machine": "1974-09-03"
  },
  {
    "human": "4 oct 1977",
    "machine": "1977-10-04"
  },
  {
    "human": "2 december 2023",
    "machine": "2023-12-02"
  },
  {
    "human": "8 may, 1991",
    "machine": "1991-05-08"
  },
  {
    "human": "1991-03-17",
    "machine": "1991-03-17"
  },
  {
    "human": "2010.03.12 ad",
    "machine": "2010-03-12"
  },
  {
    "human": "17.10.77",
    "machine": "1977-10-17"
  },
  {
    "human": "16 may 2000",
    "machine": "2000-05-16"
  },
  {
    "human": "83-03-11",
    "machine": "1983-03-11"
  },
  {
    "human": "march 6, 1971",
    "machine": "1971-03-06"
  },
  {
    "human": "friday, june 9, 2000",
    "machine": "2000-06-09"
  },
  {
    "human": "wednesday, april 9, 2014",
    "machine": "2014-04-09"
  },
  {
    "human": "february 22, 1976",
    "machine": "1976-02-22"
  },
  {
    "human": "11 february 1986",
    "machine": "1986-02-11"
  },
  {
    "human": "1998.04.30 ad",
    "machine": "1998-04-30"
  },
  {
    "human": "nov 2, 71",
    "machine": "1971-11-02"
  },
  {
    "human": "dec 25 2005",
    "machine": "2005-12-25"
  },
  {
    "human": "1987/11/16",
    "machine": "1987-11-16"
  },
  {
    "human": "2021/06/05",
    "machine": "2021-06-05"
  },
  {
    "human": "06, nov 1993",
    "machine": "1993-11-06"
  },
  {
    "human": "may 28, 2020",
    "machine": "2020-05-28"
  },
  {
    "human": "3 sep 2023",
    "machine": "2023-09-03"
  },
  {
    "human": "may 9, 1994",
    "machine": "1994-05-09"
  },
  {
    "human": "94.03.22",
    "machine": "1994-03-22"
  },
  {
    "human": "april 14, 1991",
    "machine": "1991-04-14"
  },
  {
    "human": "nov 9 1987",
    "machine": "1987-11-09"
  },
  {
    "human": "10 october 1970",
    "machine": "1970-10-10"
  },
  {
    "human": "30.09.1970",
    "machine": "1970-09-30"
  },
  {
    "human": "1978.08.12 ad",
    "machine": "1978-08-12"
  },
  {
    "human": "7 apr, 1993",
    "machine": "1993-04-07"
  },
  {
    "human": "28-oct-1992",
    "machine": "1992-10-28"
  },
  {
    "human": "00-07-26",
    "machine": "2000-07-26"
  },
  {
    "human": "1981/05/21",
    "machine": "1981-05-21"
  },
  {
    "human": "mar 13, 87",
    "machine": "1987-03-13"
  },
  {
    "human": "16 january 1992",
    "machine": "1992-01-16"
  },
  {
    "human": "04-27-14",
    "machine": "2014-04-27"
  },
  {
    "human": "nov 1, 2009",
    "machine": "2009-11-01"
  },
  {
    "human": "12 november 1980",
    "machine": "1980-11-12"
  },
  {
    "human": "99-03-01",
    "machine": "1999-03-01"
  },
  {
    "human": "jul 9, 2021",
    "machine": "2021-07-09"
  },
  {
    "human": "aug 20, 72",
    "machine": "1972-08-20"
  },
  {
    "human": "24.4.90",
    "machine": "1990-04-24"
  },
  {
    "human": "2/2/20",
    "machine": "2020-02-02"
  },
  {
    "human": "21 october 2009",
    "machine": "2009-10-21"
  },
  {
    "human": "mar 7, 1972",
    "machine": "1972-03-07"
  },
  {
    "human": "18/09/1978",
    "machine": "1978-09-18"
  },
  {
    "human": "10/4/81",
    "machine": "1981-10-04"
  },
  {
    "human": "12 may 1998",
    "machine": "1998-05-12"
  },
  {
    "human": "26.7.78",
    "machine": "1978-07-26"
  },
  {
    "human": "1 jul 2024",
    "machine": "2024-07-01"
  },
  {
    "human": "04/22/2005",
    "machine": "2005-04-22"
  },
  {
    "human": "jan 21, 70",
    "machine": "1970-01-21"
  },
  {
    "human": "1992.06.16 ad",
    "machine": "1992-06-16"
  },
  {
    "human": "2021/04/18",
    "machine": "2021-04-18"
  },
  {
    "human": "28/12/2022",
    "machine": "2022-12-28"
  },
  {
    "human": "wednesday, february 18, 1981",
    "machine": "1981-02-18"
  },
  {
    "human": "sunday, march 15, 1981",
    "machine": "1981-03-15"
  },
  {
    "human": "22 aug, 1978",
    "machine": "1978-08-22"
  },
  {
    "human": "08, nov 1990",
    "machine": "1990-11-08"
  },
  {
    "human": "1971-01-30",
    "machine": "1971-01-30"
  },
  {
    "human": "1971-11-29",
    "machine": "1971-11-29"
  },
  {
    "human": "19 december 1987",
    "machine": "1987-12-19"
  },
  {
    "human": "17-03-23",
    "machine": "2017-03-23"
  },
  {
    "human": "november 21, 2004",
    "machine": "2004-11-21"
  },
  {
    "human": "17.12.13",
    "machine": "2013-12-17"
  },
  {
    "human": "1985.07.12 ad",
    "machine": "1985-07-12"
  },
  {
    "human": "jun 18, 76",
    "machine": "1976-06-18"
  },
  {
    "human": "10-22-03",
    "machine": "2003-10-22"
  },
  {
    "human": "sep 7 2016",
    "machine": "2016-09-07"
  },
  {
    "human": "30, aug 1978",
    "machine": "1978-08-30"
  },
  {
    "human": "19-02-27",
    "machine": "2019-02-27"
  },
  {
    "human": "77.09.10",
    "machine": "1977-09-10"
  },
  {
    "human": "1989.09.10 ad",
    "machine": "1989-09-10"
  },
  {
    "human": "22 jul 2014",
    "machine": "2014-07-22"
  },
  {
    "human": "aug 19, 2012",
    "machine": "2012-08-19"
  },
  {
    "human": "25 mar, 2012",
    "machine": "2012-03-25"
  },
  {
    "human": "12/24/73",
    "machine": "1973-12-24"
  },
  {
    "human": "04 march 2024",
    "machine": "2024-03-04"
  },
  {
    "human": "2022-04-25",
    "machine": "2022-04-25"
  },
  {
    "human": "1/27/25",
    "machine": "2025-01-27"
  },
  {
    "human": "16 feb 1974",
    "machine": "1974-02-16"
  },
  {
    "human": "21 september 1993",
    "machine": "1993-09-21"
  },
  {
    "human": "1999/09/19",
    "machine": "1999-09-19"
  },
  {
    "human": "15 aug, 1991",
    "machine": "1991-08-15"
  },
  {
    "human": "22.09.1973",
    "machine": "1973-09-22"
  },
  {
    "human": "2008.06.22 ad",
    "machine": "2008-06-22"
  },
  {
    "human": "5.4.19",
    "machine": "2019-04-05"
  },
  {
    "human": "23 september 1994",
    "machine": "1994-09-23"
  },
  {
    "human": "october 5, 1985",
    "machine": "1985-10-05"
  },
  {
    "human": "25.01.2016",
    "machine": "2016-01-25"
  },
  {
    "human": "tuesday, february 7, 1984",
    "machine": "1984-02-07"
  },
  {
    "human": "10/17/09",
    "machine": "2009-10-17"
  },
  {
    "human": "1971.03.21 ad",
    "machine": "1971-03-21"
  },
  {
    "human": "thursday, february 15, 2018",
    "machine": "2018-02-15"
  },
  {
    "human": "12, jul 1972",
    "machine": "1972-07-12"
  },
  {
    "human": "february 06, 2015",
    "machine": "2015-02-06"
  },
  {
    "human": "5.11.97",
    "machine": "1997-11-05"
  },
  {
    "human": "thursday, november 29, 2001",
    "machine": "2001-11-29"
  },
  {
    "human": "1987.05.13 ad",
    "machine": "1987-05-13"
  },
  {
    "human": "10-30-93",
    "machine": "1993-10-30"
  },
  {
    "human": "20 sep, 1999",
    "machine": "1999-09-20"
  },
  {
    "human": "april 30, 1991",
    "machine": "1991-04-30"
  },
  {
    "human": "february 03, 2002",
    "machine": "2002-02-03"
  },
  {
    "human": "04 july 2025",
    "machine": "2025-07-04"
  },
  {
    "human": "07/15/1996",
    "machine": "1996-07-15"
  },
  {
    "human": "2006.03.17 ad",
    "machine": "2006-03-17"
  },
  {
    "human": "09, nov 1978",
    "machine": "1978-11-09"
  },
  {
    "human": "june 29, 2002",
    "machine": "2002-06-29"
  },
  {
    "human": "2021.11.09 ad",
    "machine": "2021-11-09"
  },
  {
    "human": "december 16, 2024",
    "machine": "2024-12-16"
  },
  {
    "human": "28.11.1988",
    "machine": "1988-11-28"
  },
  {
    "human": "may 5, 99",
    "machine": "1999-05-05"
  },
  {
    "human": "22.03.3",
    "machine": "2022-03-03"
  },
  {
    "human": "1982.02.09 ad",
    "machine": "1982-02-09"
  },
  {
    "human": "02-25-71",
    "machine": "1971-02-25"
  },
  {
    "human": "saturday, may 19, 1990",
    "machine": "1990-05-19"
  },
  {
    "human": "16 jul, 2013",
    "machine": "2013-07-16"
  },
  {
    "human": "sep 13, 04",
    "machine": "2004-09-13"
  },
  {
    "human": "thursday, august 31, 1972",
    "machine": "1972-08-31"
  },
  {
    "human": "july 04, 2005",
    "machine": "2005-07-04"
  },
  {
    "human": "01, feb 2007",
    "machine": "2007-02-01"
  },
  {
    "human": "08/06/1986",
    "machine": "1986-08-06"
  },
  {
    "human": "august 16, 1971",
    "machine": "1971-08-16"
  },
  {
    "human": "1998-05-22",
    "machine": "1998-05-22"
  },
  {
    "human": "december 20, 2006",
    "machine": "2006-12-20"
  },
  {
    "human": "03-08-20",
    "machine": "2020-03-08"
  },
  {
    "human": "07 december 2006",
    "machine": "2006-12-07"
  },
  {
    "human": "10.10.5",
    "machine": "2010-10-05"
  },
  {
    "human": "april 3, 2003",
    "machine": "2003-04-03"
  },
  {
    "human": "2019/11/30",
    "machine": "2019-11-30"
  },
  {
    "human": "18.01.7",
    "machine": "2018-01-07"
  },
  {
    "human": "jun 4, 2021",
    "machine": "2021-06-04"
  },
  {
    "human": "sunday, august 9, 2020",
    "machine": "2020-08-09"
  },
  {
    "human": "22.4.98",
    "machine": "1998-04-22"
  },
  {
    "human": "21-08-26",
    "machine": "2021-08-26"
  },
  {
    "human": "1982-04-03",
    "machine": "1982-04-03"
  },
  {
    "human": "saturday, september 21, 1996",
    "machine": "1996-09-21"
  },
  {
    "human": "19.04.21",
    "machine": "2019-04-21"
  },
  {
    "human": "3-aug-1977",
    "machine": "1977-08-03"
  },
  {
    "human": "14 july 1977",
    "machine": "1977-07-14"
  },
  {
    "human": "10/08/2010",
    "machine": "2010-10-08"
  },
  {
    "human": "may 5 2020",
    "machine": "2020-05-05"
  },
  {
    "human": "18-dec-2021",
    "machine": "2021-12-18"
  },
  {
    "human": "jun 10, 77",
    "machine": "1977-06-10"
  },
  {
    "human": "5/31/72",
    "machine": "1972-05-31"
  },
  {
    "human": "03-02-23",
    "machine": "2023-03-02"
  },
  {
    "human": "fri, apr 14, 78",
    "machine": "1978-04-14"
  },
  {
    "human": "16 may 1983",
    "machine": "1983-05-16"
  },
  {
    "human": "may 8, 2012",
    "machine": "2012-05-08"
  },
  {
    "human": "sunday, september 1, 1974",
    "machine": "1974-09-01"
  },
  {
    "human": "20.9.97",
    "machine": "1997-09-20"
  },
  {
    "human": "04-09-75",
    "machine": "1975-04-09"
  },
  {
    "human": "1982.06.08 ad",
    "machine": "1982-06-08"
  },
  {
    "human": "apr 20 1980",
    "machine": "1980-04-20"
  },
  {
    "human": "23 july 2024",
    "machine": "2024-07-23"
  },
  {
    "human": "dec 25 1987",
    "machine": "1987-12-25"
  },
  {
    "human": "jan 5 1990",
    "machine": "1990-01-05"
  },
  {
    "human": "10/25/23",
    "machine": "2023-10-25"
  },
  {
    "human": "21.02.10",
    "machine": "2021-02-10"
  },
  {
    "human": "sunday, may 23, 1971",
    "machine": "1971-05-23"
  },
  {
    "human": "march 04, 1985",
    "machine": "1985-03-04"
  },
  {
    "human": "20.05.2001",
    "machine": "2001-05-20"
  },
  {
    "human": "january 3, 1989",
    "machine": "1989-01-03"
  },
  {
    "human": "2000-02-29",
    "machine": "2000-02-29"
  },
  {
    "human": "28.07.1984",
    "machine": "1984-07-28"
  },
  {
    "human": "oct 24, 2000",
    "machine": "2000-10-24"
  },
  {
    "human": "17 september 1987",
    "machine": "1987-09-17"
  },
  {
    "human": "20 jan 1971",
    "machine": "1971-01-20"
  },
  {
    "human": "23 dec 2018",
    "machine": "2018-12-23"
  },
  {
    "human": "3/12/88",
    "machine": "1988-03-12"
  },
  {
    "human": "1991-10-20",
    "machine": "1991-10-20"
  },
  {
    "human": "september 08, 1997",
    "machine": "1997-09-08"
  },
  {
    "human": "sep 29, 09",
    "machine": "2009-09-29"
  },
  {
    "human": "01/02/1971",
    "machine": "1971-01-02"
  },
  {
    "human": "1976-12-20",
    "machine": "1976-12-20"
  },
  {
    "human": "10/07/2014",
    "machine": "2014-07-10"
  },
  {
    "human": "dec 9, 1993",
    "machine": "1993-12-09"
  },
  {
    "human": "04, apr 2023",
    "machine": "2023-04-04"
  },
  {
    "human": "02 september 2011",
    "machine": "2011-09-02"
  },
  {
    "human": "nov 4, 1986",
    "machine": "1986-11-04"
  },
  {
    "human": "oct 24 2016",
    "machine": "2016-10-24"
  },
  {
    "human": "2/05/2013",
    "machine": "2013-05-02"
  },
  {
    "human": "05 march 1996",
    "machine": "1996-03-05"
  },
  {
    "human": "may 01, 1994",
    "machine": "1994-05-01"
  },
  {
    "human": "march 18, 2008",
    "machine": "2008-03-18"
  },
  {
    "human": "mar 15, 2016",
    "machine": "2016-03-15"
  },
  {
    "human": "fri, nov 21, 86",
    "machine": "1986-11-21"
  },
  {
    "human": "1986.12.23 ad",
    "machine": "1986-12-23"
  },
  {
    "human": "friday, march 26, 1982",
    "machine": "1982-03-26"
  },
  {
    "human": "12-02-70",
    "machine": "1970-12-02"
  },
  {
    "human": "03/04/2011",
    "machine": "2011-03-04"
  },
  {
    "human": "00.11.17",
    "machine": "2000-11-17"
  },
  {
    "human": "15.6.86",
    "machine": "1986-06-15"
  },
  {
    "human": "03/24/2002",
    "machine": "2002-03-24"
  },
  {
    "human": "06-10-25",
    "machine": "2006-10-25"
  },
  {
    "human": "mon, feb 21, 22",
    "machine": "2022-02-21"
  },
  {
    "human": "wed, mar 24, 21",
    "machine": "2021-03-24"
  },
  {
    "human": "saturday, july 15, 2017",
    "machine": "2017-07-15"
  },
  {
    "human": "07, feb 2017",
    "machine": "2017-02-07"
  },
  {
    "human": "1 apr, 1973",
    "machine": "1973-04-01"
  },
  {
    "human": "sunday, december 4, 2022",
    "machine": "2022-12-04"
  },
  {
    "human": "30-oct-1976",
    "machine": "1976-10-30"
  },
  {
    "human": "21.09.12",
    "machine": "2021-09-12"
  },
  {
    "human": "6 may, 1992",
    "machine": "1992-05-06"
  },
  {
    "human": "16.09.13",
    "machine": "2016-09-13"
  },
  {
    "human": "friday, february 5, 2010",
    "machine": "2010-02-05"
  },
  {
    "human": "03.08.1974",
    "machine": "1974-08-03"
  },
  {
    "human": "30 march 1998",
    "machine": "1998-03-30"
  },
  {
    "human": "22 nov 1982",
    "machine": "1982-11-22"
  },
  {
    "human": "14 apr, 2009",
    "machine": "2009-04-14"
  },
  {
    "human": "06-24-89",
    "machine": "1989-06-24"
  },
  {
    "human": "apr 9, 1975",
    "machine": "1975-04-09"
  },
  {
    "human": "05/27/1972",
    "machine": "1972-05-27"
  },
  {
    "human": "11/16/2017",
    "machine": "2017-11-16"
  },
  {
    "human": "1980/07/13",
    "machine": "1980-07-13"
  },
  {
    "human": "20.8.82",
    "machine": "1982-08-20"
  },
  {
    "human": "5/23/82",
    "machine": "1982-05-23"
  },
  {
    "human": "2015-10-11",
    "machine": "2015-10-11"
  },
  {
    "human": "28 august 1977",
    "machine": "1977-08-28"
  },
  {
    "human": "25/07/1994",
    "machine": "1994-07-25"
  },
  {
    "human": "april 28, 2002",
    "machine": "2002-04-28"
  },
  {
    "human": "dec 3, 70",
    "machine": "1970-12-03"
  },
  {
    "human": "01 may 2025",
    "machine": "2025-05-01"
  },
  {
    "human": "15 feb 1979",
    "machine": "1979-02-15"
  },
  {
    "human": "29 apr 1985",
    "machine": "1985-04-29"
  },
  {
    "human": "20-05-07",
    "machine": "2020-05-07"
  },
  {
    "human": "monday, may 13, 1974",
    "machine": "1974-05-13"
  },
  {
    "human": "23 oct 2003",
    "machine": "2003-10-23"
  },
  {
    "human": "30, may 2023",
    "machine": "2023-05-30"
  },
  {
    "human": "2019/03/27",
    "machine": "2019-03-27"
  },
  {
    "human": "2017-07-14",
    "machine": "2017-07-14"
  },
  {
    "human": "monday, july 3, 1995",
    "machine": "1995-07-03"
  },
  {
    "human": "aug 8 2019",
    "machine": "2019-08-08"
  },
  {
    "human": "12.8.76",
    "machine": "1976-08-12"
  },
  {
    "human": "5 february 2012",
    "machine": "2012-02-05"
  },
  {
    "human": "mar 21, 2017",
    "machine": "2017-03-21"
  },
  {
    "human": "06-10-99",
    "machine": "1999-06-10"
  },
  {
    "human": "tuesday, march 29, 1988",
    "machine": "1988-03-29"
  },
  {
    "human": "26.5.86",
    "machine": "1986-05-26"
  },
  {
    "human": "3 january 1973",
    "machine": "1973-01-03"
  },
  {
    "human": "aug 9, 1986",
    "machine": "1986-08-09"
  },
  {
    "human": "19/03/1991",
    "machine": "1991-03-19"
  },
  {
    "human": "1989.03.05 ad",
    "machine": "1989-03-05"
  },
  {
    "human": "november 26, 2015",
    "machine": "2015-11-26"
  },
  {
    "human": "06.05.1971",
    "machine": "1971-05-06"
  },
  {
    "human": "mar 15, 89",
    "machine": "1989-03-15"
  },
  {
    "human": "19 sep, 1986",
    "machine": "1986-09-19"
  },
  {
    "human": "18 may, 2009",
    "machine": "2009-05-18"
  },
  {
    "human": "6.1.90",
    "machine": "1990-01-06"
  },
  {
    "human": "02/09/2010",
    "machine": "2010-02-09"
  },
  {
    "human": "04 august 1980",
    "machine": "1980-08-04"
  },
  {
    "human": "24, jan 1971",
    "machine": "1971-01-24"
  },
  {
    "human": "05, oct 2000",
    "machine": "2000-10-05"
  },
  {
    "human": "thursday, january 2, 1992",
    "machine": "1992-01-02"
  },
  {
    "human": "93-07-17",
    "machine": "1993-07-17"
  },
  {
    "human": "sunday, september 22, 1991",
    "machine": "1991-09-22"
  },
  {
    "human": "jan 12, 1999",
    "machine": "1999-01-12"
  },
  {
    "human": "1-aug-1977",
    "machine": "1977-08-01"
  },
  {
    "human": "5/6/82",
    "machine": "1982-05-06"
  },
  {
    "human": "11/12/14",
    "machine": "2014-11-12"
  },
  {
    "human": "august 9, 1992",
    "machine": "1992-08-09"
  },
  {
    "human": "22 september 2003",
    "machine": "2003-09-22"
  },
  {
    "human": "04 may 1984",
    "machine": "1984-05-04"
  },
  {
    "human": "31 march 1989",
    "machine": "1989-03-31"
  },
  {
    "human": "2003-05-31",
    "machine": "2003-05-31"
  },
  {
    "human": "1998.08.01 ad",
    "machine": "1998-08-01"
  },
  {
    "human": "1984-01-15",
    "machine": "1984-01-15"
  },
  {
    "human": "aug 2, 94",
    "machine": "1994-08-02"
  },
  {
    "human": "18 sep, 2016",
    "machine": "2016-09-18"
  },
  {
    "human": "06.06.2021",
    "machine": "2021-06-06"
  },
  {
    "human": "73.08.28",
    "machine": "1973-08-28"
  },
  {
    "human": "20-09-20",
    "machine": "2020-09-20"
  },
  {
    "human": "18.12.1977",
    "machine": "1977-12-18"
  },
  {
    "human": "04-20-18",
    "machine": "2018-04-20"
  },
  {
    "human": "2/10/88",
    "machine": "1988-02-10"
  },
  {
    "human": "1979-05-11",
    "machine": "1979-05-11"
  },
  {
    "human": "august 08, 1998",
    "machine": "1998-08-08"
  },
  {
    "human": "mon, dec 10, 90",
    "machine": "1990-12-10"
  },
  {
    "human": "mon, nov 18, 91",
    "machine": "1991-11-18"
  },
  {
    "human": "92-11-20",
    "machine": "1992-11-20"
  },
  {
    "human": "11-oct-1971",
    "machine": "1971-10-11"
  },
  {
    "human": "09.08.6",
    "machine": "2009-08-06"
  },
  {
    "human": "1984.08.18 ad",
    "machine": "1984-08-18"
  },
  {
    "human": "06, mar 1994",
    "machine": "1994-03-06"
  },
  {
    "human": "2/01/1988",
    "machine": "1988-01-02"
  },
  {
    "human": "february 22, 1974",
    "machine": "1974-02-22"
  },
  {
    "human": "5/11/16",
    "machine": "2016-05-11"
  },
  {
    "human": "11, aug 2004",
    "machine": "2004-08-11"
  },
  {
    "human": "mar 20, 2018",
    "machine": "2018-03-20"
  },
  {
    "human": "13, jun 1993",
    "machine": "1993-06-13"
  },
  {
    "human": "1/4/73",
    "machine": "1973-01-04"
  },
  {
    "human": "26 sep 2017",
    "machine": "2017-09-26"
  },
  {
    "human": "2005/09/01",
    "machine": "2005-09-01"
  },
  {
    "human": "11/18/2024",
    "machine": "2024-11-18"
  },
  {
    "human": "17.09.30",
    "machine": "2017-09-30"
  },
  {
    "human": "mar 14 2019",
    "machine": "2019-03-14"
  },
  {
    "human": "19 june 2004",
    "machine": "2004-06-19"
  },
  {
    "human": "16.07.21",
    "machine": "2016-07-21"
  },
  {
    "human": "12.05.5",
    "machine": "2012-05-05"
  },
  {
    "human": "1989/12/29",
    "machine": "1989-12-29"
  },
  {
    "human": "1992-01-21",
    "machine": "1992-01-21"
  },
  {
    "human": "7.8.16",
    "machine": "2016-08-07"
  },
  {
    "human": "1991/05/11",
    "machine": "1991-05-11"
  },
  {
    "human": "03/05/1984",
    "machine": "1984-03-05"
  },
  {
    "human": "02-12-96",
    "machine": "1996-02-12"
  },
  {
    "human": "12/8/86",
    "machine": "1986-12-08"
  },
  {
    "human": "2019/09/01",
    "machine": "2019-09-01"
  },
  {
    "human": "friday, may 5, 2000",
    "machine": "2000-05-05"
  },
  {
    "human": "8 apr 2000",
    "machine": "2000-04-08"
  },
  {
    "human": "28 june 1975",
    "machine": "1975-06-28"
  },
  {
    "human": "88.05.16",
    "machine": "1988-05-16"
  },
  {
    "human": "17.02.2016",
    "machine": "2016-02-17"
  },
  {
    "human": "saturday, september 12, 1981",
    "machine": "1981-09-12"
  },
  {
    "human": "11 april 2020",
    "machine": "2020-04-11"
  },
  {
    "human": "9/01/1997",
    "machine": "1997-01-09"
  },
  {
    "human": "1989-09-13",
    "machine": "1989-09-13"
  },
  {
    "human": "june 10, 2008",
    "machine": "2008-06-10"
  },
  {
    "human": "11/28/00",
    "machine": "2000-11-28"
  },
  {
    "human": "09 june 1972",
    "machine": "1972-06-09"
  },
  {
    "human": "10 sep, 2006",
    "machine": "2006-09-10"
  },
  {
    "human": "28.02.2022",
    "machine": "2022-02-28"
  },
  {
    "human": "saturday, september 6, 2008",
    "machine": "2008-09-06"
  },
  {
    "human": "september 18, 2005",
    "machine": "2005-09-18"
  },
  {
    "human": "6-jun-1998",
    "machine": "1998-06-06"
  },
  {
    "human": "87.05.12",
    "machine": "1987-05-12"
  },
  {
    "human": "9 oct 1994",
    "machine": "1994-10-09"
  },
  {
    "human": "2022-01-23",
    "machine": "2022-01-23"
  },
  {
    "human": "19/06/1990",
    "machine": "1990-06-19"
  },
  {
    "human": "2020/04/25",
    "machine": "2020-04-25"
  },
  {
    "human": "22.01.1989",
    "machine": "1989-01-22"
  },
  {
    "human": "28 may 1983",
    "machine": "1983-05-28"
  },
  {
    "human": "15-jul-1999",
    "machine": "1999-07-15"
  },
  {
    "human": "8 january 1991",
    "machine": "1991-01-08"
  },
  {
    "human": "may 10 2000",
    "machine": "2000-05-10"
  },
  {
    "human": "aug 10, 2025",
    "machine": "2025-08-10"
  },
  {
    "human": "22 december 2006",
    "machine": "2006-12-22"
  },
  {
    "human": "july 17, 1998",
    "machine": "1998-07-17"
  },
  {
    "human": "10 august 1976",
    "machine": "1976-08-10"
  },
  {
    "human": "october 22, 2014",
    "machine": "2014-10-22"
  },
  {
    "human": "05-02-02",
    "machine": "2002-05-02"
  },
  {
    "human": "8/23/97",
    "machine": "1997-08-23"
  },
  {
    "human": "2020-05-31",
    "machine": "2020-05-31"
  },
  {
    "human": "wed, nov 22, 17",
    "machine": "2017-11-22"
  },
  {
    "human": "18-jun-2022",
    "machine": "2022-06-18"
  },
  {
    "human": "26.6.02",
    "machine": "2002-06-26"
  },
  {
    "human": "16 jan, 1970",
    "machine": "1970-01-16"
  },
  {
    "human": "25-sep-1991",
    "machine": "1991-09-25"
  },
  {
    "human": "1974/10/18",
    "machine": "1974-10-18"
  },
  {
    "human": "05.04.2018",
    "machine": "2018-04-05"
  },
  {
    "human": "mar 27 1970",
    "machine": "1970-03-27"
  },
  {
    "human": "2007-11-17",
    "machine": "2007-11-17"
  },
  {
    "human": "4 dec 2008",
    "machine": "2008-12-04"
  },
  {
    "human": "25 feb 1988",
    "machine": "1988-02-25"
  },
  {
    "human": "17 july 1979",
    "machine": "1979-07-17"
  },
  {
    "human": "2023/03/13",
    "machine": "2023-03-13"
  },
  {
    "human": "08 april 1989",
    "machine": "1989-04-08"
  },
  {
    "human": "23 jul, 1975",
    "machine": "1975-07-23"
  },
  {
    "human": "december 7, 2023",
    "machine": "2023-12-07"
  },
  {
    "human": "19 october 1989",
    "machine": "1989-10-19"
  },
  {
    "human": "2007.11.12 ad",
    "machine": "2007-11-12"
  },
  {
    "human": "03/17/1996",
    "machine": "1996-03-17"
  },
  {
    "human": "78-07-30",
    "machine": "1978-07-30"
  },
  {
    "human": "16 september 1975",
    "machine": "1975-09-16"
  },
  {
    "human": "10, dec 1998",
    "machine": "1998-12-10"
  },
  {
    "human": "11 december 2007",
    "machine": "2007-12-11"
  },
  {
    "human": "25-01-04",
    "machine": "2025-01-04"
  },
  {
    "human": "15-jul-1972",
    "machine": "1972-07-15"
  },
  {
    "human": "16.04.1987",
    "machine": "1987-04-16"
  },
  {
    "human": "09/28/1990",
    "machine": "1990-09-28"
  },
  {
    "human": "oct 2, 10",
    "machine": "2010-10-02"
  },
  {
    "human": "nov 24 2023",
    "machine": "2023-11-24"
  },
  {
    "human": "27.9.71",
    "machine": "1971-09-27"
  },
  {
    "human": "apr 11 2018",
    "machine": "2018-04-11"
  },
  {
    "human": "2007/09/18",
    "machine": "2007-09-18"
  },
  {
    "human": "apr 20, 1973",
    "machine": "1973-04-20"
  },
  {
    "human": "october 07, 1982",
    "machine": "1982-10-07"
  },
  {
    "human": "08 august 1999",
    "machine": "1999-08-08"
  },
  {
    "human": "22.12.2004",
    "machine": "2004-12-22"
  },
  {
    "human": "2017-05-25",
    "machine": "2017-05-25"
  },
  {
    "human": "16 sep, 2009",
    "machine": "2009-09-16"
  },
  {
    "human": "77-06-06",
    "machine": "1977-06-06"
  },
  {
    "human": "march 21, 2021",
    "machine": "2021-03-21"
  },
  {
    "human": "87.01.21",
    "machine": "1987-01-21"
  },
  {
    "human": "mon, jun 28, 71",
    "machine": "1971-06-28"
  },
  {
    "human": "aug 10 2013",
    "machine": "2013-08-10"
  },
  {
    "human": "06.04.2024",
    "machine": "2024-04-06"
  },
  {
    "human": "14-mar-1986",
    "machine": "1986-03-14"
  },
  {
    "human": "friday, july 19, 1985",
    "machine": "1985-07-19"
  },
  {
    "human": "january 24, 2013",
    "machine": "2013-01-24"
  },
  {
    "human": "08-21-15",
    "machine": "2015-08-21"
  },
  {
    "human": "13, jan 2013",
    "machine": "2013-01-13"
  },
  {
    "human": "1996-06-29",
    "machine": "1996-06-29"
  },
  {
    "human": "28.3.86",
    "machine": "1986-03-28"
  },
  {
    "human": "28.05.1994",
    "machine": "1994-05-28"
  },
  {
    "human": "august 2, 2003",
    "machine": "2003-08-02"
  },
  {
    "human": "06-06-14",
    "machine": "2014-06-06"
  },
  {
    "human": "2002-11-12",
    "machine": "2002-11-12"
  },
  {
    "human": "jul 19, 1972",
    "machine": "1972-07-19"
  },
  {
    "human": "december 12, 2006",
    "machine": "2006-12-12"
  },
  {
    "human": "19.09.1992",
    "machine": "1992-09-19"
  },
  {
    "human": "may 24, 1970",
    "machine": "1970-05-24"
  },
  {
    "human": "jun 22 1970",
    "machine": "1970-06-22"
  },
  {
    "human": "27, jul 1988",
    "machine": "1988-07-27"
  },
  {
    "human": "oct 20 1970",
    "machine": "1970-10-20"
  },
  {
    "human": "november 5, 1978",
    "machine": "1978-11-05"
  },
  {
    "human": "5 sep 1979",
    "machine": "1979-09-05"
  },
  {
    "human": "27-mar-2001",
    "machine": "2001-03-27"
  },
  {
    "human": "friday, december 6, 1996",
    "machine": "1996-12-06"
  },
  {
    "human": "may 23, 2022",
    "machine": "2022-05-23"
  },
  {
    "human": "2025-05-29",
    "machine": "2025-05-29"
  },
  {
    "human": "22.02.2021",
    "machine": "2021-02-22"
  },
  {
    "human": "4/26/20",
    "machine": "2020-04-26"
  },
  {
    "human": "09/16/1997",
    "machine": "1997-09-16"
  },
  {
    "human": "2000.01.21 ad",
    "machine": "2000-01-21"
  },
  {
    "human": "27 aug, 2019",
    "machine": "2019-08-27"
  },
  {
    "human": "08-01-15",
    "machine": "2008-01-15"
  },
  {
    "human": "december 9, 1991",
    "machine": "1991-12-09"
  },
  {
    "human": "06/08/1999",
    "machine": "1999-06-08"
  },
  {
    "human": "sunday, august 21, 2022",
    "machine": "2022-08-21"
  },
  {
    "human": "1985-01-29",
    "machine": "1985-01-29"
  },
  {
    "human": "9.11.03",
    "machine": "2003-11-09"
  },
  {
    "human": "2024-06-19",
    "machine": "2024-06-19"
  },
  {
    "human": "10-dec-1999",
    "machine": "1999-12-10"
  },
  {
    "human": "1985-08-02",
    "machine": "1985-08-02"
  },
  {
    "human": "8 may, 2009",
    "machine": "2009-05-08"
  },
  {
    "human": "friday, november 11, 1994",
    "machine": "1994-11-11"
  },
  {
    "human": "3 february 1981",
    "machine": "1981-02-03"
  },
  {
    "human": "1993.08.20 ad",
    "machine": "1993-08-20"
  },
  {
    "human": "11.6.84",
    "machine": "1984-06-11"
  },
  {
    "human": "wed, aug 29, 18",
    "machine": "2018-08-29"
  },
  {
    "human": "09-06-09",
    "machine": "2009-06-09"
  },
  {
    "human": "may 10, 1997",
    "machine": "1997-05-10"
  },
  {
    "human": "30.10.2013",
    "machine": "2013-10-30"
  },
  {
    "human": "01/23/1981",
    "machine": "1981-01-23"
  },
  {
    "human": "5 jun, 1996",
    "machine": "1996-06-05"
  },
  {
    "human": "15.08.30",
    "machine": "2015-08-30"
  },
  {
    "human": "10/12/14",
    "machine": "2014-10-12"
  },
  {
    "human": "24.03.1998",
    "machine": "1998-03-24"
  },
  {
    "human": "03, sep 2016",
    "machine": "2016-09-03"
  },
  {
    "human": "01-17-19",
    "machine": "2019-01-17"
  },
  {
    "human": "may 24, 1977",
    "machine": "1977-05-24"
  },
  {
    "human": "21.01.26",
    "machine": "2021-01-26"
  },
  {
    "human": "sep 5 1985",
    "machine": "1985-09-05"
  },
  {
    "human": "sun, nov 24, 13",
    "machine": "2013-11-24"
  },
  {
    "human": "jun 22 2024",
    "machine": "2024-06-22"
  },
  {
    "human": "jul 5, 22",
    "machine": "2022-07-05"
  },
  {
    "human": "7 oct 2004",
    "machine": "2004-10-07"
  },
  {
    "human": "6-jan-1985",
    "machine": "1985-01-06"
  },
  {
    "human": "19-12-16",
    "machine": "2019-12-16"
  },
  {
    "human": "11-jun-2005",
    "machine": "2005-06-11"
  },
  {
    "human": "15 january 1995",
    "machine": "1995-01-15"
  },
  {
    "human": "19 january 2007",
    "machine": "2007-01-19"
  },
  {
    "human": "25 november 2013",
    "machine": "2013-11-25"
  },
  {
    "human": "2009/02/25",
    "machine": "2009-02-25"
  },
  {
    "human": "10/11/1980",
    "machine": "1980-11-10"
  },
  {
    "human": "mar 11, 1989",
    "machine": "1989-03-11"
  },
  {
    "human": "5 january 2006",
    "machine": "2006-01-05"
  },
  {
    "human": "3/21/71",
    "machine": "1971-03-21"
  },
  {
    "human": "06.03.2013",
    "machine": "2013-03-06"
  },
  {
    "human": "1998-09-11",
    "machine": "1998-09-11"
  },
  {
    "human": "7 october 1979",
    "machine": "1979-10-07"
  },
  {
    "human": "june 24, 1979",
    "machine": "1979-06-24"
  },
  {
    "human": "1994/10/26",
    "machine": "1994-10-26"
  },
  {
    "human": "6 december 1972",
    "machine": "1972-12-06"
  },
  {
    "human": "25.12.19",
    "machine": "2019-12-25"
  },
  {
    "human": "monday, november 25, 2024",
    "machine": "2024-11-25"
  },
  {
    "human": "30 september 2023",
    "machine": "2023-09-30"
  },
  {
    "human": "13 jul 1996",
    "machine": "1996-07-13"
  },
  {
    "human": "tuesday, october 28, 2025",
    "machine": "2025-10-28"
  },
  {
    "human": "2/22/06",
    "machine": "2006-02-22"
  },
  {
    "human": "11-jun-1981",
    "machine": "1981-06-11"
  },
  {
    "human": "1998/10/31",
    "machine": "1998-10-31"
  },
  {
    "human": "5 may 2004",
    "machine": "2004-05-05"
  },
  {
    "human": "08/06/1981",
    "machine": "1981-08-06"
  },
  {
    "human": "1996/12/25",
    "machine": "1996-12-25"
  },
  {
    "human": "thu, oct 2, 86",
    "machine": "1986-10-02"
  },
  {
    "human": "20.06.2",
    "machine": "2020-06-02"
  },
  {
    "human": "03-18-77",
    "machine": "1977-03-18"
  },
  {
    "human": "19 august 1976",
    "machine": "1976-08-19"
  },
  {
    "human": "apr 12, 1974",
    "machine": "1974-04-12"
  },
  {
    "human": "saturday, february 22, 2014",
    "machine": "2014-02-22"
  },
  {
    "human": "23 apr 1991",
    "machine": "1991-04-23"
  },
  {
    "human": "19/06/2012",
    "machine": "2012-06-19"
  },
  {
    "human": "sep 10 1973",
    "machine": "1973-09-10"
  },
  {
    "human": "monday, march 17, 2003",
    "machine": "2003-03-17"
  },
  {
    "human": "august 16, 1982",
    "machine": "1982-08-16"
  },
  {
    "human": "2020.04.28 ad",
    "machine": "2020-04-28"
  },
  {
    "human": "10/20/70",
    "machine": "1970-10-20"
  },
  {
    "human": "5/17/93",
    "machine": "1993-05-17"
  },
  {
    "human": "19.8.11",
    "machine": "2011-08-19"
  },
  {
    "human": "8-jan-1991",
    "machine": "1991-01-08"
  },
  {
    "human": "1974/04/17",
    "machine": "1974-04-17"
  },
  {
    "human": "november 20, 1985",
    "machine": "1985-11-20"
  },
  {
    "human": "2009-11-27",
    "machine": "2009-11-27"
  },
  {
    "human": "1/22/78",
    "machine": "1978-01-22"
  },
  {
    "human": "08.02.2012",
    "machine": "2012-02-08"
  },
  {
    "human": "february 26, 1981",
    "machine": "1981-02-26"
  },
  {
    "human": "30, jul 1983",
    "machine": "1983-07-30"
  },
  {
    "human": "10/20/92",
    "machine": "1992-10-20"
  },
  {
    "human": "monday, august 3, 2020",
    "machine": "2020-08-03"
  },
  {
    "human": "01.12.2017",
    "machine": "2017-12-01"
  },
  {
    "human": "2024.08.14 ad",
    "machine": "2024-08-14"
  },
  {
    "human": "september 11, 1975",
    "machine": "1975-09-11"
  },
  {
    "human": "18-06-08",
    "machine": "2018-06-08"
  },
  {
    "human": "24 october 2018",
    "machine": "2018-10-24"
  },
  {
    "human": "august 29, 1988",
    "machine": "1988-08-29"
  },
  {
    "human": "july 09, 1971",
    "machine": "1971-07-09"
  },
  {
    "human": "03-04-03",
    "machine": "2003-03-04"
  },
  {
    "human": "26.05.2012",
    "machine": "2012-05-26"
  },
  {
    "human": "9/17/25",
    "machine": "2025-09-17"
  },
  {
    "human": "september 23, 2018",
    "machine": "2018-09-23"
  },
  {
    "human": "jun 22, 1978",
    "machine": "1978-06-22"
  },
  {
    "human": "jan 2, 77",
    "machine": "1977-01-02"
  },
  {
    "human": "29.10.1996",
    "machine": "1996-10-29"
  },
  {
    "human": "wednesday, november 2, 1983",
    "machine": "1983-11-02"
  },
  {
    "human": "2008-11-12",
    "machine": "2008-11-12"
  },
  {
    "human": "1977-04-25",
    "machine": "1977-04-25"
  },
  {
    "human": "11/01/2004",
    "machine": "2004-01-11"
  },
  {
    "human": "1984-08-23",
    "machine": "1984-08-23"
  },
  {
    "human": "feb 3, 1994",
    "machine": "1994-02-03"
  },
  {
    "human": "wednesday, may 14, 2008",
    "machine": "2008-05-14"
  },
  {
    "human": "09 january 2018",
    "machine": "2018-01-09"
  },
  {
    "human": "19/01/2006",
    "machine": "2006-01-19"
  },
  {
    "human": "23 may 1970",
    "machine": "1970-05-23"
  },
  {
    "human": "thu, jan 7, 16",
    "machine": "2016-01-07"
  },
  {
    "human": "1982-07-03",
    "machine": "1982-07-03"
  },
  {
    "human": "09-22-92",
    "machine": "1992-09-22"
  },
  {
    "human": "02-07-14",
    "machine": "2014-02-07"
  },
  {
    "human": "saturday, may 13, 1978",
    "machine": "1978-05-13"
  },
  {
    "human": "2006.12.21 ad",
    "machine": "2006-12-21"
  },
  {
    "human": "18/03/1984",
    "machine": "1984-03-18"
  },
  {
    "human": "jul 31, 93",
    "machine": "1993-07-31"
  },
  {
    "human": "15-may-2019",
    "machine": "2019-05-15"
  },
  {
    "human": "01-26-80",
    "machine": "1980-01-26"
  },
  {
    "human": "15, sep 1995",
    "machine": "1995-09-15"
  },
  {
    "human": "tuesday, march 27, 1990",
    "machine": "1990-03-27"
  },
  {
    "human": "wednesday, september 5, 2007",
    "machine": "2007-09-05"
  },
  {
    "human": "01 april 2016",
    "machine": "2016-04-01"
  },
  {
    "human": "monday, december 25, 1972",
    "machine": "1972-12-25"
  },
  {
    "human": "13-01-08",
    "machine": "2013-01-08"
  },
  {
    "human": "05/23/2010",
    "machine": "2010-05-23"
  },
  {
    "human": "nov 13, 2002",
    "machine": "2002-11-13"
  },
  {
    "human": "nov 8, 03",
    "machine": "2003-11-08"
  },
  {
    "human": "11/17/05",
    "machine": "2005-11-17"
  },
  {
    "human": "1991.11.23 ad",
    "machine": "1991-11-23"
  },
  {
    "human": "10/10/80",
    "machine": "1980-10-10"
  },
  {
    "human": "apr 5, 01",
    "machine": "2001-04-05"
  },
  {
    "human": "1996-04-28",
    "machine": "1996-04-28"
  },
  {
    "human": "30, dec 1983",
    "machine": "1983-12-30"
  },
  {
    "human": "29.9.00",
    "machine": "2000-09-29"
  },
  {
    "human": "17.01.9",
    "machine": "2017-01-09"
  },
  {
    "human": "2006-12-06",
    "machine": "2006-12-06"
  },
  {
    "human": "saturday, june 5, 2010",
    "machine": "2010-06-05"
  },
  {
    "human": "97.05.11",
    "machine": "1997-05-11"
  },
  {
    "human": "saturday, august 20, 2005",
    "machine": "2005-08-20"
  },
  {
    "human": "28-jan-1980",
    "machine": "1980-01-28"
  },
  {
    "human": "24 dec 1974",
    "machine": "1974-12-24"
  },
  {
    "human": "dec 18, 2023",
    "machine": "2023-12-18"
  },
  {
    "human": "12/17/07",
    "machine": "2007-12-17"
  },
  {
    "human": "27.1.23",
    "machine": "2023-01-27"
  },
  {
    "human": "1972/08/16",
    "machine": "1972-08-16"
  },
  {
    "human": "11, aug 1989",
    "machine": "1989-08-11"
  },
  {
    "human": "27 jan 1981",
    "machine": "1981-01-27"
  },
  {
    "human": "jul 17, 98",
    "machine": "1998-07-17"
  },
  {
    "human": "02, jun 1996",
    "machine": "1996-06-02"
  },
  {
    "human": "10 apr, 1977",
    "machine": "1977-04-10"
  },
  {
    "human": "22, mar 1979",
    "machine": "1979-03-22"
  },
  {
    "human": "3-mar-2021",
    "machine": "2021-03-03"
  },
  {
    "human": "saturday, july 10, 2021",
    "machine": "2021-07-10"
  },
  {
    "human": "23 jan 1992",
    "machine": "1992-01-23"
  },
  {
    "human": "saturday, february 1, 2014",
    "machine": "2014-02-01"
  },
  {
    "human": "16 nov, 1974",
    "machine": "1974-11-16"
  },
  {
    "human": "10 january 1981",
    "machine": "1981-01-10"
  },
  {
    "human": "18 january 1996",
    "machine": "1996-01-18"
  },
  {
    "human": "06, mar 2024",
    "machine": "2024-03-06"
  },
  {
    "human": "18 january 1972",
    "machine": "1972-01-18"
  },
  {
    "human": "january 31, 1989",
    "machine": "1989-01-31"
  },
  {
    "human": "september 25, 1993",
    "machine": "1993-09-25"
  },
  {
    "human": "22 march 1993",
    "machine": "1993-03-22"
  },
  {
    "human": "2016-03-7",
    "machine": "2016-03-07"
  },
  {
    "human": "6-may-2013",
    "machine": "2013-05-06"
  },
  {
    "human": "july 14, 1987",
    "machine": "1987-07-14"
  },
  {
    "human": "jul 12, 1990",
    "machine": "1990-07-12"
  },
  {
    "human": "17.10.2020",
    "machine": "2020-10-17"
  },
  {
    "human": "saturday, november 22, 2014",
    "machine": "2014-11-22"
  },
  {
    "human": "30 may 2005",
    "machine": "2005-05-30"
  },
  {
    "human": "19.01.1988",
    "machine": "1988-01-19"
  },
  {
    "human": "71-11-10",
    "machine": "1971-11-10"
  },
  {
    "human": "22 oct 2006",
    "machine": "2006-10-22"
  },
  {
    "human": "09-23-93",
    "machine": "1993-09-23"
  },
  {
    "human": "17/10/2018",
    "machine": "2018-10-17"
  },
  {
    "human": "tuesday, february 7, 2012",
    "machine": "2012-02-07"
  },
  {
    "human": "05/14/2008",
    "machine": "2008-05-14"
  },
  {
    "human": "may 26, 02",
    "machine": "2002-05-26"
  },
  {
    "human": "6/24/14",
    "machine": "2014-06-24"
  },
  {
    "human": "22/11/2008",
    "machine": "2008-11-22"
  },
  {
    "human": "20 may, 2015",
    "machine": "2015-05-20"
  },
  {
    "human": "06.10.2018",
    "machine": "2018-10-06"
  },
  {
    "human": "11.04.29",
    "machine": "2011-04-29"
  },
  {
    "human": "1987/08/13",
    "machine": "1987-08-13"
  },
  {
    "human": "september 16, 1998",
    "machine": "1998-09-16"
  },
  {
    "human": "november 22, 1985",
    "machine": "1985-11-22"
  },
  {
    "human": "fri, jul 10, 70",
    "machine": "1970-07-10"
  },
  {
    "human": "november 16, 2001",
    "machine": "2001-11-16"
  },
  {
    "human": "05/27/2005",
    "machine": "2005-05-27"
  },
  {
    "human": "friday, april 26, 1985",
    "machine": "1985-04-26"
  },
  {
    "human": "oct 6, 99",
    "machine": "1999-10-06"
  },
  {
    "human": "03-20-79",
    "machine": "1979-03-20"
  },
  {
    "human": "1/4/12",
    "machine": "2012-01-04"
  },
  {
    "human": "13.8.25",
    "machine": "2025-08-13"
  },
  {
    "human": "3 november 2017",
    "machine": "2017-11-03"
  },
  {
    "human": "29 may 2003",
    "machine": "2003-05-29"
  },
  {
    "human": "sunday, january 2, 2000",
    "machine": "2000-01-02"
  },
  {
    "human": "5/06/1996",
    "machine": "1996-06-05"
  },
  {
    "human": "4.4.23",
    "machine": "2023-04-04"
  },
  {
    "human": "31.12.12",
    "machine": "2012-12-31"
  },
  {
    "human": "jul 24 2024",
    "machine": "2024-07-24"
  },
  {
    "human": "6.12.18",
    "machine": "2018-12-06"
  },
  {
    "human": "friday, september 21, 2001",
    "machine": "2001-09-21"
  },
  {
    "human": "1997-11-21",
    "machine": "1997-11-21"
  },
  {
    "human": "nov 25, 19",
    "machine": "2019-11-25"
  },
  {
    "human": "may 23, 1997",
    "machine": "1997-05-23"
  },
  {
    "human": "1.8.98",
    "machine": "1998-08-01"
  },
  {
    "human": "22/12/1995",
    "machine": "1995-12-22"
  },
  {
    "human": "10/22/01",
    "machine": "2001-10-22"
  },
  {
    "human": "may 4, 2017",
    "machine": "2017-05-04"
  },
  {
    "human": "fri, aug 27, 93",
    "machine": "1993-08-27"
  },
  {
    "human": "18, mar 2010",
    "machine": "2010-03-18"
  },
  {
    "human": "12.07.30",
    "machine": "2012-07-30"
  },
  {
    "human": "10.7.86",
    "machine": "1986-07-10"
  },
  {
    "human": "june 13, 1984",
    "machine": "1984-06-13"
  },
  {
    "human": "thursday, february 3, 1983",
    "machine": "1983-02-03"
  },
  {
    "human": "fri, may 3, 02",
    "machine": "2002-05-03"
  },
  {
    "human": "1976-07-3",
    "machine": "1976-07-03"
  },
  {
    "human": "2.8.12",
    "machine": "2012-08-02"
  },
  {
    "human": "january 13, 2022",
    "machine": "2022-01-13"
  },
  {
    "human": "9/4/00",
    "machine": "2000-09-04"
  },
  {
    "human": "9/7/16",
    "machine": "2016-09-07"
  },
  {
    "human": "23 december 1976",
    "machine": "1976-12-23"
  },
  {
    "human": "2/15/80",
    "machine": "1980-02-15"
  },
  {
    "human": "jun 3, 01",
    "machine": "2001-06-03"
  },
  {
    "human": "1974-02-01",
    "machine": "1974-02-01"
  },
  {
    "human": "25, mar 1977",
    "machine": "1977-03-25"
  },
  {
    "human": "1976-06-18",
    "machine": "1976-06-18"
  },
  {
    "human": "8.4.20",
    "machine": "2020-04-08"
  },
  {
    "human": "30/12/2022",
    "machine": "2022-12-30"
  },
  {
    "human": "jul 7, 1984",
    "machine": "1984-07-07"
  },
  {
    "human": "10/27/2002",
    "machine": "2002-10-27"
  },
  {
    "human": "june 30, 1971",
    "machine": "1971-06-30"
  },
  {
    "human": "91-07-17",
    "machine": "1991-07-17"
  },
  {
    "human": "99-11-27",
    "machine": "1999-11-27"
  },
  {
    "human": "march 11, 1978",
    "machine": "1978-03-11"
  },
  {
    "human": "1985-04-15",
    "machine": "1985-04-15"
  },
  {
    "human": "march 28, 2020",
    "machine": "2020-03-28"
  },
  {
    "human": "monday, february 8, 2010",
    "machine": "2010-02-08"
  },
  {
    "human": "5.6.81",
    "machine": "1981-06-05"
  },
  {
    "human": "dec 19 2013",
    "machine": "2013-12-19"
  },
  {
    "human": "03.06.5",
    "machine": "2003-06-05"
  },
  {
    "human": "thursday, february 11, 1971",
    "machine": "1971-02-11"
  },
  {
    "human": "jun 16, 18",
    "machine": "2018-06-16"
  },
  {
    "human": "february 7, 1975",
    "machine": "1975-02-07"
  },
  {
    "human": "4.7.96",
    "machine": "1996-07-04"
  },
  {
    "human": "1992-12-22",
    "machine": "1992-12-22"
  },
  {
    "human": "10-14-87",
    "machine": "1987-10-14"
  },
  {
    "human": "2019/01/20",
    "machine": "2019-01-20"
  },
  {
    "human": "1992-05-22",
    "machine": "1992-05-22"
  },
  {
    "human": "1982.10.07 ad",
    "machine": "1982-10-07"
  },
  {
    "human": "friday, july 28, 1995",
    "machine": "1995-07-28"
  },
  {
    "human": "31, dec 1974",
    "machine": "1974-12-31"
  },
  {
    "human": "75.05.3",
    "machine": "1975-05-03"
  },
  {
    "human": "1984-01-09",
    "machine": "1984-01-09"
  },
  {
    "human": "30 nov 1971",
    "machine": "1971-11-30"
  },
  {
    "human": "28.10.1981",
    "machine": "1981-10-28"
  },
  {
    "human": "26 may, 2015",
    "machine": "2015-05-26"
  },
  {
    "human": "2002-12-3",
    "machine": "2002-12-03"
  },
  {
    "human": "mar 19, 01",
    "machine": "2001-03-19"
  },
  {
    "human": "1977/11/30",
    "machine": "1977-11-30"
  },
  {
    "human": "dec 15, 83",
    "machine": "1983-12-15"
  },
  {
    "human": "january 14, 2023",
    "machine": "2023-01-14"
  },
  {
    "human": "21 jan 2002",
    "machine": "2002-01-21"
  },
  {
    "human": "06 may 1978",
    "machine": "1978-05-06"
  },
  {
    "human": "09-09-25",
    "machine": "2009-09-25"
  },
  {
    "human": "30 aug 1995",
    "machine": "1995-08-30"
  },
  {
    "human": "30.7.18",
    "machine": "2018-07-30"
  },
  {
    "human": "24 may 1999",
    "machine": "1999-05-24"
  },
  {
    "human": "11/30/03",
    "machine": "2003-11-30"
  },
  {
    "human": "1974-09-13",
    "machine": "1974-09-13"
  },
  {
    "human": "march 07, 1971",
    "machine": "1971-03-07"
  },
  {
    "human": "november 06, 2015",
    "machine": "2015-11-06"
  },
  {
    "human": "2008/09/07",
    "machine": "2008-09-07"
  },
  {
    "human": "22/02/2005",
    "machine": "2005-02-22"
  },
  {
    "human": "27.10.2008",
    "machine": "2008-10-27"
  },
  {
    "human": "1970-11-7",
    "machine": "1970-11-07"
  },
  {
    "human": "jun 11 2015",
    "machine": "2015-06-11"
  },
  {
    "human": "16, jun 1994",
    "machine": "1994-06-16"
  },
  {
    "human": "monday, february 9, 1998",
    "machine": "1998-02-09"
  },
  {
    "human": "2012-04-26",
    "machine": "2012-04-26"
  },
  {
    "human": "1994-07-8",
    "machine": "1994-07-08"
  },
  {
    "human": "wednesday, october 1, 1986",
    "machine": "1986-10-01"
  },
  {
    "human": "jan 15, 10",
    "machine": "2010-01-15"
  },
  {
    "human": "sep 16 1993",
    "machine": "1993-09-16"
  },
  {
    "human": "07/12/1985",
    "machine": "1985-07-12"
  },
  {
    "human": "aug 14, 18",
    "machine": "2018-08-14"
  },
  {
    "human": "1986.12.22 ad",
    "machine": "1986-12-22"
  },
  {
    "human": "20-dec-1988",
    "machine": "1988-12-20"
  },
  {
    "human": "july 28, 2017",
    "machine": "2017-07-28"
  },
  {
    "human": "thursday, october 17, 2002",
    "machine": "2002-10-17"
  },
  {
    "human": "13-jan-1986",
    "machine": "1986-01-13"
  },
  {
    "human": "june 25, 1999",
    "machine": "1999-06-25"
  },
  {
    "human": "02, mar 1981",
    "machine": "1981-03-02"
  },
  {
    "human": "10.03.31",
    "machine": "2010-03-31"
  },
  {
    "human": "thursday, january 4, 2007",
    "machine": "2007-01-04"
  },
  {
    "human": "february 5, 2019",
    "machine": "2019-02-05"
  },
  {
    "human": "2014-10-27",
    "machine": "2014-10-27"
  },
  {
    "human": "march 28, 2024",
    "machine": "2024-03-28"
  },
  {
    "human": "2008.11.30 ad",
    "machine": "2008-11-30"
  },
  {
    "human": "may 5, 03",
    "machine": "2003-05-05"
  },
  {
    "human": "06 july 1974",
    "machine": "1974-07-06"
  },
  {
    "human": "2008-06-02",
    "machine": "2008-06-02"
  },
  {
    "human": "24-02-20",
    "machine": "2024-02-20"
  },
  {
    "human": "20-06-19",
    "machine": "2020-06-19"
  },
  {
    "human": "21.03.1996",
    "machine": "1996-03-21"
  },
  {
    "human": "4 march 1993",
    "machine": "1993-03-04"
  },
  {
    "human": "sat, jul 8, 72",
    "machine": "1972-07-08"
  },
  {
    "human": "09-14-06",
    "machine": "2006-09-14"
  },
  {
    "human": "25, jun 2005",
    "machine": "2005-06-25"
  },
  {
    "human": "1983/10/07",
    "machine": "1983-10-07"
  },
  {
    "human": "jun 11, 2010",
    "machine": "2010-06-11"
  },
  {
    "human": "sep 9 1974",
    "machine": "1974-09-09"
  },
  {
    "human": "7/7/95",
    "machine": "1995-07-07"
  },
  {
    "human": "03-17-75",
    "machine": "1975-03-17"
  },
  {
    "human": "1972-11-12",
    "machine": "1972-11-12"
  },
  {
    "human": "13-may-2008",
    "machine": "2008-05-13"
  },
  {
    "human": "8/12/14",
    "machine": "2014-08-12"
  },
  {
    "human": "09-06-02",
    "machine": "2002-09-06"
  },
  {
    "human": "14.1.77",
    "machine": "1977-01-14"
  },
  {
    "human": "4/4/08",
    "machine": "2008-04-04"
  },
  {
    "human": "5-sep-1993",
    "machine": "1993-09-05"
  },
  {
    "human": "may 7, 2008",
    "machine": "2008-05-07"
  },
  {
    "human": "2005-02-25",
    "machine": "2005-02-25"
  },
  {
    "human": "november 25, 2004",
    "machine": "2004-11-25"
  },
  {
    "human": "18 september 1993",
    "machine": "1993-09-18"
  },
  {
    "human": "oct 5, 02",
    "machine": "2002-10-05"
  },
  {
    "human": "23-nov-2002",
    "machine": "2002-11-23"
  },
  {
    "human": "tuesday, july 26, 1983",
    "machine": "1983-07-26"
  },
  {
    "human": "august 28, 1986",
    "machine": "1986-08-28"
  },
  {
    "human": "2007/11/28",
    "machine": "2007-11-28"
  },
  {
    "human": "07-08-83",
    "machine": "1983-07-08"
  },
  {
    "human": "jun 2, 2022",
    "machine": "2022-06-02"
  },
  {
    "human": "april 3, 1994",
    "machine": "1994-04-03"
  },
  {
    "human": "10/30/2011",
    "machine": "2011-10-30"
  },
  {
    "human": "09-11-80",
    "machine": "1980-09-11"
  },
  {
    "human": "24.02.21",
    "machine": "2024-02-21"
  },
  {
    "human": "18 jan, 2023",
    "machine": "2023-01-18"
  },
  {
    "human": "28, jul 1981",
    "machine": "1981-07-28"
  },
  {
    "human": "9/21/92",
    "machine": "1992-09-21"
  },
  {
    "human": "tuesday, september 10, 1985",
    "machine": "1985-09-10"
  },
  {
    "human": "may 31, 05",
    "machine": "2005-05-31"
  },
  {
    "human": "31-may-1998",
    "machine": "1998-05-31"
  },
  {
    "human": "april 26, 1997",
    "machine": "1997-04-26"
  },
  {
    "human": "1/18/72",
    "machine": "1972-01-18"
  },
  {
    "human": "wed, oct 10, 12",
    "machine": "2012-10-10"
  },
  {
    "human": "2010-10-19",
    "machine": "2010-10-19"
  },
  {
    "human": "28, jan 2012",
    "machine": "2012-01-28"
  },
  {
    "human": "2012/10/27",
    "machine": "2012-10-27"
  },
  {
    "human": "75.03.4",
    "machine": "1975-03-04"
  },
  {
    "human": "thursday, november 25, 1999",
    "machine": "1999-11-25"
  },
  {
    "human": "mon, jan 21, 19",
    "machine": "2019-01-21"
  },
  {
    "human": "2015-08-8",
    "machine": "2015-08-08"
  },
  {
    "human": "1980-06-25",
    "machine": "1980-06-25"
  },
  {
    "human": "1979.12.03 ad",
    "machine": "1979-12-03"
  },
  {
    "human": "93.04.22",
    "machine": "1993-04-22"
  },
  {
    "human": "07/25/2017",
    "machine": "2017-07-25"
  },
  {
    "human": "mon, jun 8, 87",
    "machine": "1987-06-08"
  },
  {
    "human": "2003-12-07",
    "machine": "2003-12-07"
  },
  {
    "human": "18 august 2003",
    "machine": "2003-08-18"
  },
  {
    "human": "8/22/06",
    "machine": "2006-08-22"
  },
  {
    "human": "02/24/2009",
    "machine": "2009-02-24"
  },
  {
    "human": "1.6.95",
    "machine": "1995-06-01"
  },
  {
    "human": "mar 4 1986",
    "machine": "1986-03-04"
  },
  {
    "human": "86.04.18",
    "machine": "1986-04-18"
  },
  {
    "human": "1993.03.12 ad",
    "machine": "1993-03-12"
  },
  {
    "human": "12, may 1998",
    "machine": "1998-05-12"
  },
  {
    "human": "11/01/2001",
    "machine": "2001-01-11"
  },
  {
    "human": "8-jun-1994",
    "machine": "1994-06-08"
  },
  {
    "human": "2007-06-21",
    "machine": "2007-06-21"
  },
  {
    "human": "5/2/19",
    "machine": "2019-05-02"
  },
  {
    "human": "01-13-25",
    "machine": "2025-01-13"
  },
  {
    "human": "1/23/24",
    "machine": "2024-01-23"
  },
  {
    "human": "dec 17, 87",
    "machine": "1987-12-17"
  },
  {
    "human": "1.12.85",
    "machine": "1985-12-01"
  },
  {
    "human": "01, dec 2003",
    "machine": "2003-12-01"
  },
  {
    "human": "september 18, 1995",
    "machine": "1995-09-18"
  },
  {
    "human": "11/11/91",
    "machine": "1991-11-11"
  },
  {
    "human": "2015/05/28",
    "machine": "2015-05-28"
  },
  {
    "human": "august 12, 2013",
    "machine": "2013-08-12"
  },
  {
    "human": "2005/05/12",
    "machine": "2005-05-12"
  },
  {
    "human": "28.08.2025",
    "machine": "2025-08-28"
  },
  {
    "human": "january 27, 1978",
    "machine": "1978-01-27"
  },
  {
    "human": "08-08-91",
    "machine": "1991-08-08"
  },
  {
    "human": "1998-03-28",
    "machine": "1998-03-28"
  },
  {
    "human": "may 14, 1988",
    "machine": "1988-05-14"
  },
  {
    "human": "6 december 2001",
    "machine": "2001-12-06"
  },
  {
    "human": "21.08.2",
    "machine": "2021-08-02"
  },
  {
    "human": "4/27/87",
    "machine": "1987-04-27"
  },
  {
    "human": "1973/08/16",
    "machine": "1973-08-16"
  },
  {
    "human": "02-19-90",
    "machine": "1990-02-19"
  },
  {
    "human": "1993/06/02",
    "machine": "1993-06-02"
  },
  {
    "human": "june 15, 1988",
    "machine": "1988-06-15"
  },
  {
    "human": "tuesday, july 8, 2014",
    "machine": "2014-07-08"
  },
  {
    "human": "september 29, 1990",
    "machine": "1990-09-29"
  },
  {
    "human": "jun 15 2006",
    "machine": "2006-06-15"
  },
  {
    "human": "tuesday, november 21, 1995",
    "machine": "1995-11-21"
  },
  {
    "human": "15/05/2004",
    "machine": "2004-05-15"
  },
  {
    "human": "1985-03-11",
    "machine": "1985-03-11"
  },
  {
    "human": "2010-10-14",
    "machine": "2010-10-14"
  },
  {
    "human": "11/24/73",
    "machine": "1973-11-24"
  },
  {
    "human": "7/19/77",
    "machine": "1977-07-19"
  },
  {
    "human": "04-17-92",
    "machine": "1992-04-17"
  },
  {
    "human": "september 18, 1985",
    "machine": "1985-09-18"
  },
  {
    "human": "94-03-29",
    "machine": "1994-03-29"
  },
  {
    "human": "aug 21, 80",
    "machine": "1980-08-21"
  },
  {
    "human": "tue, mar 28, 78",
    "machine": "1978-03-28"
  },
  {
    "human": "friday, november 22, 1996",
    "machine": "1996-11-22"
  },
  {
    "human": "thursday, october 30, 1980",
    "machine": "1980-10-30"
  },
  {
    "human": "april 24, 2019",
    "machine": "2019-04-24"
  },
  {
    "human": "1 jun, 2013",
    "machine": "2013-06-01"
  },
  {
    "human": "18 june 2023",
    "machine": "2023-06-18"
  },
  {
    "human": "1/12/1983",
    "machine": "1983-12-01"
  },
  {
    "human": "mar 7 2009",
    "machine": "2009-03-07"
  },
  {
    "human": "1973-04-14",
    "machine": "1973-04-14"
  },
  {
    "human": "november 23, 2023",
    "machine": "2023-11-23"
  },
  {
    "human": "3/02/2013",
    "machine": "2013-02-03"
  },
  {
    "human": "july 17, 2009",
    "machine": "2009-07-17"
  },
  {
    "human": "22 april 2021",
    "machine": "2021-04-22"
  },
  {
    "human": "10 december 1978",
    "machine": "1978-12-10"
  },
  {
    "human": "06-10-06",
    "machine": "2006-10-06"
  },
  {
    "human": "2015/08/17",
    "machine": "2015-08-17"
  },
  {
    "human": "10 august 1989",
    "machine": "1989-08-10"
  },
  {
    "human": "6-feb-1980",
    "machine": "1980-02-06"
  },
  {
    "human": "17 september 2021",
    "machine": "2021-09-17"
  },
  {
    "human": "10-may-1994",
    "machine": "1994-05-10"
  },
  {
    "human": "july 21, 1997",
    "machine": "1997-07-21"
  },
  {
    "human": "15/11/2016",
    "machine": "2016-11-15"
  },
  {
    "human": "20 sep 2003",
    "machine": "2003-09-20"
  },
  {
    "human": "22 feb 1976",
    "machine": "1976-02-22"
  },
  {
    "human": "wednesday, july 9, 1975",
    "machine": "1975-07-09"
  },
  {
    "human": "1998-02-2",
    "machine": "1998-02-02"
  },
  {
    "human": "august 8, 1985",
    "machine": "1985-08-08"
  },
  {
    "human": "august 22, 2024",
    "machine": "2024-08-22"
  },
  {
    "human": "july 27, 2010",
    "machine": "2010-07-27"
  },
  {
    "human": "1984-08-24",
    "machine": "1984-08-24"
  },
  {
    "human": "23-oct-2025",
    "machine": "2025-10-23"
  },
  {
    "human": "1989.03.27 ad",
    "machine": "1989-03-27"
  },
  {
    "human": "october 24, 1980",
    "machine": "1980-10-24"
  },
  {
    "human": "jan 2, 1995",
    "machine": "1995-01-02"
  },
  {
    "human": "09, oct 2005",
    "machine": "2005-10-09"
  },
  {
    "human": "1975-01-02",
    "machine": "1975-01-02"
  },
  {
    "human": "1995-08-23",
    "machine": "1995-08-23"
  },
  {
    "human": "3 mar, 1997",
    "machine": "1997-03-03"
  },
  {
    "human": "6/09/1992",
    "machine": "1992-09-06"
  },
  {
    "human": "03-26-97",
    "machine": "1997-03-26"
  },
  {
    "human": "26, feb 2013",
    "machine": "2013-02-26"
  },
  {
    "human": "30 august 1995",
    "machine": "1995-08-30"
  },
  {
    "human": "october 18, 1998",
    "machine": "1998-10-18"
  },
  {
    "human": "march 24, 1984",
    "machine": "1984-03-24"
  },
  {
    "human": "17, feb 2012",
    "machine": "2012-02-17"
  },
  {
    "human": "22-dec-1999",
    "machine": "1999-12-22"
  },
  {
    "human": "feb 17 1970",
    "machine": "1970-02-17"
  },
  {
    "human": "1973-04-01",
    "machine": "1973-04-01"
  },
  {
    "human": "08/11/1976",
    "machine": "1976-08-11"
  },
  {
    "human": "30 dec, 1979",
    "machine": "1979-12-30"
  },
  {
    "human": "feb 21 2009",
    "machine": "2009-02-21"
  },
  {
    "human": "tuesday, november 10, 2009",
    "machine": "2009-11-10"
  },
  {
    "human": "05, jul 1985",
    "machine": "1985-07-05"
  },
  {
    "human": "march 13, 1983",
    "machine": "1983-03-13"
  },
  {
    "human": "february 3, 1975",
    "machine": "1975-02-03"
  },
  {
    "human": "february 10, 1972",
    "machine": "1972-02-10"
  },
  {
    "human": "31 mar, 2008",
    "machine": "2008-03-31"
  },
  {
    "human": "27-feb-1991",
    "machine": "1991-02-27"
  },
  {
    "human": "tue, jul 31, 07",
    "machine": "2007-07-31"
  },
  {
    "human": "17-may-1987",
    "machine": "1987-05-17"
  },
  {
    "human": "monday, august 11, 2014",
    "machine": "2014-08-11"
  },
  {
    "human": "05-29-72",
    "machine": "1972-05-29"
  },
  {
    "human": "nov 19, 2021",
    "machine": "2021-11-19"
  },
  {
    "human": "sep 2, 2005",
    "machine": "2005-09-02"
  },
  {
    "human": "2013.02.02 ad",
    "machine": "2013-02-02"
  },
  {
    "human": "20/09/1990",
    "machine": "1990-09-20"
  },
  {
    "human": "friday, july 5, 2019",
    "machine": "2019-07-05"
  },
  {
    "human": "july 16, 1989",
    "machine": "1989-07-16"
  },
  {
    "human": "71.01.23",
    "machine": "1971-01-23"
  },
  {
    "human": "sunday, january 25, 2009",
    "machine": "2009-01-25"
  },
  {
    "human": "12/18/74",
    "machine": "1974-12-18"
  },
  {
    "human": "10 oct, 2018",
    "machine": "2018-10-10"
  },
  {
    "human": "apr 21, 1995",
    "machine": "1995-04-21"
  },
  {
    "human": "2/01/2022",
    "machine": "2022-01-02"
  },
  {
    "human": "11 november 1984",
    "machine": "1984-11-11"
  },
  {
    "human": "2013-03-13",
    "machine": "2013-03-13"
  },
  {
    "human": "9 jan 1975",
    "machine": "1975-01-09"
  },
  {
    "human": "march 31, 1993",
    "machine": "1993-03-31"
  },
  {
    "human": "05/27/1996",
    "machine": "1996-05-27"
  },
  {
    "human": "2019-06-6",
    "machine": "2019-06-06"
  },
  {
    "human": "9/9/21",
    "machine": "2021-09-09"
  },
  {
    "human": "08-21-17",
    "machine": "2017-08-21"
  },
  {
    "human": "22-feb-2009",
    "machine": "2009-02-22"
  },
  {
    "human": "saturday, january 7, 2012",
    "machine": "2012-01-07"
  },
  {
    "human": "8/8/06",
    "machine": "2006-08-08"
  },
  {
    "human": "oct 8 2017",
    "machine": "2017-10-08"
  },
  {
    "human": "2017-09-10",
    "machine": "2017-09-10"
  },
  {
    "human": "friday, february 25, 2011",
    "machine": "2011-02-25"
  },
  {
    "human": "04-03-04",
    "machine": "2004-04-03"
  },
  {
    "human": "1997-01-29",
    "machine": "1997-01-29"
  },
  {
    "human": "29.1.24",
    "machine": "2024-01-29"
  },
  {
    "human": "june 17, 2005",
    "machine": "2005-06-17"
  },
  {
    "human": "08-09-06",
    "machine": "2006-08-09"
  },
  {
    "human": "2010-12-08",
    "machine": "2010-12-08"
  },
  {
    "human": "06/25/2024",
    "machine": "2024-06-25"
  },
  {
    "human": "31 mar 2023",
    "machine": "2023-03-31"
  },
  {
    "human": "sunday, november 3, 2019",
    "machine": "2019-11-03"
  },
  {
    "human": "26 apr 2012",
    "machine": "2012-04-26"
  },
  {
    "human": "nov 23 2001",
    "machine": "2001-11-23"
  },
  {
    "human": "11.12.2003",
    "machine": "2003-12-11"
  },
  {
    "human": "february 09, 1984",
    "machine": "1984-02-09"
  },
  {
    "human": "5/22/74",
    "machine": "1974-05-22"
  },
  {
    "human": "16/11/2005",
    "machine": "2005-11-16"
  },
  {
    "human": "04.09.2018",
    "machine": "2018-09-04"
  },
  {
    "human": "23.04.1977",
    "machine": "1977-04-23"
  },
  {
    "human": "apr 28, 18",
    "machine": "2018-04-28"
  },
  {
    "human": "15, jan 1974",
    "machine": "1974-01-15"
  },
  {
    "human": "may 16, 85",
    "machine": "1985-05-16"
  },
  {
    "human": "1997-11-12",
    "machine": "1997-11-12"
  },
  {
    "human": "31 january 1980",
    "machine": "1980-01-31"
  },
  {
    "human": "oct 5 2005",
    "machine": "2005-10-05"
  },
  {
    "human": "2014/03/08",
    "machine": "2014-03-08"
  },
  {
    "human": "july 9, 2020",
    "machine": "2020-07-09"
  },
  {
    "human": "17 july 2001",
    "machine": "2001-07-17"
  },
  {
    "human": "1988-03-23",
    "machine": "1988-03-23"
  },
  {
    "human": "monday, january 18, 1999",
    "machine": "1999-01-18"
  },
  {
    "human": "5/3/07",
    "machine": "2007-05-03"
  },
  {
    "human": "dec 13, 75",
    "machine": "1975-12-13"
  },
  {
    "human": "mar 30, 97",
    "machine": "1997-03-30"
  },
  {
    "human": "may 18 2019",
    "machine": "2019-05-18"
  },
  {
    "human": "jan 12, 95",
    "machine": "1995-01-12"
  },
  {
    "human": "26 may 1994",
    "machine": "1994-05-26"
  },
  {
    "human": "31-oct-2017",
    "machine": "2017-10-31"
  },
  {
    "human": "31, oct 1977",
    "machine": "1977-10-31"
  },
  {
    "human": "1974-04-20",
    "machine": "1974-04-20"
  },
  {
    "human": "19.1.04",
    "machine": "2004-01-19"
  },
  {
    "human": "10.8.15",
    "machine": "2015-08-10"
  },
  {
    "human": "tuesday, august 16, 2022",
    "machine": "2022-08-16"
  },
  {
    "human": "10/05/1970",
    "machine": "1970-05-10"
  },
  {
    "human": "27 september 2000",
    "machine": "2000-09-27"
  },
  {
    "human": "12 may, 1986",
    "machine": "1986-05-12"
  },
  {
    "human": "1979-11-25",
    "machine": "1979-11-25"
  },
  {
    "human": "02/16/1972",
    "machine": "1972-02-16"
  },
  {
    "human": "10/1/95",
    "machine": "1995-10-01"
  },
  {
    "human": "april 12, 2013",
    "machine": "2013-04-12"
  },
  {
    "human": "12/17/1970",
    "machine": "1970-12-17"
  },
  {
    "human": "wednesday, april 9, 1997",
    "machine": "1997-04-09"
  },
  {
    "human": "1 april 1991",
    "machine": "1991-04-01"
  },
  {
    "human": "apr 24, 88",
    "machine": "1988-04-24"
  },
  {
    "human": "12.06.1994",
    "machine": "1994-06-12"
  },
  {
    "human": "2019.07.04 ad",
    "machine": "2019-07-04"
  },
  {
    "human": "1999/05/04",
    "machine": "1999-05-04"
  },
  {
    "human": "1992.03.21 ad",
    "machine": "1992-03-21"
  },
  {
    "human": "11/4/17",
    "machine": "2017-11-04"
  },
  {
    "human": "6/11/21",
    "machine": "2021-06-11"
  },
  {
    "human": "aug 16 1980",
    "machine": "1980-08-16"
  },
  {
    "human": "2019.12.08 ad",
    "machine": "2019-12-08"
  },
  {
    "human": "1978/08/25",
    "machine": "1978-08-25"
  },
  {
    "human": "21, jun 1990",
    "machine": "1990-06-21"
  },
  {
    "human": "wed, may 13, 09",
    "machine": "2009-05-13"
  },
  {
    "human": "29 may, 1970",
    "machine": "1970-05-29"
  },
  {
    "human": "jul 30, 86",
    "machine": "1986-07-30"
  },
  {
    "human": "26, may 1977",
    "machine": "1977-05-26"
  },
  {
    "human": "05.07.2023",
    "machine": "2023-07-05"
  },
  {
    "human": "17.12.2003",
    "machine": "2003-12-17"
  },
  {
    "human": "dec 11, 2004",
    "machine": "2004-12-11"
  },
  {
    "human": "10/4/82",
    "machine": "1982-10-04"
  },
  {
    "human": "01-13-79",
    "machine": "1979-01-13"
  },
  {
    "human": "1/01/2022",
    "machine": "2022-01-01"
  },
  {
    "human": "8/26/82",
    "machine": "1982-08-26"
  },
  {
    "human": "aug 14, 1999",
    "machine": "1999-08-14"
  },
  {
    "human": "12/29/81",
    "machine": "1981-12-29"
  },
  {
    "human": "23-10-16",
    "machine": "2023-10-16"
  },
  {
    "human": "21.06.1976",
    "machine": "1976-06-21"
  },
  {
    "human": "21 jul, 1979",
    "machine": "1979-07-21"
  },
  {
    "human": "aug 16 2013",
    "machine": "2013-08-16"
  },
  {
    "human": "friday, august 7, 1970",
    "machine": "1970-08-07"
  },
  {
    "human": "october 8, 2005",
    "machine": "2005-10-08"
  },
  {
    "human": "03.06.7",
    "machine": "2003-06-07"
  },
  {
    "human": "dec 6, 15",
    "machine": "2015-12-06"
  },
  {
    "human": "2024-09-6",
    "machine": "2024-09-06"
  },
  {
    "human": "74-11-23",
    "machine": "1974-11-23"
  },
  {
    "human": "sun, feb 15, 09",
    "machine": "2009-02-15"
  },
  {
    "human": "11 april 2022",
    "machine": "2022-04-11"
  },
  {
    "human": "1978.01.09 ad",
    "machine": "1978-01-09"
  },
  {
    "human": "sep 17 1975",
    "machine": "1975-09-17"
  },
  {
    "human": "sunday, november 14, 2004",
    "machine": "2004-11-14"
  },
  {
    "human": "mar 8 1984",
    "machine": "1984-03-08"
  },
  {
    "human": "26 january 2021",
    "machine": "2021-01-26"
  },
  {
    "human": "oct 10 2008",
    "machine": "2008-10-10"
  },
  {
    "human": "22 jan, 1972",
    "machine": "1972-01-22"
  },
  {
    "human": "13 june 1993",
    "machine": "1993-06-13"
  },
  {
    "human": "friday, december 19, 2003",
    "machine": "2003-12-19"
  },
  {
    "human": "wednesday, june 27, 1990",
    "machine": "1990-06-27"
  },
  {
    "human": "apr 23, 75",
    "machine": "1975-04-23"
  },
  {
    "human": "29 june 2018",
    "machine": "2018-06-29"
  },
  {
    "human": "19, nov 1991",
    "machine": "1991-11-19"
  },
  {
    "human": "11.05.1976",
    "machine": "1976-05-11"
  },
  {
    "human": "oct 30, 2010",
    "machine": "2010-10-30"
  },
  {
    "human": "12/20/1993",
    "machine": "1993-12-20"
  },
  {
    "human": "2010/09/07",
    "machine": "2010-09-07"
  },
  {
    "human": "4/17/97",
    "machine": "1997-04-17"
  },
  {
    "human": "9.4.17",
    "machine": "2017-04-09"
  },
  {
    "human": "07.10.1989",
    "machine": "1989-10-07"
  },
  {
    "human": "2021.08.11 ad",
    "machine": "2021-08-11"
  },
  {
    "human": "november 10, 2003",
    "machine": "2003-11-10"
  },
  {
    "human": "04 august 2004",
    "machine": "2004-08-04"
  },
  {
    "human": "9/16/17",
    "machine": "2017-09-16"
  },
  {
    "human": "02-06-76",
    "machine": "1976-02-06"
  },
  {
    "human": "2013.03.01 ad",
    "machine": "2013-03-01"
  },
  {
    "human": "january 21, 1973",
    "machine": "1973-01-21"
  },
  {
    "human": "84.05.1",
    "machine": "1984-05-01"
  },
  {
    "human": "11-03-70",
    "machine": "1970-11-03"
  },
  {
    "human": "19 may 1994",
    "machine": "1994-05-19"
  },
  {
    "human": "jul 1, 72",
    "machine": "1972-07-01"
  },
  {
    "human": "wed, oct 15, 14",
    "machine": "2014-10-15"
  },
  {
    "human": "2020-03-06",
    "machine": "2020-03-06"
  },
  {
    "human": "8/18/83",
    "machine": "1983-08-18"
  },
  {
    "human": "29, dec 1991",
    "machine": "1991-12-29"
  },
  {
    "human": "monday, june 3, 1996",
    "machine": "1996-06-03"
  },
  {
    "human": "january 11, 1981",
    "machine": "1981-01-11"
  },
  {
    "human": "20 january 2018",
    "machine": "2018-01-20"
  },
  {
    "human": "march 15, 2004",
    "machine": "2004-03-15"
  },
  {
    "human": "2018-08-23",
    "machine": "2018-08-23"
  },
  {
    "human": "80.06.28",
    "machine": "1980-06-28"
  },
  {
    "human": "1988-09-12",
    "machine": "1988-09-12"
  },
  {
    "human": "fri, sep 21, 18",
    "machine": "2018-09-21"
  },
  {
    "human": "1992-06-15",
    "machine": "1992-06-15"
  },
  {
    "human": "july 2, 1976",
    "machine": "1976-07-02"
  },
  {
    "human": "5/7/17",
    "machine": "2017-05-07"
  },
  {
    "human": "thursday, february 8, 2018",
    "machine": "2018-02-08"
  },
  {
    "human": "21.09.1979",
    "machine": "1979-09-21"
  },
  {
    "human": "3 june 2021",
    "machine": "2021-06-03"
  },
  {
    "human": "1996-12-01",
    "machine": "1996-12-01"
  },
  {
    "human": "1981/02/07",
    "machine": "1981-02-07"
  },
  {
    "human": "march 12, 1976",
    "machine": "1976-03-12"
  },
  {
    "human": "jan 14 2017",
    "machine": "2017-01-14"
  },
  {
    "human": "29-oct-2009",
    "machine": "2009-10-29"
  },
  {
    "human": "14, jan 1992",
    "machine": "1992-01-14"
  },
  {
    "human": "1975-06-08",
    "machine": "1975-06-08"
  },
  {
    "human": "09-24-95",
    "machine": "1995-09-24"
  },
  {
    "human": "8/10/2002",
    "machine": "2002-10-08"
  },
  {
    "human": "7 november 2013",
    "machine": "2013-11-07"
  },
  {
    "human": "1986.03.08 ad",
    "machine": "1986-03-08"
  },
  {
    "human": "august 1, 2003",
    "machine": "2003-08-01"
  },
  {
    "human": "jun 17, 05",
    "machine": "2005-06-17"
  },
  {
    "human": "13 february 2006",
    "machine": "2006-02-13"
  },
  {
    "human": "march 03, 1997",
    "machine": "1997-03-03"
  },
  {
    "human": "71.05.11",
    "machine": "1971-05-11"
  },
  {
    "human": "78-06-29",
    "machine": "1978-06-29"
  },
  {
    "human": "1980/09/11",
    "machine": "1980-09-11"
  },
  {
    "human": "6/05/1982",
    "machine": "1982-05-06"
  },
  {
    "human": "may 31, 1991",
    "machine": "1991-05-31"
  },
  {
    "human": "may 29 2000",
    "machine": "2000-05-29"
  },
  {
    "human": "may 24 1980",
    "machine": "1980-05-24"
  },
  {
    "human": "march 21, 2013",
    "machine": "2013-03-21"
  },
  {
    "human": "1984/07/10",
    "machine": "1984-07-10"
  },
  {
    "human": "21, may 1997",
    "machine": "1997-05-21"
  },
  {
    "human": "7/12/2022",
    "machine": "2022-12-07"
  },
  {
    "human": "feb 15, 00",
    "machine": "2000-02-15"
  },
  {
    "human": "8/21/06",
    "machine": "2006-08-21"
  },
  {
    "human": "jun 4 2000",
    "machine": "2000-06-04"
  },
  {
    "human": "january 7, 1987",
    "machine": "1987-01-07"
  },
  {
    "human": "mon, dec 6, 10",
    "machine": "2010-12-06"
  },
  {
    "human": "21.02.2014",
    "machine": "2014-02-21"
  },
  {
    "human": "8/08/1996",
    "machine": "1996-08-08"
  },
  {
    "human": "5 apr, 1990",
    "machine": "1990-04-05"
  },
  {
    "human": "10/31/2003",
    "machine": "2003-10-31"
  },
  {
    "human": "march 29, 1974",
    "machine": "1974-03-29"
  },
  {
    "human": "saturday, may 23, 1992",
    "machine": "1992-05-23"
  },
  {
    "human": "november 11, 1978",
    "machine": "1978-11-11"
  },
  {
    "human": "tuesday, november 21, 2000",
    "machine": "2000-11-21"
  },
  {
    "human": "feb 5, 90",
    "machine": "1990-02-05"
  },
  {
    "human": "10/26/11",
    "machine": "2011-10-26"
  },
  {
    "human": "88.08.19",
    "machine": "1988-08-19"
  },
  {
    "human": "oct 14 1980",
    "machine": "1980-10-14"
  },
  {
    "human": "2024/10/24",
    "machine": "2024-10-24"
  },
  {
    "human": "09, sep 2019",
    "machine": "2019-09-09"
  },
  {
    "human": "1990-11-22",
    "machine": "1990-11-22"
  },
  {
    "human": "22/02/1979",
    "machine": "1979-02-22"
  },
  {
    "human": "wed, nov 19, 14",
    "machine": "2014-11-19"
  },
  {
    "human": "sep 25, 84",
    "machine": "1984-09-25"
  },
  {
    "human": "30 june 1998",
    "machine": "1998-06-30"
  },
  {
    "human": "sep 23 1982",
    "machine": "1982-09-23"
  },
  {
    "human": "15 mar, 2024",
    "machine": "2024-03-15"
  },
  {
    "human": "2018.05.03 ad",
    "machine": "2018-05-03"
  },
  {
    "human": "12-08-20",
    "machine": "2020-12-08"
  },
  {
    "human": "2022-11-13",
    "machine": "2022-11-13"
  },
  {
    "human": "07 june 1994",
    "machine": "1994-06-07"
  },
  {
    "human": "1987-01-09",
    "machine": "1987-01-09"
  },
  {
    "human": "dec 7 2014",
    "machine": "2014-12-07"
  },
  {
    "human": "25-05-02",
    "machine": "2025-05-02"
  },
  {
    "human": "1971/01/08",
    "machine": "1971-01-08"
  },
  {
    "human": "78-09-30",
    "machine": "1978-09-30"
  },
  {
    "human": "jul 19, 96",
    "machine": "1996-07-19"
  },
  {
    "human": "08-26-93",
    "machine": "1993-08-26"
  },
  {
    "human": "2001.12.22 ad",
    "machine": "2001-12-22"
  },
  {
    "human": "25 january 2007",
    "machine": "2007-01-25"
  },
  {
    "human": "1998.02.17 ad",
    "machine": "1998-02-17"
  },
  {
    "human": "29 mar, 1993",
    "machine": "1993-03-29"
  },
  {
    "human": "saturday, september 19, 1970",
    "machine": "1970-09-19"
  },
  {
    "human": "november 12, 2014",
    "machine": "2014-11-12"
  },
  {
    "human": "tuesday, january 27, 1970",
    "machine": "1970-01-27"
  },
  {
    "human": "tuesday, november 24, 1987",
    "machine": "1987-11-24"
  },
  {
    "human": "89.02.26",
    "machine": "1989-02-26"
  },
  {
    "human": "5/23/10",
    "machine": "2010-05-23"
  },
  {
    "human": "june 2, 1981",
    "machine": "1981-06-02"
  },
  {
    "human": "1985-10-17",
    "machine": "1985-10-17"
  },
  {
    "human": "15.01.1987",
    "machine": "1987-01-15"
  },
  {
    "human": "october 19, 1976",
    "machine": "1976-10-19"
  },
  {
    "human": "01-01-90",
    "machine": "1990-01-01"
  },
  {
    "human": "2015.09.28 ad",
    "machine": "2015-09-28"
  },
  {
    "human": "24 dec, 2020",
    "machine": "2020-12-24"
  },
  {
    "human": "february 11, 1975",
    "machine": "1975-02-11"
  },
  {
    "human": "3/20/91",
    "machine": "1991-03-20"
  },
  {
    "human": "30 august 2002",
    "machine": "2002-08-30"
  },
  {
    "human": "7/2/79",
    "machine": "1979-07-02"
  },
  {
    "human": "20, jan 1985",
    "machine": "1985-01-20"
  },
  {
    "human": "10/31/04",
    "machine": "2004-10-31"
  },
  {
    "human": "1/8/76",
    "machine": "1976-01-08"
  },
  {
    "human": "2020-03-10",
    "machine": "2020-03-10"
  },
  {
    "human": "10/10/2002",
    "machine": "2002-10-10"
  },
  {
    "human": "3 june 2010",
    "machine": "2010-06-03"
  },
  {
    "human": "tue, oct 13, 15",
    "machine": "2015-10-13"
  },
  {
    "human": "06.05.26",
    "machine": "2006-05-26"
  },
  {
    "human": "mar 16, 1979",
    "machine": "1979-03-16"
  },
  {
    "human": "26 may, 1989",
    "machine": "1989-05-26"
  },
  {
    "human": "07, dec 1974",
    "machine": "1974-12-07"
  },
  {
    "human": "27.05.2025",
    "machine": "2025-05-27"
  },
  {
    "human": "26, oct 1996",
    "machine": "1996-10-26"
  },
  {
    "human": "1976/03/18",
    "machine": "1976-03-18"
  },
  {
    "human": "april 4, 2012",
    "machine": "2012-04-04"
  },
  {
    "human": "5 june 2017",
    "machine": "2017-06-05"
  },
  {
    "human": "03-05-98",
    "machine": "1998-03-05"
  },
  {
    "human": "1987.06.25 ad",
    "machine": "1987-06-25"
  },
  {
    "human": "7/9/14",
    "machine": "2014-07-09"
  },
  {
    "human": "09-13-21",
    "machine": "2021-09-13"
  },
  {
    "human": "tuesday, september 11, 1973",
    "machine": "1973-09-11"
  },
  {
    "human": "96-02-10",
    "machine": "1996-02-10"
  },
  {
    "human": "friday, may 30, 1986",
    "machine": "1986-05-30"
  },
  {
    "human": "23-oct-1980",
    "machine": "1980-10-23"
  },
  {
    "human": "15 october 1973",
    "machine": "1973-10-15"
  },
  {
    "human": "70.01.22",
    "machine": "1970-01-22"
  },
  {
    "human": "jan 11, 2024",
    "machine": "2024-01-11"
  },
  {
    "human": "7/11/89",
    "machine": "1989-07-11"
  },
  {
    "human": "saturday, february 3, 2001",
    "machine": "2001-02-03"
  },
  {
    "human": "5/28/80",
    "machine": "1980-05-28"
  },
  {
    "human": "30.03.1995",
    "machine": "1995-03-30"
  },
  {
    "human": "92.06.22",
    "machine": "1992-06-22"
  },
  {
    "human": "mar 29 1975",
    "machine": "1975-03-29"
  },
  {
    "human": "wednesday, april 24, 2002",
    "machine": "2002-04-24"
  },
  {
    "human": "august 03, 1973",
    "machine": "1973-08-03"
  },
  {
    "human": "12.10.92",
    "machine": "1992-10-12"
  },
  {
    "human": "apr 19 1982",
    "machine": "1982-04-19"
  },
  {
    "human": "8/14/22",
    "machine": "2022-08-14"
  },
  {
    "human": "november 29, 1986",
    "machine": "1986-11-29"
  },
  {
    "human": "2002.01.21 ad",
    "machine": "2002-01-21"
  },
  {
    "human": "06-10-25",
    "machine": "2006-10-25"
  },
  {
    "human": "13, may 1990",
    "machine": "1990-05-13"
  },
  {
    "human": "15, feb 2018",
    "machine": "2018-02-15"
  },
  {
    "human": "10/06/1987",
    "machine": "1987-10-06"
  },
  {
    "human": "wed, sep 11, 74",
    "machine": "1974-09-11"
  },
  {
    "human": "12/10/2022",
    "machine": "2022-12-10"
  },
  {
    "human": "9 feb, 2024",
    "machine": "2024-02-09"
  },
  {
    "human": "19 march 1976",
    "machine": "1976-03-19"
  },
  {
    "human": "1972/12/19",
    "machine": "1972-12-19"
  },
  {
    "human": "18 may 1975",
    "machine": "1975-05-18"
  },
  {
    "human": "23.3.08",
    "machine": "2008-03-23"
  },
  {
    "human": "04-06-23",
    "machine": "2004-06-23"
  },
  {
    "human": "1971.09.27 ad",
    "machine": "1971-09-27"
  },
  {
    "human": "1970-06-18",
    "machine": "1970-06-18"
  },
  {
    "human": "august 26, 2001",
    "machine": "2001-08-26"
  },
  {
    "human": "13, jul 2012",
    "machine": "2012-07-13"
  },
  {
    "human": "1994-09-8",
    "machine": "1994-09-08"
  },
  {
    "human": "saturday, july 31, 2004",
    "machine": "2004-07-31"
  },
  {
    "human": "18, nov 1981",
    "machine": "1981-11-18"
  },
  {
    "human": "1986/12/25",
    "machine": "1986-12-25"
  },
  {
    "human": "3/6/71",
    "machine": "1971-03-06"
  },
  {
    "human": "august 6, 2002",
    "machine": "2002-08-06"
  },
  {
    "human": "8/07/1972",
    "machine": "1972-07-08"
  },
  {
    "human": "6.6.90",
    "machine": "1990-06-06"
  },
  {
    "human": "aug 16 2005",
    "machine": "2005-08-16"
  },
  {
    "human": "8-may-2003",
    "machine": "2003-05-08"
  },
  {
    "human": "oct 13, 2002",
    "machine": "2002-10-13"
  },
  {
    "human": "january 15, 1997",
    "machine": "1997-01-15"
  },
  {
    "human": "28 march 2024",
    "machine": "2024-03-28"
  },
  {
    "human": "03/26/1985",
    "machine": "1985-03-26"
  },
  {
    "human": "monday, february 1, 1999",
    "machine": "1999-02-01"
  },
  {
    "human": "10, oct 1973",
    "machine": "1973-10-10"
  },
  {
    "human": "1989/08/10",
    "machine": "1989-08-10"
  },
  {
    "human": "24 aug 2009",
    "machine": "2009-08-24"
  },
  {
    "human": "15-jun-2008",
    "machine": "2008-06-15"
  },
  {
    "human": "january 31, 1981",
    "machine": "1981-01-31"
  },
  {
    "human": "8/12/1980",
    "machine": "1980-12-08"
  },
  {
    "human": "3/9/09",
    "machine": "2009-03-09"
  },
  {
    "human": "dec 11 2022",
    "machine": "2022-12-11"
  },
  {
    "human": "january 4, 2023",
    "machine": "2023-01-04"
  },
  {
    "human": "07/18/1974",
    "machine": "1974-07-18"
  },
  {
    "human": "monday, may 18, 1987",
    "machine": "1987-05-18"
  },
  {
    "human": "09/18/1991",
    "machine": "1991-09-18"
  },
  {
    "human": "2024.03.24 ad",
    "machine": "2024-03-24"
  },
  {
    "human": "1994-04-3",
    "machine": "1994-04-03"
  },
  {
    "human": "11/24/1974",
    "machine": "1974-11-24"
  },
  {
    "human": "22 oct, 1986",
    "machine": "1986-10-22"
  },
  {
    "human": "jan 15, 21",
    "machine": "2021-01-15"
  },
  {
    "human": "21.6.04",
    "machine": "2004-06-21"
  },
  {
    "human": "aug 5, 89",
    "machine": "1989-08-05"
  },
  {
    "human": "oct 22 1993",
    "machine": "1993-10-22"
  },
  {
    "human": "1980.09.06 ad",
    "machine": "1980-09-06"
  },
  {
    "human": "26 august 1982",
    "machine": "1982-08-26"
  },
  {
    "human": "jan 26 1973",
    "machine": "1973-01-26"
  },
  {
    "human": "82.05.16",
    "machine": "1982-05-16"
  },
  {
    "human": "jan 27, 2004",
    "machine": "2004-01-27"
  },
  {
    "human": "2 jul, 2005",
    "machine": "2005-07-02"
  },
  {
    "human": "14.5.77",
    "machine": "1977-05-14"
  },
  {
    "human": "jan 6, 94",
    "machine": "1994-01-06"
  },
  {
    "human": "thursday, may 4, 2017",
    "machine": "2017-05-04"
  },
  {
    "human": "jun 26, 79",
    "machine": "1979-06-26"
  },
  {
    "human": "23-sep-1997",
    "machine": "1997-09-23"
  },
  {
    "human": "04/02/1972",
    "machine": "1972-04-02"
  },
  {
    "human": "february 09, 2008",
    "machine": "2008-02-09"
  },
  {
    "human": "1994/11/11",
    "machine": "1994-11-11"
  },
  {
    "human": "08/25/2013",
    "machine": "2013-08-25"
  },
  {
    "human": "18.07.2009",
    "machine": "2009-07-18"
  },
  {
    "human": "1982.02.16 ad",
    "machine": "1982-02-16"
  },
  {
    "human": "12-21-79",
    "machine": "1979-12-21"
  },
  {
    "human": "november 22, 1982",
    "machine": "1982-11-22"
  },
  {
    "human": "may 15, 2014",
    "machine": "2014-05-15"
  },
  {
    "human": "feb 25, 93",
    "machine": "1993-02-25"
  },
  {
    "human": "thursday, march 6, 2008",
    "machine": "2008-03-06"
  },
  {
    "human": "08 june 1977",
    "machine": "1977-06-08"
  },
  {
    "human": "13-jan-2013",
    "machine": "2013-01-13"
  },
  {
    "human": "84.08.12",
    "machine": "1984-08-12"
  },
  {
    "human": "8/6/24",
    "machine": "2024-08-06"
  },
  {
    "human": "november 19, 1976",
    "machine": "1976-11-19"
  },
  {
    "human": "04-05-17",
    "machine": "2017-04-05"
  },
  {
    "human": "18.06.12",
    "machine": "2018-06-12"
  },
  {
    "human": "2013-10-05",
    "machine": "2013-10-05"
  },
  {
    "human": "may 1, 1980",
    "machine": "1980-05-01"
  },
  {
    "human": "08/21/1980",
    "machine": "1980-08-21"
  },
  {
    "human": "4.12.13",
    "machine": "2013-12-04"
  },
  {
    "human": "january 17, 1974",
    "machine": "1974-01-17"
  },
  {
    "human": "february 13, 2010",
    "machine": "2010-02-13"
  },
  {
    "human": "05-24-70",
    "machine": "1970-05-24"
  },
  {
    "human": "2018-05-18",
    "machine": "2018-05-18"
  },
  {
    "human": "wednesday, october 23, 2002",
    "machine": "2002-10-23"
  },
  {
    "human": "11/22/10",
    "machine": "2010-11-22"
  },
  {
    "human": "16 oct 2020",
    "machine": "2020-10-16"
  },
  {
    "human": "07.06.1984",
    "machine": "1984-06-07"
  },
  {
    "human": "84.01.19",
    "machine": "1984-01-19"
  },
  {
    "human": "9-may-2022",
    "machine": "2022-05-09"
  },
  {
    "human": "july 16, 2015",
    "machine": "2015-07-16"
  },
  {
    "human": "may 1, 1975",
    "machine": "1975-05-01"
  },
  {
    "human": "6/9/92",
    "machine": "1992-06-09"
  },
  {
    "human": "85.04.12",
    "machine": "1985-04-12"
  },
  {
    "human": "24 feb, 2012",
    "machine": "2012-02-24"
  },
  {
    "human": "april 7, 2015",
    "machine": "2015-04-07"
  },
  {
    "human": "11, jul 2012",
    "machine": "2012-07-11"
  },
  {
    "human": "2011.01.12 ad",
    "machine": "2011-01-12"
  },
  {
    "human": "07-12-08",
    "machine": "2007-12-08"
  },
  {
    "human": "20/11/2021",
    "machine": "2021-11-20"
  },
  {
    "human": "94.06.10",
    "machine": "1994-06-10"
  },
  {
    "human": "10 nov, 1977",
    "machine": "1977-11-10"
  },
  {
    "human": "8 november 1987",
    "machine": "1987-11-08"
  },
  {
    "human": "31 aug, 2013",
    "machine": "2013-08-31"
  },
  {
    "human": "1/18/17",
    "machine": "2017-01-18"
  },
  {
    "human": "june 03, 2000",
    "machine": "2000-06-03"
  },
  {
    "human": "february 26, 2007",
    "machine": "2007-02-26"
  },
  {
    "human": "february 24, 2011",
    "machine": "2011-02-24"
  },
  {
    "human": "04/19/2022",
    "machine": "2022-04-19"
  },
  {
    "human": "1982/05/21",
    "machine": "1982-05-21"
  },
  {
    "human": "96-05-25",
    "machine": "1996-05-25"
  },
  {
    "human": "november 17, 1988",
    "machine": "1988-11-17"
  },
  {
    "human": "jan 8 1995",
    "machine": "1995-01-08"
  },
  {
    "human": "1978-03-30",
    "machine": "1978-03-30"
  },
  {
    "human": "11/05/2005",
    "machine": "2005-05-11"
  },
  {
    "human": "17 jun 2001",
    "machine": "2001-06-17"
  },
  {
    "human": "14-04-26",
    "machine": "2014-04-26"
  },
  {
    "human": "1995-03-17",
    "machine": "1995-03-17"
  },
  {
    "human": "08-20-19",
    "machine": "2019-08-20"
  },
  {
    "human": "25-11-20",
    "machine": "2025-11-20"
  },
  {
    "human": "may 19, 1990",
    "machine": "1990-05-19"
  },
  {
    "human": "23/08/1988",
    "machine": "1988-08-23"
  },
  {
    "human": "25-jun-1995",
    "machine": "1995-06-25"
  },
  {
    "human": "23/06/2019",
    "machine": "2019-06-23"
  },
  {
    "human": "sunday, february 28, 1988",
    "machine": "1988-02-28"
  },
  {
    "human": "78.09.9",
    "machine": "1978-09-09"
  },
  {
    "human": "december 13, 1972",
    "machine": "1972-12-13"
  },
  {
    "human": "july 01, 2015",
    "machine": "2015-07-01"
  },
  {
    "human": "2004-11-17",
    "machine": "2004-11-17"
  },
  {
    "human": "nov 13 1971",
    "machine": "1971-11-13"
  },
  {
    "human": "06-03-09",
    "machine": "2009-06-03"
  },
  {
    "human": "17, may 2007",
    "machine": "2007-05-17"
  },
  {
    "human": "03.11.1983",
    "machine": "1983-11-03"
  },
  {
    "human": "wednesday, august 11, 1976",
    "machine": "1976-08-11"
  },
  {
    "human": "23 march 1991",
    "machine": "1991-03-23"
  },
  {
    "human": "03-17-14",
    "machine": "2014-03-17"
  },
  {
    "human": "2016-10-7",
    "machine": "2016-10-07"
  },
  {
    "human": "1979-04-19",
    "machine": "1979-04-19"
  },
  {
    "human": "september 19, 2005",
    "machine": "2005-09-19"
  },
  {
    "human": "1987/08/01",
    "machine": "1987-08-01"
  },
  {
    "human": "june 28, 1979",
    "machine": "1979-06-28"
  },
  {
    "human": "12-21-94",
    "machine": "1994-12-21"
  },
  {
    "human": "15, feb 2010",
    "machine": "2010-02-15"
  },
  {
    "human": "24, jul 1972",
    "machine": "1972-07-24"
  },
  {
    "human": "05.12.6",
    "machine": "2005-12-06"
  },
  {
    "human": "21/04/2017",
    "machine": "2017-04-21"
  },
  {
    "human": "2017-01-17",
    "machine": "2017-01-17"
  },
  {
    "human": "90.08.9",
    "machine": "1990-08-09"
  },
  {
    "human": "april 4, 2011",
    "machine": "2011-04-04"
  },
  {
    "human": "22 july 2021",
    "machine": "2021-07-22"
  },
  {
    "human": "15/09/1970",
    "machine": "1970-09-15"
  },
  {
    "human": "sunday, july 19, 1992",
    "machine": "1992-07-19"
  },
  {
    "human": "sunday, february 20, 1977",
    "machine": "1977-02-20"
  },
  {
    "human": "thu, apr 12, 73",
    "machine": "1973-04-12"
  },
  {
    "human": "monday, december 24, 2007",
    "machine": "2007-12-24"
  },
  {
    "human": "7 feb 2000",
    "machine": "2000-02-07"
  },
  {
    "human": "11-10-20",
    "machine": "2020-11-10"
  },
  {
    "human": "1991.04.16 ad",
    "machine": "1991-04-16"
  },
  {
    "human": "17.09.1994",
    "machine": "1994-09-17"
  },
  {
    "human": "apr 1, 2010",
    "machine": "2010-04-01"
  },
  {
    "human": "11-oct-2002",
    "machine": "2002-10-11"
  },
  {
    "human": "august 13, 1988",
    "machine": "1988-08-13"
  },
  {
    "human": "1985/05/23",
    "machine": "1985-05-23"
  },
  {
    "human": "march 12, 2013",
    "machine": "2013-03-12"
  },
  {
    "human": "7/12/75",
    "machine": "1975-07-12"
  },
  {
    "human": "11.6.21",
    "machine": "2021-06-11"
  },
  {
    "human": "1978-07-18",
    "machine": "1978-07-18"
  },
  {
    "human": "8 oct 2016",
    "machine": "2016-10-08"
  },
  {
    "human": "april 10, 2017",
    "machine": "2017-04-10"
  },
  {
    "human": "27.4.74",
    "machine": "1974-04-27"
  },
  {
    "human": "sat, sep 26, 20",
    "machine": "2020-09-26"
  },
  {
    "human": "28 november 1987",
    "machine": "1987-11-28"
  },
  {
    "human": "08-10-04",
    "machine": "2008-10-04"
  },
  {
    "human": "1992.05.20 ad",
    "machine": "1992-05-20"
  },
  {
    "human": "2008-06-8",
    "machine": "2008-06-08"
  },
  {
    "human": "5/20/07",
    "machine": "2007-05-20"
  },
  {
    "human": "13 february 2019",
    "machine": "2019-02-13"
  },
  {
    "human": "january 9, 2025",
    "machine": "2025-01-09"
  },
  {
    "human": "18-dec-1984",
    "machine": "1984-12-18"
  },
  {
    "human": "17 september 2009",
    "machine": "2009-09-17"
  },
  {
    "human": "1990-09-08",
    "machine": "1990-09-08"
  },
  {
    "human": "wednesday, march 23, 1988",
    "machine": "1988-03-23"
  },
  {
    "human": "1989-08-03",
    "machine": "1989-08-03"
  },
  {
    "human": "2002-06-29",
    "machine": "2002-06-29"
  },
  {
    "human": "2014.07.10 ad",
    "machine": "2014-07-10"
  },
  {
    "human": "13, apr 1973",
    "machine": "1973-04-13"
  },
  {
    "human": "feb 10 2016",
    "machine": "2016-02-10"
  },
  {
    "human": "may 15, 1988",
    "machine": "1988-05-15"
  },
  {
    "human": "wed, may 25, 88",
    "machine": "1988-05-25"
  },
  {
    "human": "tuesday, may 24, 2022",
    "machine": "2022-05-24"
  },
  {
    "human": "4 feb, 1973",
    "machine": "1973-02-04"
  },
  {
    "human": "august 15, 1985",
    "machine": "1985-08-15"
  },
  {
    "human": "2023.01.09 ad",
    "machine": "2023-01-09"
  },
  {
    "human": "tue, mar 22, 22",
    "machine": "2022-03-22"
  },
  {
    "human": "1979/02/24",
    "machine": "1979-02-24"
  },
  {
    "human": "26/11/2008",
    "machine": "2008-11-26"
  },
  {
    "human": "05/15/1986",
    "machine": "1986-05-15"
  },
  {
    "human": "20 nov, 1988",
    "machine": "1988-11-20"
  },
  {
    "human": "apr 23 2015",
    "machine": "2015-04-23"
  },
  {
    "human": "10-11-79",
    "machine": "1979-10-11"
  },
  {
    "human": "1972-11-4",
    "machine": "1972-11-04"
  },
  {
    "human": "13 december 2003",
    "machine": "2003-12-13"
  },
  {
    "human": "09, mar 2013",
    "machine": "2013-03-09"
  },
  {
    "human": "25 mar 2003",
    "machine": "2003-03-25"
  },
  {
    "human": "1988-08-25",
    "machine": "1988-08-25"
  },
  {
    "human": "2019-09-27",
    "machine": "2019-09-27"
  },
  {
    "human": "12-02-25",
    "machine": "2012-02-25"
  },
  {
    "human": "10/27/2019",
    "machine": "2019-10-27"
  },
  {
    "human": "71.09.12",
    "machine": "1971-09-12"
  },
  {
    "human": "02.04.2011",
    "machine": "2011-04-02"
  },
  {
    "human": "10 nov, 1996",
    "machine": "1996-11-10"
  },
  {
    "human": "15 november 2023",
    "machine": "2023-11-15"
  },
  {
    "human": "1971-06-24",
    "machine": "1971-06-24"
  },
  {
    "human": "august 12, 2002",
    "machine": "2002-08-12"
  },
  {
    "human": "04-19-82",
    "machine": "1982-04-19"
  },
  {
    "human": "2020-10-1",
    "machine": "2020-10-01"
  },
  {
    "human": "6 oct, 2024",
    "machine": "2024-10-06"
  },
  {
    "human": "thu, sep 12, 96",
    "machine": "1996-09-12"
  },
  {
    "human": "20.08.1981",
    "machine": "1981-08-20"
  },
  {
    "human": "2007/02/26",
    "machine": "2007-02-26"
  },
  {
    "human": "24-05-15",
    "machine": "2024-05-15"
  },
  {
    "human": "2017/01/08",
    "machine": "2017-01-08"
  },
  {
    "human": "mar 19, 87",
    "machine": "1987-03-19"
  },
  {
    "human": "thursday, may 25, 1989",
    "machine": "1989-05-25"
  },
  {
    "human": "14 june 1996",
    "machine": "1996-06-14"
  },
  {
    "human": "9/1/20",
    "machine": "2020-09-01"
  },
  {
    "human": "2012-04-03",
    "machine": "2012-04-03"
  },
  {
    "human": "2/8/21",
    "machine": "2021-02-08"
  },
  {
    "human": "23.11.73",
    "machine": "1973-11-23"
  },
  {
    "human": "9 jun, 1979",
    "machine": "1979-06-09"
  },
  {
    "human": "21-04-22",
    "machine": "2021-04-22"
  },
  {
    "human": "1986/03/30",
    "machine": "1986-03-30"
  },
  {
    "human": "jun 13, 75",
    "machine": "1975-06-13"
  },
  {
    "human": "2003-06-9",
    "machine": "2003-06-09"
  },
  {
    "human": "78-12-02",
    "machine": "1978-12-02"
  },
  {
    "human": "february 17, 1977",
    "machine": "1977-02-17"
  },
  {
    "human": "sat, oct 27, 07",
    "machine": "2007-10-27"
  },
  {
    "human": "jul 27 2008",
    "machine": "2008-07-27"
  },
  {
    "human": "21.06.1988",
    "machine": "1988-06-21"
  },
  {
    "human": "monday, august 13, 2001",
    "machine": "2001-08-13"
  },
  {
    "human": "1.10.70",
    "machine": "1970-10-01"
  },
  {
    "human": "12/11/2006",
    "machine": "2006-11-12"
  },
  {
    "human": "05-27-08",
    "machine": "2008-05-27"
  },
  {
    "human": "30, jan 2023",
    "machine": "2023-01-30"
  },
  {
    "human": "86.02.7",
    "machine": "1986-02-07"
  },
  {
    "human": "may 5 1973",
    "machine": "1973-05-05"
  },
  {
    "human": "19.12.1999",
    "machine": "1999-12-19"
  },
  {
    "human": "1989-10-28",
    "machine": "1989-10-28"
  },
  {
    "human": "may 29, 1981",
    "machine": "1981-05-29"
  },
  {
    "human": "19.06.2017",
    "machine": "2017-06-19"
  },
  {
    "human": "11/14/77",
    "machine": "1977-11-14"
  },
  {
    "human": "1975-08-28",
    "machine": "1975-08-28"
  },
  {
    "human": "27 march 2014",
    "machine": "2014-03-27"
  },
  {
    "human": "2010-05-4",
    "machine": "2010-05-04"
  },
  {
    "human": "18 september 1994",
    "machine": "1994-09-18"
  },
  {
    "human": "wednesday, july 9, 1997",
    "machine": "1997-07-09"
  },
  {
    "human": "16.12.14",
    "machine": "2016-12-14"
  },
  {
    "human": "4/30/77",
    "machine": "1977-04-30"
  },
  {
    "human": "12-25-97",
    "machine": "1997-12-25"
  },
  {
    "human": "23 january 1987",
    "machine": "1987-01-23"
  },
  {
    "human": "december 22, 1985",
    "machine": "1985-12-22"
  },
  {
    "human": "20 march 1974",
    "machine": "1974-03-20"
  },
  {
    "human": "fri, jul 12, 74",
    "machine": "1974-07-12"
  },
  {
    "human": "wed, jul 15, 87",
    "machine": "1987-07-15"
  },
  {
    "human": "2018.06.09 ad",
    "machine": "2018-06-09"
  },
  {
    "human": "1977.03.03 ad",
    "machine": "1977-03-03"
  },
  {
    "human": "dec 17 1991",
    "machine": "1991-12-17"
  },
  {
    "human": "09-09-25",
    "machine": "2009-09-25"
  },
  {
    "human": "26, apr 1992",
    "machine": "1992-04-26"
  },
  {
    "human": "28-feb-2010",
    "machine": "2010-02-28"
  },
  {
    "human": "1994-10-01",
    "machine": "1994-10-01"
  },
  {
    "human": "2016-12-28",
    "machine": "2016-12-28"
  },
  {
    "human": "apr 17, 1980",
    "machine": "1980-04-17"
  },
  {
    "human": "3/13/79",
    "machine": "1979-03-13"
  },
  {
    "human": "02 march 1972",
    "machine": "1972-03-02"
  },
  {
    "human": "1981-08-08",
    "machine": "1981-08-08"
  },
  {
    "human": "may 16, 2018",
    "machine": "2018-05-16"
  },
  {
    "human": "sun, may 10, 87",
    "machine": "1987-05-10"
  },
  {
    "human": "jun 7 2002",
    "machine": "2002-06-07"
  },
  {
    "human": "6/12/1971",
    "machine": "1971-12-06"
  },
  {
    "human": "november 19, 1989",
    "machine": "1989-11-19"
  },
  {
    "human": "jul 23, 76",
    "machine": "1976-07-23"
  },
  {
    "human": "february 23, 1985",
    "machine": "1985-02-23"
  },
  {
    "human": "saturday, april 24, 2010",
    "machine": "2010-04-24"
  },
  {
    "human": "1/2/20",
    "machine": "2020-01-02"
  },
  {
    "human": "1999-12-16",
    "machine": "1999-12-16"
  },
  {
    "human": "1979-07-31",
    "machine": "1979-07-31"
  },
  {
    "human": "oct 2, 81",
    "machine": "1981-10-02"
  },
  {
    "human": "3/25/18",
    "machine": "2018-03-25"
  },
  {
    "human": "may 9, 2014",
    "machine": "2014-05-09"
  },
  {
    "human": "2010/06/27",
    "machine": "2010-06-27"
  },
  {
    "human": "november 18, 2019",
    "machine": "2019-11-18"
  },
  {
    "human": "feb 20 2016",
    "machine": "2016-02-20"
  },
  {
    "human": "8 january 2003",
    "machine": "2003-01-08"
  },
  {
    "human": "11, may 1973",
    "machine": "1973-05-11"
  },
  {
    "human": "8/11/12",
    "machine": "2012-08-11"
  },
  {
    "human": "04-25-11",
    "machine": "2011-04-25"
  },
  {
    "human": "september 09, 2003",
    "machine": "2003-09-09"
  },
  {
    "human": "98-06-25",
    "machine": "1998-06-25"
  },
  {
    "human": "2 february 2019",
    "machine": "2019-02-02"
  },
  {
    "human": "23/06/1995",
    "machine": "1995-06-23"
  },
  {
    "human": "fri, jan 15, 16",
    "machine": "2016-01-15"
  },
  {
    "human": "9/07/2021",
    "machine": "2021-07-09"
  },
  {
    "human": "10, jan 1971",
    "machine": "1971-01-10"
  },
  {
    "human": "aug 10 1981",
    "machine": "1981-08-10"
  },
  {
    "human": "18, jan 1988",
    "machine": "1988-01-18"
  },
  {
    "human": "tuesday, february 21, 2017",
    "machine": "2017-02-21"
  },
  {
    "human": "tue, aug 29, 06",
    "machine": "2006-08-29"
  },
  {
    "human": "20 apr, 1976",
    "machine": "1976-04-20"
  },
  {
    "human": "2006.02.27 ad",
    "machine": "2006-02-27"
  },
  {
    "human": "77.08.26",
    "machine": "1977-08-26"
  },
  {
    "human": "8-feb-2025",
    "machine": "2025-02-08"
  },
  {
    "human": "8/19/87",
    "machine": "1987-08-19"
  },
  {
    "human": "17, dec 2004",
    "machine": "2004-12-17"
  },
  {
    "human": "2005-07-02",
    "machine": "2005-07-02"
  },
  {
    "human": "november 23, 2010",
    "machine": "2010-11-23"
  },
  {
    "human": "30.05.2007",
    "machine": "2007-05-30"
  },
  {
    "human": "13, may 1990",
    "machine": "1990-05-13"
  },
  {
    "human": "2001-04-17",
    "machine": "2001-04-17"
  },
  {
    "human": "feb 1, 1973",
    "machine": "1973-02-01"
  },
  {
    "human": "04-30-24",
    "machine": "2024-04-30"
  },
  {
    "human": "8-jul-1972",
    "machine": "1972-07-08"
  },
  {
    "human": "11/4/25",
    "machine": "2025-11-04"
  },
  {
    "human": "20, dec 1972",
    "machine": "1972-12-20"
  },
  {
    "human": "5 feb, 1976",
    "machine": "1976-02-05"
  },
  {
    "human": "09-28-23",
    "machine": "2023-09-28"
  },
  {
    "human": "2001.04.02 ad",
    "machine": "2001-04-02"
  },
  {
    "human": "may 7 1995",
    "machine": "1995-05-07"
  },
  {
    "human": "30 aug, 1984",
    "machine": "1984-08-30"
  },
  {
    "human": "2022-11-14",
    "machine": "2022-11-14"
  },
  {
    "human": "22.6.95",
    "machine": "1995-06-22"
  },
  {
    "human": "1972-05-12",
    "machine": "1972-05-12"
  },
  {
    "human": "april 12, 1981",
    "machine": "1981-04-12"
  },
  {
    "human": "24-02-28",
    "machine": "2024-02-28"
  },
  {
    "human": "9.11.76",
    "machine": "1976-11-09"
  },
  {
    "human": "thu, dec 26, 24",
    "machine": "2024-12-26"
  },
  {
    "human": "may 25, 11",
    "machine": "2011-05-25"
  },
  {
    "human": "jun 22, 00",
    "machine": "2000-06-22"
  },
  {
    "human": "april 4, 1986",
    "machine": "1986-04-04"
  },
  {
    "human": "12-27-90",
    "machine": "1990-12-27"
  },
  {
    "human": "21 dec 2006",
    "machine": "2006-12-21"
  },
  {
    "human": "05-24-79",
    "machine": "1979-05-24"
  },
  {
    "human": "8 may 1997",
    "machine": "1997-05-08"
  },
  {
    "human": "4 apr 1975",
    "machine": "1975-04-04"
  },
  {
    "human": "mon, jul 16, 84",
    "machine": "1984-07-16"
  },
  {
    "human": "saturday, september 26, 2009",
    "machine": "2009-09-26"
  },
  {
    "human": "11/20/2005",
    "machine": "2005-11-20"
  },
  {
    "human": "01-03-02",
    "machine": "2001-03-02"
  },
  {
    "human": "tue, dec 29, 09",
    "machine": "2009-12-29"
  },
  {
    "human": "02 november 1989",
    "machine": "1989-11-02"
  },
  {
    "human": "sun, feb 15, 09",
    "machine": "2009-02-15"
  },
  {
    "human": "15 may 1970",
    "machine": "1970-05-15"
  },
  {
    "human": "10/7/75",
    "machine": "1975-10-07"
  },
  {
    "human": "sunday, december 19, 1971",
    "machine": "1971-12-19"
  },
  {
    "human": "13 jun, 1992",
    "machine": "1992-06-13"
  },
  {
    "human": "wed, nov 10, 99",
    "machine": "1999-11-10"
  },
  {
    "human": "2002-02-18",
    "machine": "2002-02-18"
  },
  {
    "human": "tue, jan 30, 90",
    "machine": "1990-01-30"
  },
  {
    "human": "11/24/22",
    "machine": "2022-11-24"
  },
  {
    "human": "1995-10-15",
    "machine": "1995-10-15"
  },
  {
    "human": "jun 21 2014",
    "machine": "2014-06-21"
  },
  {
    "human": "november 5, 1974",
    "machine": "1974-11-05"
  },
  {
    "human": "3/8/90",
    "machine": "1990-03-08"
  },
  {
    "human": "1985/10/12",
    "machine": "1985-10-12"
  },
  {
    "human": "10 aug 1989",
    "machine": "1989-08-10"
  },
  {
    "human": "wednesday, march 16, 1988",
    "machine": "1988-03-16"
  },
  {
    "human": "september 03, 2002",
    "machine": "2002-09-03"
  },
  {
    "human": "10/02/2002",
    "machine": "2002-10-02"
  },
  {
    "human": "tuesday, december 11, 1973",
    "machine": "1973-12-11"
  },
  {
    "human": "dec 7, 1974",
    "machine": "1974-12-07"
  },
  {
    "human": "june 1, 1980",
    "machine": "1980-06-01"
  },
  {
    "human": "monday, october 27, 2003",
    "machine": "2003-10-27"
  },
  {
    "human": "8.1.01",
    "machine": "2001-01-08"
  },
  {
    "human": "96-03-04",
    "machine": "1996-03-04"
  },
  {
    "human": "6/29/15",
    "machine": "2015-06-29"
  },
  {
    "human": "24 may 1988",
    "machine": "1988-05-24"
  },
  {
    "human": "07-27-01",
    "machine": "2001-07-27"
  },
  {
    "human": "aug 7 2006",
    "machine": "2006-08-07"
  },
  {
    "human": "2017-04-16",
    "machine": "2017-04-16"
  },
  {
    "human": "2009-07-30",
    "machine": "2009-07-30"
  },
  {
    "human": "10.7.06",
    "machine": "2006-07-10"
  },
  {
    "human": "1994-09-8",
    "machine": "1994-09-08"
  },
  {
    "human": "2022.06.25 ad",
    "machine": "2022-06-25"
  },
  {
    "human": "26/08/1973",
    "machine": "1973-08-26"
  },
  {
    "human": "10/19/72",
    "machine": "1972-10-19"
  },
  {
    "human": "tue, apr 1, 80",
    "machine": "1980-04-01"
  },
  {
    "human": "september 17, 1978",
    "machine": "1978-09-17"
  },
  {
    "human": "24 mar, 1999",
    "machine": "1999-03-24"
  },
  {
    "human": "jun 27, 71",
    "machine": "1971-06-27"
  },
  {
    "human": "mon, may 23, 77",
    "machine": "1977-05-23"
  },
  {
    "human": "12/10/1971",
    "machine": "1971-10-12"
  },
  {
    "human": "jun 1, 1994",
    "machine": "1994-06-01"
  },
  {
    "human": "5 october 1971",
    "machine": "1971-10-05"
  },
  {
    "human": "6/12/2010",
    "machine": "2010-12-06"
  },
  {
    "human": "fri, nov 9, 73",
    "machine": "1973-11-09"
  },
  {
    "human": "13 sep 1973",
    "machine": "1973-09-13"
  },
  {
    "human": "28.10.79",
    "machine": "1979-10-28"
  },
  {
    "human": "26.5.75",
    "machine": "1975-05-26"
  },
  {
    "human": "17.10.1997",
    "machine": "1997-10-17"
  },
  {
    "human": "04.07.1",
    "machine": "2004-07-01"
  },
  {
    "human": "88.02.8",
    "machine": "1988-02-08"
  },
  {
    "human": "11 dec, 1977",
    "machine": "1977-12-11"
  },
  {
    "human": "06 may 1989",
    "machine": "1989-05-06"
  },
  {
    "human": "04-22-18",
    "machine": "2018-04-22"
  },
  {
    "human": "22/10/1972",
    "machine": "1972-10-22"
  },
  {
    "human": "jun 13 1988",
    "machine": "1988-06-13"
  },
  {
    "human": "august 7, 1975",
    "machine": "1975-08-07"
  },
  {
    "human": "october 21, 2011",
    "machine": "2011-10-21"
  },
  {
    "human": "february 9, 1996",
    "machine": "1996-02-09"
  },
  {
    "human": "3/7/79",
    "machine": "1979-03-07"
  },
  {
    "human": "1990-02-1",
    "machine": "1990-02-01"
  },
  {
    "human": "29 oct, 1972",
    "machine": "1972-10-29"
  },
  {
    "human": "23, aug 1995",
    "machine": "1995-08-23"
  },
  {
    "human": "may 12, 2019",
    "machine": "2019-05-12"
  },
  {
    "human": "thu, feb 22, 96",
    "machine": "1996-02-22"
  },
  {
    "human": "1985.02.22 ad",
    "machine": "1985-02-22"
  },
  {
    "human": "24.08.22",
    "machine": "2024-08-22"
  },
  {
    "human": "october 23, 1974",
    "machine": "1974-10-23"
  },
  {
    "human": "1.2.11",
